A1: ShadowPanther - Classic - World of Warcraft Rogue Info - Charts, Articles, Guides & more!
A2: World of Warcraft Classic Rogue PVE Armor Chart
A3: Created by Shadow Panther (Zodar on the US Earthen Ring Server)
A4: This chart is used to compare Classic Rogue Armor to see which is best for PVE. Check the Armor Sets Chart for Set Bonuses.
A5: Last Updated: | B5: P 1 | C5: P 2 | D5: P 3-6 | G5: PVP AEP Values | K5: 00.01 | L5: 1 | M5: 1 | N5: 0.5 | O5: 0.5 | P5: 10 | Q5: 7.5 | R5: 5 | S5: 3 | T5: 00.2 | U5: 00.1 | V5: 00.1 | W5: 00.1 | X5: 00.1 | Y5: 00.1 | Z5: 00.1 | AA5: 1 | AB5: 1
A6: =NOW() -> 43723.794104745371 | B6: PVP | C6: PVE | G6: PVE MAEP Values | K6: 1E-3 | L6: 1 | M6: 00.01 | N6: 0.5 | O6: 0.5 | P6: 10 | Q6: 7.5 | R6: 00.01 | S6: 00.01 | T6: 00.01 | U6: 00.01 | V6: 00.01 | W6: 00.01 | X6: 00.01 | Y6: 00.01 | Z6: 00.01 | AA6: 1 | AB6: 1
A7: HEAD | B7: AEP | C7: MAEP | D7: Loc | E7: P | F7: Info | G7: Source | H7: Set | I7: Lvl | J7: B | K7: Arm | L7: Agi | M7: Sta | N7: Str | O7: AP | P7: Cri | Q7: Hit | R7: Par | S7: Dod | T7: Def | U7: Ar | V7: Fi | W7: Fr | X7: Na | Y7: Sh | Z7: H/5 | AA7: PVP | AB7: PVE | AC7: Special
A8: Bonescythe Helmet | B8: =(K8*$K$5)+(L8*$L$5)+(M8*$M$5)+(N8*$N$5)+(O8*$O$5)+(P8*100*$P$5)+(Q8*100*$Q$5)+(R8*100*$R$5)+(S8*100*$S$5)+(T8*$T$5)+(U8*$U$5)+(V8*$V$5)+(W8*$W$5)+(X8*$X$5)+(Y8*$Y$5)+(Z8*$Z$5)+(AA8*$AA$5) -> 97.55 | C8: =(K8*$K$6)+(L8*$L$6)+(M8*$M$6)+(N8*$N$6)+(O8*$O$6)+(P8*100*$P$6)+(Q8*100*$Q$6)+(R8*100*$R$6)+(S8*100*$S$6)+(T8*$T$6)+(U8*$U$6)+(V8*$V$6)+(W8*$W$6)+(X8*$X$6)+(Y8*$Y$6)+(Z8*$Z$6)+(AB8*$AA$6) -> 66.995000000000005 | D8: Naxx | E8: 6 | F8: Q | G8: Thaddius | H8: BS | I8: 60 | J8: P | K8: 205 | L8: 30 | M8: 29 | N8: 18 | P8: 00.02 | Q8: 00.01
A9: Deathdealer's Helm | B9: =(K9*$K$5)+(L9*$L$5)+(M9*$M$5)+(N9*$N$5)+(O9*$O$5)+(P9*100*$P$5)+(Q9*100*$Q$5)+(R9*100*$R$5)+(S9*100*$S$5)+(T9*$T$5)+(U9*$U$5)+(V9*$V$5)+(W9*$W$5)+(X9*$X$5)+(Y9*$Y$5)+(Z9*$Z$5)+(AA9*$AA$5) -> 87.92 | C9: =(K9*$K$6)+(L9*$L$6)+(M9*$M$6)+(N9*$N$6)+(O9*$O$6)+(P9*100*$P$6)+(Q9*100*$Q$6)+(R9*100*$R$6)+(S9*100*$S$6)+(T9*$T$6)+(U9*$U$6)+(V9*$V$6)+(W9*$W$6)+(X9*$X$6)+(Y9*$Y$6)+(Z9*$Z$6)+(AB9*$AA$6) -> 59.462000000000003 | D9: AQ40 | E9: 5 | F9: Q | G9: Twin Emps | H9: DE | I9: 60 | J9: P | K9: 192 | L9: 29 | M9: 27 | N9: 25 | P9: 00.01 | Q9: 00.01
A10: Bloodfang Hood | B10: =(K10*$K$5)+(L10*$L$5)+(M10*$M$5)+(N10*$N$5)+(O10*$O$5)+(P10*100*$P$5)+(Q10*100*$Q$5)+(R10*100*$R$5)+(S10*100*$S$5)+(T10*$T$5)+(U10*$U$5)+(V10*$V$5)+(W10*$W$5)+(X10*$X$5)+(Y10*$Y$5)+(Z10*$Z$5)+(AA10*$AA$5) -> 75.33 | C10: =(K10*$K$6)+(L10*$L$6)+(M10*$M$6)+(N10*$N$6)+(O10*$O$6)+(P10*100*$P$6)+(Q10*100*$Q$6)+(R10*100*$R$6)+(S10*100*$S$6)+(T10*$T$6)+(U10*$U$6)+(V10*$V$6)+(W10*$W$6)+(X10*$X$6)+(Y10*$Y$6)+(Z10*$Z$6)+(AB10*$AA$6) -> 47.133000000000003 | D10: OL | E10: 1 | F10: 00.21 | G10: Onyxia | H10: BF | I10: 60 | J10: P | K10: 183 | L10: 27 | M10: 25 | N10: 19 | P10: 00.01 | W10: 10 | Y10: 10
A11: Circlet of Restless Dreams | B11: =(K11*$K$5)+(L11*$L$5)+(M11*$M$5)+(N11*$N$5)+(O11*$O$5)+(P11*100*$P$5)+(Q11*100*$Q$5)+(R11*100*$R$5)+(S11*100*$S$5)+(T11*$T$5)+(U11*$U$5)+(V11*$V$5)+(W11*$W$5)+(X11*$X$5)+(Y11*$Y$5)+(Z11*$Z$5)+(AA11*$AA$5) -> 66.75 | C11: =(K11*$K$6)+(L11*$L$6)+(M11*$M$6)+(N11*$N$6)+(O11*$O$6)+(P11*100*$P$6)+(Q11*100*$Q$6)+(R11*100*$R$6)+(S11*100*$S$6)+(T11*$T$6)+(U11*$U$6)+(V11*$V$6)+(W11*$W$6)+(X11*$X$6)+(Y11*$Y$6)+(Z11*$Z$6)+(AB11*$AA$6) -> 45.555 | D11: 4D | E11: 4 | F11: 00.14 | G11: Emeriss | I11: 60 | J11: P | K11: 175 | L11: 21 | M11: 38 | AA11: 6 | AB11: 24 | AC11: Daggers +6
A12: Field Marshal's Leather Mask | B12: =(K12*$K$5)+(L12*$L$5)+(M12*$M$5)+(N12*$N$5)+(O12*$O$5)+(P12*100*$P$5)+(Q12*100*$Q$5)+(R12*100*$R$5)+(S12*100*$S$5)+(T12*$T$5)+(U12*$U$5)+(V12*$V$5)+(W12*$W$5)+(X12*$X$5)+(Y12*$Y$5)+(Z12*$Z$5)+(AA12*$AA$5) -> 77.79 | C12: =(K12*$K$6)+(L12*$L$6)+(M12*$M$6)+(N12*$N$6)+(O12*$O$6)+(P12*100*$P$6)+(Q12*100*$Q$6)+(R12*100*$R$6)+(S12*100*$S$6)+(T12*$T$6)+(U12*$U$6)+(V12*$V$6)+(W12*$W$6)+(X12*$X$6)+(Y12*$Y$6)+(Z12*$Z$6)+(AB12*$AA$6) -> 45.039000000000001 | D12: PVP | E12: 2 | F12: FM | G12: Alliance Rank 13 PVP | H12: FM | I12: 60 | J12: P | K12: 229 | L12: 27 | M12: 31 | P12: 00.01 | Q12: 00.01
A13: Warlord's Leather Helm | B13: =(K13*$K$5)+(L13*$L$5)+(M13*$M$5)+(N13*$N$5)+(O13*$O$5)+(P13*100*$P$5)+(Q13*100*$Q$5)+(R13*100*$R$5)+(S13*100*$S$5)+(T13*$T$5)+(U13*$U$5)+(V13*$V$5)+(W13*$W$5)+(X13*$X$5)+(Y13*$Y$5)+(Z13*$Z$5)+(AA13*$AA$5) -> 77.79 | C13: =(K13*$K$6)+(L13*$L$6)+(M13*$M$6)+(N13*$N$6)+(O13*$O$6)+(P13*100*$P$6)+(Q13*100*$Q$6)+(R13*100*$R$6)+(S13*100*$S$6)+(T13*$T$6)+(U13*$U$6)+(V13*$V$6)+(W13*$W$6)+(X13*$X$6)+(Y13*$Y$6)+(Z13*$Z$6)+(AB13*$AA$6) -> 45.039000000000001 | D13: PVP | E13: 2 | F13: WL | G13: Horde Rank 13 PVP | H13: WL | I13: 60 | J13: P | K13: 229 | L13: 27 | M13: 31 | P13: 00.01 | Q13: 00.01
A14: Nightslayer Cover | B14: =(K14*$K$5)+(L14*$L$5)+(M14*$M$5)+(N14*$N$5)+(O14*$O$5)+(P14*100*$P$5)+(Q14*100*$Q$5)+(R14*100*$R$5)+(S14*100*$S$5)+(T14*$T$5)+(U14*$U$5)+(V14*$V$5)+(W14*$W$5)+(X14*$X$5)+(Y14*$Y$5)+(Z14*$Z$5)+(AA14*$AA$5) -> 64.63 | C14: =(K14*$K$6)+(L14*$L$6)+(M14*$M$6)+(N14*$N$6)+(O14*$O$6)+(P14*100*$P$6)+(Q14*100*$Q$6)+(R14*100*$R$6)+(S14*100*$S$6)+(T14*$T$6)+(U14*$U$6)+(V14*$V$6)+(W14*$W$6)+(X14*$X$6)+(Y14*$Y$6)+(Z14*$Z$6)+(AB14*$AA$6) -> 43.453000000000003 | D14: MC | E14: 1 | F14: 00.21 | G14: Garr | H14: NS | I14: 60 | J14: P | K14: 163 | L14: 20 | M14: 19 | N14: 6 | P14: 00.02 | V14: 10
A15: Darkmantle Cap | B15: =(K15*$K$5)+(L15*$L$5)+(M15*$M$5)+(N15*$N$5)+(O15*$O$5)+(P15*100*$P$5)+(Q15*100*$Q$5)+(R15*100*$R$5)+(S15*100*$S$5)+(T15*$T$5)+(U15*$U$5)+(V15*$V$5)+(W15*$W$5)+(X15*$X$5)+(Y15*$Y$5)+(Z15*$Z$5)+(AA15*$AA$5) -> 62 | C15: =(K15*$K$6)+(L15*$L$6)+(M15*$M$6)+(N15*$N$6)+(O15*$O$6)+(P15*100*$P$6)+(Q15*100*$Q$6)+(R15*100*$R$6)+(S15*100*$S$6)+(T15*$T$6)+(U15*$U$6)+(V15*$V$6)+(W15*$W$6)+(X15*$X$6)+(Y15*$Y$6)+(Z15*$Z$6)+(AB15*$AA$6) -> 42.83 | D15: Q | E15: 5 | F15: Q | G15: SC Upgrade Quest | H15: DM | I15: 58 | J15: P | K15: 150 | L15: 26 | M15: 18 | N15: 13 | P15: 00.01
A16: Foror's Eyepatch | B16: =(K16*$K$5)+(L16*$L$5)+(M16*$M$5)+(N16*$N$5)+(O16*$O$5)+(P16*100*$P$5)+(Q16*100*$Q$5)+(R16*100*$R$5)+(S16*100*$S$5)+(T16*$T$5)+(U16*$U$5)+(V16*$V$5)+(W16*$W$5)+(X16*$X$5)+(Y16*$Y$5)+(Z16*$Z$5)+(AA16*$AA$5) -> 62.6 | C16: =(K16*$K$6)+(L16*$L$6)+(M16*$M$6)+(N16*$N$6)+(O16*$O$6)+(P16*100*$P$6)+(Q16*100*$Q$6)+(R16*100*$R$6)+(S16*100*$S$6)+(T16*$T$6)+(U16*$U$6)+(V16*$V$6)+(W16*$W$6)+(X16*$X$6)+(Y16*$Y$6)+(Z16*$Z$6)+(AB16*$AA$6) -> 42.35 | D16: ZG | E16: 4 | F16: 00.1 | G16: Gahz'ranka | I16: 60 | J16: P | K16: 160 | M16: 19 | O16: 44 | P16: 00.02
A17: Southwind Helm | B17: =(K17*$K$5)+(L17*$L$5)+(M17*$M$5)+(N17*$N$5)+(O17*$O$5)+(P17*100*$P$5)+(Q17*100*$Q$5)+(R17*100*$R$5)+(S17*100*$S$5)+(T17*$T$5)+(U17*$U$5)+(V17*$V$5)+(W17*$W$5)+(X17*$X$5)+(Y17*$Y$5)+(Z17*$Z$5)+(AA17*$AA$5) -> 57.64 | C17: =(K17*$K$6)+(L17*$L$6)+(M17*$M$6)+(N17*$N$6)+(O17*$O$6)+(P17*100*$P$6)+(Q17*100*$Q$6)+(R17*100*$R$6)+(S17*100*$S$6)+(T17*$T$6)+(U17*$U$6)+(V17*$V$6)+(W17*$W$6)+(X17*$X$6)+(Y17*$Y$6)+(Z17*$Z$6)+(AB17*$AA$6) -> 42.304000000000002 | D17: AQ20 | E17: 5 | F17: 00.18 | G17: Moam | I17: 60 | J17: P | K17: 164 | L17: 24 | M17: 14 | N17: 21 | Q17: 00.01
A18: Blooddrenched Mask | B18: =(K18*$K$5)+(L18*$L$5)+(M18*$M$5)+(N18*$N$5)+(O18*$O$5)+(P18*100*$P$5)+(Q18*100*$Q$5)+(R18*100*$R$5)+(S18*100*$S$5)+(T18*$T$5)+(U18*$U$5)+(V18*$V$5)+(W18*$W$5)+(X18*$X$5)+(Y18*$Y$5)+(Z18*$Z$5)+(AA18*$AA$5) -> 55.53 | C18: =(K18*$K$6)+(L18*$L$6)+(M18*$M$6)+(N18*$N$6)+(O18*$O$6)+(P18*100*$P$6)+(Q18*100*$Q$6)+(R18*100*$R$6)+(S18*100*$S$6)+(T18*$T$6)+(U18*$U$6)+(V18*$V$6)+(W18*$W$6)+(X18*$X$6)+(Y18*$Y$6)+(Z18*$Z$6)+(AB18*$AA$6) -> 37.323 | D18: ZG | E18: 4 | F18: 00.03 | G18: Var. Priestesses | I18: 60 | J18: P | K18: 153 | L18: 22 | M18: 17 | Q18: 00.02
A19: Champion's Leather Helm | B19: =(K19*$K$5)+(L19*$L$5)+(M19*$M$5)+(N19*$N$5)+(O19*$O$5)+(P19*100*$P$5)+(Q19*100*$Q$5)+(R19*100*$R$5)+(S19*100*$S$5)+(T19*$T$5)+(U19*$U$5)+(V19*$V$5)+(W19*$W$5)+(X19*$X$5)+(Y19*$Y$5)+(Z19*$Z$5)+(AA19*$AA$5) -> 60.88 | C19: =(K19*$K$6)+(L19*$L$6)+(M19*$M$6)+(N19*$N$6)+(O19*$O$6)+(P19*100*$P$6)+(Q19*100*$Q$6)+(R19*100*$R$6)+(S19*100*$S$6)+(T19*$T$6)+(U19*$U$6)+(V19*$V$6)+(W19*$W$6)+(X19*$X$6)+(Y19*$Y$6)+(Z19*$Z$6)+(AB19*$AA$6) -> 35.968000000000004 | D19: PVP | E19: 2 | F19: Cha | G19: Horde Rank 10 PVP | H19: CV | I19: 60 | J19: P | K19: 238 | M19: 23 | O19: 36 | P19: 00.01 | Q19: 00.01
A20: Lt. Comm. Leather Helm | B20: =(K20*$K$5)+(L20*$L$5)+(M20*$M$5)+(N20*$N$5)+(O20*$O$5)+(P20*100*$P$5)+(Q20*100*$Q$5)+(R20*100*$R$5)+(S20*100*$S$5)+(T20*$T$5)+(U20*$U$5)+(V20*$V$5)+(W20*$W$5)+(X20*$X$5)+(Y20*$Y$5)+(Z20*$Z$5)+(AA20*$AA$5) -> 60.88 | C20: =(K20*$K$6)+(L20*$L$6)+(M20*$M$6)+(N20*$N$6)+(O20*$O$6)+(P20*100*$P$6)+(Q20*100*$Q$6)+(R20*100*$R$6)+(S20*100*$S$6)+(T20*$T$6)+(U20*$U$6)+(V20*$V$6)+(W20*$W$6)+(X20*$X$6)+(Y20*$Y$6)+(Z20*$Z$6)+(AB20*$AA$6) -> 35.968000000000004 | D20: PVP | E20: 2 | F20: LC | G20: Alliance Rank 10 PVP | H20: LCG | I20: 60 | J20: P | K20: 238 | M20: 23 | O20: 36 | P20: 00.01 | Q20: 00.01
A21: Supreme Crown of the Tiger | B21: =(K21*$K$5)+(L21*$L$5)+(M21*$M$5)+(N21*$N$5)+(O21*$O$5)+(P21*100*$P$5)+(Q21*100*$Q$5)+(R21*100*$R$5)+(S21*100*$S$5)+(T21*$T$5)+(U21*$U$5)+(V21*$V$5)+(W21*$W$5)+(X21*$X$5)+(Y21*$Y$5)+(Z21*$Z$5)+(AA21*$AA$5) -> 29.82 | C21: =(K21*$K$6)+(L21*$L$6)+(M21*$M$6)+(N21*$N$6)+(O21*$O$6)+(P21*100*$P$6)+(Q21*100*$Q$6)+(R21*100*$R$6)+(S21*100*$S$6)+(T21*$T$6)+(U21*$U$6)+(V21*$V$6)+(W21*$W$6)+(X21*$X$6)+(Y21*$Y$6)+(Z21*$Z$6)+(AB21*$AA$6) -> 28.632000000000001 | D21: R | E21: 1 | F21: 63 | G21: Random World Drop | I21: 59 | J21: E | K21: 132 | L21: 19 | N21: 19
A22: Ebon Mask | B22: =(K22*$K$5)+(L22*$L$5)+(M22*$M$5)+(N22*$N$5)+(O22*$O$5)+(P22*100*$P$5)+(Q22*100*$Q$5)+(R22*100*$R$5)+(S22*100*$S$5)+(T22*$T$5)+(U22*$U$5)+(V22*$V$5)+(W22*$W$5)+(X22*$X$5)+(Y22*$Y$5)+(Z22*$Z$5)+(AA22*$AA$5) -> 40.22 | C22: =(K22*$K$6)+(L22*$L$6)+(M22*$M$6)+(N22*$N$6)+(O22*$O$6)+(P22*100*$P$6)+(Q22*100*$Q$6)+(R22*100*$R$6)+(S22*100*$S$6)+(T22*$T$6)+(U22*$U$6)+(V22*$V$6)+(W22*$W$6)+(X22*$X$6)+(Y22*$Y$6)+(Z22*$Z$6)+(AB22*$AA$6) -> 28.231999999999999 | D22: Azs | E22: 4 | F22: Q | G22: Quest Reward | I22: 50 | J22: P | K22: 122 | M22: 11 | O22: 36 | P22: 00.01
A23: Guise of the Devourer | B23: =(K23*$K$5)+(L23*$L$5)+(M23*$M$5)+(N23*$N$5)+(O23*$O$5)+(P23*100*$P$5)+(Q23*100*$Q$5)+(R23*100*$R$5)+(S23*100*$S$5)+(T23*$T$5)+(U23*$U$5)+(V23*$V$5)+(W23*$W$5)+(X23*$X$5)+(Y23*$Y$5)+(Z23*$Z$5)+(AA23*$AA$5) -> 69 | C23: =(K23*$K$6)+(L23*$L$6)+(M23*$M$6)+(N23*$N$6)+(O23*$O$6)+(P23*100*$P$6)+(Q23*100*$Q$6)+(R23*100*$R$6)+(S23*100*$S$6)+(T23*$T$6)+(U23*$U$6)+(V23*$V$6)+(W23*$W$6)+(X23*$X$6)+(Y23*$Y$6)+(Z23*$Z$6)+(AB23*$AA$6) -> 28.12 | D23: AQ40 | E23: 5 | F23: 00.13 | G23: Vem | I23: 60 | J23: P | K23: 250 | L23: 19 | M23: 36 | N23: 17 | S23: 00.01
A24: Advr's Bandana of the Tiger | B24: =(K24*$K$5)+(L24*$L$5)+(M24*$M$5)+(N24*$N$5)+(O24*$O$5)+(P24*100*$P$5)+(Q24*100*$Q$5)+(R24*100*$R$5)+(S24*100*$S$5)+(T24*$T$5)+(U24*$U$5)+(V24*$V$5)+(W24*$W$5)+(X24*$X$5)+(Y24*$Y$5)+(Z24*$Z$5)+(AA24*$AA$5) -> 28.3 | C24: =(K24*$K$6)+(L24*$L$6)+(M24*$M$6)+(N24*$N$6)+(O24*$O$6)+(P24*100*$P$6)+(Q24*100*$Q$6)+(R24*100*$R$6)+(S24*100*$S$6)+(T24*$T$6)+(U24*$U$6)+(V24*$V$6)+(W24*$W$6)+(X24*$X$6)+(Y24*$Y$6)+(Z24*$Z$6)+(AB24*$AA$6) -> 27.13 | D24: R | E24: 1 | F24: 59-61 | G24: Random World Drop | I24: 58 | J24: E | K24: 130 | L24: 18 | N24: 18
A25: Grand Crown of the Tiger | B25: =(K25*$K$5)+(L25*$L$5)+(M25*$M$5)+(N25*$N$5)+(O25*$O$5)+(P25*100*$P$5)+(Q25*100*$Q$5)+(R25*100*$R$5)+(S25*100*$S$5)+(T25*$T$5)+(U25*$U$5)+(V25*$V$5)+(W25*$W$5)+(X25*$X$5)+(Y25*$Y$5)+(Z25*$Z$5)+(AA25*$AA$5) -> 28.29 | C25: =(K25*$K$6)+(L25*$L$6)+(M25*$M$6)+(N25*$N$6)+(O25*$O$6)+(P25*100*$P$6)+(Q25*100*$Q$6)+(R25*100*$R$6)+(S25*100*$S$6)+(T25*$T$6)+(U25*$U$6)+(V25*$V$6)+(W25*$W$6)+(X25*$X$6)+(Y25*$Y$6)+(Z25*$Z$6)+(AB25*$AA$6) -> 27.129000000000001 | D25: R | E25: 1 | F25: 60 | G25: Random World Drop | I25: 57 | J25: E | K25: 129 | L25: 18 | N25: 18
A26: Mighty Helmet of the Tiger | B26: =(K26*$K$5)+(L26*$L$5)+(M26*$M$5)+(N26*$N$5)+(O26*$O$5)+(P26*100*$P$5)+(Q26*100*$Q$5)+(R26*100*$R$5)+(S26*100*$S$5)+(T26*$T$5)+(U26*$U$5)+(V26*$V$5)+(W26*$W$5)+(X26*$X$5)+(Y26*$Y$5)+(Z26*$Z$5)+(AA26*$AA$5) -> 28.29 | C26: =(K26*$K$6)+(L26*$L$6)+(M26*$M$6)+(N26*$N$6)+(O26*$O$6)+(P26*100*$P$6)+(Q26*100*$Q$6)+(R26*100*$R$6)+(S26*100*$S$6)+(T26*$T$6)+(U26*$U$6)+(V26*$V$6)+(W26*$W$6)+(X26*$X$6)+(Y26*$Y$6)+(Z26*$Z$6)+(AB26*$AA$6) -> 27.129000000000001 | D26: R | E26: 1 | F26: 59-62 | G26: Random World Drop | I26: 57 | J26: E | K26: 129 | L26: 18 | N26: 18
A27: Nightshade Helmet of the Tiger | B27: =(K27*$K$5)+(L27*$L$5)+(M27*$M$5)+(N27*$N$5)+(O27*$O$5)+(P27*100*$P$5)+(Q27*100*$Q$5)+(R27*100*$R$5)+(S27*100*$S$5)+(T27*$T$5)+(U27*$U$5)+(V27*$V$5)+(W27*$W$5)+(X27*$X$5)+(Y27*$Y$5)+(Z27*$Z$5)+(AA27*$AA$5) -> 28.27 | C27: =(K27*$K$6)+(L27*$L$6)+(M27*$M$6)+(N27*$N$6)+(O27*$O$6)+(P27*100*$P$6)+(Q27*100*$Q$6)+(R27*100*$R$6)+(S27*100*$S$6)+(T27*$T$6)+(U27*$U$6)+(V27*$V$6)+(W27*$W$6)+(X27*$X$6)+(Y27*$Y$6)+(Z27*$Z$6)+(AB27*$AA$6) -> 27.126999999999999 | D27: R | E27: 1 | F27: 58-61 | G27: Random World Drop | I27: 56 | J27: E | K27: 127 | L27: 18 | N27: 18
A28: Shadowcraft Cap | B28: =(K28*$K$5)+(L28*$L$5)+(M28*$M$5)+(N28*$N$5)+(O28*$O$5)+(P28*100*$P$5)+(Q28*100*$Q$5)+(R28*100*$R$5)+(S28*100*$S$5)+(T28*$T$5)+(U28*$U$5)+(V28*$V$5)+(W28*$W$5)+(X28*$X$5)+(Y28*$Y$5)+(Z28*$Z$5)+(AA28*$AA$5) -> 45.91 | C28: =(K28*$K$6)+(L28*$L$6)+(M28*$M$6)+(N28*$N$6)+(O28*$O$6)+(P28*100*$P$6)+(Q28*100*$Q$6)+(R28*100*$R$6)+(S28*100*$S$6)+(T28*$T$6)+(U28*$U$6)+(V28*$V$6)+(W28*$W$6)+(X28*$X$6)+(Y28*$Y$6)+(Z28*$Z$6)+(AB28*$AA$6) -> 26.820999999999998 | D28: Sch | E28: 1 | F28: 00.06 | G28: Darkmaster Gandling | H28: SC | I28: 57 | J28: P | K28: 141 | L28: 20 | M28: 18 | N28: 13
A29: Eye of Rend | B29: =(K29*$K$5)+(L29*$L$5)+(M29*$M$5)+(N29*$N$5)+(O29*$O$5)+(P29*100*$P$5)+(Q29*100*$Q$5)+(R29*100*$R$5)+(S29*100*$S$5)+(T29*$T$5)+(U29*$U$5)+(V29*$V$5)+(W29*$W$5)+(X29*$X$5)+(Y29*$Y$5)+(Z29*$Z$5)+(AA29*$AA$5) -> 34.93 | C29: =(K29*$K$6)+(L29*$L$6)+(M29*$M$6)+(N29*$N$6)+(O29*$O$6)+(P29*100*$P$6)+(Q29*100*$Q$6)+(R29*100*$R$6)+(S29*100*$S$6)+(T29*$T$6)+(U29*$U$6)+(V29*$V$6)+(W29*$W$6)+(X29*$X$6)+(Y29*$Y$6)+(Z29*$Z$6)+(AB29*$AA$6) -> 26.713000000000001 | D29: UBRS | E29: 1 | F29: 00.16 | G29: Warchief Rend | I29: 58 | J29: P | K29: 143 | M29: 7 | N29: 13 | P29: 00.02
A30: Ghostshroud | B30: =(K30*$K$5)+(L30*$L$5)+(M30*$M$5)+(N30*$N$5)+(O30*$O$5)+(P30*100*$P$5)+(Q30*100*$Q$5)+(R30*100*$R$5)+(S30*100*$S$5)+(T30*$T$5)+(U30*$U$5)+(V30*$V$5)+(W30*$W$5)+(X30*$X$5)+(Y30*$Y$5)+(Z30*$Z$5)+(AA30*$AA$5) -> 44.82 | C30: =(K30*$K$6)+(L30*$L$6)+(M30*$M$6)+(N30*$N$6)+(O30*$O$6)+(P30*100*$P$6)+(Q30*100*$Q$6)+(R30*100*$R$6)+(S30*100*$S$6)+(T30*$T$6)+(U30*$U$6)+(V30*$V$6)+(W30*$W$6)+(X30*$X$6)+(Y30*$Y$6)+(Z30*$Z$6)+(AB30*$AA$6) -> 25.362000000000002 | D30: BRD | E30: 1 | F30: 00.19 | G30: Chest of the Seven | I30: 52 | J30: P | K30: 132 | L30: 19 | M30: 18 | N30: 12 | Y30: 5
A31: Mask of the Unforgiven | B31: =(K31*$K$5)+(L31*$L$5)+(M31*$M$5)+(N31*$N$5)+(O31*$O$5)+(P31*100*$P$5)+(Q31*100*$Q$5)+(R31*100*$R$5)+(S31*100*$S$5)+(T31*$T$5)+(U31*$U$5)+(V31*$V$5)+(W31*$W$5)+(X31*$X$5)+(Y31*$Y$5)+(Z31*$Z$5)+(AA31*$AA$5) -> 38.32 | C31: =(K31*$K$6)+(L31*$L$6)+(M31*$M$6)+(N31*$N$6)+(O31*$O$6)+(P31*100*$P$6)+(Q31*100*$Q$6)+(R31*100*$R$6)+(S31*100*$S$6)+(T31*$T$6)+(U31*$U$6)+(V31*$V$6)+(W31*$W$6)+(X31*$X$6)+(Y31*$Y$6)+(Z31*$Z$6)+(AB31*$AA$6) -> 25.252000000000002 | D31: Str | E31: 1 | F31: 00.21 | G31: The Unforgiven | I31: 52 | J31: P | K31: 132 | M31: 12 | P31: 00.01 | Q31: 00.02
A32: Ragefury Eyepatch | B32: =(K32*$K$5)+(L32*$L$5)+(M32*$M$5)+(N32*$N$5)+(O32*$O$5)+(P32*100*$P$5)+(Q32*100*$Q$5)+(R32*100*$R$5)+(S32*100*$S$5)+(T32*$T$5)+(U32*$U$5)+(V32*$V$5)+(W32*$W$5)+(X32*$X$5)+(Y32*$Y$5)+(Z32*$Z$5)+(AA32*$AA$5) -> 33.32 | C32: =(K32*$K$6)+(L32*$L$6)+(M32*$M$6)+(N32*$N$6)+(O32*$O$6)+(P32*100*$P$6)+(Q32*100*$Q$6)+(R32*100*$R$6)+(S32*100*$S$6)+(T32*$T$6)+(U32*$U$6)+(V32*$V$6)+(W32*$W$6)+(X32*$X$6)+(Y32*$Y$6)+(Z32*$Z$6)+(AB32*$AA$6) -> 23.222000000000001 | D32: BRD | E32: 1 | F32: 00.21 | G32: Hurley Blackbreath | I32: 52 | J32: P | K32: 132 | M32: 9 | N32: 6 | P32: 00.02
A33: Righteous Helmet of the Tiger | B33: =(K33*$K$5)+(L33*$L$5)+(M33*$M$5)+(N33*$N$5)+(O33*$O$5)+(P33*100*$P$5)+(Q33*100*$Q$5)+(R33*100*$R$5)+(S33*100*$S$5)+(T33*$T$5)+(U33*$U$5)+(V33*$V$5)+(W33*$W$5)+(X33*$X$5)+(Y33*$Y$5)+(Z33*$Z$5)+(AA33*$AA$5) -> 23.61 | C33: =(K33*$K$6)+(L33*$L$6)+(M33*$M$6)+(N33*$N$6)+(O33*$O$6)+(P33*100*$P$6)+(Q33*100*$Q$6)+(R33*100*$R$6)+(S33*100*$S$6)+(T33*$T$6)+(U33*$U$6)+(V33*$V$6)+(W33*$W$6)+(X33*$X$6)+(Y33*$Y$6)+(Z33*$Z$6)+(AB33*$AA$6) -> 22.611000000000001 | D33: R | E33: 1 | F33: 49-53 | G33: Random World Drop | I33: 47 | J33: E | K33: 111 | L33: 15 | N33: 15
A34: Helm of Fire | B34: =(K34*$K$5)+(L34*$L$5)+(M34*$M$5)+(N34*$N$5)+(O34*$O$5)+(P34*100*$P$5)+(Q34*100*$Q$5)+(R34*100*$R$5)+(S34*100*$S$5)+(T34*$T$5)+(U34*$U$5)+(V34*$V$5)+(W34*$W$5)+(X34*$X$5)+(Y34*$Y$5)+(Z34*$Z$5)+(AA34*$AA$5) -> 33.68 | C34: =(K34*$K$6)+(L34*$L$6)+(M34*$M$6)+(N34*$N$6)+(O34*$O$6)+(P34*100*$P$6)+(Q34*100*$Q$6)+(R34*100*$R$6)+(S34*100*$S$6)+(T34*$T$6)+(U34*$U$6)+(V34*$V$6)+(W34*$W$6)+(X34*$X$6)+(Y34*$Y$6)+(Z34*$Z$6)+(AB34*$AA$6) -> 22.268000000000001 | D34: LW | E34: 1 | F34: 250 | G34: Elemental LW Trainer | I34: 45 | J34: E | K34: 118 | L34: 17 | M34: 10 | V34: 5 | AA34: 5 | AB34: 5 | AC34: Fireball
A35: Felhide Cap | B35: =(K35*$K$5)+(L35*$L$5)+(M35*$M$5)+(N35*$N$5)+(O35*$O$5)+(P35*100*$P$5)+(Q35*100*$Q$5)+(R35*100*$R$5)+(S35*100*$S$5)+(T35*$T$5)+(U35*$U$5)+(V35*$V$5)+(W35*$W$5)+(X35*$X$5)+(Y35*$Y$5)+(Z35*$Z$5)+(AA35*$AA$5) -> 37.94 | C35: =(K35*$K$6)+(L35*$L$6)+(M35*$M$6)+(N35*$N$6)+(O35*$O$6)+(P35*100*$P$6)+(Q35*100*$Q$6)+(R35*100*$R$6)+(S35*100*$S$6)+(T35*$T$6)+(U35*$U$6)+(V35*$V$6)+(W35*$W$6)+(X35*$X$6)+(Y35*$Y$6)+(Z35*$Z$6)+(AB35*$AA$6) -> 21.433999999999997 | D35: DM-E | E35: 2 | F35: 0.25 | G35: Lethtendris | I35: 53 | J35: P | K35: 134 | L35: 21 | M35: 14 | V35: 8 | Y35: 8
A36: Bloodvine Lens | B36: =(K36*$K$5)+(L36*$L$5)+(M36*$M$5)+(N36*$N$5)+(O36*$O$5)+(P36*100*$P$5)+(Q36*100*$Q$5)+(R36*100*$R$5)+(S36*100*$S$5)+(T36*$T$5)+(U36*$U$5)+(V36*$V$5)+(W36*$W$5)+(X36*$X$5)+(Y36*$Y$5)+(Z36*$Z$5)+(AA36*$AA$5) -> 35.47 | C36: =(K36*$K$6)+(L36*$L$6)+(M36*$M$6)+(N36*$N$6)+(O36*$O$6)+(P36*100*$P$6)+(Q36*100*$Q$6)+(R36*100*$R$6)+(S36*100*$S$6)+(T36*$T$6)+(U36*$U$6)+(V36*$V$6)+(W36*$W$6)+(X36*$X$6)+(Y36*$Y$6)+(Z36*$Z$6)+(AB36*$AA$6) -> 21.266999999999999 | D36: Eng | E36: 4 | F36: 300 | G36: Vendor | I36: 60 | J36: E | K36: 147 | M36: 12 | P36: 00.02 | AA36: 2 | AB36: 1 | AC36: Stealth Detect
A37: Embrace of the Lycan | B37: =(K37*$K$5)+(L37*$L$5)+(M37*$M$5)+(N37*$N$5)+(O37*$O$5)+(P37*100*$P$5)+(Q37*100*$Q$5)+(R37*100*$R$5)+(S37*100*$S$5)+(T37*$T$5)+(U37*$U$5)+(V37*$V$5)+(W37*$W$5)+(X37*$X$5)+(Y37*$Y$5)+(Z37*$Z$5)+(AA37*$AA$5) -> 37.18 | C37: =(K37*$K$6)+(L37*$L$6)+(M37*$M$6)+(N37*$N$6)+(O37*$O$6)+(P37*100*$P$6)+(Q37*100*$Q$6)+(R37*100*$R$6)+(S37*100*$S$6)+(T37*$T$6)+(U37*$U$6)+(V37*$V$6)+(W37*$W$6)+(X37*$X$6)+(Y37*$Y$6)+(Z37*$Z$6)+(AB37*$AA$6) -> 20.277999999999999 | D37: ZF | E37: 1 | F37: 00.07 | G37: Chief Ukorz | I37: 45 | J37: P | K37: 118 | M37: 16 | N37: 8 | O37: 32
A38: Polar Helmet | B38: =(K38*$K$5)+(L38*$L$5)+(M38*$M$5)+(N38*$N$5)+(O38*$O$5)+(P38*100*$P$5)+(Q38*100*$Q$5)+(R38*100*$R$5)+(S38*100*$S$5)+(T38*$T$5)+(U38*$U$5)+(V38*$V$5)+(W38*$W$5)+(X38*$X$5)+(Y38*$Y$5)+(Z38*$Z$5)+(AA38*$AA$5) -> 48.36 | C38: =(K38*$K$6)+(L38*$L$6)+(M38*$M$6)+(N38*$N$6)+(O38*$O$6)+(P38*100*$P$6)+(Q38*100*$Q$6)+(R38*100*$R$6)+(S38*100*$S$6)+(T38*$T$6)+(U38*$U$6)+(V38*$V$6)+(W38*$W$6)+(X38*$X$6)+(Y38*$Y$6)+(Z38*$Z$6)+(AB38*$AA$6) -> 18.876000000000001 | D38: Naxx | E38: 6 | F38: 00.2 | G38: Gothik | I38: 60 | J38: P | K38: 196 | L38: 18 | M38: 24 | W38: 44
A39: Tattered Leather Hood | B39: =(K39*$K$5)+(L39*$L$5)+(M39*$M$5)+(N39*$N$5)+(O39*$O$5)+(P39*100*$P$5)+(Q39*100*$Q$5)+(R39*100*$R$5)+(S39*100*$S$5)+(T39*$T$5)+(U39*$U$5)+(V39*$V$5)+(W39*$W$5)+(X39*$X$5)+(Y39*$Y$5)+(Z39*$Z$5)+(AA39*$AA$5) -> 41.8 | C39: =(K39*$K$6)+(L39*$L$6)+(M39*$M$6)+(N39*$N$6)+(O39*$O$6)+(P39*100*$P$6)+(Q39*100*$Q$6)+(R39*100*$R$6)+(S39*100*$S$6)+(T39*$T$6)+(U39*$U$6)+(V39*$V$6)+(W39*$W$6)+(X39*$X$6)+(Y39*$Y$6)+(Z39*$Z$6)+(AB39*$AA$6) -> 17.86 | D39: Sch | E39: 1 | F39: 57-61 | G39: Scholo Random Drop | I39: 51 | J39: P | K39: 130 | L39: 10 | M39: 23 | Q39: 00.01
A40: Wicked Leather Headband | B40: =(K40*$K$5)+(L40*$L$5)+(M40*$M$5)+(N40*$N$5)+(O40*$O$5)+(P40*100*$P$5)+(Q40*100*$Q$5)+(R40*100*$R$5)+(S40*100*$S$5)+(T40*$T$5)+(U40*$U$5)+(V40*$V$5)+(W40*$W$5)+(X40*$X$5)+(Y40*$Y$5)+(Z40*$Z$5)+(AA40*$AA$5) -> 33.18 | C40: =(K40*$K$6)+(L40*$L$6)+(M40*$M$6)+(N40*$N$6)+(O40*$O$6)+(P40*100*$P$6)+(Q40*100*$Q$6)+(R40*100*$R$6)+(S40*100*$S$6)+(T40*$T$6)+(U40*$U$6)+(V40*$V$6)+(W40*$W$6)+(X40*$X$6)+(Y40*$Y$6)+(Z40*$Z$6)+(AB40*$AA$6) -> 16.277999999999999 | D40: LW | E40: 1 | F40: 280 | G40: WS Recipe Drop | I40: 51 | J40: E | K40: 118 | L40: 16 | M40: 16
A41: Champion's Leather Headguard | B41: =(K41*$K$5)+(L41*$L$5)+(M41*$M$5)+(N41*$N$5)+(O41*$O$5)+(P41*100*$P$5)+(Q41*100*$Q$5)+(R41*100*$R$5)+(S41*100*$S$5)+(T41*$T$5)+(U41*$U$5)+(V41*$V$5)+(W41*$W$5)+(X41*$X$5)+(Y41*$Y$5)+(Z41*$Z$5)+(AA41*$AA$5) -> 43.93 | C41: =(K41*$K$6)+(L41*$L$6)+(M41*$M$6)+(N41*$N$6)+(O41*$O$6)+(P41*100*$P$6)+(Q41*100*$Q$6)+(R41*100*$R$6)+(S41*100*$S$6)+(T41*$T$6)+(U41*$U$6)+(V41*$V$6)+(W41*$W$6)+(X41*$X$6)+(Y41*$Y$6)+(Z41*$Z$6)+(AB41*$AA$6) -> 13.913 | D41: PVP | E41: 2 | F41: Cha | G41: Horde Rank 10 PVP | H41: CG | I41: 58 | J41: P | K41: 143 | M41: 26 | O41: 12 | Q41: 00.01 | S41: 00.01
A42: Lt. Comm. Leather Veil | B42: =(K42*$K$5)+(L42*$L$5)+(M42*$M$5)+(N42*$N$5)+(O42*$O$5)+(P42*100*$P$5)+(Q42*100*$Q$5)+(R42*100*$R$5)+(S42*100*$S$5)+(T42*$T$5)+(U42*$U$5)+(V42*$V$5)+(W42*$W$5)+(X42*$X$5)+(Y42*$Y$5)+(Z42*$Z$5)+(AA42*$AA$5) -> 43.93 | C42: =(K42*$K$6)+(L42*$L$6)+(M42*$M$6)+(N42*$N$6)+(O42*$O$6)+(P42*100*$P$6)+(Q42*100*$Q$6)+(R42*100*$R$6)+(S42*100*$S$6)+(T42*$T$6)+(U42*$U$6)+(V42*$V$6)+(W42*$W$6)+(X42*$X$6)+(Y42*$Y$6)+(Z42*$Z$6)+(AB42*$AA$6) -> 13.913 | D42: PVP | E42: 2 | F42: LC | G42: Alliance Rank 10 PVP | H42: LCV | I42: 58 | J42: P | K42: 143 | M42: 26 | O42: 12 | Q42: 00.01 | S42: 00.01
A44: NECK | B44: AEP | C44: MAEP | D44: Loc | E44: P | F44: Info | G44: Source | H44: Set | I44: Lvl | J44: B | K44: Arm | L44: Agi | M44: Sta | N44: Str | O44: AP | P44: Cri | Q44: Hit | R44: Par | S44: Dod | T44: Def | U44: Ar | V44: Fi | W44: Fr | X44: Na | Y44: Sh | Z44: H/5 | AA44: PVP | AB44: PVE | AC44: Special
A45: Prestor's Talisman of Connivery | B45: =(K45*$K$5)+(L45*$L$5)+(M45*$M$5)+(N45*$N$5)+(O45*$O$5)+(P45*100*$P$5)+(Q45*100*$Q$5)+(R45*100*$R$5)+(S45*100*$S$5)+(T45*$T$5)+(U45*$U$5)+(V45*$V$5)+(W45*$W$5)+(X45*$X$5)+(Y45*$Y$5)+(Z45*$Z$5)+(AA45*$AA$5) -> 37.5 | C45: =(K45*$K$6)+(L45*$L$6)+(M45*$M$6)+(N45*$N$6)+(O45*$O$6)+(P45*100*$P$6)+(Q45*100*$Q$6)+(R45*100*$R$6)+(S45*100*$S$6)+(T45*$T$6)+(U45*$U$6)+(V45*$V$6)+(W45*$W$6)+(X45*$X$6)+(Y45*$Y$6)+(Z45*$Z$6)+(AB45*$AA$6) -> 37.5 | D45: BWL | E45: 3 | F45: 00.15 | G45: Nefarian | I45: 60 | J45: P | L45: 30 | Q45: 00.01
A46: Stormrage's Talisman of Seething | B46: =(K46*$K$5)+(L46*$L$5)+(M46*$M$5)+(N46*$N$5)+(O46*$O$5)+(P46*100*$P$5)+(Q46*100*$Q$5)+(R46*100*$R$5)+(S46*100*$S$5)+(T46*$T$5)+(U46*$U$5)+(V46*$V$5)+(W46*$W$5)+(X46*$X$5)+(Y46*$Y$5)+(Z46*$Z$5)+(AA46*$AA$5) -> 45 | C46: =(K46*$K$6)+(L46*$L$6)+(M46*$M$6)+(N46*$N$6)+(O46*$O$6)+(P46*100*$P$6)+(Q46*100*$Q$6)+(R46*100*$R$6)+(S46*100*$S$6)+(T46*$T$6)+(U46*$U$6)+(V46*$V$6)+(W46*$W$6)+(X46*$X$6)+(Y46*$Y$6)+(Z46*$Z$6)+(AB46*$AA$6) -> 33.12 | D46: Naxx | E46: 6 | F46: 00.17 | G46: Kel'Thuzad | I46: 60 | J46: P | M46: 12 | O46: 26 | P46: 00.02
A47: Barbed Choker | B47: =(K47*$K$5)+(L47*$L$5)+(M47*$M$5)+(N47*$N$5)+(O47*$O$5)+(P47*100*$P$5)+(Q47*100*$Q$5)+(R47*100*$R$5)+(S47*100*$S$5)+(T47*$T$5)+(U47*$U$5)+(V47*$V$5)+(W47*$W$5)+(X47*$X$5)+(Y47*$Y$5)+(Z47*$Z$5)+(AA47*$AA$5) -> 42 | C47: =(K47*$K$6)+(L47*$L$6)+(M47*$M$6)+(N47*$N$6)+(O47*$O$6)+(P47*100*$P$6)+(Q47*100*$Q$6)+(R47*100*$R$6)+(S47*100*$S$6)+(T47*$T$6)+(U47*$U$6)+(V47*$V$6)+(W47*$W$6)+(X47*$X$6)+(Y47*$Y$6)+(Z47*$Z$6)+(AB47*$AA$6) -> 32.1 | D47: AQ40 | E47: 5 | F47: 00.15 | G47: Fankriss | I47: 60 | J47: P | M47: 10 | O47: 44 | P47: 00.01
A48: The Eye of Hakkar | B48: =(K48*$K$5)+(L48*$L$5)+(M48*$M$5)+(N48*$N$5)+(O48*$O$5)+(P48*100*$P$5)+(Q48*100*$Q$5)+(R48*100*$R$5)+(S48*100*$S$5)+(T48*$T$5)+(U48*$U$5)+(V48*$V$5)+(W48*$W$5)+(X48*$X$5)+(Y48*$Y$5)+(Z48*$Z$5)+(AA48*$AA$5) -> 30 | C48: =(K48*$K$6)+(L48*$L$6)+(M48*$M$6)+(N48*$N$6)+(O48*$O$6)+(P48*100*$P$6)+(Q48*100*$Q$6)+(R48*100*$R$6)+(S48*100*$S$6)+(T48*$T$6)+(U48*$U$6)+(V48*$V$6)+(W48*$W$6)+(X48*$X$6)+(Y48*$Y$6)+(Z48*$Z$6)+(AB48*$AA$6) -> 30 | D48: ZG | E48: 4 | F48: 00.14 | G48: Hakkar | I48: 60 | J48: P | O48: 40 | P48: 00.01
A49: Onyxia Tooth Pendant | B49: =(K49*$K$5)+(L49*$L$5)+(M49*$M$5)+(N49*$N$5)+(O49*$O$5)+(P49*100*$P$5)+(Q49*100*$Q$5)+(R49*100*$R$5)+(S49*100*$S$5)+(T49*$T$5)+(U49*$U$5)+(V49*$V$5)+(W49*$W$5)+(X49*$X$5)+(Y49*$Y$5)+(Z49*$Z$5)+(AA49*$AA$5) -> 39.5 | C49: =(K49*$K$6)+(L49*$L$6)+(M49*$M$6)+(N49*$N$6)+(O49*$O$6)+(P49*100*$P$6)+(Q49*100*$Q$6)+(R49*100*$R$6)+(S49*100*$S$6)+(T49*$T$6)+(U49*$U$6)+(V49*$V$6)+(W49*$W$6)+(X49*$X$6)+(Y49*$Y$6)+(Z49*$Z$6)+(AB49*$AA$6) -> 29.69 | D49: OL | E49: 1 | F49: Q | G49: Onyxia Head Reward | I49: 60 | J49: P | L49: 12 | M49: 9 | P49: 00.01 | Q49: 00.01 | V49: 10
A50: Amulet of the Darkmoon | B50: =(K50*$K$5)+(L50*$L$5)+(M50*$M$5)+(N50*$N$5)+(O50*$O$5)+(P50*100*$P$5)+(Q50*100*$Q$5)+(R50*100*$R$5)+(S50*100*$S$5)+(T50*$T$5)+(U50*$U$5)+(V50*$V$5)+(W50*$W$5)+(X50*$X$5)+(Y50*$Y$5)+(Z50*$Z$5)+(AA50*$AA$5) -> 34 | C50: =(K50*$K$6)+(L50*$L$6)+(M50*$M$6)+(N50*$N$6)+(O50*$O$6)+(P50*100*$P$6)+(Q50*100*$Q$6)+(R50*100*$R$6)+(S50*100*$S$6)+(T50*$T$6)+(U50*$U$6)+(V50*$V$6)+(W50*$W$6)+(X50*$X$6)+(Y50*$Y$6)+(Z50*$Z$6)+(AB50*$AA$6) -> 24.1 | D50: DMF | E50: 3 | F50: 1200 | G50: Darkmoon Faire Tix | I50: 60 | J50: P | L50: 19 | M50: 10 | N50: 10
A51: Mark of Fordring | B51: =(K51*$K$5)+(L51*$L$5)+(M51*$M$5)+(N51*$N$5)+(O51*$O$5)+(P51*100*$P$5)+(Q51*100*$Q$5)+(R51*100*$R$5)+(S51*100*$S$5)+(T51*$T$5)+(U51*$U$5)+(V51*$V$5)+(W51*$W$5)+(X51*$X$5)+(Y51*$Y$5)+(Z51*$Z$5)+(AA51*$AA$5) -> 23 | C51: =(K51*$K$6)+(L51*$L$6)+(M51*$M$6)+(N51*$N$6)+(O51*$O$6)+(P51*100*$P$6)+(Q51*100*$Q$6)+(R51*100*$R$6)+(S51*100*$S$6)+(T51*$T$6)+(U51*$U$6)+(V51*$V$6)+(W51*$W$6)+(X51*$X$6)+(Y51*$Y$6)+(Z51*$Z$6)+(AB51*$AA$6) -> 23 | D51: Str | E51: 1 | F51: Q | G51: Quest Series Reward | I51: 52 | J51: P | O51: 26 | P51: 00.01
A52: Pendant of Celerity | B52: =(K52*$K$5)+(L52*$L$5)+(M52*$M$5)+(N52*$N$5)+(O52*$O$5)+(P52*100*$P$5)+(Q52*100*$Q$5)+(R52*100*$R$5)+(S52*100*$S$5)+(T52*$T$5)+(U52*$U$5)+(V52*$V$5)+(W52*$W$5)+(X52*$X$5)+(Y52*$Y$5)+(Z52*$Z$5)+(AA52*$AA$5) -> 22.5 | C52: =(K52*$K$6)+(L52*$L$6)+(M52*$M$6)+(N52*$N$6)+(O52*$O$6)+(P52*100*$P$6)+(Q52*100*$Q$6)+(R52*100*$R$6)+(S52*100*$S$6)+(T52*$T$6)+(U52*$U$6)+(V52*$V$6)+(W52*$W$6)+(X52*$X$6)+(Y52*$Y$6)+(Z52*$Z$6)+(AB52*$AA$6) -> 22.5 | D52: UBRS | E52: 5 | F52: 00.2 | G52: Lord Valthalak | I52: 58 | J52: P | L52: 15 | Q52: 00.01
A53: Medallion of the Dawn | B53: =(K53*$K$5)+(L53*$L$5)+(M53*$M$5)+(N53*$N$5)+(O53*$O$5)+(P53*100*$P$5)+(Q53*100*$Q$5)+(R53*100*$R$5)+(S53*100*$S$5)+(T53*$T$5)+(U53*$U$5)+(V53*$V$5)+(W53*$W$5)+(X53*$X$5)+(Y53*$Y$5)+(Z53*$Z$5)+(AA53*$AA$5) -> 34 | C53: =(K53*$K$6)+(L53*$L$6)+(M53*$M$6)+(N53*$N$6)+(O53*$O$6)+(P53*100*$P$6)+(Q53*100*$Q$6)+(R53*100*$R$6)+(S53*100*$S$6)+(T53*$T$6)+(U53*$U$6)+(V53*$V$6)+(W53*$W$6)+(X53*$X$6)+(Y53*$Y$6)+(Z53*$Z$6)+(AB53*$AA$6) -> 22.12 | D53: EPL | E53: 6 | F53: AD | G53: AD Quest Reward | I53: 55 | J53: P | M53: 12 | O53: 24 | P53: 00.01
A54: Fury of the Forgotten Swarm | B54: =(K54*$K$5)+(L54*$L$5)+(M54*$M$5)+(N54*$N$5)+(O54*$O$5)+(P54*100*$P$5)+(Q54*100*$Q$5)+(R54*100*$R$5)+(S54*100*$S$5)+(T54*$T$5)+(U54*$U$5)+(V54*$V$5)+(W54*$W$5)+(X54*$X$5)+(Y54*$Y$5)+(Z54*$Z$5)+(AA54*$AA$5) -> 21.5 | C54: =(K54*$K$6)+(L54*$L$6)+(M54*$M$6)+(N54*$N$6)+(O54*$O$6)+(P54*100*$P$6)+(Q54*100*$Q$6)+(R54*100*$R$6)+(S54*100*$S$6)+(T54*$T$6)+(U54*$U$6)+(V54*$V$6)+(W54*$W$6)+(X54*$X$6)+(Y54*$Y$6)+(Z54*$Z$6)+(AB54*$AA$6) -> 21.5 | D54: AQ20 | E54: 5 | F54: 00.12 | G54: Major Pakkon | I54: 60 | J54: P | N54: 8 | P54: 00.01 | Q54: 00.01
A55: Choker of the Shifting Sands | B55: =(K55*$K$5)+(L55*$L$5)+(M55*$M$5)+(N55*$N$5)+(O55*$O$5)+(P55*100*$P$5)+(Q55*100*$Q$5)+(R55*100*$R$5)+(S55*100*$S$5)+(T55*$T$5)+(U55*$U$5)+(V55*$V$5)+(W55*$W$5)+(X55*$X$5)+(Y55*$Y$5)+(Z55*$Z$5)+(AA55*$AA$5) -> 37 | C55: =(K55*$K$6)+(L55*$L$6)+(M55*$M$6)+(N55*$N$6)+(O55*$O$6)+(P55*100*$P$6)+(Q55*100*$Q$6)+(R55*100*$R$6)+(S55*100*$S$6)+(T55*$T$6)+(U55*$U$6)+(V55*$V$6)+(W55*$W$6)+(X55*$X$6)+(Y55*$Y$6)+(Z55*$Z$6)+(AB55*$AA$6) -> 21.16 | D55: AQ20 | E55: 5 | F55: Q | G55: Head of Ossirian | I55: 60 | J55: P | M55: 16 | O55: 42
A56: Sadist's Collar | B56: =(K56*$K$5)+(L56*$L$5)+(M56*$M$5)+(N56*$N$5)+(O56*$O$5)+(P56*100*$P$5)+(Q56*100*$Q$5)+(R56*100*$R$5)+(S56*100*$S$5)+(T56*$T$5)+(U56*$U$5)+(V56*$V$5)+(W56*$W$5)+(X56*$X$5)+(Y56*$Y$5)+(Z56*$Z$5)+(AA56*$AA$5) -> 44 | C56: =(K56*$K$6)+(L56*$L$6)+(M56*$M$6)+(N56*$N$6)+(O56*$O$6)+(P56*100*$P$6)+(Q56*100*$Q$6)+(R56*100*$R$6)+(S56*100*$S$6)+(T56*$T$6)+(U56*$U$6)+(V56*$V$6)+(W56*$W$6)+(X56*$X$6)+(Y56*$Y$6)+(Z56*$Z$6)+(AB56*$AA$6) -> 20.24 | D56: Naxx | E56: 6 | F56: 00.2 | G56: Gothik | I56: 60 | J56: P | M56: 24 | O56: 20 | P56: 00.01
A57: Beads of Ogre Might | B57: =(K57*$K$5)+(L57*$L$5)+(M57*$M$5)+(N57*$N$5)+(O57*$O$5)+(P57*100*$P$5)+(Q57*100*$Q$5)+(R57*100*$R$5)+(S57*100*$S$5)+(T57*$T$5)+(U57*$U$5)+(V57*$V$5)+(W57*$W$5)+(X57*$X$5)+(Y57*$Y$5)+(Z57*$Z$5)+(AA57*$AA$5) -> 26.5 | C57: =(K57*$K$6)+(L57*$L$6)+(M57*$M$6)+(N57*$N$6)+(O57*$O$6)+(P57*100*$P$6)+(Q57*100*$Q$6)+(R57*100*$R$6)+(S57*100*$S$6)+(T57*$T$6)+(U57*$U$6)+(V57*$V$6)+(W57*$W$6)+(X57*$X$6)+(Y57*$Y$6)+(Z57*$Z$6)+(AB57*$AA$6) -> 19.57 | D57: DM-W | E57: 2 | F57: Q | G57: Quest Reward | I57: 58 | J57: P | M57: 7 | O57: 24 | Q57: 00.01
A58: Blazefury Medallion | B58: =(K58*$K$5)+(L58*$L$5)+(M58*$M$5)+(N58*$N$5)+(O58*$O$5)+(P58*100*$P$5)+(Q58*100*$Q$5)+(R58*100*$R$5)+(S58*100*$S$5)+(T58*$T$5)+(U58*$U$5)+(V58*$V$5)+(W58*$W$5)+(X58*$X$5)+(Y58*$Y$5)+(Z58*$Z$5)+(AA58*$AA$5) -> 34.2 | C58: =(K58*$K$6)+(L58*$L$6)+(M58*$M$6)+(N58*$N$6)+(O58*$O$6)+(P58*100*$P$6)+(Q58*100*$Q$6)+(R58*100*$R$6)+(S58*100*$S$6)+(T58*$T$6)+(U58*$U$6)+(V58*$V$6)+(W58*$W$6)+(X58*$X$6)+(Y58*$Y$6)+(Z58*$Z$6)+(AB58*$AA$6) -> 19.26 | D58: BL | E58: 2 | F58: 00.02 | G58: Lord Kazzak | I58: 60 | J58: P | L58: 13 | M58: 14 | V58: 12 | AA58: 6 | AB58: 6 | AC58: +2 fire dam.
A59: Zand. Shadow Mastery Talisman | B59: =(K59*$K$5)+(L59*$L$5)+(M59*$M$5)+(N59*$N$5)+(O59*$O$5)+(P59*100*$P$5)+(Q59*100*$Q$5)+(R59*100*$R$5)+(S59*100*$S$5)+(T59*$T$5)+(U59*$U$5)+(V59*$V$5)+(W59*$W$5)+(X59*$X$5)+(Y59*$Y$5)+(Z59*$Z$5)+(AA59*$AA$5) -> 28 | C59: =(K59*$K$6)+(L59*$L$6)+(M59*$M$6)+(N59*$N$6)+(O59*$O$6)+(P59*100*$P$6)+(Q59*100*$Q$6)+(R59*100*$R$6)+(S59*100*$S$6)+(T59*$T$6)+(U59*$U$6)+(V59*$V$6)+(W59*$W$6)+(X59*$X$6)+(Y59*$Y$6)+(Z59*$Z$6)+(AB59*$AA$6) -> 18.09 | D59: ZG | E59: 4 | F59: Q | G59: Zandalar Exalted | H59: MO | I59: 58 | J59: P | L59: 15 | M59: 9 | N59: 6 | AA59: 1 | AB59: 0 | AC59: Decr. Kick CD
A60: Zandalarian Shadow Talisman (3) | B60: =(K60*$K$5)+(L60*$L$5)+(M60*$M$5)+(N60*$N$5)+(O60*$O$5)+(P60*100*$P$5)+(Q60*100*$Q$5)+(R60*100*$R$5)+(S60*100*$S$5)+(T60*$T$5)+(U60*$U$5)+(V60*$V$5)+(W60*$W$5)+(X60*$X$5)+(Y60*$Y$5)+(Z60*$Z$5)+(AA60*$AA$5) -> 27 | C60: =(K60*$K$6)+(L60*$L$6)+(M60*$M$6)+(N60*$N$6)+(O60*$O$6)+(P60*100*$P$6)+(Q60*100*$Q$6)+(R60*100*$R$6)+(S60*100*$S$6)+(T60*$T$6)+(U60*$U$6)+(V60*$V$6)+(W60*$W$6)+(X60*$X$6)+(Y60*$Y$6)+(Z60*$Z$6)+(AB60*$AA$6) -> 18.09 | D60: ZG | E60: 4 | F60: Q | G60: Zandalar Revered | I60: 58 | J60: P | L60: 15 | M60: 9 | N60: 6
A61: Pendant of the Qiraji Guardian | B61: =(K61*$K$5)+(L61*$L$5)+(M61*$M$5)+(N61*$N$5)+(O61*$O$5)+(P61*100*$P$5)+(Q61*100*$Q$5)+(R61*100*$R$5)+(S61*100*$S$5)+(T61*$T$5)+(U61*$U$5)+(V61*$V$5)+(W61*$W$5)+(X61*$X$5)+(Y61*$Y$5)+(Z61*$Z$5)+(AA61*$AA$5) -> 35.2 | C61: =(K61*$K$6)+(L61*$L$6)+(M61*$M$6)+(N61*$N$6)+(O61*$O$6)+(P61*100*$P$6)+(Q61*100*$Q$6)+(R61*100*$R$6)+(S61*100*$S$6)+(T61*$T$6)+(U61*$U$6)+(V61*$V$6)+(W61*$W$6)+(X61*$X$6)+(Y61*$Y$6)+(Z61*$Z$6)+(AB61*$AA$6) -> 17.23 | D61: AQ40 | E61: 5 | F61: 00.15 | G61: Prophet Skeram | I61: 60 | J61: P | L61: 11 | M61: 17 | N61: 12 | T61: 6
A62: Prismatic Pendant of the Tiger | B62: =(K62*$K$5)+(L62*$L$5)+(M62*$M$5)+(N62*$N$5)+(O62*$O$5)+(P62*100*$P$5)+(Q62*100*$Q$5)+(R62*100*$R$5)+(S62*100*$S$5)+(T62*$T$5)+(U62*$U$5)+(V62*$V$5)+(W62*$W$5)+(X62*$X$5)+(Y62*$Y$5)+(Z62*$Z$5)+(AA62*$AA$5) -> 16.5 | C62: =(K62*$K$6)+(L62*$L$6)+(M62*$M$6)+(N62*$N$6)+(O62*$O$6)+(P62*100*$P$6)+(Q62*100*$Q$6)+(R62*100*$R$6)+(S62*100*$S$6)+(T62*$T$6)+(U62*$U$6)+(V62*$V$6)+(W62*$W$6)+(X62*$X$6)+(Y62*$Y$6)+(Z62*$Z$6)+(AB62*$AA$6) -> 16.5 | D62: R | E62: 1 | F62: 58-62 | G62: Random World Drop | I62: 60 | J62: E | L62: 11 | N62: 11
A63: Imperial Jewel | B63: =(K63*$K$5)+(L63*$L$5)+(M63*$M$5)+(N63*$N$5)+(O63*$O$5)+(P63*100*$P$5)+(Q63*100*$Q$5)+(R63*100*$R$5)+(S63*100*$S$5)+(T63*$T$5)+(U63*$U$5)+(V63*$V$5)+(W63*$W$5)+(X63*$X$5)+(Y63*$Y$5)+(Z63*$Z$5)+(AA63*$AA$5) -> 23 | C63: =(K63*$K$6)+(L63*$L$6)+(M63*$M$6)+(N63*$N$6)+(O63*$O$6)+(P63*100*$P$6)+(Q63*100*$Q$6)+(R63*100*$R$6)+(S63*100*$S$6)+(T63*$T$6)+(U63*$U$6)+(V63*$V$6)+(W63*$W$6)+(X63*$X$6)+(Y63*$Y$6)+(Z63*$Z$6)+(AB63*$AA$6) -> 16.07 | D63: BRD | E63: 1 | F63: 00.15 | G63: Emperor Dagran | I63: 55 | J63: P | M63: 7 | O63: 32
A64: Skibi's Pendant | B64: =(K64*$K$5)+(L64*$L$5)+(M64*$M$5)+(N64*$N$5)+(O64*$O$5)+(P64*100*$P$5)+(Q64*100*$Q$5)+(R64*100*$R$5)+(S64*100*$S$5)+(T64*$T$5)+(U64*$U$5)+(V64*$V$5)+(W64*$W$5)+(X64*$X$5)+(Y64*$Y$5)+(Z64*$Z$5)+(AA64*$AA$5) -> 15.5 | C64: =(K64*$K$6)+(L64*$L$6)+(M64*$M$6)+(N64*$N$6)+(O64*$O$6)+(P64*100*$P$6)+(Q64*100*$Q$6)+(R64*100*$R$6)+(S64*100*$S$6)+(T64*$T$6)+(U64*$U$6)+(V64*$V$6)+(W64*$W$6)+(X64*$X$6)+(Y64*$Y$6)+(Z64*$Z$6)+(AB64*$AA$6) -> 15.5 | D64: R | E64: 1 | F64: 46-51 | G64: Random World Drop | I64: 44 | J64: E | L64: 13 | N64: 5
A65: Will of the Martyr | B65: =(K65*$K$5)+(L65*$L$5)+(M65*$M$5)+(N65*$N$5)+(O65*$O$5)+(P65*100*$P$5)+(Q65*100*$Q$5)+(R65*100*$R$5)+(S65*100*$S$5)+(T65*$T$5)+(U65*$U$5)+(V65*$V$5)+(W65*$W$5)+(X65*$X$5)+(Y65*$Y$5)+(Z65*$Z$5)+(AA65*$AA$5) -> 25 | C65: =(K65*$K$6)+(L65*$L$6)+(M65*$M$6)+(N65*$N$6)+(O65*$O$6)+(P65*100*$P$6)+(Q65*100*$Q$6)+(R65*100*$R$6)+(S65*100*$S$6)+(T65*$T$6)+(U65*$U$6)+(V65*$V$6)+(W65*$W$6)+(X65*$X$6)+(Y65*$Y$6)+(Z65*$Z$6)+(AB65*$AA$6) -> 15.1 | D65: Str | E65: 1 | F65: Q | G65: Quest Series Reward | I65: 55 | J65: P | M65: 10 | O65: 30
A66: Scout's Medallion (58) | B66: =(K66*$K$5)+(L66*$L$5)+(M66*$M$5)+(N66*$N$5)+(O66*$O$5)+(P66*100*$P$5)+(Q66*100*$Q$5)+(R66*100*$R$5)+(S66*100*$S$5)+(T66*$T$5)+(U66*$U$5)+(V66*$V$5)+(W66*$W$5)+(X66*$X$5)+(Y66*$Y$5)+(Z66*$Z$5)+(AA66*$AA$5) -> 25 | C66: =(K66*$K$6)+(L66*$L$6)+(M66*$M$6)+(N66*$N$6)+(O66*$O$6)+(P66*100*$P$6)+(Q66*100*$Q$6)+(R66*100*$R$6)+(S66*100*$S$6)+(T66*$T$6)+(U66*$U$6)+(V66*$V$6)+(W66*$W$6)+(X66*$X$6)+(Y66*$Y$6)+(Z66*$Z$6)+(AB66*$AA$6) -> 15.1 | D66: PVP | E66: 2 | F66: Hon | G66: Alliance Rank 4 PVP | I66: 58 | J66: P | L66: 15 | M66: 10
A67: Sentinel's Medallion (58) | B67: =(K67*$K$5)+(L67*$L$5)+(M67*$M$5)+(N67*$N$5)+(O67*$O$5)+(P67*100*$P$5)+(Q67*100*$Q$5)+(R67*100*$R$5)+(S67*100*$S$5)+(T67*$T$5)+(U67*$U$5)+(V67*$V$5)+(W67*$W$5)+(X67*$X$5)+(Y67*$Y$5)+(Z67*$Z$5)+(AA67*$AA$5) -> 25 | C67: =(K67*$K$6)+(L67*$L$6)+(M67*$M$6)+(N67*$N$6)+(O67*$O$6)+(P67*100*$P$6)+(Q67*100*$Q$6)+(R67*100*$R$6)+(S67*100*$S$6)+(T67*$T$6)+(U67*$U$6)+(V67*$V$6)+(W67*$W$6)+(X67*$X$6)+(Y67*$Y$6)+(Z67*$Z$6)+(AB67*$AA$6) -> 15.1 | D67: PVP | E67: 2 | F67: Hon | G67: Horde Rank 4 PVP | I67: 58 | J67: P | L67: 15 | M67: 10
A68: Evil Eye Pendant | B68: =(K68*$K$5)+(L68*$L$5)+(M68*$M$5)+(N68*$N$5)+(O68*$O$5)+(P68*100*$P$5)+(Q68*100*$Q$5)+(R68*100*$R$5)+(S68*100*$S$5)+(T68*$T$5)+(U68*$U$5)+(V68*$V$5)+(W68*$W$5)+(X68*$X$5)+(Y68*$Y$5)+(Z68*$Z$5)+(AA68*$AA$5) -> 17 | C68: =(K68*$K$6)+(L68*$L$6)+(M68*$M$6)+(N68*$N$6)+(O68*$O$6)+(P68*100*$P$6)+(Q68*100*$Q$6)+(R68*100*$R$6)+(S68*100*$S$6)+(T68*$T$6)+(U68*$U$6)+(V68*$V$6)+(W68*$W$6)+(X68*$X$6)+(Y68*$Y$6)+(Z68*$Z$6)+(AB68*$AA$6) -> 15.1 | D68: DM-W | E68: 2 | F68: 00.2 | G68: Immol'thar | I68: 57 | J68: P | L68: 15 | T68: 10
A69: Zandalarian Shadow Talisman (2) | B69: =(K69*$K$5)+(L69*$L$5)+(M69*$M$5)+(N69*$N$5)+(O69*$O$5)+(P69*100*$P$5)+(Q69*100*$Q$5)+(R69*100*$R$5)+(S69*100*$S$5)+(T69*$T$5)+(U69*$U$5)+(V69*$V$5)+(W69*$W$5)+(X69*$X$5)+(Y69*$Y$5)+(Z69*$Z$5)+(AA69*$AA$5) -> 22 | C69: =(K69*$K$6)+(L69*$L$6)+(M69*$M$6)+(N69*$N$6)+(O69*$O$6)+(P69*100*$P$6)+(Q69*100*$Q$6)+(R69*100*$R$6)+(S69*100*$S$6)+(T69*$T$6)+(U69*$U$6)+(V69*$V$6)+(W69*$W$6)+(X69*$X$6)+(Y69*$Y$6)+(Z69*$Z$6)+(AB69*$AA$6) -> 15.07 | D69: ZG | E69: 4 | F69: Q | G69: Zandalar Honored | I69: 58 | J69: P | L69: 12 | M69: 7 | N69: 6
A70: Jungle Necklace of the Tiger | B70: =(K70*$K$5)+(L70*$L$5)+(M70*$M$5)+(N70*$N$5)+(O70*$O$5)+(P70*100*$P$5)+(Q70*100*$Q$5)+(R70*100*$R$5)+(S70*100*$S$5)+(T70*$T$5)+(U70*$U$5)+(V70*$V$5)+(W70*$W$5)+(X70*$X$5)+(Y70*$Y$5)+(Z70*$Z$5)+(AA70*$AA$5) -> 15 | C70: =(K70*$K$6)+(L70*$L$6)+(M70*$M$6)+(N70*$N$6)+(O70*$O$6)+(P70*100*$P$6)+(Q70*100*$Q$6)+(R70*100*$R$6)+(S70*100*$S$6)+(T70*$T$6)+(U70*$U$6)+(V70*$V$6)+(W70*$W$6)+(X70*$X$6)+(Y70*$Y$6)+(Z70*$Z$6)+(AB70*$AA$6) -> 15 | D70: R | E70: 1 | F70: 57-61 | G70: Random World Drop | I70: 55 | J70: E | L70: 10 | N70: 10
A71: Master Dragonslayer's Medallion | B71: =(K71*$K$5)+(L71*$L$5)+(M71*$M$5)+(N71*$N$5)+(O71*$O$5)+(P71*100*$P$5)+(Q71*100*$Q$5)+(R71*100*$R$5)+(S71*100*$S$5)+(T71*$T$5)+(U71*$U$5)+(V71*$V$5)+(W71*$W$5)+(X71*$X$5)+(Y71*$Y$5)+(Z71*$Z$5)+(AA71*$AA$5) -> 39.4 | C71: =(K71*$K$6)+(L71*$L$6)+(M71*$M$6)+(N71*$N$6)+(O71*$O$6)+(P71*100*$P$6)+(Q71*100*$Q$6)+(R71*100*$R$6)+(S71*100*$S$6)+(T71*$T$6)+(U71*$U$6)+(V71*$V$6)+(W71*$W$6)+(X71*$X$6)+(Y71*$Y$6)+(Z71*$Z$6)+(AB71*$AA$6) -> 14.31 | D71: BWL | E71: 3 | F71: Q | G71: Nefarian's Head | I71: 60 | J71: P | L71: 14 | M71: 24 | T71: 7
A72: Talisman of Evasion | B72: =(K72*$K$5)+(L72*$L$5)+(M72*$M$5)+(N72*$N$5)+(O72*$O$5)+(P72*100*$P$5)+(Q72*100*$Q$5)+(R72*100*$R$5)+(S72*100*$S$5)+(T72*$T$5)+(U72*$U$5)+(V72*$V$5)+(W72*$W$5)+(X72*$X$5)+(Y72*$Y$5)+(Z72*$Z$5)+(AA72*$AA$5) -> 16 | C72: =(K72*$K$6)+(L72*$L$6)+(M72*$M$6)+(N72*$N$6)+(O72*$O$6)+(P72*100*$P$6)+(Q72*100*$Q$6)+(R72*100*$R$6)+(S72*100*$S$6)+(T72*$T$6)+(U72*$U$6)+(V72*$V$6)+(W72*$W$6)+(X72*$X$6)+(Y72*$Y$6)+(Z72*$Z$6)+(AB72*$AA$6) -> 13.01 | D72: LBRS | E72: 1 | F72: 00.12 | G72: War Master Voone | I72: 55 | J72: P | L72: 13 | S72: 00.01
A73: Amulet of Foul Warding | B73: =(K73*$K$5)+(L73*$L$5)+(M73*$M$5)+(N73*$N$5)+(O73*$O$5)+(P73*100*$P$5)+(Q73*100*$Q$5)+(R73*100*$R$5)+(S73*100*$S$5)+(T73*$T$5)+(U73*$U$5)+(V73*$V$5)+(W73*$W$5)+(X73*$X$5)+(Y73*$Y$5)+(Z73*$Z$5)+(AA73*$AA$5) -> 26 | C73: =(K73*$K$6)+(L73*$L$6)+(M73*$M$6)+(N73*$N$6)+(O73*$O$6)+(P73*100*$P$6)+(Q73*100*$Q$6)+(R73*100*$R$6)+(S73*100*$S$6)+(T73*$T$6)+(U73*$U$6)+(V73*$V$6)+(W73*$W$6)+(X73*$X$6)+(Y73*$Y$6)+(Z73*$Z$6)+(AB73*$AA$6) -> 12.32 | D73: AQ40 | E73: 5 | F73: 00.15 | G73: Prophet Skeram | I73: 60 | J73: P | M73: 12 | O73: 24 | X73: 20
A74: Dragonheart Necklace | B74: =(K74*$K$5)+(L74*$L$5)+(M74*$M$5)+(N74*$N$5)+(O74*$O$5)+(P74*100*$P$5)+(Q74*100*$Q$5)+(R74*100*$R$5)+(S74*100*$S$5)+(T74*$T$5)+(U74*$U$5)+(V74*$V$5)+(W74*$W$5)+(X74*$X$5)+(Y74*$Y$5)+(Z74*$Z$5)+(AA74*$AA$5) -> 33 | C74: =(K74*$K$6)+(L74*$L$6)+(M74*$M$6)+(N74*$N$6)+(O74*$O$6)+(P74*100*$P$6)+(Q74*100*$Q$6)+(R74*100*$R$6)+(S74*100*$S$6)+(T74*$T$6)+(U74*$U$6)+(V74*$V$6)+(W74*$W$6)+(X74*$X$6)+(Y74*$Y$6)+(Z74*$Z$6)+(AB74*$AA$6) -> 12.21 | D74: 4D | E74: 4 | F74: 00.14 | G74: Emeriss | I74: 60 | J74: P | M74: 21 | O74: 24
A75: Woven Ivy Necklace (Horde) | B75: =(K75*$K$5)+(L75*$L$5)+(M75*$M$5)+(N75*$N$5)+(O75*$O$5)+(P75*100*$P$5)+(Q75*100*$Q$5)+(R75*100*$R$5)+(S75*100*$S$5)+(T75*$T$5)+(U75*$U$5)+(V75*$V$5)+(W75*$W$5)+(X75*$X$5)+(Y75*$Y$5)+(Z75*$Z$5)+(AA75*$AA$5) -> 22 | C75: =(K75*$K$6)+(L75*$L$6)+(M75*$M$6)+(N75*$N$6)+(O75*$O$6)+(P75*100*$P$6)+(Q75*100*$Q$6)+(R75*100*$R$6)+(S75*100*$S$6)+(T75*$T$6)+(U75*$U$6)+(V75*$V$6)+(W75*$W$6)+(X75*$X$6)+(Y75*$Y$6)+(Z75*$Z$6)+(AB75*$AA$6) -> 12.1 | D75: Hin | E75: 1 | F75: Q | G75: Horde Quest Reward | I75: 46 | J75: P | L75: 9 | M75: 10 | N75: 6
A76: Scout's Medallion (48) | B76: =(K76*$K$5)+(L76*$L$5)+(M76*$M$5)+(N76*$N$5)+(O76*$O$5)+(P76*100*$P$5)+(Q76*100*$Q$5)+(R76*100*$R$5)+(S76*100*$S$5)+(T76*$T$5)+(U76*$U$5)+(V76*$V$5)+(W76*$W$5)+(X76*$X$5)+(Y76*$Y$5)+(Z76*$Z$5)+(AA76*$AA$5) -> 20 | C76: =(K76*$K$6)+(L76*$L$6)+(M76*$M$6)+(N76*$N$6)+(O76*$O$6)+(P76*100*$P$6)+(Q76*100*$Q$6)+(R76*100*$R$6)+(S76*100*$S$6)+(T76*$T$6)+(U76*$U$6)+(V76*$V$6)+(W76*$W$6)+(X76*$X$6)+(Y76*$Y$6)+(Z76*$Z$6)+(AB76*$AA$6) -> 12.08 | D76: WSG | E76: 3 | F76: Hon | G76: Horde WSG Honored | I76: 48 | J76: P | L76: 12 | M76: 8
A77: Sentinel's Medallion (48) | B77: =(K77*$K$5)+(L77*$L$5)+(M77*$M$5)+(N77*$N$5)+(O77*$O$5)+(P77*100*$P$5)+(Q77*100*$Q$5)+(R77*100*$R$5)+(S77*100*$S$5)+(T77*$T$5)+(U77*$U$5)+(V77*$V$5)+(W77*$W$5)+(X77*$X$5)+(Y77*$Y$5)+(Z77*$Z$5)+(AA77*$AA$5) -> 20 | C77: =(K77*$K$6)+(L77*$L$6)+(M77*$M$6)+(N77*$N$6)+(O77*$O$6)+(P77*100*$P$6)+(Q77*100*$Q$6)+(R77*100*$R$6)+(S77*100*$S$6)+(T77*$T$6)+(U77*$U$6)+(V77*$V$6)+(W77*$W$6)+(X77*$X$6)+(Y77*$Y$6)+(Z77*$Z$6)+(AB77*$AA$6) -> 12.08 | D77: WSG | E77: 3 | F77: Hon | G77: Alliance WSG Hon. | I77: 48 | J77: P | L77: 12 | M77: 8
A78: Zandalarian Shadow Talisman (1) | B78: =(K78*$K$5)+(L78*$L$5)+(M78*$M$5)+(N78*$N$5)+(O78*$O$5)+(P78*100*$P$5)+(Q78*100*$Q$5)+(R78*100*$R$5)+(S78*100*$S$5)+(T78*$T$5)+(U78*$U$5)+(V78*$V$5)+(W78*$W$5)+(X78*$X$5)+(Y78*$Y$5)+(Z78*$Z$5)+(AA78*$AA$5) -> 19 | C78: =(K78*$K$6)+(L78*$L$6)+(M78*$M$6)+(N78*$N$6)+(O78*$O$6)+(P78*100*$P$6)+(Q78*100*$Q$6)+(R78*100*$R$6)+(S78*100*$S$6)+(T78*$T$6)+(U78*$U$6)+(V78*$V$6)+(W78*$W$6)+(X78*$X$6)+(Y78*$Y$6)+(Z78*$Z$6)+(AB78*$AA$6) -> 12.07 | D78: ZG | E78: 4 | F78: Q | G78: Zandalar Friendly | I78: 58 | J78: P | L78: 12 | M78: 7
A79: Sunprism Pendant | B79: =(K79*$K$5)+(L79*$L$5)+(M79*$M$5)+(N79*$N$5)+(O79*$O$5)+(P79*100*$P$5)+(Q79*100*$Q$5)+(R79*100*$R$5)+(S79*100*$S$5)+(T79*$T$5)+(U79*$U$5)+(V79*$V$5)+(W79*$W$5)+(X79*$X$5)+(Y79*$Y$5)+(Z79*$Z$5)+(AA79*$AA$5) -> 19 | C79: =(K79*$K$6)+(L79*$L$6)+(M79*$M$6)+(N79*$N$6)+(O79*$O$6)+(P79*100*$P$6)+(Q79*100*$Q$6)+(R79*100*$R$6)+(S79*100*$S$6)+(T79*$T$6)+(U79*$U$6)+(V79*$V$6)+(W79*$W$6)+(X79*$X$6)+(Y79*$Y$6)+(Z79*$Z$6)+(AB79*$AA$6) -> 12.07 | D79: Sil | E79: 4 | F79: Q | G79: Two-part quest | I79: 60 | J79: P | L79: 12 | M79: 7
A80: Scout's Medallion (38) | B80: =(K80*$K$5)+(L80*$L$5)+(M80*$M$5)+(N80*$N$5)+(O80*$O$5)+(P80*100*$P$5)+(Q80*100*$Q$5)+(R80*100*$R$5)+(S80*100*$S$5)+(T80*$T$5)+(U80*$U$5)+(V80*$V$5)+(W80*$W$5)+(X80*$X$5)+(Y80*$Y$5)+(Z80*$Z$5)+(AA80*$AA$5) -> 18 | C80: =(K80*$K$6)+(L80*$L$6)+(M80*$M$6)+(N80*$N$6)+(O80*$O$6)+(P80*100*$P$6)+(Q80*100*$Q$6)+(R80*100*$R$6)+(S80*100*$S$6)+(T80*$T$6)+(U80*$U$6)+(V80*$V$6)+(W80*$W$6)+(X80*$X$6)+(Y80*$Y$6)+(Z80*$Z$6)+(AB80*$AA$6) -> 11.07 | D80: WSG | E80: 3 | F80: Hon | G80: Horde WSG Honored | I80: 38 | J80: P | L80: 11 | M80: 7
A81: Sentinel's Medallion (38) | B81: =(K81*$K$5)+(L81*$L$5)+(M81*$M$5)+(N81*$N$5)+(O81*$O$5)+(P81*100*$P$5)+(Q81*100*$Q$5)+(R81*100*$R$5)+(S81*100*$S$5)+(T81*$T$5)+(U81*$U$5)+(V81*$V$5)+(W81*$W$5)+(X81*$X$5)+(Y81*$Y$5)+(Z81*$Z$5)+(AA81*$AA$5) -> 18 | C81: =(K81*$K$6)+(L81*$L$6)+(M81*$M$6)+(N81*$N$6)+(O81*$O$6)+(P81*100*$P$6)+(Q81*100*$Q$6)+(R81*100*$R$6)+(S81*100*$S$6)+(T81*$T$6)+(U81*$U$6)+(V81*$V$6)+(W81*$W$6)+(X81*$X$6)+(Y81*$Y$6)+(Z81*$Z$6)+(AB81*$AA$6) -> 11.07 | D81: WSG | E81: 3 | F81: Hon | G81: Alliance WSG Hon. | I81: 38 | J81: P | L81: 11 | M81: 7
A82: Eskhandar's Collar | B82: =(K82*$K$5)+(L82*$L$5)+(M82*$M$5)+(N82*$N$5)+(O82*$O$5)+(P82*100*$P$5)+(Q82*100*$Q$5)+(R82*100*$R$5)+(S82*100*$S$5)+(T82*$T$5)+(U82*$U$5)+(V82*$V$5)+(W82*$W$5)+(X82*$X$5)+(Y82*$Y$5)+(Z82*$Z$5)+(AA82*$AA$5) -> 30 | C82: =(K82*$K$6)+(L82*$L$6)+(M82*$M$6)+(N82*$N$6)+(O82*$O$6)+(P82*100*$P$6)+(Q82*100*$Q$6)+(R82*100*$R$6)+(S82*100*$S$6)+(T82*$T$6)+(U82*$U$6)+(V82*$V$6)+(W82*$W$6)+(X82*$X$6)+(Y82*$Y$6)+(Z82*$Z$6)+(AB82*$AA$6) -> 10.18 | D82: OL | E82: 1 | F82: 00.36 | G82: Onyxia | H82: SoE | I82: 60 | J82: P | M82: 17 | P82: 00.01 | S82: 00.01
A83: Abyssal War Beads | B83: =(K83*$K$5)+(L83*$L$5)+(M83*$M$5)+(N83*$N$5)+(O83*$O$5)+(P83*100*$P$5)+(Q83*100*$Q$5)+(R83*100*$R$5)+(S83*100*$S$5)+(T83*$T$5)+(U83*$U$5)+(V83*$V$5)+(W83*$W$5)+(X83*$X$5)+(Y83*$Y$5)+(Z83*$Z$5)+(AA83*$AA$5) -> 25 | C83: =(K83*$K$6)+(L83*$L$6)+(M83*$M$6)+(N83*$N$6)+(O83*$O$6)+(P83*100*$P$6)+(Q83*100*$Q$6)+(R83*100*$R$6)+(S83*100*$S$6)+(T83*$T$6)+(U83*$U$6)+(V83*$V$6)+(W83*$W$6)+(X83*$X$6)+(Y83*$Y$6)+(Z83*$Z$6)+(AB83*$AA$6) -> 10.15 | D83: Sil | E83: 4 | F83: 00.01 | G83: Bor Wildmane | I83: 58 | J83: E | M83: 15 | O83: 20
A84: Emberfury Talisman | B84: =(K84*$K$5)+(L84*$L$5)+(M84*$M$5)+(N84*$N$5)+(O84*$O$5)+(P84*100*$P$5)+(Q84*100*$Q$5)+(R84*100*$R$5)+(S84*100*$S$5)+(T84*$T$5)+(U84*$U$5)+(V84*$V$5)+(W84*$W$5)+(X84*$X$5)+(Y84*$Y$5)+(Z84*$Z$5)+(AA84*$AA$5) -> 18.7 | C84: =(K84*$K$6)+(L84*$L$6)+(M84*$M$6)+(N84*$N$6)+(O84*$O$6)+(P84*100*$P$6)+(Q84*100*$Q$6)+(R84*100*$R$6)+(S84*100*$S$6)+(T84*$T$6)+(U84*$U$6)+(V84*$V$6)+(W84*$W$6)+(X84*$X$6)+(Y84*$Y$6)+(Z84*$Z$6)+(AB84*$AA$6) -> 10.15 | D84: UBRS | E84: 1 | F84: 00.08 | G84: Pyroguard Emberseer | I84: 56 | J84: P | M84: 8 | P84: 00.01 | V84: 7
A85: Stormpike Soldier's Pendant | B85: =(K85*$K$5)+(L85*$L$5)+(M85*$M$5)+(N85*$N$5)+(O85*$O$5)+(P85*100*$P$5)+(Q85*100*$Q$5)+(R85*100*$R$5)+(S85*100*$S$5)+(T85*$T$5)+(U85*$U$5)+(V85*$V$5)+(W85*$W$5)+(X85*$X$5)+(Y85*$Y$5)+(Z85*$Z$5)+(AA85*$AA$5) -> 24 | C85: =(K85*$K$6)+(L85*$L$6)+(M85*$M$6)+(N85*$N$6)+(O85*$O$6)+(P85*100*$P$6)+(Q85*100*$Q$6)+(R85*100*$R$6)+(S85*100*$S$6)+(T85*$T$6)+(U85*$U$6)+(V85*$V$6)+(W85*$W$6)+(X85*$X$6)+(Y85*$Y$6)+(Z85*$Z$6)+(AB85*$AA$6) -> 9.15 | D85: AV | E85: 3 | F85: Hon | G85: Alliance AV Honored | I85: 55 | J85: P | M85: 15 | O85: 18
A86: Frostwolf Legionnaire's Pendant | B86: =(K86*$K$5)+(L86*$L$5)+(M86*$M$5)+(N86*$N$5)+(O86*$O$5)+(P86*100*$P$5)+(Q86*100*$Q$5)+(R86*100*$R$5)+(S86*100*$S$5)+(T86*$T$5)+(U86*$U$5)+(V86*$V$5)+(W86*$W$5)+(X86*$X$5)+(Y86*$Y$5)+(Z86*$Z$5)+(AA86*$AA$5) -> 24 | C86: =(K86*$K$6)+(L86*$L$6)+(M86*$M$6)+(N86*$N$6)+(O86*$O$6)+(P86*100*$P$6)+(Q86*100*$Q$6)+(R86*100*$R$6)+(S86*100*$S$6)+(T86*$T$6)+(U86*$U$6)+(V86*$V$6)+(W86*$W$6)+(X86*$X$6)+(Y86*$Y$6)+(Z86*$Z$6)+(AB86*$AA$6) -> 9.15 | D86: AV | E86: 3 | F86: Hon | G86: Horde AV Honored | I86: 55 | J86: P | M86: 15 | O86: 18
A87: Conqueror's Medallion (Horde) | B87: =(K87*$K$5)+(L87*$L$5)+(M87*$M$5)+(N87*$N$5)+(O87*$O$5)+(P87*100*$P$5)+(Q87*100*$Q$5)+(R87*100*$R$5)+(S87*100*$S$5)+(T87*$T$5)+(U87*$U$5)+(V87*$V$5)+(W87*$W$5)+(X87*$X$5)+(Y87*$Y$5)+(Z87*$Z$5)+(AA87*$AA$5) -> 20 | C87: =(K87*$K$6)+(L87*$L$6)+(M87*$M$6)+(N87*$N$6)+(O87*$O$6)+(P87*100*$P$6)+(Q87*100*$Q$6)+(R87*100*$R$6)+(S87*100*$S$6)+(T87*$T$6)+(U87*$U$6)+(V87*$V$6)+(W87*$W$6)+(X87*$X$6)+(Y87*$Y$6)+(Z87*$Z$6)+(AB87*$AA$6) -> 9.11 | D87: BRD | E87: 1 | F87: Q | G87: Horde Quest Reward | I87: 55 | J87: P | L87: 4 | M87: 11 | N87: 10
A88: Pendant of the Shifting Sands | B88: =(K88*$K$5)+(L88*$L$5)+(M88*$M$5)+(N88*$N$5)+(O88*$O$5)+(P88*100*$P$5)+(Q88*100*$Q$5)+(R88*100*$R$5)+(S88*100*$S$5)+(T88*$T$5)+(U88*$U$5)+(V88*$V$5)+(W88*$W$5)+(X88*$X$5)+(Y88*$Y$5)+(Z88*$Z$5)+(AA88*$AA$5) -> 28.8 | C88: =(K88*$K$6)+(L88*$L$6)+(M88*$M$6)+(N88*$N$6)+(O88*$O$6)+(P88*100*$P$6)+(Q88*100*$Q$6)+(R88*100*$R$6)+(S88*100*$S$6)+(T88*$T$6)+(U88*$U$6)+(V88*$V$6)+(W88*$W$6)+(X88*$X$6)+(Y88*$Y$6)+(Z88*$Z$6)+(AB88*$AA$6) -> 7.25 | D88: AQ20 | E88: 5 | F88: Q | G88: Head of Ossirian | I88: 60 | J88: P | M88: 21 | N88: 14 | T88: 4
A90: SHOULDER | B90: AEP | C90: MAEP | D90: Loc | E90: P | F90: Info | G90: Source | H90: Set | I90: Lvl | J90: B | K90: Arm | L90: Agi | M90: Sta | N90: Str | O90: AP | P90: Cri | Q90: Hit | R90: Par | S90: Dod | T90: Def | U90: Ar | V90: Fi | W90: Fr | X90: Na | Y90: Sh | Z90: H/5 | AA90: PVP | AB90: PVE | AC90: Special
A91: Bonescythe Pauldrons | B91: =(K91*$K$5)+(L91*$L$5)+(M91*$M$5)+(N91*$N$5)+(O91*$O$5)+(P91*100*$P$5)+(Q91*100*$Q$5)+(R91*100*$R$5)+(S91*100*$S$5)+(T91*$T$5)+(U91*$U$5)+(V91*$V$5)+(W91*$W$5)+(X91*$X$5)+(Y91*$Y$5)+(Z91*$Z$5)+(AA91*$AA$5) -> 67.36 | C91: =(K91*$K$6)+(L91*$L$6)+(M91*$M$6)+(N91*$N$6)+(O91*$O$6)+(P91*100*$P$6)+(Q91*100*$Q$6)+(R91*100*$R$6)+(S91*100*$S$6)+(T91*$T$6)+(U91*$U$6)+(V91*$V$6)+(W91*$W$6)+(X91*$X$6)+(Y91*$Y$6)+(Z91*$Z$6)+(AB91*$AA$6) -> 50.835999999999999 | D91: Naxx | E91: 6 | F91: Q | G91: Patch/Grob/Gluth | H91: BS | I91: 60 | J91: P | K91: 186 | L91: 22 | M91: 15 | N91: 22 | P91: 00.01 | Q91: 00.01
A92: Deathdealer's Spaulders | B92: =(K92*$K$5)+(L92*$L$5)+(M92*$M$5)+(N92*$N$5)+(O92*$O$5)+(P92*100*$P$5)+(Q92*100*$Q$5)+(R92*100*$R$5)+(S92*100*$S$5)+(T92*$T$5)+(U92*$U$5)+(V92*$V$5)+(W92*$W$5)+(X92*$X$5)+(Y92*$Y$5)+(Z92*$Z$5)+(AA92*$AA$5) -> 60.22 | C92: =(K92*$K$6)+(L92*$L$6)+(M92*$M$6)+(N92*$N$6)+(O92*$O$6)+(P92*100*$P$6)+(Q92*100*$Q$6)+(R92*100*$R$6)+(S92*100*$S$6)+(T92*$T$6)+(U92*$U$6)+(V92*$V$6)+(W92*$W$6)+(X92*$X$6)+(Y92*$Y$6)+(Z92*$Z$6)+(AB92*$AA$6) -> 43.822000000000003 | D92: AQ40 | E92: 5 | F92: Q | G92: Huhuran/Viscidus | H92: DE | I92: 60 | J92: P | K92: 172 | L92: 27 | M92: 15 | N92: 18 | Q92: 00.01
A93: Mantle of Wicked Revenge | B93: =(K93*$K$5)+(L93*$L$5)+(M93*$M$5)+(N93*$N$5)+(O93*$O$5)+(P93*100*$P$5)+(Q93*100*$Q$5)+(R93*100*$R$5)+(S93*100*$S$5)+(T93*$T$5)+(U93*$U$5)+(V93*$V$5)+(W93*$W$5)+(X93*$X$5)+(Y93*$Y$5)+(Z93*$Z$5)+(AA93*$AA$5) -> 53.7 | C93: =(K93*$K$6)+(L93*$L$6)+(M93*$M$6)+(N93*$N$6)+(O93*$O$6)+(P93*100*$P$6)+(Q93*100*$Q$6)+(R93*100*$R$6)+(S93*100*$S$6)+(T93*$T$6)+(U93*$U$6)+(V93*$V$6)+(W93*$W$6)+(X93*$X$6)+(Y93*$Y$6)+(Z93*$Z$6)+(AB93*$AA$6) -> 38.31 | D93: AQ40 | E93: 5 | F93: 00.1 | G93: Fankriss | I93: 60 | J93: P | K93: 170 | L93: 30 | M93: 14 | N93: 16
A94: Nightslayer Shoulder Pads | B94: =(K94*$K$5)+(L94*$L$5)+(M94*$M$5)+(N94*$N$5)+(O94*$O$5)+(P94*100*$P$5)+(Q94*100*$Q$5)+(R94*100*$R$5)+(S94*100*$S$5)+(T94*$T$5)+(U94*$U$5)+(V94*$V$5)+(W94*$W$5)+(X94*$X$5)+(Y94*$Y$5)+(Z94*$Z$5)+(AA94*$AA$5) -> 49.2 | C94: =(K94*$K$6)+(L94*$L$6)+(M94*$M$6)+(N94*$N$6)+(O94*$O$6)+(P94*100*$P$6)+(Q94*100*$Q$6)+(R94*100*$R$6)+(S94*100*$S$6)+(T94*$T$6)+(U94*$U$6)+(V94*$V$6)+(W94*$W$6)+(X94*$X$6)+(Y94*$Y$6)+(Z94*$Z$6)+(AB94*$AA$6) -> 35.34 | D94: MC | E94: 1 | F94: 00.26 | G94: Sulfuron Harbinger | H94: NS | I94: 60 | J94: P | K94: 150 | L94: 26 | M94: 12 | N94: 3 | Q94: 00.01 | Y94: 7
A95: Zandalar Madcap's Mantle | B95: =(K95*$K$5)+(L95*$L$5)+(M95*$M$5)+(N95*$N$5)+(O95*$O$5)+(P95*100*$P$5)+(Q95*100*$Q$5)+(R95*100*$R$5)+(S95*100*$S$5)+(T95*$T$5)+(U95*$U$5)+(V95*$V$5)+(W95*$W$5)+(X95*$X$5)+(Y95*$Y$5)+(Z95*$Z$5)+(AA95*$AA$5) -> 46.9 | C95: =(K95*$K$6)+(L95*$L$6)+(M95*$M$6)+(N95*$N$6)+(O95*$O$6)+(P95*100*$P$6)+(Q95*100*$Q$6)+(R95*100*$R$6)+(S95*100*$S$6)+(T95*$T$6)+(U95*$U$6)+(V95*$V$6)+(W95*$W$6)+(X95*$X$6)+(Y95*$Y$6)+(Z95*$Z$6)+(AB95*$AA$6) -> 33.76 | D95: ZG | E95: 4 | F95: Q | G95: Zandalar - Honored | H95: MO | I95: 58 | J95: P | K95: 140 | L95: 20 | M95: 12 | N95: 12 | Q95: 00.01
A96: Highlander's Leather Shoulders | B96: =(K96*$K$5)+(L96*$L$5)+(M96*$M$5)+(N96*$N$5)+(O96*$O$5)+(P96*100*$P$5)+(Q96*100*$Q$5)+(R96*100*$R$5)+(S96*100*$S$5)+(T96*$T$5)+(U96*$U$5)+(V96*$V$5)+(W96*$W$5)+(X96*$X$5)+(Y96*$Y$5)+(Z96*$Z$5)+(AA96*$AA$5) -> 52.58 | C96: =(K96*$K$6)+(L96*$L$6)+(M96*$M$6)+(N96*$N$6)+(O96*$O$6)+(P96*100*$P$6)+(Q96*100*$Q$6)+(R96*100*$R$6)+(S96*100*$S$6)+(T96*$T$6)+(U96*$U$6)+(V96*$V$6)+(W96*$W$6)+(X96*$X$6)+(Y96*$Y$6)+(Z96*$Z$6)+(AB96*$AA$6) -> 33.427999999999997 | D96: AB | E96: 4 | F96: Exa | G96: Alliance AB Exalted | H96: HP | I96: 60 | J96: P | K96: 258 | L96: 18 | M96: 17 | O96: 30
A97: Defiler's Leather Shoulders | B97: =(K97*$K$5)+(L97*$L$5)+(M97*$M$5)+(N97*$N$5)+(O97*$O$5)+(P97*100*$P$5)+(Q97*100*$Q$5)+(R97*100*$R$5)+(S97*100*$S$5)+(T97*$T$5)+(U97*$U$5)+(V97*$V$5)+(W97*$W$5)+(X97*$X$5)+(Y97*$Y$5)+(Z97*$Z$5)+(AA97*$AA$5) -> 52.58 | C97: =(K97*$K$6)+(L97*$L$6)+(M97*$M$6)+(N97*$N$6)+(O97*$O$6)+(P97*100*$P$6)+(Q97*100*$Q$6)+(R97*100*$R$6)+(S97*100*$S$6)+(T97*$T$6)+(U97*$U$6)+(V97*$V$6)+(W97*$W$6)+(X97*$X$6)+(Y97*$Y$6)+(Z97*$Z$6)+(AB97*$AA$6) -> 33.427999999999997 | D97: AB | E97: 4 | F97: Exa | G97: Horde AB Exalted | H97: DP | I97: 60 | J97: P | K97: 258 | L97: 18 | M97: 17 | O97: 30
A98: Chitinous Shoulderguards | B98: =(K98*$K$5)+(L98*$L$5)+(M98*$M$5)+(N98*$N$5)+(O98*$O$5)+(P98*100*$P$5)+(Q98*100*$Q$5)+(R98*100*$R$5)+(S98*100*$S$5)+(T98*$T$5)+(U98*$U$5)+(V98*$V$5)+(W98*$W$5)+(X98*$X$5)+(Y98*$Y$5)+(Z98*$Z$5)+(AA98*$AA$5) -> 39.01 | C98: =(K98*$K$6)+(L98*$L$6)+(M98*$M$6)+(N98*$N$6)+(O98*$O$6)+(P98*100*$P$6)+(Q98*100*$Q$6)+(R98*100*$R$6)+(S98*100*$S$6)+(T98*$T$6)+(U98*$U$6)+(V98*$V$6)+(W98*$W$6)+(X98*$X$6)+(Y98*$Y$6)+(Z98*$Z$6)+(AB98*$AA$6) -> 30.721 | D98: AQ20 | E98: 5 | F98: 00.19 | G98: Moam | I98: 60 | J98: P | K98: 151 | L98: 25 | M98: 7 | N98: 11
A99: Field Marshal's Leather Epaulets | B99: =(K99*$K$5)+(L99*$L$5)+(M99*$M$5)+(N99*$N$5)+(O99*$O$5)+(P99*100*$P$5)+(Q99*100*$Q$5)+(R99*100*$R$5)+(S99*100*$S$5)+(T99*$T$5)+(U99*$U$5)+(V99*$V$5)+(W99*$W$5)+(X99*$X$5)+(Y99*$Y$5)+(Z99*$Z$5)+(AA99*$AA$5) -> 57.65 | C99: =(K99*$K$6)+(L99*$L$6)+(M99*$M$6)+(N99*$N$6)+(O99*$O$6)+(P99*100*$P$6)+(Q99*100*$Q$6)+(R99*100*$R$6)+(S99*100*$S$6)+(T99*$T$6)+(U99*$U$6)+(V99*$V$6)+(W99*$W$6)+(X99*$X$6)+(Y99*$Y$6)+(Z99*$Z$6)+(AB99*$AA$6) -> 28.984999999999999 | D99: PVP | E99: 2 | F99: FM | G99: Alliance Rank 13 PVP | H99: FM | I99: 60 | J99: P | K99: 215 | L99: 21 | M99: 27 | Q99: 00.01
A100: Warlord's Leather Spaulders | B100: =(K100*$K$5)+(L100*$L$5)+(M100*$M$5)+(N100*$N$5)+(O100*$O$5)+(P100*100*$P$5)+(Q100*100*$Q$5)+(R100*100*$R$5)+(S100*100*$S$5)+(T100*$T$5)+(U100*$U$5)+(V100*$V$5)+(W100*$W$5)+(X100*$X$5)+(Y100*$Y$5)+(Z100*$Z$5)+(AA100*$AA$5) -> 57.65 | C100: =(K100*$K$6)+(L100*$L$6)+(M100*$M$6)+(N100*$N$6)+(O100*$O$6)+(P100*100*$P$6)+(Q100*100*$Q$6)+(R100*100*$R$6)+(S100*100*$S$6)+(T100*$T$6)+(U100*$U$6)+(V100*$V$6)+(W100*$W$6)+(X100*$X$6)+(Y100*$Y$6)+(Z100*$Z$6)+(AB100*$AA$6) -> 28.984999999999999 | D100: PVP | E100: 2 | F100: WL | G100: Horde Rank 13 PVP | H100: WL | I100: 60 | J100: P | K100: 215 | L100: 21 | M100: 27 | Q100: 00.01
A101: Lt. Comm. Leather Shoulders | B101: =(K101*$K$5)+(L101*$L$5)+(M101*$M$5)+(N101*$N$5)+(O101*$O$5)+(P101*100*$P$5)+(Q101*100*$Q$5)+(R101*100*$R$5)+(S101*100*$S$5)+(T101*$T$5)+(U101*$U$5)+(V101*$V$5)+(W101*$W$5)+(X101*$X$5)+(Y101*$Y$5)+(Z101*$Z$5)+(AA101*$AA$5) -> 47.46 | C101: =(K101*$K$6)+(L101*$L$6)+(M101*$M$6)+(N101*$N$6)+(O101*$O$6)+(P101*100*$P$6)+(Q101*100*$Q$6)+(R101*100*$R$6)+(S101*100*$S$6)+(T101*$T$6)+(U101*$U$6)+(V101*$V$6)+(W101*$W$6)+(X101*$X$6)+(Y101*$Y$6)+(Z101*$Z$6)+(AB101*$AA$6) -> 28.866 | D101: PVP | E101: 2 | F101: LC | G101: Alliance Rank 10 PVP | H101: LCG | I101: 60 | J101: P | K101: 196 | M101: 17 | O101: 22 | P101: 00.01 | Q101: 00.01
A102: Champion's Leather Shoulders | B102: =(K102*$K$5)+(L102*$L$5)+(M102*$M$5)+(N102*$N$5)+(O102*$O$5)+(P102*100*$P$5)+(Q102*100*$Q$5)+(R102*100*$R$5)+(S102*100*$S$5)+(T102*$T$5)+(U102*$U$5)+(V102*$V$5)+(W102*$W$5)+(X102*$X$5)+(Y102*$Y$5)+(Z102*$Z$5)+(AA102*$AA$5) -> 47.46 | C102: =(K102*$K$6)+(L102*$L$6)+(M102*$M$6)+(N102*$N$6)+(O102*$O$6)+(P102*100*$P$6)+(Q102*100*$Q$6)+(R102*100*$R$6)+(S102*100*$S$6)+(T102*$T$6)+(U102*$U$6)+(V102*$V$6)+(W102*$W$6)+(X102*$X$6)+(Y102*$Y$6)+(Z102*$Z$6)+(AB102*$AA$6) -> 28.866 | D102: PVP | E102: 2 | F102: LC | G102: Horde Rank 10 PVP | H102: CV | I102: 60 | J102: P | K102: 196 | M102: 17 | O102: 22 | P102: 00.01 | Q102: 00.01
A103: Bloodfang Spaulders | B103: =(K103*$K$5)+(L103*$L$5)+(M103*$M$5)+(N103*$N$5)+(O103*$O$5)+(P103*100*$P$5)+(Q103*100*$Q$5)+(R103*100*$R$5)+(S103*100*$S$5)+(T103*$T$5)+(U103*$U$5)+(V103*$V$5)+(W103*$W$5)+(X103*$X$5)+(Y103*$Y$5)+(Z103*$Z$5)+(AA103*$AA$5) -> 50.69 | C103: =(K103*$K$6)+(L103*$L$6)+(M103*$M$6)+(N103*$N$6)+(O103*$O$6)+(P103*100*$P$6)+(Q103*100*$Q$6)+(R103*100*$R$6)+(S103*100*$S$6)+(T103*$T$6)+(U103*$U$6)+(V103*$V$6)+(W103*$W$6)+(X103*$X$6)+(Y103*$Y$6)+(Z103*$Z$6)+(AB103*$AA$6) -> 28.449000000000005 | D103: BWL | E103: 3 | F103: 00.21 | G103: Chromaggus | H103: BF | I103: 60 | J103: P | K103: 169 | L103: 25 | M103: 17 | N103: 6 | S103: 00.01 | V103: 10
A104: Highlander's Lizardhide Shoulders | B104: =(K104*$K$5)+(L104*$L$5)+(M104*$M$5)+(N104*$N$5)+(O104*$O$5)+(P104*100*$P$5)+(Q104*100*$Q$5)+(R104*100*$R$5)+(S104*100*$S$5)+(T104*$T$5)+(U104*$U$5)+(V104*$V$5)+(W104*$W$5)+(X104*$X$5)+(Y104*$Y$5)+(Z104*$Z$5)+(AA104*$AA$5) -> 46.58 | C104: =(K104*$K$6)+(L104*$L$6)+(M104*$M$6)+(N104*$N$6)+(O104*$O$6)+(P104*100*$P$6)+(Q104*100*$Q$6)+(R104*100*$R$6)+(S104*100*$S$6)+(T104*$T$6)+(U104*$U$6)+(V104*$V$6)+(W104*$W$6)+(X104*$X$6)+(Y104*$Y$6)+(Z104*$Z$6)+(AB104*$AA$6) -> 27.427999999999997 | D104: AB | E104: 4 | F104: Exa | G104: Alliance AB Exalted | H104: HW | I104: 60 | J104: P | K104: 258 | L104: 12 | M104: 17 | O104: 30
A105: Defiler's Lizardhide Shoulders | B105: =(K105*$K$5)+(L105*$L$5)+(M105*$M$5)+(N105*$N$5)+(O105*$O$5)+(P105*100*$P$5)+(Q105*100*$Q$5)+(R105*100*$R$5)+(S105*100*$S$5)+(T105*$T$5)+(U105*$U$5)+(V105*$V$5)+(W105*$W$5)+(X105*$X$5)+(Y105*$Y$5)+(Z105*$Z$5)+(AA105*$AA$5) -> 46.58 | C105: =(K105*$K$6)+(L105*$L$6)+(M105*$M$6)+(N105*$N$6)+(O105*$O$6)+(P105*100*$P$6)+(Q105*100*$Q$6)+(R105*100*$R$6)+(S105*100*$S$6)+(T105*$T$6)+(U105*$U$6)+(V105*$V$6)+(W105*$W$6)+(X105*$X$6)+(Y105*$Y$6)+(Z105*$Z$6)+(AB105*$AA$6) -> 27.427999999999997 | D105: AB | E105: 4 | F105: Exa | G105: Horde AB Exalted | H105: DW | I105: 60 | J105: P | K105: 258 | L105: 12 | M105: 17 | O105: 30
A106: Truestrike Shoulders | B106: =(K106*$K$5)+(L106*$L$5)+(M106*$M$5)+(N106*$N$5)+(O106*$O$5)+(P106*100*$P$5)+(Q106*100*$Q$5)+(R106*100*$R$5)+(S106*100*$S$5)+(T106*$T$5)+(U106*$U$5)+(V106*$V$5)+(W106*$W$5)+(X106*$X$5)+(Y106*$Y$5)+(Z106*$Z$5)+(AA106*$AA$5) -> 28.29 | C106: =(K106*$K$6)+(L106*$L$6)+(M106*$M$6)+(N106*$N$6)+(O106*$O$6)+(P106*100*$P$6)+(Q106*100*$Q$6)+(R106*100*$R$6)+(S106*100*$S$6)+(T106*$T$6)+(U106*$U$6)+(V106*$V$6)+(W106*$W$6)+(X106*$X$6)+(Y106*$Y$6)+(Z106*$Z$6)+(AB106*$AA$6) -> 27.128999999999998 | D106: UBRS | E106: 1 | F106: 00.1 | G106: Pyroguard Emberseer | I106: 56 | J106: P | K106: 129 | O106: 24 | Q106: 00.02
A107: Abyssal Leather Shoulders of Stri. | B107: =(K107*$K$5)+(L107*$L$5)+(M107*$M$5)+(N107*$N$5)+(O107*$O$5)+(P107*100*$P$5)+(Q107*100*$Q$5)+(R107*100*$R$5)+(S107*100*$S$5)+(T107*$T$5)+(U107*$U$5)+(V107*$V$5)+(W107*$W$5)+(X107*$X$5)+(Y107*$Y$5)+(Z107*$Z$5)+(AA107*$AA$5) -> 38.91 | C107: =(K107*$K$6)+(L107*$L$6)+(M107*$M$6)+(N107*$N$6)+(O107*$O$6)+(P107*100*$P$6)+(Q107*100*$Q$6)+(R107*100*$R$6)+(S107*100*$S$6)+(T107*$T$6)+(U107*$U$6)+(V107*$V$6)+(W107*$W$6)+(X107*$X$6)+(Y107*$Y$6)+(Z107*$Z$6)+(AB107*$AA$6) -> 25.760999999999999 | D107: Sil | E107: 4 | F107: 00.21 | G107: High Mar. Whirlaxis | I107: 60 | J107: P | K107: 141 | L107: 12 | M107: 12 | N107: 12 | Q107: 00.01
A108: Darkmantle Spaulders | B108: =(K108*$K$5)+(L108*$L$5)+(M108*$M$5)+(N108*$N$5)+(O108*$O$5)+(P108*100*$P$5)+(Q108*100*$Q$5)+(R108*100*$R$5)+(S108*100*$S$5)+(T108*$T$5)+(U108*$U$5)+(V108*$V$5)+(W108*$W$5)+(X108*$X$5)+(Y108*$Y$5)+(Z108*$Z$5)+(AA108*$AA$5) -> 35.36 | C108: =(K108*$K$6)+(L108*$L$6)+(M108*$M$6)+(N108*$N$6)+(O108*$O$6)+(P108*100*$P$6)+(Q108*100*$Q$6)+(R108*100*$R$6)+(S108*100*$S$6)+(T108*$T$6)+(U108*$U$6)+(V108*$V$6)+(W108*$W$6)+(X108*$X$6)+(Y108*$Y$6)+(Z108*$Z$6)+(AB108*$AA$6) -> 24.236000000000001 | D108: Q | E108: 5 | F108: Q | G108: SC Upgrade Quest | H108: DM | I108: 58 | J108: P | K108: 136 | L108: 24 | M108: 10
A109: Taut Dragonhide Shoulderpads | B109: =(K109*$K$5)+(L109*$L$5)+(M109*$M$5)+(N109*$N$5)+(O109*$O$5)+(P109*100*$P$5)+(Q109*100*$Q$5)+(R109*100*$R$5)+(S109*100*$S$5)+(T109*$T$5)+(U109*$U$5)+(V109*$V$5)+(W109*$W$5)+(X109*$X$5)+(Y109*$Y$5)+(Z109*$Z$5)+(AA109*$AA$5) -> 54.7 | C109: =(K109*$K$6)+(L109*$L$6)+(M109*$M$6)+(N109*$N$6)+(O109*$O$6)+(P109*100*$P$6)+(Q109*100*$Q$6)+(R109*100*$R$6)+(S109*100*$S$6)+(T109*$T$6)+(U109*$U$6)+(V109*$V$6)+(W109*$W$6)+(X109*$X$6)+(Y109*$Y$6)+(Z109*$Z$6)+(AB109*$AA$6) -> 23.47 | D109: BWL | E109: 3 | F109: 00.15 | G109: Chromaggus | I109: 60 | J109: P | K109: 170 | M109: 30 | O109: 46
A110: Wyrmtongue Shoulders | B110: =(K110*$K$5)+(L110*$L$5)+(M110*$M$5)+(N110*$N$5)+(O110*$O$5)+(P110*100*$P$5)+(Q110*100*$Q$5)+(R110*100*$R$5)+(S110*100*$S$5)+(T110*$T$5)+(U110*$U$5)+(V110*$V$5)+(W110*$W$5)+(X110*$X$5)+(Y110*$Y$5)+(Z110*$Z$5)+(AA110*$AA$5) -> 34.32 | C110: =(K110*$K$6)+(L110*$L$6)+(M110*$M$6)+(N110*$N$6)+(O110*$O$6)+(P110*100*$P$6)+(Q110*100*$Q$6)+(R110*100*$R$6)+(S110*100*$S$6)+(T110*$T$6)+(U110*$U$6)+(V110*$V$6)+(W110*$W$6)+(X110*$X$6)+(Y110*$Y$6)+(Z110*$Z$6)+(AB110*$AA$6) -> 23.232000000000003 | D110: Str | E110: 1 | F110: 00.12 | G110: Balnazzar | I110: 58 | J110: P | K110: 132 | L110: 23 | M110: 10
A111: Dark Warder's Pauldrons | B111: =(K111*$K$5)+(L111*$L$5)+(M111*$M$5)+(N111*$N$5)+(O111*$O$5)+(P111*100*$P$5)+(Q111*100*$Q$5)+(R111*100*$R$5)+(S111*100*$S$5)+(T111*$T$5)+(U111*$U$5)+(V111*$V$5)+(W111*$W$5)+(X111*$X$5)+(Y111*$Y$5)+(Z111*$Z$5)+(AA111*$AA$5) -> 30.72 | C111: =(K111*$K$6)+(L111*$L$6)+(M111*$M$6)+(N111*$N$6)+(O111*$O$6)+(P111*100*$P$6)+(Q111*100*$Q$6)+(R111*100*$R$6)+(S111*100*$S$6)+(T111*$T$6)+(U111*$U$6)+(V111*$V$6)+(W111*$W$6)+(X111*$X$6)+(Y111*$Y$6)+(Z111*$Z$6)+(AB111*$AA$6) -> 22.692 | D111: BRD | E111: 5 | F111: 00.01 | G111: Warder Stilgiss | I111: 52 | J111: P | K111: 122 | L111: 17 | M111: 7 | N111: 11
A112: Shadowcraft Spaulders | B112: =(K112*$K$5)+(L112*$L$5)+(M112*$M$5)+(N112*$N$5)+(O112*$O$5)+(P112*100*$P$5)+(Q112*100*$Q$5)+(R112*100*$R$5)+(S112*100*$S$5)+(T112*$T$5)+(U112*$U$5)+(V112*$V$5)+(W112*$W$5)+(X112*$X$5)+(Y112*$Y$5)+(Z112*$Z$5)+(AA112*$AA$5) -> 32.27 | C112: =(K112*$K$6)+(L112*$L$6)+(M112*$M$6)+(N112*$N$6)+(O112*$O$6)+(P112*100*$P$6)+(Q112*100*$Q$6)+(R112*100*$R$6)+(S112*100*$S$6)+(T112*$T$6)+(U112*$U$6)+(V112*$V$6)+(W112*$W$6)+(X112*$X$6)+(Y112*$Y$6)+(Z112*$Z$6)+(AB112*$AA$6) -> 22.216999999999999 | D112: Str | E112: 1 | F112: 00.1 | G112: Cannon Master Willey | H112: SC | I112: 55 | J112: P | K112: 127 | L112: 22 | M112: 9
A113: Spaulders of the Unseen | B113: =(K113*$K$5)+(L113*$L$5)+(M113*$M$5)+(N113*$N$5)+(O113*$O$5)+(P113*100*$P$5)+(Q113*100*$Q$5)+(R113*100*$R$5)+(S113*100*$S$5)+(T113*$T$5)+(U113*$U$5)+(V113*$V$5)+(W113*$W$5)+(X113*$X$5)+(Y113*$Y$5)+(Z113*$Z$5)+(AA113*$AA$5) -> 30.29 | C113: =(K113*$K$6)+(L113*$L$6)+(M113*$M$6)+(N113*$N$6)+(O113*$O$6)+(P113*100*$P$6)+(Q113*100*$Q$6)+(R113*100*$R$6)+(S113*100*$S$6)+(T113*$T$6)+(U113*$U$6)+(V113*$V$6)+(W113*$W$6)+(X113*$X$6)+(Y113*$Y$6)+(Z113*$Z$6)+(AB113*$AA$6) -> 22.199000000000002 | D113: R | E113: 1 | F113: 58-61 | G113: Random World Drop | I113: 56 | J113: E | K113: 129 | L113: 22 | M113: 7
A114: Advr's Shoulders of the Tiger | B114: =(K114*$K$5)+(L114*$L$5)+(M114*$M$5)+(N114*$N$5)+(O114*$O$5)+(P114*100*$P$5)+(Q114*100*$Q$5)+(R114*100*$R$5)+(S114*100*$S$5)+(T114*$T$5)+(U114*$U$5)+(V114*$V$5)+(W114*$W$5)+(X114*$X$5)+(Y114*$Y$5)+(Z114*$Z$5)+(AA114*$AA$5) -> 22.2 | C114: =(K114*$K$6)+(L114*$L$6)+(M114*$M$6)+(N114*$N$6)+(O114*$O$6)+(P114*100*$P$6)+(Q114*100*$Q$6)+(R114*100*$R$6)+(S114*100*$S$6)+(T114*$T$6)+(U114*$U$6)+(V114*$V$6)+(W114*$W$6)+(X114*$X$6)+(Y114*$Y$6)+(Z114*$Z$6)+(AB114*$AA$6) -> 21.12 | D114: R | E114: 1 | F114: 60-63 | G114: Random World Drop | I114: 58 | J114: E | K114: 120 | L114: 14 | N114: 14
A115: Supr. Shoulders of the Tiger | B115: =(K115*$K$5)+(L115*$L$5)+(M115*$M$5)+(N115*$N$5)+(O115*$O$5)+(P115*100*$P$5)+(Q115*100*$Q$5)+(R115*100*$R$5)+(S115*100*$S$5)+(T115*$T$5)+(U115*$U$5)+(V115*$V$5)+(W115*$W$5)+(X115*$X$5)+(Y115*$Y$5)+(Z115*$Z$5)+(AA115*$AA$5) -> 22.2 | C115: =(K115*$K$6)+(L115*$L$6)+(M115*$M$6)+(N115*$N$6)+(O115*$O$6)+(P115*100*$P$6)+(Q115*100*$Q$6)+(R115*100*$R$6)+(S115*100*$S$6)+(T115*$T$6)+(U115*$U$6)+(V115*$V$6)+(W115*$W$6)+(X115*$X$6)+(Y115*$Y$6)+(Z115*$Z$6)+(AB115*$AA$6) -> 21.12 | D115: R | E115: 1 | F115: 54-61 | G115: Random World Drop | I115: 58 | J115: E | K115: 120 | L115: 14 | N115: 14
A116: Mighty Spaulders of the Tiger | B116: =(K116*$K$5)+(L116*$L$5)+(M116*$M$5)+(N116*$N$5)+(O116*$O$5)+(P116*100*$P$5)+(Q116*100*$Q$5)+(R116*100*$R$5)+(S116*100*$S$5)+(T116*$T$5)+(U116*$U$5)+(V116*$V$5)+(W116*$W$5)+(X116*$X$5)+(Y116*$Y$5)+(Z116*$Z$5)+(AA116*$AA$5) -> 22.19 | C116: =(K116*$K$6)+(L116*$L$6)+(M116*$M$6)+(N116*$N$6)+(O116*$O$6)+(P116*100*$P$6)+(Q116*100*$Q$6)+(R116*100*$R$6)+(S116*100*$S$6)+(T116*$T$6)+(U116*$U$6)+(V116*$V$6)+(W116*$W$6)+(X116*$X$6)+(Y116*$Y$6)+(Z116*$Z$6)+(AB116*$AA$6) -> 21.119 | D116: R | E116: 1 | F116: 59-63 | G116: Random World Drop | I116: 57 | J116: E | K116: 119 | L116: 14 | N116: 14
A117: Atal'ai Spaulders of the Tiger | B117: =(K117*$K$5)+(L117*$L$5)+(M117*$M$5)+(N117*$N$5)+(O117*$O$5)+(P117*100*$P$5)+(Q117*100*$Q$5)+(R117*100*$R$5)+(S117*100*$S$5)+(T117*$T$5)+(U117*$U$5)+(V117*$V$5)+(W117*$W$5)+(X117*$X$5)+(Y117*$Y$5)+(Z117*$Z$5)+(AA117*$AA$5) -> 21.43 | C117: =(K117*$K$6)+(L117*$L$6)+(M117*$M$6)+(N117*$N$6)+(O117*$O$6)+(P117*100*$P$6)+(Q117*100*$Q$6)+(R117*100*$R$6)+(S117*100*$S$6)+(T117*$T$6)+(U117*$U$6)+(V117*$V$6)+(W117*$W$6)+(X117*$X$6)+(Y117*$Y$6)+(Z117*$Z$6)+(AB117*$AA$6) -> 19.692999999999998 | D117: ToAH | E117: 1 | F117: 00.03 | G117: ToAH Bosses | I117: 47 | J117: P | K117: 193 | L117: 13 | N117: 13
A118: Flamescarred Shoulders | B118: =(K118*$K$5)+(L118*$L$5)+(M118*$M$5)+(N118*$N$5)+(O118*$O$5)+(P118*100*$P$5)+(Q118*100*$Q$5)+(R118*100*$R$5)+(S118*100*$S$5)+(T118*$T$5)+(U118*$U$5)+(V118*$V$5)+(W118*$W$5)+(X118*$X$5)+(Y118*$Y$5)+(Z118*$Z$5)+(AA118*$AA$5) -> 31.31 | C118: =(K118*$K$6)+(L118*$L$6)+(M118*$M$6)+(N118*$N$6)+(O118*$O$6)+(P118*100*$P$6)+(Q118*100*$Q$6)+(R118*100*$R$6)+(S118*100*$S$6)+(T118*$T$6)+(U118*$U$6)+(V118*$V$6)+(W118*$W$6)+(X118*$X$6)+(Y118*$Y$6)+(Z118*$Z$6)+(AB118*$AA$6) -> 18.341000000000001 | D118: DM-W | E118: 2 | F118: 00.18 | G118: Magister Kalendris | I118: 57 | J118: P | K118: 131 | L118: 12 | M118: 11 | N118: 12 | V118: 10
A119: Praetorian Pauldrons of the Tiger | B119: =(K119*$K$5)+(L119*$L$5)+(M119*$M$5)+(N119*$N$5)+(O119*$O$5)+(P119*100*$P$5)+(Q119*100*$Q$5)+(R119*100*$R$5)+(S119*100*$S$5)+(T119*$T$5)+(U119*$U$5)+(V119*$V$5)+(W119*$W$5)+(X119*$X$5)+(Y119*$Y$5)+(Z119*$Z$5)+(AA119*$AA$5) -> 19.06 | C119: =(K119*$K$6)+(L119*$L$6)+(M119*$M$6)+(N119*$N$6)+(O119*$O$6)+(P119*100*$P$6)+(Q119*100*$Q$6)+(R119*100*$R$6)+(S119*100*$S$6)+(T119*$T$6)+(U119*$U$6)+(V119*$V$6)+(W119*$W$6)+(X119*$X$6)+(Y119*$Y$6)+(Z119*$Z$6)+(AB119*$AA$6) -> 18.106000000000002 | D119: R | E119: 1 | F119: 51-55 | G119: Random World Drop | I119: 49 | J119: E | K119: 106 | L119: 12 | N119: 12
A120: Phytoskin Spaulders | B120: =(K120*$K$5)+(L120*$L$5)+(M120*$M$5)+(N120*$N$5)+(O120*$O$5)+(P120*100*$P$5)+(Q120*100*$Q$5)+(R120*100*$R$5)+(S120*100*$S$5)+(T120*$T$5)+(U120*$U$5)+(V120*$V$5)+(W120*$W$5)+(X120*$X$5)+(Y120*$Y$5)+(Z120*$Z$5)+(AA120*$AA$5) -> 28.11 | C120: =(K120*$K$6)+(L120*$L$6)+(M120*$M$6)+(N120*$N$6)+(O120*$O$6)+(P120*100*$P$6)+(Q120*100*$Q$6)+(R120*100*$R$6)+(S120*100*$S$6)+(T120*$T$6)+(U120*$U$6)+(V120*$V$6)+(W120*$W$6)+(X120*$X$6)+(Y120*$Y$6)+(Z120*$Z$6)+(AB120*$AA$6) -> 16.311000000000003 | D120: Mar | E120: 1 | F120: 00.21 | G120: Razorlash | I120: 46 | J120: P | K120: 111 | L120: 16 | M120: 10 | X120: 10
A121: Wyrmhide Spaulders | B121: =(K121*$K$5)+(L121*$L$5)+(M121*$M$5)+(N121*$N$5)+(O121*$O$5)+(P121*100*$P$5)+(Q121*100*$Q$5)+(R121*100*$R$5)+(S121*100*$S$5)+(T121*$T$5)+(U121*$U$5)+(V121*$V$5)+(W121*$W$5)+(X121*$X$5)+(Y121*$Y$5)+(Z121*$Z$5)+(AA121*$AA$5) -> 16.13 | C121: =(K121*$K$6)+(L121*$L$6)+(M121*$M$6)+(N121*$N$6)+(O121*$O$6)+(P121*100*$P$6)+(Q121*100*$Q$6)+(R121*100*$R$6)+(S121*100*$S$6)+(T121*$T$6)+(U121*$U$6)+(V121*$V$6)+(W121*$W$6)+(X121*$X$6)+(Y121*$Y$6)+(Z121*$Z$6)+(AB121*$AA$6) -> 15.113 | D121: BRD | E121: 1 | F121: Q | G121: BRD Quest Reward | I121: 52 | J121: P | K121: 113 | Q121: 00.02
A122: Forest Tracker Epaulets | B122: =(K122*$K$5)+(L122*$L$5)+(M122*$M$5)+(N122*$N$5)+(O122*$O$5)+(P122*100*$P$5)+(Q122*100*$Q$5)+(R122*100*$R$5)+(S122*100*$S$5)+(T122*$T$5)+(U122*$U$5)+(V122*$V$5)+(W122*$W$5)+(X122*$X$5)+(Y122*$Y$5)+(Z122*$Z$5)+(AA122*$AA$5) -> 14.28 | C122: =(K122*$K$6)+(L122*$L$6)+(M122*$M$6)+(N122*$N$6)+(O122*$O$6)+(P122*100*$P$6)+(Q122*100*$Q$6)+(R122*100*$R$6)+(S122*100*$S$6)+(T122*$T$6)+(U122*$U$6)+(V122*$V$6)+(W122*$W$6)+(X122*$X$6)+(Y122*$Y$6)+(Z122*$Z$6)+(AB122*$AA$6) -> 13.577999999999999 | D122: R | E122: 1 | F122: 29-33 | G122: Random World Drop | I122: 26 | J122: E | K122: 78 | L122: 11 | N122: 5
A123: Champion's Leather Mantle | B123: =(K123*$K$5)+(L123*$L$5)+(M123*$M$5)+(N123*$N$5)+(O123*$O$5)+(P123*100*$P$5)+(Q123*100*$Q$5)+(R123*100*$R$5)+(S123*100*$S$5)+(T123*$T$5)+(U123*$U$5)+(V123*$V$5)+(W123*$W$5)+(X123*$X$5)+(Y123*$Y$5)+(Z123*$Z$5)+(AA123*$AA$5) -> 37.32 | C123: =(K123*$K$6)+(L123*$L$6)+(M123*$M$6)+(N123*$N$6)+(O123*$O$6)+(P123*100*$P$6)+(Q123*100*$Q$6)+(R123*100*$R$6)+(S123*100*$S$6)+(T123*$T$6)+(U123*$U$6)+(V123*$V$6)+(W123*$W$6)+(X123*$X$6)+(Y123*$Y$6)+(Z123*$Z$6)+(AB123*$AA$6) -> 13.362 | D123: PVP | E123: 2 | F123: LC | G123: Horde Rank 10 PVP | H123: CG | I123: 58 | J123: P | K123: 132 | L123: 7 | M123: 23 | O123: 12
A124: Lt. Comm. Leather Spaulders | B124: =(K124*$K$5)+(L124*$L$5)+(M124*$M$5)+(N124*$N$5)+(O124*$O$5)+(P124*100*$P$5)+(Q124*100*$Q$5)+(R124*100*$R$5)+(S124*100*$S$5)+(T124*$T$5)+(U124*$U$5)+(V124*$V$5)+(W124*$W$5)+(X124*$X$5)+(Y124*$Y$5)+(Z124*$Z$5)+(AA124*$AA$5) -> 37.32 | C124: =(K124*$K$6)+(L124*$L$6)+(M124*$M$6)+(N124*$N$6)+(O124*$O$6)+(P124*100*$P$6)+(Q124*100*$Q$6)+(R124*100*$R$6)+(S124*100*$S$6)+(T124*$T$6)+(U124*$U$6)+(V124*$V$6)+(W124*$W$6)+(X124*$X$6)+(Y124*$Y$6)+(Z124*$Z$6)+(AB124*$AA$6) -> 13.362 | D124: PVP | E124: 2 | F124: LC | G124: Alliance Rank 10 PVP | H124: LCV | I124: 58 | J124: P | K124: 132 | L124: 7 | M124: 23 | O124: 12
A125: Flintrock Shoulders | B125: =(K125*$K$5)+(L125*$L$5)+(M125*$M$5)+(N125*$N$5)+(O125*$O$5)+(P125*100*$P$5)+(Q125*100*$Q$5)+(R125*100*$R$5)+(S125*100*$S$5)+(T125*$T$5)+(U125*$U$5)+(V125*$V$5)+(W125*$W$5)+(X125*$X$5)+(Y125*$Y$5)+(Z125*$Z$5)+(AA125*$AA$5) -> 23.38 | C125: =(K125*$K$6)+(L125*$L$6)+(M125*$M$6)+(N125*$N$6)+(O125*$O$6)+(P125*100*$P$6)+(Q125*100*$Q$6)+(R125*100*$R$6)+(S125*100*$S$6)+(T125*$T$6)+(U125*$U$6)+(V125*$V$6)+(W125*$W$6)+(X125*$X$6)+(Y125*$Y$6)+(Z125*$Z$6)+(AB125*$AA$6) -> 12.687999999999999 | D125: SM | E125: 1 | F125: 35-40 | G125: Random SM Drop | I125: 33 | J125: E | K125: 88 | L125: 10 | M125: 10 | N125: 5
A126: Icy Tomb Spaulders | B126: =(K126*$K$5)+(L126*$L$5)+(M126*$M$5)+(N126*$N$5)+(O126*$O$5)+(P126*100*$P$5)+(Q126*100*$Q$5)+(R126*100*$R$5)+(S126*100*$S$5)+(T126*$T$5)+(U126*$U$5)+(V126*$V$5)+(W126*$W$5)+(X126*$X$5)+(Y126*$Y$5)+(Z126*$Z$5)+(AA126*$AA$5) -> 25.22 | C126: =(K126*$K$6)+(L126*$L$6)+(M126*$M$6)+(N126*$N$6)+(O126*$O$6)+(P126*100*$P$6)+(Q126*100*$Q$6)+(R126*100*$R$6)+(S126*100*$S$6)+(T126*$T$6)+(U126*$U$6)+(V126*$V$6)+(W126*$W$6)+(X126*$X$6)+(Y126*$Y$6)+(Z126*$Z$6)+(AB126*$AA$6) -> 11.431999999999999 | D126: Sch | E126: 1 | F126: 57-59 | G126: Random Scholo Drop | I126: 52 | J126: P | K126: 122 | L126: 11 | M126: 11 | W126: 10 | Y126: 10
A127: Stormshroud Shoulders | B127: =(K127*$K$5)+(L127*$L$5)+(M127*$M$5)+(N127*$N$5)+(O127*$O$5)+(P127*100*$P$5)+(Q127*100*$Q$5)+(R127*100*$R$5)+(S127*100*$S$5)+(T127*$T$5)+(U127*$U$5)+(V127*$V$5)+(W127*$W$5)+(X127*$X$5)+(Y127*$Y$5)+(Z127*$Z$5)+(AA127*$AA$5) -> 26.14 | C127: =(K127*$K$6)+(L127*$L$6)+(M127*$M$6)+(N127*$N$6)+(O127*$O$6)+(P127*100*$P$6)+(Q127*100*$Q$6)+(R127*100*$R$6)+(S127*100*$S$6)+(T127*$T$6)+(U127*$U$6)+(V127*$V$6)+(W127*$W$6)+(X127*$X$6)+(Y127*$Y$6)+(Z127*$Z$6)+(AB127*$AA$6) -> 10.244 | D127: LW | E127: 1 | F127: 295 | G127: Azshara Recipe Drop | H127: SS | I127: 54 | J127: E | K127: 114 | M127: 12 | P127: 00.01 | S127: 00.01
A129: CHEST | B129: AEP | C129: MAEP | D129: Loc | E129: P | F129: Info | G129: Source | H129: Set | I129: Lvl | J129: B | K129: Arm | L129: Agi | M129: Sta | N129: Str | O129: AP | P129: Cri | Q129: Hit | R129: Par | S129: Dod | T129: Def | U129: Ar | V129: Fi | W129: Fr | X129: Na | Y129: Sh | Z129: H/5 | AA129: PVP | AB129: PVE | AC129: Special
A130: Bonescythe Breastplate | B130: =(K130*$K$5)+(L130*$L$5)+(M130*$M$5)+(N130*$N$5)+(O130*$O$5)+(P130*100*$P$5)+(Q130*100*$Q$5)+(R130*100*$R$5)+(S130*100*$S$5)+(T130*$T$5)+(U130*$U$5)+(V130*$V$5)+(W130*$W$5)+(X130*$X$5)+(Y130*$Y$5)+(Z130*$Z$5)+(AA130*$AA$5) -> 99.12 | C130: =(K130*$K$6)+(L130*$L$6)+(M130*$M$6)+(N130*$N$6)+(O130*$O$6)+(P130*100*$P$6)+(Q130*100*$Q$6)+(R130*100*$R$6)+(S130*100*$S$6)+(T130*$T$6)+(U130*$U$6)+(V130*$V$6)+(W130*$W$6)+(X130*$X$6)+(Y130*$Y$6)+(Z130*$Z$6)+(AB130*$AA$6) -> 68.051999999999992 | D130: Naxx | E130: 6 | F130: Q | G130: The Four Horsemen | H130: BS | I130: 60 | J130: P | K130: 262 | M130: 29 | O130: 80 | P130: 00.02 | Q130: 00.01
A131: Deathdealer's Vest | B131: =(K131*$K$5)+(L131*$L$5)+(M131*$M$5)+(N131*$N$5)+(O131*$O$5)+(P131*100*$P$5)+(Q131*100*$Q$5)+(R131*100*$R$5)+(S131*100*$S$5)+(T131*$T$5)+(U131*$U$5)+(V131*$V$5)+(W131*$W$5)+(X131*$X$5)+(Y131*$Y$5)+(Z131*$Z$5)+(AA131*$AA$5) -> 94.53 | C131: =(K131*$K$6)+(L131*$L$6)+(M131*$M$6)+(N131*$N$6)+(O131*$O$6)+(P131*100*$P$6)+(Q131*100*$Q$6)+(R131*100*$R$6)+(S131*100*$S$6)+(T131*$T$6)+(U131*$U$6)+(V131*$V$6)+(W131*$W$6)+(X131*$X$6)+(Y131*$Y$6)+(Z131*$Z$6)+(AB131*$AA$6) -> 64.533000000000001 | D131: AQ40 | E131: 5 | F131: Q | G131: C'Thun | H131: DE | I131: 60 | J131: P | K131: 253 | L131: 37 | M131: 28 | N131: 19 | P131: 00.01 | Q131: 00.01
A132: Bloodfang Chestpiece | B132: =(K132*$K$5)+(L132*$L$5)+(M132*$M$5)+(N132*$N$5)+(O132*$O$5)+(P132*100*$P$5)+(Q132*100*$Q$5)+(R132*100*$R$5)+(S132*100*$S$5)+(T132*$T$5)+(U132*$U$5)+(V132*$V$5)+(W132*$W$5)+(X132*$X$5)+(Y132*$Y$5)+(Z132*$Z$5)+(AA132*$AA$5) -> 78.25 | C132: =(K132*$K$6)+(L132*$L$6)+(M132*$M$6)+(N132*$N$6)+(O132*$O$6)+(P132*100*$P$6)+(Q132*100*$Q$6)+(R132*100*$R$6)+(S132*100*$S$6)+(T132*$T$6)+(U132*$U$6)+(V132*$V$6)+(W132*$W$6)+(X132*$X$6)+(Y132*$Y$6)+(Z132*$Z$6)+(AB132*$AA$6) -> 57.594999999999999 | D132: BWL | E132: 3 | F132: 500 | G132: Nefarian | H132: BF | I132: 60 | J132: P | K132: 225 | L132: 26 | M132: 17 | N132: 12 | P132: 00.01 | Q132: 00.02 | V132: 10 | X132: 10
A133: Vest of Swift Execution | B133: =(K133*$K$5)+(L133*$L$5)+(M133*$M$5)+(N133*$N$5)+(O133*$O$5)+(P133*100*$P$5)+(Q133*100*$Q$5)+(R133*100*$R$5)+(S133*100*$S$5)+(T133*$T$5)+(U133*$U$5)+(V133*$V$5)+(W133*$W$5)+(X133*$X$5)+(Y133*$Y$5)+(Z133*$Z$5)+(AA133*$AA$5) -> 73.79 | C133: =(K133*$K$6)+(L133*$L$6)+(M133*$M$6)+(N133*$N$6)+(O133*$O$6)+(P133*100*$P$6)+(Q133*100*$Q$6)+(R133*100*$R$6)+(S133*100*$S$6)+(T133*$T$6)+(U133*$U$6)+(V133*$V$6)+(W133*$W$6)+(X133*$X$6)+(Y133*$Y$6)+(Z133*$Z$6)+(AB133*$AA$6) -> 51.929000000000002 | D133: AQ40 | E133: 5 | F133: 0.25 | G133: Lord Kri | I133: 60 | J133: P | K133: 229 | L133: 41 | M133: 20 | N133: 21
A134: Darkmantle Tunic | B134: =(K134*$K$5)+(L134*$L$5)+(M134*$M$5)+(N134*$N$5)+(O134*$O$5)+(P134*100*$P$5)+(Q134*100*$Q$5)+(R134*100*$R$5)+(S134*100*$S$5)+(T134*$T$5)+(U134*$U$5)+(V134*$V$5)+(W134*$W$5)+(X134*$X$5)+(Y134*$Y$5)+(Z134*$Z$5)+(AA134*$AA$5) -> 62.85 | C134: =(K134*$K$6)+(L134*$L$6)+(M134*$M$6)+(N134*$N$6)+(O134*$O$6)+(P134*100*$P$6)+(Q134*100*$Q$6)+(R134*100*$R$6)+(S134*100*$S$6)+(T134*$T$6)+(U134*$U$6)+(V134*$V$6)+(W134*$W$6)+(X134*$X$6)+(Y134*$Y$6)+(Z134*$Z$6)+(AB134*$AA$6) -> 46.335000000000001 | D134: Q | E134: 5 | F134: Q | G134: SC Upgrade Quest | H134: DM | I134: 58 | J134: P | K134: 185 | L134: 31 | M134: 15 | Q134: 00.02
A135: Nightslayer Chestpiece | B135: =(K135*$K$5)+(L135*$L$5)+(M135*$M$5)+(N135*$N$5)+(O135*$O$5)+(P135*100*$P$5)+(Q135*100*$Q$5)+(R135*100*$R$5)+(S135*100*$S$5)+(T135*$T$5)+(U135*$U$5)+(V135*$V$5)+(W135*$W$5)+(X135*$X$5)+(Y135*$Y$5)+(Z135*$Z$5)+(AA135*$AA$5) -> 67 | C135: =(K135*$K$6)+(L135*$L$6)+(M135*$M$6)+(N135*$N$6)+(O135*$O$6)+(P135*100*$P$6)+(Q135*100*$Q$6)+(R135*100*$R$6)+(S135*100*$S$6)+(T135*$T$6)+(U135*$U$6)+(V135*$V$6)+(W135*$W$6)+(X135*$X$6)+(Y135*$Y$6)+(Z135*$Z$6)+(AB135*$AA$6) -> 44.5 | D135: MC | E135: 1 | F135: 00.21 | G135: Golemagg | H135: NS | I135: 60 | J135: P | K135: 200 | L135: 29 | M135: 20 | N135: 10 | P135: 00.01 | V135: 10
A136: Field Marshal's Leather Chestpiece | B136: =(K136*$K$5)+(L136*$L$5)+(M136*$M$5)+(N136*$N$5)+(O136*$O$5)+(P136*100*$P$5)+(Q136*100*$Q$5)+(R136*100*$R$5)+(S136*100*$S$5)+(T136*$T$5)+(U136*$U$5)+(V136*$V$5)+(W136*$W$5)+(X136*$X$5)+(Y136*$Y$5)+(Z136*$Z$5)+(AA136*$AA$5) -> 77.1 | C136: =(K136*$K$6)+(L136*$L$6)+(M136*$M$6)+(N136*$N$6)+(O136*$O$6)+(P136*100*$P$6)+(Q136*100*$Q$6)+(R136*100*$R$6)+(S136*100*$S$6)+(T136*$T$6)+(U136*$U$6)+(V136*$V$6)+(W136*$W$6)+(X136*$X$6)+(Y136*$Y$6)+(Z136*$Z$6)+(AB136*$AA$6) -> 44.07 | D136: PVP | E136: 2 | F136: FM | G136: Alliance Rank 13 PVP | H136: FM | I136: 60 | J136: P | K136: 260 | L136: 26 | M136: 31 | P136: 00.01 | Q136: 00.01
A137: Warlord's Leather Breastplate | B137: =(K137*$K$5)+(L137*$L$5)+(M137*$M$5)+(N137*$N$5)+(O137*$O$5)+(P137*100*$P$5)+(Q137*100*$Q$5)+(R137*100*$R$5)+(S137*100*$S$5)+(T137*$T$5)+(U137*$U$5)+(V137*$V$5)+(W137*$W$5)+(X137*$X$5)+(Y137*$Y$5)+(Z137*$Z$5)+(AA137*$AA$5) -> 77.1 | C137: =(K137*$K$6)+(L137*$L$6)+(M137*$M$6)+(N137*$N$6)+(O137*$O$6)+(P137*100*$P$6)+(Q137*100*$Q$6)+(R137*100*$R$6)+(S137*100*$S$6)+(T137*$T$6)+(U137*$U$6)+(V137*$V$6)+(W137*$W$6)+(X137*$X$6)+(Y137*$Y$6)+(Z137*$Z$6)+(AB137*$AA$6) -> 44.07 | D137: PVP | E137: 2 | F137: WL | G137: Horde Rank 13 PVP | H137: WL | I137: 60 | J137: P | K137: 260 | L137: 26 | M137: 31 | P137: 00.01 | Q137: 00.01
A138: Zandalar Madcap's Tunic | B138: =(K138*$K$5)+(L138*$L$5)+(M138*$M$5)+(N138*$N$5)+(O138*$O$5)+(P138*100*$P$5)+(Q138*100*$Q$5)+(R138*100*$R$5)+(S138*100*$S$5)+(T138*$T$5)+(U138*$U$5)+(V138*$V$5)+(W138*$W$5)+(X138*$X$5)+(Y138*$Y$5)+(Z138*$Z$5)+(AA138*$AA$5) -> 62.97 | C138: =(K138*$K$6)+(L138*$L$6)+(M138*$M$6)+(N138*$N$6)+(O138*$O$6)+(P138*100*$P$6)+(Q138*100*$Q$6)+(R138*100*$R$6)+(S138*100*$S$6)+(T138*$T$6)+(U138*$U$6)+(V138*$V$6)+(W138*$W$6)+(X138*$X$6)+(Y138*$Y$6)+(Z138*$Z$6)+(AB138*$AA$6) -> 42.387 | D138: ZG | E138: 4 | F138: Q | G138: Zandalar - Revered | H138: MO | I138: 58 | J138: P | K138: 197 | M138: 19 | O138: 44 | P138: 00.02
A139: Cadaverous Armor | B139: =(K139*$K$5)+(L139*$L$5)+(M139*$M$5)+(N139*$N$5)+(O139*$O$5)+(P139*100*$P$5)+(Q139*100*$Q$5)+(R139*100*$R$5)+(S139*100*$S$5)+(T139*$T$5)+(U139*$U$5)+(V139*$V$5)+(W139*$W$5)+(X139*$X$5)+(Y139*$Y$5)+(Z139*$Z$5)+(AA139*$AA$5) -> 43.72 | C139: =(K139*$K$6)+(L139*$L$6)+(M139*$M$6)+(N139*$N$6)+(O139*$O$6)+(P139*100*$P$6)+(Q139*100*$Q$6)+(R139*100*$R$6)+(S139*100*$S$6)+(T139*$T$6)+(U139*$U$6)+(V139*$V$6)+(W139*$W$6)+(X139*$X$6)+(Y139*$Y$6)+(Z139*$Z$6)+(AB139*$AA$6) -> 42.171999999999997 | D139: Sch | E139: 1 | F139: 00.02 | G139: Scholo Boss Drop | H139: Cad | I139: 56 | J139: P | K139: 172 | L139: 8 | N139: 8 | O139: 60
A140: Tunic of Undead Slaying | B140: =(K140*$K$5)+(L140*$L$5)+(M140*$M$5)+(N140*$N$5)+(O140*$O$5)+(P140*100*$P$5)+(Q140*100*$Q$5)+(R140*100*$R$5)+(S140*100*$S$5)+(T140*$T$5)+(U140*$U$5)+(V140*$V$5)+(W140*$W$5)+(X140*$X$5)+(Y140*$Y$5)+(Z140*$Z$5)+(AA140*$AA$5) -> 62.26 | C140: =(K140*$K$6)+(L140*$L$6)+(M140*$M$6)+(N140*$N$6)+(O140*$O$6)+(P140*100*$P$6)+(Q140*100*$Q$6)+(R140*100*$R$6)+(S140*100*$S$6)+(T140*$T$6)+(U140*$U$6)+(V140*$V$6)+(W140*$W$6)+(X140*$X$6)+(Y140*$Y$6)+(Z140*$Z$6)+(AB140*$AA$6) -> 40.875999999999998 | D140: R | E140: 6 | F140: 60 | G140: Shadow of Doom | H140: US | I140: 58 | J140: P | K140: 176 | M140: 20 | O140: 81 | AC140: +81AP vs Und
A141: Ghoul Skin Tunic | B141: =(K141*$K$5)+(L141*$L$5)+(M141*$M$5)+(N141*$N$5)+(O141*$O$5)+(P141*100*$P$5)+(Q141*100*$Q$5)+(R141*100*$R$5)+(S141*100*$S$5)+(T141*$T$5)+(U141*$U$5)+(V141*$V$5)+(W141*$W$5)+(X141*$X$5)+(Y141*$Y$5)+(Z141*$Z$5)+(AA141*$AA$5) -> 66.11 | C141: =(K141*$K$6)+(L141*$L$6)+(M141*$M$6)+(N141*$N$6)+(O141*$O$6)+(P141*100*$P$6)+(Q141*100*$Q$6)+(R141*100*$R$6)+(S141*100*$S$6)+(T141*$T$6)+(U141*$U$6)+(V141*$V$6)+(W141*$W$6)+(X141*$X$6)+(Y141*$Y$6)+(Z141*$Z$6)+(AB141*$AA$6) -> 40.631 | D141: Naxx | E141: 6 | F141: 00.01 | G141: Trash Mobs | I141: 60 | J141: P | K141: 411 | M141: 22 | N141: 40 | P141: 00.02
A142: Primal Batskin Jerkin | B142: =(K142*$K$5)+(L142*$L$5)+(M142*$M$5)+(N142*$N$5)+(O142*$O$5)+(P142*100*$P$5)+(Q142*100*$Q$5)+(R142*100*$R$5)+(S142*100*$S$5)+(T142*$T$5)+(U142*$U$5)+(V142*$V$5)+(W142*$W$5)+(X142*$X$5)+(Y142*$Y$5)+(Z142*$Z$5)+(AA142*$AA$5) -> 47.31 | C142: =(K142*$K$6)+(L142*$L$6)+(M142*$M$6)+(N142*$N$6)+(O142*$O$6)+(P142*100*$P$6)+(Q142*100*$Q$6)+(R142*100*$R$6)+(S142*100*$S$6)+(T142*$T$6)+(U142*$U$6)+(V142*$V$6)+(W142*$W$6)+(X142*$X$6)+(Y142*$Y$6)+(Z142*$Z$6)+(AB142*$AA$6) -> 39.741 | D142: LW | E142: 4 | F142: 300 | G142: Zandalar Revered | H142: PB | I142: 60 | J142: E | K142: 181 | L142: 32 | M142: 6 | Q142: 00.01
A143: Knight-Capt. Leather Chestpiece | B143: =(K143*$K$5)+(L143*$L$5)+(M143*$M$5)+(N143*$N$5)+(O143*$O$5)+(P143*100*$P$5)+(Q143*100*$Q$5)+(R143*100*$R$5)+(S143*100*$S$5)+(T143*$T$5)+(U143*$U$5)+(V143*$V$5)+(W143*$W$5)+(X143*$X$5)+(Y143*$Y$5)+(Z143*$Z$5)+(AA143*$AA$5) -> 58.98 | C143: =(K143*$K$6)+(L143*$L$6)+(M143*$M$6)+(N143*$N$6)+(O143*$O$6)+(P143*100*$P$6)+(Q143*100*$Q$6)+(R143*100*$R$6)+(S143*100*$S$6)+(T143*$T$6)+(U143*$U$6)+(V143*$V$6)+(W143*$W$6)+(X143*$X$6)+(Y143*$Y$6)+(Z143*$Z$6)+(AB143*$AA$6) -> 34.968000000000004 | D143: PVP | E143: 2 | F143: K-C | G143: Alliance Rank 8 PVP | H143: LCG | I143: 60 | J143: P | K143: 248 | M143: 22 | O143: 34 | P143: 00.01 | Q143: 00.01
A144: Legionnaire's Leather Chestpiece | B144: =(K144*$K$5)+(L144*$L$5)+(M144*$M$5)+(N144*$N$5)+(O144*$O$5)+(P144*100*$P$5)+(Q144*100*$Q$5)+(R144*100*$R$5)+(S144*100*$S$5)+(T144*$T$5)+(U144*$U$5)+(V144*$V$5)+(W144*$W$5)+(X144*$X$5)+(Y144*$Y$5)+(Z144*$Z$5)+(AA144*$AA$5) -> 58.98 | C144: =(K144*$K$6)+(L144*$L$6)+(M144*$M$6)+(N144*$N$6)+(O144*$O$6)+(P144*100*$P$6)+(Q144*100*$Q$6)+(R144*100*$R$6)+(S144*100*$S$6)+(T144*$T$6)+(U144*$U$6)+(V144*$V$6)+(W144*$W$6)+(X144*$X$6)+(Y144*$Y$6)+(Z144*$Z$6)+(AB144*$AA$6) -> 34.968000000000004 | D144: PVP | E144: 2 | F144: Leg | G144: Horde Rank 8 PVP | H144: CV | I144: 60 | J144: P | K144: 248 | M144: 22 | O144: 34 | P144: 00.01 | Q144: 00.01
A145: Nightbrace Tunic | B145: =(K145*$K$5)+(L145*$L$5)+(M145*$M$5)+(N145*$N$5)+(O145*$O$5)+(P145*100*$P$5)+(Q145*100*$Q$5)+(R145*100*$R$5)+(S145*100*$S$5)+(T145*$T$5)+(U145*$U$5)+(V145*$V$5)+(W145*$W$5)+(X145*$X$5)+(Y145*$Y$5)+(Z145*$Z$5)+(AA145*$AA$5) -> 43.72 | C145: =(K145*$K$6)+(L145*$L$6)+(M145*$M$6)+(N145*$N$6)+(O145*$O$6)+(P145*100*$P$6)+(Q145*100*$Q$6)+(R145*100*$R$6)+(S145*100*$S$6)+(T145*$T$6)+(U145*$U$6)+(V145*$V$6)+(W145*$W$6)+(X145*$X$6)+(Y145*$Y$6)+(Z145*$Z$6)+(AB145*$AA$6) -> 30.472000000000001 | D145: UBRS | E145: 1 | F145: 00.18 | G145: Solakar Flamewreath | I145: 56 | J145: P | K145: 172 | L145: 5 | M145: 10 | O145: 50 | V145: 10 | Y145: 10
A146: Thick Silithid Chestguard | B146: =(K146*$K$5)+(L146*$L$5)+(M146*$M$5)+(N146*$N$5)+(O146*$O$5)+(P146*100*$P$5)+(Q146*100*$Q$5)+(R146*100*$R$5)+(S146*100*$S$5)+(T146*$T$5)+(U146*$U$5)+(V146*$V$5)+(W146*$W$5)+(X146*$X$5)+(Y146*$Y$5)+(Z146*$Z$5)+(AA146*$AA$5) -> 63.58 | C146: =(K146*$K$6)+(L146*$L$6)+(M146*$M$6)+(N146*$N$6)+(O146*$O$6)+(P146*100*$P$6)+(Q146*100*$Q$6)+(R146*100*$R$6)+(S146*100*$S$6)+(T146*$T$6)+(U146*$U$6)+(V146*$V$6)+(W146*$W$6)+(X146*$X$6)+(Y146*$Y$6)+(Z146*$Z$6)+(AB146*$AA$6) -> 29.308000000000003 | D146: AQ20 | E146: 5 | F146: 0.25 | G146: Moam | I146: 60 | J146: P | K146: 258 | L146: 21 | M146: 30 | N146: 15 | U146: 5 | V146: 5 | W146: 5 | X146: 5 | Y146: 5
A147: Adventurer's Tunic of the Tiger | B147: =(K147*$K$5)+(L147*$L$5)+(M147*$M$5)+(N147*$N$5)+(O147*$O$5)+(P147*100*$P$5)+(Q147*100*$Q$5)+(R147*100*$R$5)+(S147*100*$S$5)+(T147*$T$5)+(U147*$U$5)+(V147*$V$5)+(W147*$W$5)+(X147*$X$5)+(Y147*$Y$5)+(Z147*$Z$5)+(AA147*$AA$5) -> 30.15 | C147: =(K147*$K$6)+(L147*$L$6)+(M147*$M$6)+(N147*$N$6)+(O147*$O$6)+(P147*100*$P$6)+(Q147*100*$Q$6)+(R147*100*$R$6)+(S147*100*$S$6)+(T147*$T$6)+(U147*$U$6)+(V147*$V$6)+(W147*$W$6)+(X147*$X$6)+(Y147*$Y$6)+(Z147*$Z$6)+(AB147*$AA$6) -> 28.664999999999999 | D147: R | E147: 1 | F147: 61-63 | G147: Random World Drop | I147: 60 | J147: E | K147: 165 | L147: 19 | N147: 19
A148: Supr. Breastplate of the Tiger | B148: =(K148*$K$5)+(L148*$L$5)+(M148*$M$5)+(N148*$N$5)+(O148*$O$5)+(P148*100*$P$5)+(Q148*100*$Q$5)+(R148*100*$R$5)+(S148*100*$S$5)+(T148*$T$5)+(U148*$U$5)+(V148*$V$5)+(W148*$W$5)+(X148*$X$5)+(Y148*$Y$5)+(Z148*$Z$5)+(AA148*$AA$5) -> 30.15 | C148: =(K148*$K$6)+(L148*$L$6)+(M148*$M$6)+(N148*$N$6)+(O148*$O$6)+(P148*100*$P$6)+(Q148*100*$Q$6)+(R148*100*$R$6)+(S148*100*$S$6)+(T148*$T$6)+(U148*$U$6)+(V148*$V$6)+(W148*$W$6)+(X148*$X$6)+(Y148*$Y$6)+(Z148*$Z$6)+(AB148*$AA$6) -> 28.664999999999999 | D148: R | E148: 1 | F148: 55-63 | G148: Random World Drop | I148: 60 | J148: E | K148: 165 | L148: 19 | N148: 19
A149: Mighty Tunic of the Tiger | B149: =(K149*$K$5)+(L149*$L$5)+(M149*$M$5)+(N149*$N$5)+(O149*$O$5)+(P149*100*$P$5)+(Q149*100*$Q$5)+(R149*100*$R$5)+(S149*100*$S$5)+(T149*$T$5)+(U149*$U$5)+(V149*$V$5)+(W149*$W$5)+(X149*$X$5)+(Y149*$Y$5)+(Z149*$Z$5)+(AA149*$AA$5) -> 30.13 | C149: =(K149*$K$6)+(L149*$L$6)+(M149*$M$6)+(N149*$N$6)+(O149*$O$6)+(P149*100*$P$6)+(Q149*100*$Q$6)+(R149*100*$R$6)+(S149*100*$S$6)+(T149*$T$6)+(U149*$U$6)+(V149*$V$6)+(W149*$W$6)+(X149*$X$6)+(Y149*$Y$6)+(Z149*$Z$6)+(AB149*$AA$6) -> 28.663 | D149: R | E149: 1 | F149: 61-63 | G149: Random World Drop | I149: 59 | J149: E | K149: 163 | L149: 19 | N149: 19
A150: Breastplate of Bloodthirst | B150: =(K150*$K$5)+(L150*$L$5)+(M150*$M$5)+(N150*$N$5)+(O150*$O$5)+(P150*100*$P$5)+(Q150*100*$Q$5)+(R150*100*$R$5)+(S150*100*$S$5)+(T150*$T$5)+(U150*$U$5)+(V150*$V$5)+(W150*$W$5)+(X150*$X$5)+(Y150*$Y$5)+(Z150*$Z$5)+(AA150*$AA$5) -> 51.4 | C150: =(K150*$K$6)+(L150*$L$6)+(M150*$M$6)+(N150*$N$6)+(O150*$O$6)+(P150*100*$P$6)+(Q150*100*$Q$6)+(R150*100*$R$6)+(S150*100*$S$6)+(T150*$T$6)+(U150*$U$6)+(V150*$V$6)+(W150*$W$6)+(X150*$X$6)+(Y150*$Y$6)+(Z150*$Z$6)+(AB150*$AA$6) -> 26.9 | D150: WS | E150: 1 | F150: Q | G150: WS Multi-item quest | I150: 57 | J150: P | K150: 190 | M150: 20 | N150: 13 | P150: 00.02 | S150: 00.01
A151: Traphook Jerkin | B151: =(K151*$K$5)+(L151*$L$5)+(M151*$M$5)+(N151*$N$5)+(O151*$O$5)+(P151*100*$P$5)+(Q151*100*$Q$5)+(R151*100*$R$5)+(S151*100*$S$5)+(T151*$T$5)+(U151*$U$5)+(V151*$V$5)+(W151*$W$5)+(X151*$X$5)+(Y151*$Y$5)+(Z151*$Z$5)+(AA151*$AA$5) -> 28.02 | C151: =(K151*$K$6)+(L151*$L$6)+(M151*$M$6)+(N151*$N$6)+(O151*$O$6)+(P151*100*$P$6)+(Q151*100*$Q$6)+(R151*100*$R$6)+(S151*100*$S$6)+(T151*$T$6)+(U151*$U$6)+(V151*$V$6)+(W151*$W$6)+(X151*$X$6)+(Y151*$Y$6)+(Z151*$Z$6)+(AB151*$AA$6) -> 26.652000000000001 | D151: LBRS | E151: 1 | F151: Q | G151: LBRS Quest Reward | I151: 55 | J151: P | K151: 152 | L151: 24 | N151: 5
A152: Shadowcraft Tunic | B152: =(K152*$K$5)+(L152*$L$5)+(M152*$M$5)+(N152*$N$5)+(O152*$O$5)+(P152*100*$P$5)+(Q152*100*$Q$5)+(R152*100*$R$5)+(S152*100*$S$5)+(T152*$T$5)+(U152*$U$5)+(V152*$V$5)+(W152*$W$5)+(X152*$X$5)+(Y152*$Y$5)+(Z152*$Z$5)+(AA152*$AA$5) -> 40.76 | C152: =(K152*$K$6)+(L152*$L$6)+(M152*$M$6)+(N152*$N$6)+(O152*$O$6)+(P152*100*$P$6)+(Q152*100*$Q$6)+(R152*100*$R$6)+(S152*100*$S$6)+(T152*$T$6)+(U152*$U$6)+(V152*$V$6)+(W152*$W$6)+(X152*$X$6)+(Y152*$Y$6)+(Z152*$Z$6)+(AB152*$AA$6) -> 26.305999999999997 | D152: UBRS | E152: 1 | F152: 00.06 | G152: General Drakkisath | H152: SC | I152: 58 | J152: P | K152: 176 | L152: 26 | M152: 13
A153: Fungus Shroud Armor | B153: =(K153*$K$5)+(L153*$L$5)+(M153*$M$5)+(N153*$N$5)+(O153*$O$5)+(P153*100*$P$5)+(Q153*100*$Q$5)+(R153*100*$R$5)+(S153*100*$S$5)+(T153*$T$5)+(U153*$U$5)+(V153*$V$5)+(W153*$W$5)+(X153*$X$5)+(Y153*$Y$5)+(Z153*$Z$5)+(AA153*$AA$5) -> 36.48 | C153: =(K153*$K$6)+(L153*$L$6)+(M153*$M$6)+(N153*$N$6)+(O153*$O$6)+(P153*100*$P$6)+(Q153*100*$Q$6)+(R153*100*$R$6)+(S153*100*$S$6)+(T153*$T$6)+(U153*$U$6)+(V153*$V$6)+(W153*$W$6)+(X153*$X$6)+(Y153*$Y$6)+(Z153*$Z$6)+(AB153*$AA$6) -> 25.248000000000001 | D153: Mar | E153: 1 | F153: 00.29 | G153: Meshlok the Harv. | I153: 46 | J153: P | K153: 148 | L153: 25 | M153: 10
A154: Blazewind Breastplate | B154: =(K154*$K$5)+(L154*$L$5)+(M154*$M$5)+(N154*$N$5)+(O154*$O$5)+(P154*100*$P$5)+(Q154*100*$Q$5)+(R154*100*$R$5)+(S154*100*$S$5)+(T154*$T$5)+(U154*$U$5)+(V154*$V$5)+(W154*$W$5)+(X154*$X$5)+(Y154*$Y$5)+(Z154*$Z$5)+(AA154*$AA$5) -> 30.98 | C154: =(K154*$K$6)+(L154*$L$6)+(M154*$M$6)+(N154*$N$6)+(O154*$O$6)+(P154*100*$P$6)+(Q154*100*$Q$6)+(R154*100*$R$6)+(S154*100*$S$6)+(T154*$T$6)+(U154*$U$6)+(V154*$V$6)+(W154*$W$6)+(X154*$X$6)+(Y154*$Y$6)+(Z154*$Z$6)+(AB154*$AA$6) -> 24.698 | D154: Bad | E154: 1 | F154: Q | G154: Quest Series | I154: 40 | J154: P | K154: 148 | L154: 23 | M154: 5 | N154: 3
A155: Knight-Capt. Leather Armor | B155: =(K155*$K$5)+(L155*$L$5)+(M155*$M$5)+(N155*$N$5)+(O155*$O$5)+(P155*100*$P$5)+(Q155*100*$Q$5)+(R155*100*$R$5)+(S155*100*$S$5)+(T155*$T$5)+(U155*$U$5)+(V155*$V$5)+(W155*$W$5)+(X155*$X$5)+(Y155*$Y$5)+(Z155*$Z$5)+(AA155*$AA$5) -> 49.76 | C155: =(K155*$K$6)+(L155*$L$6)+(M155*$M$6)+(N155*$N$6)+(O155*$O$6)+(P155*100*$P$6)+(Q155*100*$Q$6)+(R155*100*$R$6)+(S155*100*$S$6)+(T155*$T$6)+(U155*$U$6)+(V155*$V$6)+(W155*$W$6)+(X155*$X$6)+(Y155*$Y$6)+(Z155*$Z$6)+(AB155*$AA$6) -> 23.426000000000002 | D155: PVP | E155: 2 | F155: K-C | G155: Alliance Rank 8 PVP | H155: LCV | I155: 58 | J155: P | K155: 176 | L155: 13 | M155: 25 | P155: 00.01
A156: Legionnaire's Leather Hauberk | B156: =(K156*$K$5)+(L156*$L$5)+(M156*$M$5)+(N156*$N$5)+(O156*$O$5)+(P156*100*$P$5)+(Q156*100*$Q$5)+(R156*100*$R$5)+(S156*100*$S$5)+(T156*$T$5)+(U156*$U$5)+(V156*$V$5)+(W156*$W$5)+(X156*$X$5)+(Y156*$Y$5)+(Z156*$Z$5)+(AA156*$AA$5) -> 49.76 | C156: =(K156*$K$6)+(L156*$L$6)+(M156*$M$6)+(N156*$N$6)+(O156*$O$6)+(P156*100*$P$6)+(Q156*100*$Q$6)+(R156*100*$R$6)+(S156*100*$S$6)+(T156*$T$6)+(U156*$U$6)+(V156*$V$6)+(W156*$W$6)+(X156*$X$6)+(Y156*$Y$6)+(Z156*$Z$6)+(AB156*$AA$6) -> 23.426000000000002 | D156: PVP | E156: 2 | F156: Leg | G156: Horde Rank 8 PVP | H156: CV | I156: 58 | J156: P | K156: 176 | L156: 13 | M156: 25 | P156: 00.01
A157: Quillward Harness | B157: =(K157*$K$5)+(L157*$L$5)+(M157*$M$5)+(N157*$N$5)+(O157*$O$5)+(P157*100*$P$5)+(Q157*100*$Q$5)+(R157*100*$R$5)+(S157*100*$S$5)+(T157*$T$5)+(U157*$U$5)+(V157*$V$5)+(W157*$W$5)+(X157*$X$5)+(Y157*$Y$5)+(Z157*$Z$5)+(AA157*$AA$5) -> 23.94 | C157: =(K157*$K$6)+(L157*$L$6)+(M157*$M$6)+(N157*$N$6)+(O157*$O$6)+(P157*100*$P$6)+(Q157*100*$Q$6)+(R157*100*$R$6)+(S157*100*$S$6)+(T157*$T$6)+(U157*$U$6)+(V157*$V$6)+(W157*$W$6)+(X157*$X$6)+(Y157*$Y$6)+(Z157*$Z$6)+(AB157*$AA$6) -> 23.094000000000001 | D157: RFD | E157: 1 | F157: R | G157: Random RFD Drop | I157: 34 | J157: E | K157: 94 | L157: 19 | N157: 8
A158: Tombstone Breastplate | B158: =(K158*$K$5)+(L158*$L$5)+(M158*$M$5)+(N158*$N$5)+(O158*$O$5)+(P158*100*$P$5)+(Q158*100*$Q$5)+(R158*100*$R$5)+(S158*100*$S$5)+(T158*$T$5)+(U158*$U$5)+(V158*$V$5)+(W158*$W$5)+(X158*$X$5)+(Y158*$Y$5)+(Z158*$Z$5)+(AA158*$AA$5) -> 33.74 | C158: =(K158*$K$6)+(L158*$L$6)+(M158*$M$6)+(N158*$N$6)+(O158*$O$6)+(P158*100*$P$6)+(Q158*100*$Q$6)+(R158*100*$R$6)+(S158*100*$S$6)+(T158*$T$6)+(U158*$U$6)+(V158*$V$6)+(W158*$W$6)+(X158*$X$6)+(Y158*$Y$6)+(Z158*$Z$6)+(AB158*$AA$6) -> 22.274000000000001 | D158: Sch | E158: 1 | F158: 00.09 | G158: Darkmaster Gandling | I158: 57 | J158: P | K158: 174 | M158: 10 | N158: 4 | P158: 00.02
A159: Malfurion's Blessed Bulwark | B159: =(K159*$K$5)+(L159*$L$5)+(M159*$M$5)+(N159*$N$5)+(O159*$O$5)+(P159*100*$P$5)+(Q159*100*$Q$5)+(R159*100*$R$5)+(S159*100*$S$5)+(T159*$T$5)+(U159*$U$5)+(V159*$V$5)+(W159*$W$5)+(X159*$X$5)+(Y159*$Y$5)+(Z159*$Z$5)+(AA159*$AA$5) -> 45.92 | C159: =(K159*$K$6)+(L159*$L$6)+(M159*$M$6)+(N159*$N$6)+(O159*$O$6)+(P159*100*$P$6)+(Q159*100*$Q$6)+(R159*100*$R$6)+(S159*100*$S$6)+(T159*$T$6)+(U159*$U$6)+(V159*$V$6)+(W159*$W$6)+(X159*$X$6)+(Y159*$Y$6)+(Z159*$Z$6)+(AB159*$AA$6) -> 20.611999999999998 | D159: BWL | E159: 3 | F159: 00.08 | G159: Ebonroc | I159: 60 | J159: P | K159: 392 | M159: 22 | N159: 40
A160: Mixologist's Tunic | B160: =(K160*$K$5)+(L160*$L$5)+(M160*$M$5)+(N160*$N$5)+(O160*$O$5)+(P160*100*$P$5)+(Q160*100*$Q$5)+(R160*100*$R$5)+(S160*100*$S$5)+(T160*$T$5)+(U160*$U$5)+(V160*$V$5)+(W160*$W$5)+(X160*$X$5)+(Y160*$Y$5)+(Z160*$Z$5)+(AA160*$AA$5) -> 39.58 | C160: =(K160*$K$6)+(L160*$L$6)+(M160*$M$6)+(N160*$N$6)+(O160*$O$6)+(P160*100*$P$6)+(Q160*100*$Q$6)+(R160*100*$R$6)+(S160*100*$S$6)+(T160*$T$6)+(U160*$U$6)+(V160*$V$6)+(W160*$W$6)+(X160*$X$6)+(Y160*$Y$6)+(Z160*$Z$6)+(AB160*$AA$6) -> 20.338000000000001 | D160: BRD | E160: 1 | F160: 00.26 | G160: Plugger Spazzring | I160: 50 | J160: P | K160: 158 | L160: 11 | M160: 18 | N160: 18
A161: Stormshroud Armor | B161: =(K161*$K$5)+(L161*$L$5)+(M161*$M$5)+(N161*$N$5)+(O161*$O$5)+(P161*100*$P$5)+(Q161*100*$Q$5)+(R161*100*$R$5)+(S161*100*$S$5)+(T161*$T$5)+(U161*$U$5)+(V161*$V$5)+(W161*$W$5)+(X161*$X$5)+(Y161*$Y$5)+(Z161*$Z$5)+(AA161*$AA$5) -> 24.63 | C161: =(K161*$K$6)+(L161*$L$6)+(M161*$M$6)+(N161*$N$6)+(O161*$O$6)+(P161*100*$P$6)+(Q161*100*$Q$6)+(R161*100*$R$6)+(S161*100*$S$6)+(T161*$T$6)+(U161*$U$6)+(V161*$V$6)+(W161*$W$6)+(X161*$X$6)+(Y161*$Y$6)+(Z161*$Z$6)+(AB161*$AA$6) -> 20.173000000000002 | D161: LW | E161: 1 | F161: 285 | G161: Azshara Recipe Drop | H161: SS | I161: 52 | J161: E | K161: 163 | P161: 00.02 | S161: 00.01
A162: Songbird Blouse | B162: =(K162*$K$5)+(L162*$L$5)+(M162*$M$5)+(N162*$N$5)+(O162*$O$5)+(P162*100*$P$5)+(Q162*100*$Q$5)+(R162*100*$R$5)+(S162*100*$S$5)+(T162*$T$5)+(U162*$U$5)+(V162*$V$5)+(W162*$W$5)+(X162*$X$5)+(Y162*$Y$5)+(Z162*$Z$5)+(AA162*$AA$5) -> 34.15 | C162: =(K162*$K$6)+(L162*$L$6)+(M162*$M$6)+(N162*$N$6)+(O162*$O$6)+(P162*100*$P$6)+(Q162*100*$Q$6)+(R162*100*$R$6)+(S162*100*$S$6)+(T162*$T$6)+(U162*$U$6)+(V162*$V$6)+(W162*$W$6)+(X162*$X$6)+(Y162*$Y$6)+(Z162*$Z$6)+(AB162*$AA$6) -> 19.795000000000002 | D162: Str | E162: 1 | F162: 00.2 | G162: Hearthsinger Forrest. | I162: 53 | J162: P | K162: 165 | L162: 13 | M162: 13 | N162: 13
A163: Polar Tunic | B163: =(K163*$K$5)+(L163*$L$5)+(M163*$M$5)+(N163*$N$5)+(O163*$O$5)+(P163*100*$P$5)+(Q163*100*$Q$5)+(R163*100*$R$5)+(S163*100*$S$5)+(T163*$T$5)+(U163*$U$5)+(V163*$V$5)+(W163*$W$5)+(X163*$X$5)+(Y163*$Y$5)+(Z163*$Z$5)+(AA163*$AA$5) -> 50.34 | C163: =(K163*$K$6)+(L163*$L$6)+(M163*$M$6)+(N163*$N$6)+(O163*$O$6)+(P163*100*$P$6)+(Q163*100*$Q$6)+(R163*100*$R$6)+(S163*100*$S$6)+(T163*$T$6)+(U163*$U$6)+(V163*$V$6)+(W163*$W$6)+(X163*$X$6)+(Y163*$Y$6)+(Z163*$Z$6)+(AB163*$AA$6) -> 18.894000000000002 | D163: Naxx | E163: 6 | F163: Q | G163: Naxx Quest Reward | I163: 60 | J163: E | K163: 234 | L163: 18 | M163: 26 | W163: 40
A165: WAIST | B165: AEP | C165: MAEP | D165: Loc | E165: P | F165: Info | G165: Source | H165: Set | I165: Lvl | J165: B | K165: Arm | L165: Agi | M165: Sta | N165: Str | O165: AP | P165: Cri | Q165: Hit | R165: Par | S165: Dod | T165: Def | U165: Ar | V165: Fi | W165: Fr | X165: Na | Y165: Sh | Z165: H/5 | AA165: PVP | AB165: PVE | AC165: Special
A166: Belt of Never-ending Agony | B166: =(K166*$K$5)+(L166*$L$5)+(M166*$M$5)+(N166*$N$5)+(O166*$O$5)+(P166*100*$P$5)+(Q166*100*$Q$5)+(R166*100*$R$5)+(S166*100*$S$5)+(T166*$T$5)+(U166*$U$5)+(V166*$V$5)+(W166*$W$5)+(X166*$X$5)+(Y166*$Y$5)+(Z166*$Z$5)+(AA166*$AA$5) -> 70.92 | C166: =(K166*$K$6)+(L166*$L$6)+(M166*$M$6)+(N166*$N$6)+(O166*$O$6)+(P166*100*$P$6)+(Q166*100*$Q$6)+(R166*100*$R$6)+(S166*100*$S$6)+(T166*$T$6)+(U166*$U$6)+(V166*$V$6)+(W166*$W$6)+(X166*$X$6)+(Y166*$Y$6)+(Z166*$Z$6)+(AB166*$AA$6) -> 49.841999999999999 | D166: AQ40 | E166: 5 | F166: 00.15 | G166: C'Thun | I166: 60 | J166: P | K166: 142 | M166: 20 | O166: 64 | P166: 00.01 | Q166: 00.01
A167: Bonescythe Waistguard | B167: =(K167*$K$5)+(L167*$L$5)+(M167*$M$5)+(N167*$N$5)+(O167*$O$5)+(P167*100*$P$5)+(Q167*100*$Q$5)+(R167*100*$R$5)+(S167*100*$S$5)+(T167*$T$5)+(U167*$U$5)+(V167*$V$5)+(W167*$W$5)+(X167*$X$5)+(Y167*$Y$5)+(Z167*$Z$5)+(AA167*$AA$5) -> 66.92 | C167: =(K167*$K$6)+(L167*$L$6)+(M167*$M$6)+(N167*$N$6)+(O167*$O$6)+(P167*100*$P$6)+(Q167*100*$Q$6)+(R167*100*$R$6)+(S167*100*$S$6)+(T167*$T$6)+(U167*$U$6)+(V167*$V$6)+(W167*$W$6)+(X167*$X$6)+(Y167*$Y$6)+(Z167*$Z$6)+(AB167*$AA$6) -> 45.841999999999999 | D167: Naxx | E167: 6 | F167: Q | G167: Noth/Heigan/Gluth | H167: BS | I167: 60 | J167: P | K167: 142 | L167: 24 | M167: 20 | N167: 23 | P167: 00.01
A168: Bloodfang Belt | B168: =(K168*$K$5)+(L168*$L$5)+(M168*$M$5)+(N168*$N$5)+(O168*$O$5)+(P168*100*$P$5)+(Q168*100*$Q$5)+(R168*100*$R$5)+(S168*100*$S$5)+(T168*$T$5)+(U168*$U$5)+(V168*$V$5)+(W168*$W$5)+(X168*$X$5)+(Y168*$Y$5)+(Z168*$Z$5)+(AA168*$AA$5) -> 53.76 | C168: =(K168*$K$6)+(L168*$L$6)+(M168*$M$6)+(N168*$N$6)+(O168*$O$6)+(P168*100*$P$6)+(Q168*100*$Q$6)+(R168*100*$R$6)+(S168*100*$S$6)+(T168*$T$6)+(U168*$U$6)+(V168*$V$6)+(W168*$W$6)+(X168*$X$6)+(Y168*$Y$6)+(Z168*$Z$6)+(AB168*$AA$6) -> 36.875999999999998 | D168: BWL | E168: 3 | F168: 00.21 | G168: Vaelastrasz | H168: BF | I168: 60 | J168: P | K168: 126 | L168: 20 | M168: 15 | N168: 13 | P168: 00.01 | Y168: 10
A169: Nightslayer Belt | B169: =(K169*$K$5)+(L169*$L$5)+(M169*$M$5)+(N169*$N$5)+(O169*$O$5)+(P169*100*$P$5)+(Q169*100*$Q$5)+(R169*100*$R$5)+(S169*100*$S$5)+(T169*$T$5)+(U169*$U$5)+(V169*$V$5)+(W169*$W$5)+(X169*$X$5)+(Y169*$Y$5)+(Z169*$Z$5)+(AA169*$AA$5) -> 51.33 | C169: =(K169*$K$6)+(L169*$L$6)+(M169*$M$6)+(N169*$N$6)+(O169*$O$6)+(P169*100*$P$6)+(Q169*100*$Q$6)+(R169*100*$R$6)+(S169*100*$S$6)+(T169*$T$6)+(U169*$U$6)+(V169*$V$6)+(W169*$W$6)+(X169*$X$6)+(Y169*$Y$6)+(Z169*$Z$6)+(AB169*$AA$6) -> 31.863 | D169: MC | E169: 1 | F169: R | G169: Random MC Drop | H169: NS | I169: 60 | J169: E | K169: 113 | L169: 17 | M169: 18 | N169: 9 | P169: 00.01 | V169: 7
A170: Taut Dragonhide Belt | B170: =(K170*$K$5)+(L170*$L$5)+(M170*$M$5)+(N170*$N$5)+(O170*$O$5)+(P170*100*$P$5)+(Q170*100*$Q$5)+(R170*100*$R$5)+(S170*100*$S$5)+(T170*$T$5)+(U170*$U$5)+(V170*$V$5)+(W170*$W$5)+(X170*$X$5)+(Y170*$Y$5)+(Z170*$Z$5)+(AA170*$AA$5) -> 51.25 | C170: =(K170*$K$6)+(L170*$L$6)+(M170*$M$6)+(N170*$N$6)+(O170*$O$6)+(P170*100*$P$6)+(Q170*100*$Q$6)+(R170*100*$R$6)+(S170*100*$S$6)+(T170*$T$6)+(U170*$U$6)+(V170*$V$6)+(W170*$W$6)+(X170*$X$6)+(Y170*$Y$6)+(Z170*$Z$6)+(AB170*$AA$6) -> 30.305 | D170: BWL | E170: 3 | F170: 00.09 | G170: BWL Bosses | I170: 60 | J170: P | K170: 125 | M170: 17 | O170: 60 | S170: 00.01
A171: Mugger's Belt | B171: =(K171*$K$5)+(L171*$L$5)+(M171*$M$5)+(N171*$N$5)+(O171*$O$5)+(P171*100*$P$5)+(Q171*100*$Q$5)+(R171*100*$R$5)+(S171*100*$S$5)+(T171*$T$5)+(U171*$U$5)+(V171*$V$5)+(W171*$W$5)+(X171*$X$5)+(Y171*$Y$5)+(Z171*$Z$5)+(AA171*$AA$5) -> 31.98 | C171: =(K171*$K$6)+(L171*$L$6)+(M171*$M$6)+(N171*$N$6)+(O171*$O$6)+(P171*100*$P$6)+(Q171*100*$Q$6)+(R171*100*$R$6)+(S171*100*$S$6)+(T171*$T$6)+(U171*$U$6)+(V171*$V$6)+(W171*$W$6)+(X171*$X$6)+(Y171*$Y$6)+(Z171*$Z$6)+(AB171*$AA$6) -> 30.257999999999999 | D171: DM-N | E171: 2 | F171: 00.18 | G171: Captain Kromcrush | I171: 57 | J171: P | K171: 98 | M171: 16 | P171: 00.01 | AA171: 5 | AB171: 20 | AC171: Daggers +5
A172: Belt of Preserved Heads | B172: =(K172*$K$5)+(L172*$L$5)+(M172*$M$5)+(N172*$N$5)+(O172*$O$5)+(P172*100*$P$5)+(Q172*100*$Q$5)+(R172*100*$R$5)+(S172*100*$S$5)+(T172*$T$5)+(U172*$U$5)+(V172*$V$5)+(W172*$W$5)+(X172*$X$5)+(Y172*$Y$5)+(Z172*$Z$5)+(AA172*$AA$5) -> 41.58 | C172: =(K172*$K$6)+(L172*$L$6)+(M172*$M$6)+(N172*$N$6)+(O172*$O$6)+(P172*100*$P$6)+(Q172*100*$Q$6)+(R172*100*$R$6)+(S172*100*$S$6)+(T172*$T$6)+(U172*$U$6)+(V172*$V$6)+(W172*$W$6)+(X172*$X$6)+(Y172*$Y$6)+(Z172*$Z$6)+(AB172*$AA$6) -> 29.718 | D172: ZG | E172: 4 | F172: Q | G172: Multi-item Quest | I172: 58 | J172: P | K172: 108 | L172: 15 | M172: 11 | N172: 14 | Q172: 00.01
A173: Molten Belt | B173: =(K173*$K$5)+(L173*$L$5)+(M173*$M$5)+(N173*$N$5)+(O173*$O$5)+(P173*100*$P$5)+(Q173*100*$Q$5)+(R173*100*$R$5)+(S173*100*$S$5)+(T173*$T$5)+(U173*$U$5)+(V173*$V$5)+(W173*$W$5)+(X173*$X$5)+(Y173*$Y$5)+(Z173*$Z$5)+(AA173*$AA$5) -> 46.38 | C173: =(K173*$K$6)+(L173*$L$6)+(M173*$M$6)+(N173*$N$6)+(O173*$O$6)+(P173*100*$P$6)+(Q173*100*$Q$6)+(R173*100*$R$6)+(S173*100*$S$6)+(T173*$T$6)+(U173*$U$6)+(V173*$V$6)+(W173*$W$6)+(X173*$X$6)+(Y173*$Y$6)+(Z173*$Z$6)+(AB173*$AA$6) -> 28.398 | D173: LW | E173: 1 | F173: 300 | G173: Thorium Revered | I173: 60 | J173: E | K173: 118 | L173: 28 | M173: 16 | V173: 12
A174: Highlander's Leather Girdle (58) | B174: =(K174*$K$5)+(L174*$L$5)+(M174*$M$5)+(N174*$N$5)+(O174*$O$5)+(P174*100*$P$5)+(Q174*100*$Q$5)+(R174*100*$R$5)+(S174*100*$S$5)+(T174*$T$5)+(U174*$U$5)+(V174*$V$5)+(W174*$W$5)+(X174*$X$5)+(Y174*$Y$5)+(Z174*$Z$5)+(AA174*$AA$5) -> 35.59 | C174: =(K174*$K$6)+(L174*$L$6)+(M174*$M$6)+(N174*$N$6)+(O174*$O$6)+(P174*100*$P$6)+(Q174*100*$Q$6)+(R174*100*$R$6)+(S174*100*$S$6)+(T174*$T$6)+(U174*$U$6)+(V174*$V$6)+(W174*$W$6)+(X174*$X$6)+(Y174*$Y$6)+(Z174*$Z$6)+(AB174*$AA$6) -> 27.228999999999999 | D174: AB | E174: 4 | F174: Hon | G174: Alliance AB Honored | H174: HP | I174: 58 | J174: P | K174: 159 | M174: 7 | O174: 34 | P174: 00.01
A175: Defiler's Leather Girdle (58) | B175: =(K175*$K$5)+(L175*$L$5)+(M175*$M$5)+(N175*$N$5)+(O175*$O$5)+(P175*100*$P$5)+(Q175*100*$Q$5)+(R175*100*$R$5)+(S175*100*$S$5)+(T175*$T$5)+(U175*$U$5)+(V175*$V$5)+(W175*$W$5)+(X175*$X$5)+(Y175*$Y$5)+(Z175*$Z$5)+(AA175*$AA$5) -> 35.59 | C175: =(K175*$K$6)+(L175*$L$6)+(M175*$M$6)+(N175*$N$6)+(O175*$O$6)+(P175*100*$P$6)+(Q175*100*$Q$6)+(R175*100*$R$6)+(S175*100*$S$6)+(T175*$T$6)+(U175*$U$6)+(V175*$V$6)+(W175*$W$6)+(X175*$X$6)+(Y175*$Y$6)+(Z175*$Z$6)+(AB175*$AA$6) -> 27.228999999999999 | D175: AB | E175: 4 | F175: Hon | G175: Horde AB Honored | H175: DP | I175: 58 | J175: P | K175: 159 | M175: 7 | O175: 34 | P175: 00.01
A176: Thick Qirajihide Belt | B176: =(K176*$K$5)+(L176*$L$5)+(M176*$M$5)+(N176*$N$5)+(O176*$O$5)+(P176*100*$P$5)+(Q176*100*$Q$5)+(R176*100*$R$5)+(S176*100*$S$5)+(T176*$T$5)+(U176*$U$5)+(V176*$V$5)+(W176*$W$5)+(X176*$X$5)+(Y176*$Y$5)+(Z176*$Z$5)+(AA176*$AA$5) -> 48.86 | C176: =(K176*$K$6)+(L176*$L$6)+(M176*$M$6)+(N176*$N$6)+(O176*$O$6)+(P176*100*$P$6)+(Q176*100*$Q$6)+(R176*100*$R$6)+(S176*100*$S$6)+(T176*$T$6)+(U176*$U$6)+(V176*$V$6)+(W176*$W$6)+(X176*$X$6)+(Y176*$Y$6)+(Z176*$Z$6)+(AB176*$AA$6) -> 22.396000000000001 | D176: AQ40 | E176: 5 | F176: 00.15 | G176: Battleguard Sartura | I176: 60 | J176: P | K176: 186 | L176: 17 | M176: 20 | N176: 10 | R176: 00.01
A177: Darkmantle Belt | B177: =(K177*$K$5)+(L177*$L$5)+(M177*$M$5)+(N177*$N$5)+(O177*$O$5)+(P177*100*$P$5)+(Q177*100*$Q$5)+(R177*100*$R$5)+(S177*100*$S$5)+(T177*$T$5)+(U177*$U$5)+(V177*$V$5)+(W177*$W$5)+(X177*$X$5)+(Y177*$Y$5)+(Z177*$Z$5)+(AA177*$AA$5) -> 36.02 | C177: =(K177*$K$6)+(L177*$L$6)+(M177*$M$6)+(N177*$N$6)+(O177*$O$6)+(P177*100*$P$6)+(Q177*100*$Q$6)+(R177*100*$R$6)+(S177*100*$S$6)+(T177*$T$6)+(U177*$U$6)+(V177*$V$6)+(W177*$W$6)+(X177*$X$6)+(Y177*$Y$6)+(Z177*$Z$6)+(AB177*$AA$6) -> 22.231999999999999 | D177: Q | E177: 5 | F177: Q | G177: SC Upgrade Quest | H177: DM | I177: 58 | J177: P | K177: 102 | L177: 17 | M177: 13 | N177: 10
A178: Belt of the Trickster | B178: =(K178*$K$5)+(L178*$L$5)+(M178*$M$5)+(N178*$N$5)+(O178*$O$5)+(P178*100*$P$5)+(Q178*100*$Q$5)+(R178*100*$R$5)+(S178*100*$S$5)+(T178*$T$5)+(U178*$U$5)+(V178*$V$5)+(W178*$W$5)+(X178*$X$5)+(Y178*$Y$5)+(Z178*$Z$5)+(AA178*$AA$5) -> 31.97 | C178: =(K178*$K$6)+(L178*$L$6)+(M178*$M$6)+(N178*$N$6)+(O178*$O$6)+(P178*100*$P$6)+(Q178*100*$Q$6)+(R178*100*$R$6)+(S178*100*$S$6)+(T178*$T$6)+(U178*$U$6)+(V178*$V$6)+(W178*$W$6)+(X178*$X$6)+(Y178*$Y$6)+(Z178*$Z$6)+(AB178*$AA$6) -> 22.187000000000001 | D178: LBRS | E178: 5 | F178: 00.2 | G178: Mor Grayhoof | I178: 56 | J178: P | K178: 97 | L178: 22 | M178: 9
A179: Cloudrunner Girdle | B179: =(K179*$K$5)+(L179*$L$5)+(M179*$M$5)+(N179*$N$5)+(O179*$O$5)+(P179*100*$P$5)+(Q179*100*$Q$5)+(R179*100*$R$5)+(S179*100*$S$5)+(T179*$T$5)+(U179*$U$5)+(V179*$V$5)+(W179*$W$5)+(X179*$X$5)+(Y179*$Y$5)+(Z179*$Z$5)+(AA179*$AA$5) -> 23.85 | C179: =(K179*$K$6)+(L179*$L$6)+(M179*$M$6)+(N179*$N$6)+(O179*$O$6)+(P179*100*$P$6)+(Q179*100*$Q$6)+(R179*100*$R$6)+(S179*100*$S$6)+(T179*$T$6)+(U179*$U$6)+(V179*$V$6)+(W179*$W$6)+(X179*$X$6)+(Y179*$Y$6)+(Z179*$Z$6)+(AB179*$AA$6) -> 22.184999999999999 | D179: LBRS | E179: 1 | F179: 59 | G179: Quartermaster Zigris | I179: 55 | J179: P | K179: 185 | L179: 15 | N179: 14
A180: Adventurer's Belt of the Tiger | B180: =(K180*$K$5)+(L180*$L$5)+(M180*$M$5)+(N180*$N$5)+(O180*$O$5)+(P180*100*$P$5)+(Q180*100*$Q$5)+(R180*100*$R$5)+(S180*100*$S$5)+(T180*$T$5)+(U180*$U$5)+(V180*$V$5)+(W180*$W$5)+(X180*$X$5)+(Y180*$Y$5)+(Z180*$Z$5)+(AA180*$AA$5) -> 21.89 | C180: =(K180*$K$6)+(L180*$L$6)+(M180*$M$6)+(N180*$N$6)+(O180*$O$6)+(P180*100*$P$6)+(Q180*100*$Q$6)+(R180*100*$R$6)+(S180*100*$S$6)+(T180*$T$6)+(U180*$U$6)+(V180*$V$6)+(W180*$W$6)+(X180*$X$6)+(Y180*$Y$6)+(Z180*$Z$6)+(AB180*$AA$6) -> 21.088999999999999 | D180: R | E180: 1 | F180: 59-61 | G180: Random World Drop | I180: 57 | J180: E | K180: 89 | L180: 14 | N180: 14
A181: Supreme Sash of the Tiger | B181: =(K181*$K$5)+(L181*$L$5)+(M181*$M$5)+(N181*$N$5)+(O181*$O$5)+(P181*100*$P$5)+(Q181*100*$Q$5)+(R181*100*$R$5)+(S181*100*$S$5)+(T181*$T$5)+(U181*$U$5)+(V181*$V$5)+(W181*$W$5)+(X181*$X$5)+(Y181*$Y$5)+(Z181*$Z$5)+(AA181*$AA$5) -> 21.88 | C181: =(K181*$K$6)+(L181*$L$6)+(M181*$M$6)+(N181*$N$6)+(O181*$O$6)+(P181*100*$P$6)+(Q181*100*$Q$6)+(R181*100*$R$6)+(S181*100*$S$6)+(T181*$T$6)+(U181*$U$6)+(V181*$V$6)+(W181*$W$6)+(X181*$X$6)+(Y181*$Y$6)+(Z181*$Z$6)+(AB181*$AA$6) -> 21.088000000000001 | D181: R | E181: 1 | F181: 58-61 | G181: Random World Drop | I181: 56 | J181: E | K181: 88 | L181: 14 | N181: 14
A182: Cadaverous Belt | B182: =(K182*$K$5)+(L182*$L$5)+(M182*$M$5)+(N182*$N$5)+(O182*$O$5)+(P182*100*$P$5)+(Q182*100*$Q$5)+(R182*100*$R$5)+(S182*100*$S$5)+(T182*$T$5)+(U182*$U$5)+(V182*$V$5)+(W182*$W$5)+(X182*$X$5)+(Y182*$Y$5)+(Z182*$Z$5)+(AA182*$AA$5) -> 32.97 | C182: =(K182*$K$6)+(L182*$L$6)+(M182*$M$6)+(N182*$N$6)+(O182*$O$6)+(P182*100*$P$6)+(Q182*100*$Q$6)+(R182*100*$R$6)+(S182*100*$S$6)+(T182*$T$6)+(U182*$U$6)+(V182*$V$6)+(W182*$W$6)+(X182*$X$6)+(Y182*$Y$6)+(Z182*$Z$6)+(AB182*$AA$6) -> 20.216999999999999 | D182: Sch | E182: 1 | F182: 00.04 | G182: Scholo Boss Drop | H182: Cad | I182: 56 | J182: P | K182: 97 | M182: 12 | O182: 40
A183: Shadow Panther Hide Belt | B183: =(K183*$K$5)+(L183*$L$5)+(M183*$M$5)+(N183*$N$5)+(O183*$O$5)+(P183*100*$P$5)+(Q183*100*$Q$5)+(R183*100*$R$5)+(S183*100*$S$5)+(T183*$T$5)+(U183*$U$5)+(V183*$V$5)+(W183*$W$5)+(X183*$X$5)+(Y183*$Y$5)+(Z183*$Z$5)+(AA183*$AA$5) -> 34.02 | C183: =(K183*$K$6)+(L183*$L$6)+(M183*$M$6)+(N183*$N$6)+(O183*$O$6)+(P183*100*$P$6)+(Q183*100*$Q$6)+(R183*100*$R$6)+(S183*100*$S$6)+(T183*$T$6)+(U183*$U$6)+(V183*$V$6)+(W183*$W$6)+(X183*$X$6)+(Y183*$Y$6)+(Z183*$Z$6)+(AB183*$AA$6) -> 20.212000000000003 | D183: ZG | E183: 4 | F183: R | G183: Random ZG Drop | I183: 60 | J183: E | K183: 102 | L183: 16 | M183: 10 | N183: 8 | S183: 00.01
A184: Highlander's Leather Girdle (48) | B184: =(K184*$K$5)+(L184*$L$5)+(M184*$M$5)+(N184*$N$5)+(O184*$O$5)+(P184*100*$P$5)+(Q184*100*$Q$5)+(R184*100*$R$5)+(S184*100*$S$5)+(T184*$T$5)+(U184*$U$5)+(V184*$V$5)+(W184*$W$5)+(X184*$X$5)+(Y184*$Y$5)+(Z184*$Z$5)+(AA184*$AA$5) -> 27.36 | C184: =(K184*$K$6)+(L184*$L$6)+(M184*$M$6)+(N184*$N$6)+(O184*$O$6)+(P184*100*$P$6)+(Q184*100*$Q$6)+(R184*100*$R$6)+(S184*100*$S$6)+(T184*$T$6)+(U184*$U$6)+(V184*$V$6)+(W184*$W$6)+(X184*$X$6)+(Y184*$Y$6)+(Z184*$Z$6)+(AB184*$AA$6) -> 20.195999999999998 | D184: AB | E184: 4 | F184: Hon | G184: Alliance AB Honored | I184: 48 | J184: P | K184: 136 | M184: 6 | O184: 20 | P184: 00.01
A185: Defiler's Leather Girdle (48) | B185: =(K185*$K$5)+(L185*$L$5)+(M185*$M$5)+(N185*$N$5)+(O185*$O$5)+(P185*100*$P$5)+(Q185*100*$Q$5)+(R185*100*$R$5)+(S185*100*$S$5)+(T185*$T$5)+(U185*$U$5)+(V185*$V$5)+(W185*$W$5)+(X185*$X$5)+(Y185*$Y$5)+(Z185*$Z$5)+(AA185*$AA$5) -> 27.36 | C185: =(K185*$K$6)+(L185*$L$6)+(M185*$M$6)+(N185*$N$6)+(O185*$O$6)+(P185*100*$P$6)+(Q185*100*$Q$6)+(R185*100*$R$6)+(S185*100*$S$6)+(T185*$T$6)+(U185*$U$6)+(V185*$V$6)+(W185*$W$6)+(X185*$X$6)+(Y185*$Y$6)+(Z185*$Z$6)+(AB185*$AA$6) -> 20.195999999999998 | D185: AB | E185: 4 | F185: Hon | G185: Horde AB Honored | I185: 48 | J185: P | K185: 136 | M185: 6 | O185: 20 | P185: 00.01
A186: Girdle of Beastial Fury | B186: =(K186*$K$5)+(L186*$L$5)+(M186*$M$5)+(N186*$N$5)+(O186*$O$5)+(P186*100*$P$5)+(Q186*100*$Q$5)+(R186*100*$R$5)+(S186*100*$S$5)+(T186*$T$5)+(U186*$U$5)+(V186*$V$5)+(W186*$W$5)+(X186*$X$5)+(Y186*$Y$5)+(Z186*$Z$5)+(AA186*$AA$5) -> 29.89 | C186: =(K186*$K$6)+(L186*$L$6)+(M186*$M$6)+(N186*$N$6)+(O186*$O$6)+(P186*100*$P$6)+(Q186*100*$Q$6)+(R186*100*$R$6)+(S186*100*$S$6)+(T186*$T$6)+(U186*$U$6)+(V186*$V$6)+(W186*$W$6)+(X186*$X$6)+(Y186*$Y$6)+(Z186*$Z$6)+(AB186*$AA$6) -> 19.189 | D186: BRD | E186: 1 | F186: 00.15 | G186: Eviscerator | I186: 50 | J186: P | K186: 89 | M186: 10 | N186: 8 | O186: 30
A187: Serpentine Sash | B187: =(K187*$K$5)+(L187*$L$5)+(M187*$M$5)+(N187*$N$5)+(O187*$O$5)+(P187*100*$P$5)+(Q187*100*$Q$5)+(R187*100*$R$5)+(S187*100*$S$5)+(T187*$T$5)+(U187*$U$5)+(V187*$V$5)+(W187*$W$5)+(X187*$X$5)+(Y187*$Y$5)+(Z187*$Z$5)+(AA187*$AA$5) -> 33.42 | C187: =(K187*$K$6)+(L187*$L$6)+(M187*$M$6)+(N187*$N$6)+(O187*$O$6)+(P187*100*$P$6)+(Q187*100*$Q$6)+(R187*100*$R$6)+(S187*100*$S$6)+(T187*$T$6)+(U187*$U$6)+(V187*$V$6)+(W187*$W$6)+(X187*$X$6)+(Y187*$Y$6)+(Z187*$Z$6)+(AB187*$AA$6) -> 18.731999999999999 | D187: R | E187: 1 | F187: 54-59 | G187: Random World Drop | I187: 52 | J187: E | K187: 92 | L187: 14 | M187: 14 | N187: 9
A188: Shadowcraft Belt | B188: =(K188*$K$5)+(L188*$L$5)+(M188*$M$5)+(N188*$N$5)+(O188*$O$5)+(P188*100*$P$5)+(Q188*100*$Q$5)+(R188*100*$R$5)+(S188*100*$S$5)+(T188*$T$5)+(U188*$U$5)+(V188*$V$5)+(W188*$W$5)+(X188*$X$5)+(Y188*$Y$5)+(Z188*$Z$5)+(AA188*$AA$5) -> 29.43 | C188: =(K188*$K$6)+(L188*$L$6)+(M188*$M$6)+(N188*$N$6)+(O188*$O$6)+(P188*100*$P$6)+(Q188*100*$Q$6)+(R188*100*$R$6)+(S188*100*$S$6)+(T188*$T$6)+(U188*$U$6)+(V188*$V$6)+(W188*$W$6)+(X188*$X$6)+(Y188*$Y$6)+(Z188*$Z$6)+(AB188*$AA$6) -> 18.692999999999998 | D188: LBRS | E188: 1 | F188: 57-61 | G188: BRS Random Drop | H188: SC | I188: 53 | J188: E | K188: 93 | L188: 14 | M188: 10 | N188: 9
A189: Frostbite Girdle | B189: =(K189*$K$5)+(L189*$L$5)+(M189*$M$5)+(N189*$N$5)+(O189*$O$5)+(P189*100*$P$5)+(Q189*100*$Q$5)+(R189*100*$R$5)+(S189*100*$S$5)+(T189*$T$5)+(U189*$U$5)+(V189*$V$5)+(W189*$W$5)+(X189*$X$5)+(Y189*$Y$5)+(Z189*$Z$5)+(AA189*$AA$5) -> 34.48 | C189: =(K189*$K$6)+(L189*$L$6)+(M189*$M$6)+(N189*$N$6)+(O189*$O$6)+(P189*100*$P$6)+(Q189*100*$Q$6)+(R189*100*$R$6)+(S189*100*$S$6)+(T189*$T$6)+(U189*$U$6)+(V189*$V$6)+(W189*$W$6)+(X189*$X$6)+(Y189*$Y$6)+(Z189*$Z$6)+(AB189*$AA$6) -> 17.848000000000003 | D189: Sch | E189: 1 | F189: 00.09 | G189: Ras Frostwhisper | I189: 57 | J189: P | K189: 98 | L189: 15 | M189: 15 | N189: 5 | W189: 10
A190: Abyssal Leather Belt of Striking | B190: =(K190*$K$5)+(L190*$L$5)+(M190*$M$5)+(N190*$N$5)+(O190*$O$5)+(P190*100*$P$5)+(Q190*100*$Q$5)+(R190*100*$R$5)+(S190*100*$S$5)+(T190*$T$5)+(U190*$U$5)+(V190*$V$5)+(W190*$W$5)+(X190*$X$5)+(Y190*$Y$5)+(Z190*$Z$5)+(AA190*$AA$5) -> 28.43 | C190: =(K190*$K$6)+(L190*$L$6)+(M190*$M$6)+(N190*$N$6)+(O190*$O$6)+(P190*100*$P$6)+(Q190*100*$Q$6)+(R190*100*$R$6)+(S190*100*$S$6)+(T190*$T$6)+(U190*$U$6)+(V190*$V$6)+(W190*$W$6)+(X190*$X$6)+(Y190*$Y$6)+(Z190*$Z$6)+(AB190*$AA$6) -> 16.702999999999999 | D190: Sil | E190: 4 | F190: 00.1 | G190: The Duke of Fathoms | I190: 60 | J190: E | K190: 93 | L190: 11 | M190: 11 | N190: 11
A191: Stormpike Leather Girdle | B191: =(K191*$K$5)+(L191*$L$5)+(M191*$M$5)+(N191*$N$5)+(O191*$O$5)+(P191*100*$P$5)+(Q191*100*$Q$5)+(R191*100*$R$5)+(S191*100*$S$5)+(T191*$T$5)+(U191*$U$5)+(V191*$V$5)+(W191*$W$5)+(X191*$X$5)+(Y191*$Y$5)+(Z191*$Z$5)+(AA191*$AA$5) -> 31.95 | C191: =(K191*$K$6)+(L191*$L$6)+(M191*$M$6)+(N191*$N$6)+(O191*$O$6)+(P191*100*$P$6)+(Q191*100*$Q$6)+(R191*100*$R$6)+(S191*100*$S$6)+(T191*$T$6)+(U191*$U$6)+(V191*$V$6)+(W191*$W$6)+(X191*$X$6)+(Y191*$Y$6)+(Z191*$Z$6)+(AB191*$AA$6) -> 15.795 | D191: AV | E191: 3 | F191: Hon | G191: Alliance AV Honored | I191: 55 | J191: P | K191: 95 | L191: 10 | M191: 15 | N191: 11 | W191: 5
A192: Frostwolf Leather Belt | B192: =(K192*$K$5)+(L192*$L$5)+(M192*$M$5)+(N192*$N$5)+(O192*$O$5)+(P192*100*$P$5)+(Q192*100*$Q$5)+(R192*100*$R$5)+(S192*100*$S$5)+(T192*$T$5)+(U192*$U$5)+(V192*$V$5)+(W192*$W$5)+(X192*$X$5)+(Y192*$Y$5)+(Z192*$Z$5)+(AA192*$AA$5) -> 31.95 | C192: =(K192*$K$6)+(L192*$L$6)+(M192*$M$6)+(N192*$N$6)+(O192*$O$6)+(P192*100*$P$6)+(Q192*100*$Q$6)+(R192*100*$R$6)+(S192*100*$S$6)+(T192*$T$6)+(U192*$U$6)+(V192*$V$6)+(W192*$W$6)+(X192*$X$6)+(Y192*$Y$6)+(Z192*$Z$6)+(AB192*$AA$6) -> 15.795 | D192: AV | E192: 3 | F192: Hon | G192: Horde AV Honored | I192: 55 | J192: P | K192: 95 | L192: 10 | M192: 15 | N192: 11 | W192: 5
A193: Highlander's Leather Girdle (38) | B193: =(K193*$K$5)+(L193*$L$5)+(M193*$M$5)+(N193*$N$5)+(O193*$O$5)+(P193*100*$P$5)+(Q193*100*$Q$5)+(R193*100*$R$5)+(S193*100*$S$5)+(T193*$T$5)+(U193*$U$5)+(V193*$V$5)+(W193*$W$5)+(X193*$X$5)+(Y193*$Y$5)+(Z193*$Z$5)+(AA193*$AA$5) -> 20.13 | C193: =(K193*$K$6)+(L193*$L$6)+(M193*$M$6)+(N193*$N$6)+(O193*$O$6)+(P193*100*$P$6)+(Q193*100*$Q$6)+(R193*100*$R$6)+(S193*100*$S$6)+(T193*$T$6)+(U193*$U$6)+(V193*$V$6)+(W193*$W$6)+(X193*$X$6)+(Y193*$Y$6)+(Z193*$Z$6)+(AB193*$AA$6) -> 15.153 | D193: AB | E193: 4 | F193: Hon | G193: Alliance AB Honored | I193: 38 | J193: P | K193: 113 | M193: 4 | O193: 30
A194: Defiler's Leather Girdle (38) | B194: =(K194*$K$5)+(L194*$L$5)+(M194*$M$5)+(N194*$N$5)+(O194*$O$5)+(P194*100*$P$5)+(Q194*100*$Q$5)+(R194*100*$R$5)+(S194*100*$S$5)+(T194*$T$5)+(U194*$U$5)+(V194*$V$5)+(W194*$W$5)+(X194*$X$5)+(Y194*$Y$5)+(Z194*$Z$5)+(AA194*$AA$5) -> 20.13 | C194: =(K194*$K$6)+(L194*$L$6)+(M194*$M$6)+(N194*$N$6)+(O194*$O$6)+(P194*100*$P$6)+(Q194*100*$Q$6)+(R194*100*$R$6)+(S194*100*$S$6)+(T194*$T$6)+(U194*$U$6)+(V194*$V$6)+(W194*$W$6)+(X194*$X$6)+(Y194*$Y$6)+(Z194*$Z$6)+(AB194*$AA$6) -> 15.153 | D194: AB | E194: 4 | F194: Hon | G194: Horde AB Honored | I194: 38 | J194: P | K194: 113 | M194: 4 | O194: 30
A195: Vosh'gajin's Strand | B195: =(K195*$K$5)+(L195*$L$5)+(M195*$M$5)+(N195*$N$5)+(O195*$O$5)+(P195*100*$P$5)+(Q195*100*$Q$5)+(R195*100*$R$5)+(S195*100*$S$5)+(T195*$T$5)+(U195*$U$5)+(V195*$V$5)+(W195*$W$5)+(X195*$X$5)+(Y195*$Y$5)+(Z195*$Z$5)+(AA195*$AA$5) -> 24.45 | C195: =(K195*$K$6)+(L195*$L$6)+(M195*$M$6)+(N195*$N$6)+(O195*$O$6)+(P195*100*$P$6)+(Q195*100*$Q$6)+(R195*100*$R$6)+(S195*100*$S$6)+(T195*$T$6)+(U195*$U$6)+(V195*$V$6)+(W195*$W$6)+(X195*$X$6)+(Y195*$Y$6)+(Z195*$Z$6)+(AB195*$AA$6) -> 14.664999999999999 | D195: BRD | E195: 1 | F195: Q | G195: Quest Series Reward | I195: 56 | J195: P | K195: 95 | M195: 6 | N195: 9 | P195: 00.01 | S195: 00.01
A196: Wicked Leather Belt | B196: =(K196*$K$5)+(L196*$L$5)+(M196*$M$5)+(N196*$N$5)+(O196*$O$5)+(P196*100*$P$5)+(Q196*100*$Q$5)+(R196*100*$R$5)+(S196*100*$S$5)+(T196*$T$5)+(U196*$U$5)+(V196*$V$5)+(W196*$W$5)+(X196*$X$5)+(Y196*$Y$5)+(Z196*$Z$5)+(AA196*$AA$5) -> 27.87 | C196: =(K196*$K$6)+(L196*$L$6)+(M196*$M$6)+(N196*$N$6)+(O196*$O$6)+(P196*100*$P$6)+(Q196*100*$Q$6)+(R196*100*$R$6)+(S196*100*$S$6)+(T196*$T$6)+(U196*$U$6)+(V196*$V$6)+(W196*$W$6)+(X196*$X$6)+(Y196*$Y$6)+(Z196*$Z$6)+(AB196*$AA$6) -> 14.217000000000001 | D196: LW | E196: 1 | F196: 300 | G196: Strath Recipe Drop | I196: 55 | J196: E | K196: 87 | L196: 14 | M196: 13
A197: Hyena Hide Belt | B197: =(K197*$K$5)+(L197*$L$5)+(M197*$M$5)+(N197*$N$5)+(O197*$O$5)+(P197*100*$P$5)+(Q197*100*$Q$5)+(R197*100*$R$5)+(S197*100*$S$5)+(T197*$T$5)+(U197*$U$5)+(V197*$V$5)+(W197*$W$5)+(X197*$X$5)+(Y197*$Y$5)+(Z197*$Z$5)+(AA197*$AA$5) -> 27.87 | C197: =(K197*$K$6)+(L197*$L$6)+(M197*$M$6)+(N197*$N$6)+(O197*$O$6)+(P197*100*$P$6)+(Q197*100*$Q$6)+(R197*100*$R$6)+(S197*100*$S$6)+(T197*$T$6)+(U197*$U$6)+(V197*$V$6)+(W197*$W$6)+(X197*$X$6)+(Y197*$Y$6)+(Z197*$Z$6)+(AB197*$AA$6) -> 14.217000000000001 | D197: DM-N | E197: 2 | F197: 00.1 | G197: Ogre Guards | I197: 55 | J197: P | K197: 87 | M197: 13 | O197: 28
A198: Pridelord Girdle | B198: =(K198*$K$5)+(L198*$L$5)+(M198*$M$5)+(N198*$N$5)+(O198*$O$5)+(P198*100*$P$5)+(Q198*100*$Q$5)+(R198*100*$R$5)+(S198*100*$S$5)+(T198*$T$5)+(U198*$U$5)+(V198*$V$5)+(W198*$W$5)+(X198*$X$5)+(Y198*$Y$5)+(Z198*$Z$5)+(AA198*$AA$5) -> 22.81 | C198: =(K198*$K$6)+(L198*$L$6)+(M198*$M$6)+(N198*$N$6)+(O198*$O$6)+(P198*100*$P$6)+(Q198*100*$Q$6)+(R198*100*$R$6)+(S198*100*$S$6)+(T198*$T$6)+(U198*$U$6)+(V198*$V$6)+(W198*$W$6)+(X198*$X$6)+(Y198*$Y$6)+(Z198*$Z$6)+(AB198*$AA$6) -> 14.161 | D198: R | E198: 1 | F198: 52-56 | G198: Random World Drop | I198: 50 | J198: E | K198: 81 | L198: 12 | M198: 8 | N198: 4
A199: Ogron's Sash | B199: =(K199*$K$5)+(L199*$L$5)+(M199*$M$5)+(N199*$N$5)+(O199*$O$5)+(P199*100*$P$5)+(Q199*100*$Q$5)+(R199*100*$R$5)+(S199*100*$S$5)+(T199*$T$5)+(U199*$U$5)+(V199*$V$5)+(W199*$W$5)+(X199*$X$5)+(Y199*$Y$5)+(Z199*$Z$5)+(AA199*$AA$5) -> 23.21 | C199: =(K199*$K$6)+(L199*$L$6)+(M199*$M$6)+(N199*$N$6)+(O199*$O$6)+(P199*100*$P$6)+(Q199*100*$Q$6)+(R199*100*$R$6)+(S199*100*$S$6)+(T199*$T$6)+(U199*$U$6)+(V199*$V$6)+(W199*$W$6)+(X199*$X$6)+(Y199*$Y$6)+(Z199*$Z$6)+(AB199*$AA$6) -> 13.661 | D199: R | E199: 1 | F199: 39-44 | G199: Random World Drop | I199: 37 | J199: E | K199: 71 | L199: 9 | M199: 9 | N199: 9
A201: LEGS | B201: AEP | C201: MAEP | D201: Loc | E201: P | F201: Info | G201: Source | H201: Set | I201: Lvl | J201: B | K201: Arm | L201: Agi | M201: Sta | N201: Str | O201: AP | P201: Cri | Q201: Hit | R201: Par | S201: Dod | T201: Def | U201: Ar | V201: Fi | W201: Fr | X201: Na | Y201: Sh | Z201: H/5 | AA201: PVP | AB201: PVE | AC201: Special
A202: Bonescythe Legplates | B202: =(K202*$K$5)+(L202*$L$5)+(M202*$M$5)+(N202*$N$5)+(O202*$O$5)+(P202*100*$P$5)+(Q202*100*$Q$5)+(R202*100*$R$5)+(S202*100*$S$5)+(T202*$T$5)+(U202*$U$5)+(V202*$V$5)+(W202*$W$5)+(X202*$X$5)+(Y202*$Y$5)+(Z202*$Z$5)+(AA202*$AA$5) -> 92.21 | C202: =(K202*$K$6)+(L202*$L$6)+(M202*$M$6)+(N202*$N$6)+(O202*$O$6)+(P202*100*$P$6)+(Q202*100*$Q$6)+(R202*100*$R$6)+(S202*100*$S$6)+(T202*$T$6)+(U202*$U$6)+(V202*$V$6)+(W202*$W$6)+(X202*$X$6)+(Y202*$Y$6)+(Z202*$Z$6)+(AB202*$AA$6) -> 65.471000000000004 | D202: Naxx | E202: 6 | F202: Q | G202: Loatheb | H202: BS | I202: 60 | J202: P | K202: 221 | L202: 32 | M202: 25 | N202: 31 | P202: 00.01 | Q202: 00.01
A203: Leggings of Apocalypse | B203: =(K203*$K$5)+(L203*$L$5)+(M203*$M$5)+(N203*$N$5)+(O203*$O$5)+(P203*100*$P$5)+(Q203*100*$Q$5)+(R203*100*$R$5)+(S203*100*$S$5)+(T203*$T$5)+(U203*$U$5)+(V203*$V$5)+(W203*$W$5)+(X203*$X$5)+(Y203*$Y$5)+(Z203*$Z$5)+(AA203*$AA$5) -> 83.61 | C203: =(K203*$K$6)+(L203*$L$6)+(M203*$M$6)+(N203*$N$6)+(O203*$O$6)+(P203*100*$P$6)+(Q203*100*$Q$6)+(R203*100*$R$6)+(S203*100*$S$6)+(T203*$T$6)+(U203*$U$6)+(V203*$V$6)+(W203*$W$6)+(X203*$X$6)+(Y203*$Y$6)+(Z203*$Z$6)+(AB203*$AA$6) -> 58.941000000000003 | D203: Naxx | E203: 6 | F203: 00.17 | G203: The Four Horsemen | I203: 60 | J203: P | K203: 211 | L203: 31 | M203: 23 | N203: 15 | P203: 00.02
A204: Deathdealer's Leggings | B204: =(K204*$K$5)+(L204*$L$5)+(M204*$M$5)+(N204*$N$5)+(O204*$O$5)+(P204*100*$P$5)+(Q204*100*$Q$5)+(R204*100*$R$5)+(S204*100*$S$5)+(T204*$T$5)+(U204*$U$5)+(V204*$V$5)+(W204*$W$5)+(X204*$X$5)+(Y204*$Y$5)+(Z204*$Z$5)+(AA204*$AA$5) -> 84.07 | C204: =(K204*$K$6)+(L204*$L$6)+(M204*$M$6)+(N204*$N$6)+(O204*$O$6)+(P204*100*$P$6)+(Q204*100*$Q$6)+(R204*100*$R$6)+(S204*100*$S$6)+(T204*$T$6)+(U204*$U$6)+(V204*$V$6)+(W204*$W$6)+(X204*$X$6)+(Y204*$Y$6)+(Z204*$Z$6)+(AB204*$AA$6) -> 57.457000000000001 | D204: AQ40 | E204: 5 | F204: Q | G204: Ouro | H204: DE | I204: 60 | J204: P | K204: 207 | L204: 38 | M204: 25 | N204: 18 | P204: 00.01
A205: Bloodfang Pants | B205: =(K205*$K$5)+(L205*$L$5)+(M205*$M$5)+(N205*$N$5)+(O205*$O$5)+(P205*100*$P$5)+(Q205*100*$Q$5)+(R205*100*$R$5)+(S205*100*$S$5)+(T205*$T$5)+(U205*$U$5)+(V205*$V$5)+(W205*$W$5)+(X205*$X$5)+(Y205*$Y$5)+(Z205*$Z$5)+(AA205*$AA$5) -> 73.47 | C205: =(K205*$K$6)+(L205*$L$6)+(M205*$M$6)+(N205*$N$6)+(O205*$O$6)+(P205*100*$P$6)+(Q205*100*$Q$6)+(R205*100*$R$6)+(S205*100*$S$6)+(T205*$T$6)+(U205*$U$6)+(V205*$V$6)+(W205*$W$6)+(X205*$X$6)+(Y205*$Y$6)+(Z205*$Z$6)+(AB205*$AA$6) -> 53.067000000000007 | D205: MC | E205: 1 | F205: 00.14 | G205: Ragnaros | H205: BF | I205: 60 | J205: P | K205: 197 | L205: 37 | M205: 17 | N205: 11 | P205: 00.01 | U205: 10 | V205: 10
A206: Marshal's Leather Leggings | B206: =(K206*$K$5)+(L206*$L$5)+(M206*$M$5)+(N206*$N$5)+(O206*$O$5)+(P206*100*$P$5)+(Q206*100*$Q$5)+(R206*100*$R$5)+(S206*100*$S$5)+(T206*$T$5)+(U206*$U$5)+(V206*$V$5)+(W206*$W$5)+(X206*$X$5)+(Y206*$Y$5)+(Z206*$Z$5)+(AA206*$AA$5) -> 81.36 | C206: =(K206*$K$6)+(L206*$L$6)+(M206*$M$6)+(N206*$N$6)+(O206*$O$6)+(P206*100*$P$6)+(Q206*100*$Q$6)+(R206*100*$R$6)+(S206*100*$S$6)+(T206*$T$6)+(U206*$U$6)+(V206*$V$6)+(W206*$W$6)+(X206*$X$6)+(Y206*$Y$6)+(Z206*$Z$6)+(AB206*$AA$6) -> 52.506 | D206: PVP | E206: 2 | F206: FM | G206: Alliance Rank 12 PVP | H206: FM | I206: 60 | J206: P | K206: 236 | L206: 27 | M206: 27 | P206: 00.01 | Q206: 00.02
A207: General's Leather Legguards | B207: =(K207*$K$5)+(L207*$L$5)+(M207*$M$5)+(N207*$N$5)+(O207*$O$5)+(P207*100*$P$5)+(Q207*100*$Q$5)+(R207*100*$R$5)+(S207*100*$S$5)+(T207*$T$5)+(U207*$U$5)+(V207*$V$5)+(W207*$W$5)+(X207*$X$5)+(Y207*$Y$5)+(Z207*$Z$5)+(AA207*$AA$5) -> 81.36 | C207: =(K207*$K$6)+(L207*$L$6)+(M207*$M$6)+(N207*$N$6)+(O207*$O$6)+(P207*100*$P$6)+(Q207*100*$Q$6)+(R207*100*$R$6)+(S207*100*$S$6)+(T207*$T$6)+(U207*$U$6)+(V207*$V$6)+(W207*$W$6)+(X207*$X$6)+(Y207*$Y$6)+(Z207*$Z$6)+(AB207*$AA$6) -> 52.506 | D207: PVP | E207: 2 | F207: WL | G207: Horde Rank 12 PVP | H207: WL | I207: 60 | J207: P | K207: 236 | L207: 27 | M207: 27 | P207: 00.01 | Q207: 00.02
A208: Nightslayer Pants | B208: =(K208*$K$5)+(L208*$L$5)+(M208*$M$5)+(N208*$N$5)+(O208*$O$5)+(P208*100*$P$5)+(Q208*100*$Q$5)+(R208*100*$R$5)+(S208*100*$S$5)+(T208*$T$5)+(U208*$U$5)+(V208*$V$5)+(W208*$W$5)+(X208*$X$5)+(Y208*$Y$5)+(Z208*$Z$5)+(AA208*$AA$5) -> 65.75 | C208: =(K208*$K$6)+(L208*$L$6)+(M208*$M$6)+(N208*$N$6)+(O208*$O$6)+(P208*100*$P$6)+(Q208*100*$Q$6)+(R208*100*$R$6)+(S208*100*$S$6)+(T208*$T$6)+(U208*$U$6)+(V208*$V$6)+(W208*$W$6)+(X208*$X$6)+(Y208*$Y$6)+(Z208*$Z$6)+(AB208*$AA$6) -> 48.424999999999997 | D208: MC | E208: 1 | F208: 00.21 | G208: Magmadar | H208: NS | I208: 60 | J208: P | K208: 175 | L208: 33 | M208: 15 | N208: 10 | P208: 00.01 | Y208: 10
A209: Dark Heart Pants | B209: =(K209*$K$5)+(L209*$L$5)+(M209*$M$5)+(N209*$N$5)+(O209*$O$5)+(P209*100*$P$5)+(Q209*100*$Q$5)+(R209*100*$R$5)+(S209*100*$S$5)+(T209*$T$5)+(U209*$U$5)+(V209*$V$5)+(W209*$W$5)+(X209*$X$5)+(Y209*$Y$5)+(Z209*$Z$5)+(AA209*$AA$5) -> 66.96 | C209: =(K209*$K$6)+(L209*$L$6)+(M209*$M$6)+(N209*$N$6)+(O209*$O$6)+(P209*100*$P$6)+(Q209*100*$Q$6)+(R209*100*$R$6)+(S209*100*$S$6)+(T209*$T$6)+(U209*$U$6)+(V209*$V$6)+(W209*$W$6)+(X209*$X$6)+(Y209*$Y$6)+(Z209*$Z$6)+(AB209*$AA$6) -> 44.495999999999995 | D209: 4D | E209: 4 | F209: 00.14 | G209: Lethon | I209: 60 | J209: P | K209: 296 | M209: 20 | O209: 48 | P209: 00.02
A210: Sentinel's Leather Pants | B210: =(K210*$K$5)+(L210*$L$5)+(M210*$M$5)+(N210*$N$5)+(O210*$O$5)+(P210*100*$P$5)+(Q210*100*$Q$5)+(R210*100*$R$5)+(S210*100*$S$5)+(T210*$T$5)+(U210*$U$5)+(V210*$V$5)+(W210*$W$5)+(X210*$X$5)+(Y210*$Y$5)+(Z210*$Z$5)+(AA210*$AA$5) -> 67.33 | C210: =(K210*$K$6)+(L210*$L$6)+(M210*$M$6)+(N210*$N$6)+(O210*$O$6)+(P210*100*$P$6)+(Q210*100*$Q$6)+(R210*100*$R$6)+(S210*100*$S$6)+(T210*$T$6)+(U210*$U$6)+(V210*$V$6)+(W210*$W$6)+(X210*$X$6)+(Y210*$Y$6)+(Z210*$Z$6)+(AB210*$AA$6) -> 38.503 | D210: WSG | E210: 3 | F210: Exa | G210: Exalted WSG | I210: 60 | J210: P | K210: 233 | L210: 28 | M210: 27 | P210: 00.01
A211: Outrider's Leather Pants | B211: =(K211*$K$5)+(L211*$L$5)+(M211*$M$5)+(N211*$N$5)+(O211*$O$5)+(P211*100*$P$5)+(Q211*100*$Q$5)+(R211*100*$R$5)+(S211*100*$S$5)+(T211*$T$5)+(U211*$U$5)+(V211*$V$5)+(W211*$W$5)+(X211*$X$5)+(Y211*$Y$5)+(Z211*$Z$5)+(AA211*$AA$5) -> 67.33 | C211: =(K211*$K$6)+(L211*$L$6)+(M211*$M$6)+(N211*$N$6)+(O211*$O$6)+(P211*100*$P$6)+(Q211*100*$Q$6)+(R211*100*$R$6)+(S211*100*$S$6)+(T211*$T$6)+(U211*$U$6)+(V211*$V$6)+(W211*$W$6)+(X211*$X$6)+(Y211*$Y$6)+(Z211*$Z$6)+(AB211*$AA$6) -> 38.503 | D211: WSG | E211: 3 | F211: Exa | G211: Quest Reward | I211: 60 | J211: P | K211: 233 | L211: 28 | M211: 27 | P211: 00.01
A212: Plaguehound Leggings | B212: =(K212*$K$5)+(L212*$L$5)+(M212*$M$5)+(N212*$N$5)+(O212*$O$5)+(P212*100*$P$5)+(Q212*100*$Q$5)+(R212*100*$R$5)+(S212*100*$S$5)+(T212*$T$5)+(U212*$U$5)+(V212*$V$5)+(W212*$W$5)+(X212*$X$5)+(Y212*$Y$5)+(Z212*$Z$5)+(AA212*$AA$5) -> 45.02 | C212: =(K212*$K$6)+(L212*$L$6)+(M212*$M$6)+(N212*$N$6)+(O212*$O$6)+(P212*100*$P$6)+(Q212*100*$Q$6)+(R212*100*$R$6)+(S212*100*$S$6)+(T212*$T$6)+(U212*$U$6)+(V212*$V$6)+(W212*$W$6)+(X212*$X$6)+(Y212*$Y$6)+(Z212*$Z$6)+(AB212*$AA$6) -> 37.712000000000003 | D212: Str | E212: 1 | F212: 59-61 | G212: Random Strath Drop | I212: 57 | J212: P | K212: 152 | L212: 30 | M212: 6 | Q212: 00.01
A213: Blooddrenched Leggings | B213: =(K213*$K$5)+(L213*$L$5)+(M213*$M$5)+(N213*$N$5)+(O213*$O$5)+(P213*100*$P$5)+(Q213*100*$Q$5)+(R213*100*$R$5)+(S213*100*$S$5)+(T213*$T$5)+(U213*$U$5)+(V213*$V$5)+(W213*$W$5)+(X213*$X$5)+(Y213*$Y$5)+(Z213*$Z$5)+(AA213*$AA$5) -> 51.7 | C213: =(K213*$K$6)+(L213*$L$6)+(M213*$M$6)+(N213*$N$6)+(O213*$O$6)+(P213*100*$P$6)+(Q213*100*$Q$6)+(R213*100*$R$6)+(S213*100*$S$6)+(T213*$T$6)+(U213*$U$6)+(V213*$V$6)+(W213*$W$6)+(X213*$X$6)+(Y213*$Y$6)+(Z213*$Z$6)+(AB213*$AA$6) -> 35.32 | D213: ZG | E213: 4 | F213: 00.13 | G213: Jin'do the Hexxer | I213: 60 | J213: P | K213: 170 | L213: 35 | M213: 15
A214: Knight-Capt. Leather Legs (60) | B214: =(K214*$K$5)+(L214*$L$5)+(M214*$M$5)+(N214*$N$5)+(O214*$O$5)+(P214*100*$P$5)+(Q214*100*$Q$5)+(R214*100*$R$5)+(S214*100*$S$5)+(T214*$T$5)+(U214*$U$5)+(V214*$V$5)+(W214*$W$5)+(X214*$X$5)+(Y214*$Y$5)+(Z214*$Z$5)+(AA214*$AA$5) -> 58.75 | C214: =(K214*$K$6)+(L214*$L$6)+(M214*$M$6)+(N214*$N$6)+(O214*$O$6)+(P214*100*$P$6)+(Q214*100*$Q$6)+(R214*100*$R$6)+(S214*100*$S$6)+(T214*$T$6)+(U214*$U$6)+(V214*$V$6)+(W214*$W$6)+(X214*$X$6)+(Y214*$Y$6)+(Z214*$Z$6)+(AB214*$AA$6) -> 34.945 | D214: PVP | E214: 2 | F214: K-C | G214: Alliance Rank 8 PVP | H214: LCG | I214: 60 | J214: P | K214: 225 | M214: 22 | O214: 34 | P214: 00.01 | Q214: 00.01
A215: Legionnaire's Leather Legguards | B215: =(K215*$K$5)+(L215*$L$5)+(M215*$M$5)+(N215*$N$5)+(O215*$O$5)+(P215*100*$P$5)+(Q215*100*$Q$5)+(R215*100*$R$5)+(S215*100*$S$5)+(T215*$T$5)+(U215*$U$5)+(V215*$V$5)+(W215*$W$5)+(X215*$X$5)+(Y215*$Y$5)+(Z215*$Z$5)+(AA215*$AA$5) -> 58.75 | C215: =(K215*$K$6)+(L215*$L$6)+(M215*$M$6)+(N215*$N$6)+(O215*$O$6)+(P215*100*$P$6)+(Q215*100*$Q$6)+(R215*100*$R$6)+(S215*100*$S$6)+(T215*$T$6)+(U215*$U$6)+(V215*$V$6)+(W215*$W$6)+(X215*$X$6)+(Y215*$Y$6)+(Z215*$Z$6)+(AB215*$AA$6) -> 34.945 | D215: PVP | E215: 2 | F215: K-C | G215: Horde Rank 8 PVP | H215: CV | I215: 60 | J215: P | K215: 225 | M215: 22 | O215: 34 | P215: 00.01 | Q215: 00.01
A216: Devilsaur Leggings | B216: =(K216*$K$5)+(L216*$L$5)+(M216*$M$5)+(N216*$N$5)+(O216*$O$5)+(P216*100*$P$5)+(Q216*100*$Q$5)+(R216*100*$R$5)+(S216*100*$S$5)+(T216*$T$5)+(U216*$U$5)+(V216*$V$5)+(W216*$W$5)+(X216*$X$5)+(Y216*$Y$5)+(Z216*$Z$5)+(AA216*$AA$5) -> 46.48 | C216: =(K216*$K$6)+(L216*$L$6)+(M216*$M$6)+(N216*$N$6)+(O216*$O$6)+(P216*100*$P$6)+(Q216*100*$Q$6)+(R216*100*$R$6)+(S216*100*$S$6)+(T216*$T$6)+(U216*$U$6)+(V216*$V$6)+(W216*$W$6)+(X216*$X$6)+(Y216*$Y$6)+(Z216*$Z$6)+(AB216*$AA$6) -> 33.268000000000001 | D216: LW | E216: 1 | F216: 300 | G216: Un"Goro Recipe Drop | H216: Dev | I216: 55 | J216: E | K216: 148 | M216: 12 | O216: 46 | P216: 00.01
A217: Darkmantle Pants | B217: =(K217*$K$5)+(L217*$L$5)+(M217*$M$5)+(N217*$N$5)+(O217*$O$5)+(P217*100*$P$5)+(Q217*100*$Q$5)+(R217*100*$R$5)+(S217*100*$S$5)+(T217*$T$5)+(U217*$U$5)+(V217*$V$5)+(W217*$W$5)+(X217*$X$5)+(Y217*$Y$5)+(Z217*$Z$5)+(AA217*$AA$5) -> 49.1 | C217: =(K217*$K$6)+(L217*$L$6)+(M217*$M$6)+(N217*$N$6)+(O217*$O$6)+(P217*100*$P$6)+(Q217*100*$Q$6)+(R217*100*$R$6)+(S217*100*$S$6)+(T217*$T$6)+(U217*$U$6)+(V217*$V$6)+(W217*$W$6)+(X217*$X$6)+(Y217*$Y$6)+(Z217*$Z$6)+(AB217*$AA$6) -> 32.81 | D217: Q | E217: 5 | F217: Q | G217: SC Upgrade Quest | H217: DM | I217: 58 | J217: P | K217: 160 | L217: 25 | M217: 15 | N217: 15
A218: Abyssal Leather Leg. of Striking | B218: =(K218*$K$5)+(L218*$L$5)+(M218*$M$5)+(N218*$N$5)+(O218*$O$5)+(P218*100*$P$5)+(Q218*100*$Q$5)+(R218*100*$R$5)+(S218*100*$S$5)+(T218*$T$5)+(U218*$U$5)+(V218*$V$5)+(W218*$W$5)+(X218*$X$5)+(Y218*$Y$5)+(Z218*$Z$5)+(AA218*$AA$5) -> 49.02 | C218: =(K218*$K$6)+(L218*$L$6)+(M218*$M$6)+(N218*$N$6)+(O218*$O$6)+(P218*100*$P$6)+(Q218*100*$Q$6)+(R218*100*$R$6)+(S218*100*$S$6)+(T218*$T$6)+(U218*$U$6)+(V218*$V$6)+(W218*$W$6)+(X218*$X$6)+(Y218*$Y$6)+(Z218*$Z$6)+(AB218*$AA$6) -> 32.802 | D218: Sil | E218: 4 | F218: 00.43 | G218: Duke of Cynders | I218: 57 | J218: E | K218: 152 | L218: 15 | M218: 15 | N218: 15 | P218: 00.01
A219: Shadowcraft Pants | B219: =(K219*$K$5)+(L219*$L$5)+(M219*$M$5)+(N219*$N$5)+(O219*$O$5)+(P219*100*$P$5)+(Q219*100*$Q$5)+(R219*100*$R$5)+(S219*100*$S$5)+(T219*$T$5)+(U219*$U$5)+(V219*$V$5)+(W219*$W$5)+(X219*$X$5)+(Y219*$Y$5)+(Z219*$Z$5)+(AA219*$AA$5) -> 44.5 | C219: =(K219*$K$6)+(L219*$L$6)+(M219*$M$6)+(N219*$N$6)+(O219*$O$6)+(P219*100*$P$6)+(Q219*100*$Q$6)+(R219*100*$R$6)+(S219*100*$S$6)+(T219*$T$6)+(U219*$U$6)+(V219*$V$6)+(W219*$W$6)+(X219*$X$6)+(Y219*$Y$6)+(Z219*$Z$6)+(AB219*$AA$6) -> 31.27 | D219: Str | E219: 1 | F219: 00.08 | G219: Baron Rivendare | H219: SC | I219: 56 | J219: P | K219: 150 | L219: 25 | M219: 12 | N219: 12
A220: Adv. Legguards of the Tiger | B220: =(K220*$K$5)+(L220*$L$5)+(M220*$M$5)+(N220*$N$5)+(O220*$O$5)+(P220*100*$P$5)+(Q220*100*$Q$5)+(R220*100*$R$5)+(S220*100*$S$5)+(T220*$T$5)+(U220*$U$5)+(V220*$V$5)+(W220*$W$5)+(X220*$X$5)+(Y220*$Y$5)+(Z220*$Z$5)+(AA220*$AA$5) -> 29.92 | C220: =(K220*$K$6)+(L220*$L$6)+(M220*$M$6)+(N220*$N$6)+(O220*$O$6)+(P220*100*$P$6)+(Q220*100*$Q$6)+(R220*100*$R$6)+(S220*100*$S$6)+(T220*$T$6)+(U220*$U$6)+(V220*$V$6)+(W220*$W$6)+(X220*$X$6)+(Y220*$Y$6)+(Z220*$Z$6)+(AB220*$AA$6) -> 28.641999999999999 | D220: R | E220: 1 | F220: 61-62 | G220: Random World Drop | I220: 59 | J220: E | K220: 142 | L220: 19 | N220: 19
A221: Mighty Leggings of the Tiger | B221: =(K221*$K$5)+(L221*$L$5)+(M221*$M$5)+(N221*$N$5)+(O221*$O$5)+(P221*100*$P$5)+(Q221*100*$Q$5)+(R221*100*$R$5)+(S221*100*$S$5)+(T221*$T$5)+(U221*$U$5)+(V221*$V$5)+(W221*$W$5)+(X221*$X$5)+(Y221*$Y$5)+(Z221*$Z$5)+(AA221*$AA$5) -> 28.4 | C221: =(K221*$K$6)+(L221*$L$6)+(M221*$M$6)+(N221*$N$6)+(O221*$O$6)+(P221*100*$P$6)+(Q221*100*$Q$6)+(R221*100*$R$6)+(S221*100*$S$6)+(T221*$T$6)+(U221*$U$6)+(V221*$V$6)+(W221*$W$6)+(X221*$X$6)+(Y221*$Y$6)+(Z221*$Z$6)+(AB221*$AA$6) -> 27.14 | D221: R | E221: 1 | F221: 60-61 | G221: Random World Drop | I221: 58 | J221: E | K221: 140 | L221: 18 | N221: 18
A222: Supreme Leggings of the Tiger | B222: =(K222*$K$5)+(L222*$L$5)+(M222*$M$5)+(N222*$N$5)+(O222*$O$5)+(P222*100*$P$5)+(Q222*100*$Q$5)+(R222*100*$R$5)+(S222*100*$S$5)+(T222*$T$5)+(U222*$U$5)+(V222*$V$5)+(W222*$W$5)+(X222*$X$5)+(Y222*$Y$5)+(Z222*$Z$5)+(AA222*$AA$5) -> 28.4 | C222: =(K222*$K$6)+(L222*$L$6)+(M222*$M$6)+(N222*$N$6)+(O222*$O$6)+(P222*100*$P$6)+(Q222*100*$Q$6)+(R222*100*$R$6)+(S222*100*$S$6)+(T222*$T$6)+(U222*$U$6)+(V222*$V$6)+(W222*$W$6)+(X222*$X$6)+(Y222*$Y$6)+(Z222*$Z$6)+(AB222*$AA$6) -> 27.14 | D222: R | E222: 1 | F222: 55-63 | G222: Random World Drop | I222: 58 | J222: E | K222: 140 | L222: 18 | N222: 18
A223: Nightsh. Leggings of the Tiger | B223: =(K223*$K$5)+(L223*$L$5)+(M223*$M$5)+(N223*$N$5)+(O223*$O$5)+(P223*100*$P$5)+(Q223*100*$Q$5)+(R223*100*$R$5)+(S223*100*$S$5)+(T223*$T$5)+(U223*$U$5)+(V223*$V$5)+(W223*$W$5)+(X223*$X$5)+(Y223*$Y$5)+(Z223*$Z$5)+(AA223*$AA$5) -> 28.38 | C223: =(K223*$K$6)+(L223*$L$6)+(M223*$M$6)+(N223*$N$6)+(O223*$O$6)+(P223*100*$P$6)+(Q223*100*$Q$6)+(R223*100*$R$6)+(S223*100*$S$6)+(T223*$T$6)+(U223*$U$6)+(V223*$V$6)+(W223*$W$6)+(X223*$X$6)+(Y223*$Y$6)+(Z223*$Z$6)+(AB223*$AA$6) -> 27.138000000000002 | D223: R | E223: 1 | F223: 59-62 | G223: Random World Drop | I223: 57 | J223: E | K223: 138 | L223: 18 | N223: 18
A224: Grand Legguards of the Tiger | B224: =(K224*$K$5)+(L224*$L$5)+(M224*$M$5)+(N224*$N$5)+(O224*$O$5)+(P224*100*$P$5)+(Q224*100*$Q$5)+(R224*100*$R$5)+(S224*100*$S$5)+(T224*$T$5)+(U224*$U$5)+(V224*$V$5)+(W224*$W$5)+(X224*$X$5)+(Y224*$Y$5)+(Z224*$Z$5)+(AA224*$AA$5) -> 28.36 | C224: =(K224*$K$6)+(L224*$L$6)+(M224*$M$6)+(N224*$N$6)+(O224*$O$6)+(P224*100*$P$6)+(Q224*100*$Q$6)+(R224*100*$R$6)+(S224*100*$S$6)+(T224*$T$6)+(U224*$U$6)+(V224*$V$6)+(W224*$W$6)+(X224*$X$6)+(Y224*$Y$6)+(Z224*$Z$6)+(AB224*$AA$6) -> 27.135999999999999 | D224: R | E224: 1 | F224: 58-59 | G224: Random World Drop | I224: 56 | J224: E | K224: 136 | L224: 18 | N224: 18
A225: Cadaverous Leggings | B225: =(K225*$K$5)+(L225*$L$5)+(M225*$M$5)+(N225*$N$5)+(O225*$O$5)+(P225*100*$P$5)+(Q225*100*$Q$5)+(R225*100*$R$5)+(S225*100*$S$5)+(T225*$T$5)+(U225*$U$5)+(V225*$V$5)+(W225*$W$5)+(X225*$X$5)+(Y225*$Y$5)+(Z225*$Z$5)+(AA225*$AA$5) -> 45.5 | C225: =(K225*$K$6)+(L225*$L$6)+(M225*$M$6)+(N225*$N$6)+(O225*$O$6)+(P225*100*$P$6)+(Q225*100*$Q$6)+(R225*100*$R$6)+(S225*100*$S$6)+(T225*$T$6)+(U225*$U$6)+(V225*$V$6)+(W225*$W$6)+(X225*$X$6)+(Y225*$Y$6)+(Z225*$Z$6)+(AB225*$AA$6) -> 26.33 | D225: Sch | E225: 1 | F225: 00.04 | G225: Scholo Boss Drop | H225: Cad | I225: 56 | J225: P | K225: 150 | M225: 18 | O225: 52
A226: Pridelord Pants | B226: =(K226*$K$5)+(L226*$L$5)+(M226*$M$5)+(N226*$N$5)+(O226*$O$5)+(P226*100*$P$5)+(Q226*100*$Q$5)+(R226*100*$R$5)+(S226*100*$S$5)+(T226*$T$5)+(U226*$U$5)+(V226*$V$5)+(W226*$W$5)+(X226*$X$5)+(Y226*$Y$5)+(Z226*$Z$5)+(AA226*$AA$5) -> 29.81 | C226: =(K226*$K$6)+(L226*$L$6)+(M226*$M$6)+(N226*$N$6)+(O226*$O$6)+(P226*100*$P$6)+(Q226*100*$Q$6)+(R226*100*$R$6)+(S226*100*$S$6)+(T226*$T$6)+(U226*$U$6)+(V226*$V$6)+(W226*$W$6)+(X226*$X$6)+(Y226*$Y$6)+(Z226*$Z$6)+(AB226*$AA$6) -> 24.670999999999999 | D226: R | E226: 1 | F226: 55-59 | G226: Random World Drop | I226: 53 | J226: E | K226: 131 | L226: 23 | M226: 4 | N226: 3
A227: Knight-Capt. Leather Legs (58) | B227: =(K227*$K$5)+(L227*$L$5)+(M227*$M$5)+(N227*$N$5)+(O227*$O$5)+(P227*100*$P$5)+(Q227*100*$Q$5)+(R227*100*$R$5)+(S227*100*$S$5)+(T227*$T$5)+(U227*$U$5)+(V227*$V$5)+(W227*$W$5)+(X227*$X$5)+(Y227*$Y$5)+(Z227*$Z$5)+(AA227*$AA$5) -> 38.04 | C227: =(K227*$K$6)+(L227*$L$6)+(M227*$M$6)+(N227*$N$6)+(O227*$O$6)+(P227*100*$P$6)+(Q227*100*$Q$6)+(R227*100*$R$6)+(S227*100*$S$6)+(T227*$T$6)+(U227*$U$6)+(V227*$V$6)+(W227*$W$6)+(X227*$X$6)+(Y227*$Y$6)+(Z227*$Z$6)+(AB227*$AA$6) -> 23.783999999999999 | D227: PVP | E227: 2 | F227: K-C | G227: Alliance Rank 8 PVP | H227: LCV | I227: 58 | J227: P | K227: 154 | M227: 13 | N227: 7 | P227: 00.02
A228: Legionnaire's Leather Leggings | B228: =(K228*$K$5)+(L228*$L$5)+(M228*$M$5)+(N228*$N$5)+(O228*$O$5)+(P228*100*$P$5)+(Q228*100*$Q$5)+(R228*100*$R$5)+(S228*100*$S$5)+(T228*$T$5)+(U228*$U$5)+(V228*$V$5)+(W228*$W$5)+(X228*$X$5)+(Y228*$Y$5)+(Z228*$Z$5)+(AA228*$AA$5) -> 38.04 | C228: =(K228*$K$6)+(L228*$L$6)+(M228*$M$6)+(N228*$N$6)+(O228*$O$6)+(P228*100*$P$6)+(Q228*100*$Q$6)+(R228*100*$R$6)+(S228*100*$S$6)+(T228*$T$6)+(U228*$U$6)+(V228*$V$6)+(W228*$W$6)+(X228*$X$6)+(Y228*$Y$6)+(Z228*$Z$6)+(AB228*$AA$6) -> 23.783999999999999 | D228: PVP | E228: 2 | F228: K-C | G228: Horde Rank 8 PVP | H228: CV | I228: 58 | J228: P | K228: 154 | M228: 13 | N228: 7 | P228: 00.02
A229: Blademaster Leggings | B229: =(K229*$K$5)+(L229*$L$5)+(M229*$M$5)+(N229*$N$5)+(O229*$O$5)+(P229*100*$P$5)+(Q229*100*$Q$5)+(R229*100*$R$5)+(S229*100*$S$5)+(T229*$T$5)+(U229*$U$5)+(V229*$V$5)+(W229*$W$5)+(X229*$X$5)+(Y229*$Y$5)+(Z229*$Z$5)+(AA229*$AA$5) -> 30.04 | C229: =(K229*$K$6)+(L229*$L$6)+(M229*$M$6)+(N229*$N$6)+(O229*$O$6)+(P229*100*$P$6)+(Q229*100*$Q$6)+(R229*100*$R$6)+(S229*100*$S$6)+(T229*$T$6)+(U229*$U$6)+(V229*$V$6)+(W229*$W$6)+(X229*$X$6)+(Y229*$Y$6)+(Z229*$Z$6)+(AB229*$AA$6) -> 22.673999999999999 | D229: UBRS | E229: 1 | F229: 00.17 | G229: The Beast | I229: 58 | J229: P | K229: 154 | L229: 5 | P229: 00.01 | Q229: 00.01 | S229: 00.02
A230: Serpentskin Leggings | B230: =(K230*$K$5)+(L230*$L$5)+(M230*$M$5)+(N230*$N$5)+(O230*$O$5)+(P230*100*$P$5)+(Q230*100*$Q$5)+(R230*100*$R$5)+(S230*100*$S$5)+(T230*$T$5)+(U230*$U$5)+(V230*$V$5)+(W230*$W$5)+(X230*$X$5)+(Y230*$Y$5)+(Z230*$Z$5)+(AA230*$AA$5) -> 28.74 | C230: =(K230*$K$6)+(L230*$L$6)+(M230*$M$6)+(N230*$N$6)+(O230*$O$6)+(P230*100*$P$6)+(Q230*100*$Q$6)+(R230*100*$R$6)+(S230*100*$S$6)+(T230*$T$6)+(U230*$U$6)+(V230*$V$6)+(W230*$W$6)+(X230*$X$6)+(Y230*$Y$6)+(Z230*$Z$6)+(AB230*$AA$6) -> 22.673999999999999 | D230: R | E230: 1 | F230: 51-55 | G230: Random World Drop | I230: 49 | J230: E | K230: 124 | L230: 16 | M230: 5 | N230: 13
A231: Jadefire Pants of the Tiger | B231: =(K231*$K$5)+(L231*$L$5)+(M231*$M$5)+(N231*$N$5)+(O231*$O$5)+(P231*100*$P$5)+(Q231*100*$Q$5)+(R231*100*$R$5)+(S231*100*$S$5)+(T231*$T$5)+(U231*$U$5)+(V231*$V$5)+(W231*$W$5)+(X231*$X$5)+(Y231*$Y$5)+(Z231*$Z$5)+(AA231*$AA$5) -> 23.74 | C231: =(K231*$K$6)+(L231*$L$6)+(M231*$M$6)+(N231*$N$6)+(O231*$O$6)+(P231*100*$P$6)+(Q231*100*$Q$6)+(R231*100*$R$6)+(S231*100*$S$6)+(T231*$T$6)+(U231*$U$6)+(V231*$V$6)+(W231*$W$6)+(X231*$X$6)+(Y231*$Y$6)+(Z231*$Z$6)+(AB231*$AA$6) -> 22.624000000000002 | D231: R | E231: 1 | F231: 51-55 | G231: Random World Drop | I231: 49 | J231: E | K231: 124 | L231: 15 | N231: 15
A232: Righteous Leggings of the Tiger | B232: =(K232*$K$5)+(L232*$L$5)+(M232*$M$5)+(N232*$N$5)+(O232*$O$5)+(P232*100*$P$5)+(Q232*100*$Q$5)+(R232*100*$R$5)+(S232*100*$S$5)+(T232*$T$5)+(U232*$U$5)+(V232*$V$5)+(W232*$W$5)+(X232*$X$5)+(Y232*$Y$5)+(Z232*$Z$5)+(AA232*$AA$5) -> 23.72 | C232: =(K232*$K$6)+(L232*$L$6)+(M232*$M$6)+(N232*$N$6)+(O232*$O$6)+(P232*100*$P$6)+(Q232*100*$Q$6)+(R232*100*$R$6)+(S232*100*$S$6)+(T232*$T$6)+(U232*$U$6)+(V232*$V$6)+(W232*$W$6)+(X232*$X$6)+(Y232*$Y$6)+(Z232*$Z$6)+(AB232*$AA$6) -> 22.622 | D232: R | E232: 1 | F232: 51-55 | G232: Random World Drop | I232: 48 | J232: E | K232: 122 | L232: 15 | N232: 15
A233: Basilisk Hide Pants | B233: =(K233*$K$5)+(L233*$L$5)+(M233*$M$5)+(N233*$N$5)+(O233*$O$5)+(P233*100*$P$5)+(Q233*100*$Q$5)+(R233*100*$R$5)+(S233*100*$S$5)+(T233*$T$5)+(U233*$U$5)+(V233*$V$5)+(W233*$W$5)+(X233*$X$5)+(Y233*$Y$5)+(Z233*$Z$5)+(AA233*$AA$5) -> 30.13 | C233: =(K233*$K$6)+(L233*$L$6)+(M233*$M$6)+(N233*$N$6)+(O233*$O$6)+(P233*100*$P$6)+(Q233*100*$Q$6)+(R233*100*$R$6)+(S233*100*$S$6)+(T233*$T$6)+(U233*$U$6)+(V233*$V$6)+(W233*$W$6)+(X233*$X$6)+(Y233*$Y$6)+(Z233*$Z$6)+(AB233*$AA$6) -> 21.192999999999998 | D233: R | E233: 1 | F233: 41-44 | G233: Random World Drop | I233: 38 | J233: E | K233: 113 | L233: 21 | M233: 8
A234: Stormshroud Pants | B234: =(K234*$K$5)+(L234*$L$5)+(M234*$M$5)+(N234*$N$5)+(O234*$O$5)+(P234*100*$P$5)+(Q234*100*$Q$5)+(R234*100*$R$5)+(S234*100*$S$5)+(T234*$T$5)+(U234*$U$5)+(V234*$V$5)+(W234*$W$5)+(X234*$X$5)+(Y234*$Y$5)+(Z234*$Z$5)+(AA234*$AA$5) -> 24.38 | C234: =(K234*$K$6)+(L234*$L$6)+(M234*$M$6)+(N234*$N$6)+(O234*$O$6)+(P234*100*$P$6)+(Q234*100*$Q$6)+(R234*100*$R$6)+(S234*100*$S$6)+(T234*$T$6)+(U234*$U$6)+(V234*$V$6)+(W234*$W$6)+(X234*$X$6)+(Y234*$Y$6)+(Z234*$Z$6)+(AB234*$AA$6) -> 20.148000000000003 | D234: LW | E234: 1 | F234: 275 | G234: Vendor Recipe | H234: SS | I234: 50 | J234: E | K234: 138 | P234: 00.02 | S234: 00.01
A235: Triprunner Dungarees | B235: =(K235*$K$5)+(L235*$L$5)+(M235*$M$5)+(N235*$N$5)+(O235*$O$5)+(P235*100*$P$5)+(Q235*100*$Q$5)+(R235*100*$R$5)+(S235*100*$S$5)+(T235*$T$5)+(U235*$U$5)+(V235*$V$5)+(W235*$W$5)+(X235*$X$5)+(Y235*$Y$5)+(Z235*$Z$5)+(AA235*$AA$5) -> 26.51 | C235: =(K235*$K$6)+(L235*$L$6)+(M235*$M$6)+(N235*$N$6)+(O235*$O$6)+(P235*100*$P$6)+(Q235*100*$Q$6)+(R235*100*$R$6)+(S235*100*$S$6)+(T235*$T$6)+(U235*$U$6)+(V235*$V$6)+(W235*$W$6)+(X235*$X$6)+(Y235*$Y$6)+(Z235*$Z$6)+(AB235*$AA$6) -> 19.660999999999998 | D235: Gno | E235: 1 | F235: Q | G235: Gno Quest Reward | I235: 25 | J235: P | K235: 101 | L235: 18 | M235: 6 | N235: 3
A236: Wildheart Kilt | B236: =(K236*$K$5)+(L236*$L$5)+(M236*$M$5)+(N236*$N$5)+(O236*$O$5)+(P236*100*$P$5)+(Q236*100*$Q$5)+(R236*100*$R$5)+(S236*100*$S$5)+(T236*$T$5)+(U236*$U$5)+(V236*$V$5)+(W236*$W$5)+(X236*$X$5)+(Y236*$Y$5)+(Z236*$Z$5)+(AA236*$AA$5) -> 34 | C236: =(K236*$K$6)+(L236*$L$6)+(M236*$M$6)+(N236*$N$6)+(O236*$O$6)+(P236*100*$P$6)+(Q236*100*$Q$6)+(R236*100*$R$6)+(S236*100*$S$6)+(T236*$T$6)+(U236*$U$6)+(V236*$V$6)+(W236*$W$6)+(X236*$X$6)+(Y236*$Y$6)+(Z236*$Z$6)+(AB236*$AA$6) -> 18.79 | D236: Str | E236: 1 | F236: 00.08 | G236: Baron Rivendare | H236: WH | I236: 56 | J236: P | K236: 150 | L236: 12 | M236: 14 | N236: 13
A237: Polar Leggings | B237: =(K237*$K$5)+(L237*$L$5)+(M237*$M$5)+(N237*$N$5)+(O237*$O$5)+(P237*100*$P$5)+(Q237*100*$Q$5)+(R237*100*$R$5)+(S237*100*$S$5)+(T237*$T$5)+(U237*$U$5)+(V237*$V$5)+(W237*$W$5)+(X237*$X$5)+(Y237*$Y$5)+(Z237*$Z$5)+(AA237*$AA$5) -> 49.05 | C237: =(K237*$K$6)+(L237*$L$6)+(M237*$M$6)+(N237*$N$6)+(O237*$O$6)+(P237*100*$P$6)+(Q237*100*$Q$6)+(R237*100*$R$6)+(S237*100*$S$6)+(T237*$T$6)+(U237*$U$6)+(V237*$V$6)+(W237*$W$6)+(X237*$X$6)+(Y237*$Y$6)+(Z237*$Z$6)+(AB237*$AA$6) -> 15.885 | D237: Naxx | E237: 6 | F237: Q | G237: Naxx Quest Reward | I237: 60 | J237: P | K237: 205 | L237: 15 | M237: 28 | W237: 40
A238: Warbear Woolies | B238: =(K238*$K$5)+(L238*$L$5)+(M238*$M$5)+(N238*$N$5)+(O238*$O$5)+(P238*100*$P$5)+(Q238*100*$Q$5)+(R238*100*$R$5)+(S238*100*$S$5)+(T238*$T$5)+(U238*$U$5)+(V238*$V$5)+(W238*$W$5)+(X238*$X$5)+(Y238*$Y$5)+(Z238*$Z$5)+(AA238*$AA$5) -> 27.42 | C238: =(K238*$K$6)+(L238*$L$6)+(M238*$M$6)+(N238*$N$6)+(O238*$O$6)+(P238*100*$P$6)+(Q238*100*$Q$6)+(R238*100*$R$6)+(S238*100*$S$6)+(T238*$T$6)+(U238*$U$6)+(V238*$V$6)+(W238*$W$6)+(X238*$X$6)+(Y238*$Y$6)+(Z238*$Z$6)+(AB238*$AA$6) -> 14.262 | D238: LW | E238: 1 | F238: 285 | G238: Felwood Vendor | I238: 52 | J238: E | K238: 142 | M238: 12 | N238: 28
A240: FEET | B240: AEP | C240: MAEP | D240: Loc | E240: P | F240: Info | G240: Source | H240: Set | I240: Lvl | J240: B | K240: Arm | L240: Agi | M240: Sta | N240: Str | O240: AP | P240: Cri | Q240: Hit | R240: Par | S240: Dod | T240: Def | U240: Ar | V240: Fi | W240: Fr | X240: Na | Y240: Sh | Z240: H/5 | AA240: PVP | AB240: PVE | AC240: Special
A241: Bonescythe Sabatons | B241: =(K241*$K$5)+(L241*$L$5)+(M241*$M$5)+(N241*$N$5)+(O241*$O$5)+(P241*100*$P$5)+(Q241*100*$Q$5)+(R241*100*$R$5)+(S241*100*$S$5)+(T241*$T$5)+(U241*$U$5)+(V241*$V$5)+(W241*$W$5)+(X241*$X$5)+(Y241*$Y$5)+(Z241*$Z$5)+(AA241*$AA$5) -> 69.21 | C241: =(K241*$K$6)+(L241*$L$6)+(M241*$M$6)+(N241*$N$6)+(O241*$O$6)+(P241*100*$P$6)+(Q241*100*$Q$6)+(R241*100*$R$6)+(S241*100*$S$6)+(T241*$T$6)+(U241*$U$6)+(V241*$V$6)+(W241*$W$6)+(X241*$X$6)+(Y241*$Y$6)+(Z241*$Z$6)+(AB241*$AA$6) -> 49.850999999999999 | D241: Naxx | E241: 6 | F241: Q | G241: Raz/Gothik | H241: BS | I241: 60 | J241: P | K241: 171 | M241: 18 | O241: 64 | P241: 00.01 | Q241: 00.01
A242: Deathdealer's Boots | B242: =(K242*$K$5)+(L242*$L$5)+(M242*$M$5)+(N242*$N$5)+(O242*$O$5)+(P242*100*$P$5)+(Q242*100*$Q$5)+(R242*100*$R$5)+(S242*100*$S$5)+(T242*$T$5)+(U242*$U$5)+(V242*$V$5)+(W242*$W$5)+(X242*$X$5)+(Y242*$Y$5)+(Z242*$Z$5)+(AA242*$AA$5) -> 59.08 | C242: =(K242*$K$6)+(L242*$L$6)+(M242*$M$6)+(N242*$N$6)+(O242*$O$6)+(P242*100*$P$6)+(Q242*100*$Q$6)+(R242*100*$R$6)+(S242*100*$S$6)+(T242*$T$6)+(U242*$U$6)+(V242*$V$6)+(W242*$W$6)+(X242*$X$6)+(Y242*$Y$6)+(Z242*$Z$6)+(AB242*$AA$6) -> 40.828000000000003 | D242: AQ40 | E242: 5 | F242: Q | G242: Huhuran/Viscidus | H242: DE | I242: 60 | J242: P | K242: 158 | L242: 26 | M242: 17 | N242: 14 | Q242: 00.01
A243: Boots of the Shadow Flame | B243: =(K243*$K$5)+(L243*$L$5)+(M243*$M$5)+(N243*$N$5)+(O243*$O$5)+(P243*100*$P$5)+(Q243*100*$Q$5)+(R243*100*$R$5)+(S243*100*$S$5)+(T243*$T$5)+(U243*$U$5)+(V243*$V$5)+(W243*$W$5)+(X243*$X$5)+(Y243*$Y$5)+(Z243*$Z$5)+(AA243*$AA$5) -> 61.86 | C243: =(K243*$K$6)+(L243*$L$6)+(M243*$M$6)+(N243*$N$6)+(O243*$O$6)+(P243*100*$P$6)+(Q243*100*$Q$6)+(R243*100*$R$6)+(S243*100*$S$6)+(T243*$T$6)+(U243*$U$6)+(V243*$V$6)+(W243*$W$6)+(X243*$X$6)+(Y243*$Y$6)+(Z243*$Z$6)+(AB243*$AA$6) -> 37.506 | D243: BWL | E243: 3 | F243: 00.27 | G243: Nefarian | I243: 60 | J243: P | K243: 286 | M243: 22 | O243: 44 | Q243: 00.02
A244: Boots of Displacement | B244: =(K244*$K$5)+(L244*$L$5)+(M244*$M$5)+(N244*$N$5)+(O244*$O$5)+(P244*100*$P$5)+(Q244*100*$Q$5)+(R244*100*$R$5)+(S244*100*$S$5)+(T244*$T$5)+(U244*$U$5)+(V244*$V$5)+(W244*$W$5)+(X244*$X$5)+(Y244*$Y$5)+(Z244*$Z$5)+(AA244*$AA$5) -> 58.66 | C244: =(K244*$K$6)+(L244*$L$6)+(M244*$M$6)+(N244*$N$6)+(O244*$O$6)+(P244*100*$P$6)+(Q244*100*$Q$6)+(R244*100*$R$6)+(S244*100*$S$6)+(T244*$T$6)+(U244*$U$6)+(V244*$V$6)+(W244*$W$6)+(X244*$X$6)+(Y244*$Y$6)+(Z244*$Z$6)+(AB244*$AA$6) -> 34.375999999999998 | D244: Naxx | E244: 6 | F244: 00.2 | G244: Gothik | I244: 60 | J244: P | K244: 166 | L244: 33 | M244: 21 | AA244: 3 | AB244: 1 | AC244: Incr. Stealth
A245: Boots of the Vanguard | B245: =(K245*$K$5)+(L245*$L$5)+(M245*$M$5)+(N245*$N$5)+(O245*$O$5)+(P245*100*$P$5)+(Q245*100*$Q$5)+(R245*100*$R$5)+(S245*100*$S$5)+(T245*$T$5)+(U245*$U$5)+(V245*$V$5)+(W245*$W$5)+(X245*$X$5)+(Y245*$Y$5)+(Z245*$Z$5)+(AA245*$AA$5) -> 45.38 | C245: =(K245*$K$6)+(L245*$L$6)+(M245*$M$6)+(N245*$N$6)+(O245*$O$6)+(P245*100*$P$6)+(Q245*100*$Q$6)+(R245*100*$R$6)+(S245*100*$S$6)+(T245*$T$6)+(U245*$U$6)+(V245*$V$6)+(W245*$W$6)+(X245*$X$6)+(Y245*$Y$6)+(Z245*$Z$6)+(AB245*$AA$6) -> 33.248000000000005 | D245: AQ20 | E245: 5 | F245: 00.17 | G245: General Rajaxx | I245: 60 | J245: P | K245: 138 | L245: 22 | M245: 11 | N245: 22
A246: Blooddrenched Footpads | B246: =(K246*$K$5)+(L246*$L$5)+(M246*$M$5)+(N246*$N$5)+(O246*$O$5)+(P246*100*$P$5)+(Q246*100*$Q$5)+(R246*100*$R$5)+(S246*100*$S$5)+(T246*$T$5)+(U246*$U$5)+(V246*$V$5)+(W246*$W$5)+(X246*$X$5)+(Y246*$Y$5)+(Z246*$Z$5)+(AA246*$AA$5) -> 39.79 | C246: =(K246*$K$6)+(L246*$L$6)+(M246*$M$6)+(N246*$N$6)+(O246*$O$6)+(P246*100*$P$6)+(Q246*100*$Q$6)+(R246*100*$R$6)+(S246*100*$S$6)+(T246*$T$6)+(U246*$U$6)+(V246*$V$6)+(W246*$W$6)+(X246*$X$6)+(Y246*$Y$6)+(Z246*$Z$6)+(AB246*$AA$6) -> 28.729000000000003 | D246: ZG | E246: 4 | F246: 00.09 | G246: High Priest Venoxis | I246: 60 | J246: P | K246: 129 | L246: 21 | M246: 10 | Q246: 00.01
A247: Bloodfang Boots | B247: =(K247*$K$5)+(L247*$L$5)+(M247*$M$5)+(N247*$N$5)+(O247*$O$5)+(P247*100*$P$5)+(Q247*100*$Q$5)+(R247*100*$R$5)+(S247*100*$S$5)+(T247*$T$5)+(U247*$U$5)+(V247*$V$5)+(W247*$W$5)+(X247*$X$5)+(Y247*$Y$5)+(Z247*$Z$5)+(AA247*$AA$5) -> 50.54 | C247: =(K247*$K$6)+(L247*$L$6)+(M247*$M$6)+(N247*$N$6)+(O247*$O$6)+(P247*100*$P$6)+(Q247*100*$Q$6)+(R247*100*$R$6)+(S247*100*$S$6)+(T247*$T$6)+(U247*$U$6)+(V247*$V$6)+(W247*$W$6)+(X247*$X$6)+(Y247*$Y$6)+(Z247*$Z$6)+(AB247*$AA$6) -> 28.434000000000005 | D247: BWL | E247: 3 | F247: 00.21 | G247: Broodlord Lashlayer | H247: BF | I247: 60 | J247: P | K247: 154 | L247: 25 | M247: 17 | N247: 6 | S247: 00.01 | V247: 10
A248: Highlander's Leather Boots (58) | B248: =(K248*$K$5)+(L248*$L$5)+(M248*$M$5)+(N248*$N$5)+(O248*$O$5)+(P248*100*$P$5)+(Q248*100*$Q$5)+(R248*100*$R$5)+(S248*100*$S$5)+(T248*$T$5)+(U248*$U$5)+(V248*$V$5)+(W248*$W$5)+(X248*$X$5)+(Y248*$Y$5)+(Z248*$Z$5)+(AA248*$AA$5) -> 44.81 | C248: =(K248*$K$6)+(L248*$L$6)+(M248*$M$6)+(N248*$N$6)+(O248*$O$6)+(P248*100*$P$6)+(Q248*100*$Q$6)+(R248*100*$R$6)+(S248*100*$S$6)+(T248*$T$6)+(U248*$U$6)+(V248*$V$6)+(W248*$W$6)+(X248*$X$6)+(Y248*$Y$6)+(Z248*$Z$6)+(AB248*$AA$6) -> 27.341000000000001 | D248: AB | E248: 4 | F248: Rev | G248: Alliance AB Revered | H248: HP | I248: 58 | J248: P | K248: 181 | L248: 12 | M248: 16 | O248: 16 | AA248: 7 | AB248: 7 | AC248: Inc. Run Spd
A249: Defiler's Leather Boots (58) | B249: =(K249*$K$5)+(L249*$L$5)+(M249*$M$5)+(N249*$N$5)+(O249*$O$5)+(P249*100*$P$5)+(Q249*100*$Q$5)+(R249*100*$R$5)+(S249*100*$S$5)+(T249*$T$5)+(U249*$U$5)+(V249*$V$5)+(W249*$W$5)+(X249*$X$5)+(Y249*$Y$5)+(Z249*$Z$5)+(AA249*$AA$5) -> 44.81 | C249: =(K249*$K$6)+(L249*$L$6)+(M249*$M$6)+(N249*$N$6)+(O249*$O$6)+(P249*100*$P$6)+(Q249*100*$Q$6)+(R249*100*$R$6)+(S249*100*$S$6)+(T249*$T$6)+(U249*$U$6)+(V249*$V$6)+(W249*$W$6)+(X249*$X$6)+(Y249*$Y$6)+(Z249*$Z$6)+(AB249*$AA$6) -> 27.341000000000001 | D249: AB | E249: 4 | F249: Rev | G249: Horde AB Revered | H249: DP | I249: 58 | J249: P | K249: 181 | L249: 12 | M249: 16 | O249: 16 | AA249: 7 | AB249: 7 | AC249: Inc. Run Spd
A250: Nightslayer Boots | B250: =(K250*$K$5)+(L250*$L$5)+(M250*$M$5)+(N250*$N$5)+(O250*$O$5)+(P250*100*$P$5)+(Q250*100*$Q$5)+(R250*100*$R$5)+(S250*100*$S$5)+(T250*$T$5)+(U250*$U$5)+(V250*$V$5)+(W250*$W$5)+(X250*$X$5)+(Y250*$Y$5)+(Z250*$Z$5)+(AA250*$AA$5) -> 46.08 | C250: =(K250*$K$6)+(L250*$L$6)+(M250*$M$6)+(N250*$N$6)+(O250*$O$6)+(P250*100*$P$6)+(Q250*100*$Q$6)+(R250*100*$R$6)+(S250*100*$S$6)+(T250*$T$6)+(U250*$U$6)+(V250*$V$6)+(W250*$W$6)+(X250*$X$6)+(Y250*$Y$6)+(Z250*$Z$6)+(AB250*$AA$6) -> 26.388000000000002 | D250: MC | E250: 1 | F250: 00.22 | G250: Shazzrah | H250: NS | I250: 60 | J250: P | K250: 138 | L250: 26 | M250: 18 | Y250: 7
A251: Darkmantle Boots | B251: =(K251*$K$5)+(L251*$L$5)+(M251*$M$5)+(N251*$N$5)+(O251*$O$5)+(P251*100*$P$5)+(Q251*100*$Q$5)+(R251*100*$R$5)+(S251*100*$S$5)+(T251*$T$5)+(U251*$U$5)+(V251*$V$5)+(W251*$W$5)+(X251*$X$5)+(Y251*$Y$5)+(Z251*$Z$5)+(AA251*$AA$5) -> 38.27 | C251: =(K251*$K$6)+(L251*$L$6)+(M251*$M$6)+(N251*$N$6)+(O251*$O$6)+(P251*100*$P$6)+(Q251*100*$Q$6)+(R251*100*$R$6)+(S251*100*$S$6)+(T251*$T$6)+(U251*$U$6)+(V251*$V$6)+(W251*$W$6)+(X251*$X$6)+(Y251*$Y$6)+(Z251*$Z$6)+(AB251*$AA$6) -> 25.227 | D251: Q | E251: 5 | F251: Q | G251: SC Upgrade Quest | H251: DM | I251: 58 | J251: P | K251: 127 | L251: 24 | M251: 10 | AA251: 3 | AB251: 1 | AC251: Incr. Stealth
A252: Highlander's Leather Boots (48) | B252: =(K252*$K$5)+(L252*$L$5)+(M252*$M$5)+(N252*$N$5)+(O252*$O$5)+(P252*100*$P$5)+(Q252*100*$Q$5)+(R252*100*$R$5)+(S252*100*$S$5)+(T252*$T$5)+(U252*$U$5)+(V252*$V$5)+(W252*$W$5)+(X252*$X$5)+(Y252*$Y$5)+(Z252*$Z$5)+(AA252*$AA$5) -> 38.45 | C252: =(K252*$K$6)+(L252*$L$6)+(M252*$M$6)+(N252*$N$6)+(O252*$O$6)+(P252*100*$P$6)+(Q252*100*$Q$6)+(R252*100*$R$6)+(S252*100*$S$6)+(T252*$T$6)+(U252*$U$6)+(V252*$V$6)+(W252*$W$6)+(X252*$X$6)+(Y252*$Y$6)+(Z252*$Z$6)+(AB252*$AA$6) -> 24.274999999999999 | D252: AB | E252: 4 | F252: Rev | G252: Alliance AB Revered | I252: 48 | J252: P | K252: 145 | L252: 11 | M252: 13 | O252: 12 | AA252: 7 | AB252: 7 | AC252: Inc. Run Spd
A253: Defiler's Leather Boots (48) | B253: =(K253*$K$5)+(L253*$L$5)+(M253*$M$5)+(N253*$N$5)+(O253*$O$5)+(P253*100*$P$5)+(Q253*100*$Q$5)+(R253*100*$R$5)+(S253*100*$S$5)+(T253*$T$5)+(U253*$U$5)+(V253*$V$5)+(W253*$W$5)+(X253*$X$5)+(Y253*$Y$5)+(Z253*$Z$5)+(AA253*$AA$5) -> 38.45 | C253: =(K253*$K$6)+(L253*$L$6)+(M253*$M$6)+(N253*$N$6)+(O253*$O$6)+(P253*100*$P$6)+(Q253*100*$Q$6)+(R253*100*$R$6)+(S253*100*$S$6)+(T253*$T$6)+(U253*$U$6)+(V253*$V$6)+(W253*$W$6)+(X253*$X$6)+(Y253*$Y$6)+(Z253*$Z$6)+(AB253*$AA$6) -> 24.274999999999999 | D253: AB | E253: 4 | F253: Rev | G253: Horde AB Revered | I253: 48 | J253: P | K253: 145 | L253: 11 | M253: 13 | O253: 12 | AA253: 7 | AB253: 7 | AC253: Inc. Run Spd
A254: Drudge Boots | B254: =(K254*$K$5)+(L254*$L$5)+(M254*$M$5)+(N254*$N$5)+(O254*$O$5)+(P254*100*$P$5)+(Q254*100*$Q$5)+(R254*100*$R$5)+(S254*100*$S$5)+(T254*$T$5)+(U254*$U$5)+(V254*$V$5)+(W254*$W$5)+(X254*$X$5)+(Y254*$Y$5)+(Z254*$Z$5)+(AA254*$AA$5) -> 47.06 | C254: =(K254*$K$6)+(L254*$L$6)+(M254*$M$6)+(N254*$N$6)+(O254*$O$6)+(P254*100*$P$6)+(Q254*100*$Q$6)+(R254*100*$R$6)+(S254*100*$S$6)+(T254*$T$6)+(U254*$U$6)+(V254*$V$6)+(W254*$W$6)+(X254*$X$6)+(Y254*$Y$6)+(Z254*$Z$6)+(AB254*$AA$6) -> 24.055999999999997 | D254: MG | E254: 5 | F254: Q | G254: Quest Reward | I254: 60 | J254: P | K254: 156 | L254: 17 | M254: 20 | N254: 13 | X254: 20
A255: Dunestalker's Boots | B255: =(K255*$K$5)+(L255*$L$5)+(M255*$M$5)+(N255*$N$5)+(O255*$O$5)+(P255*100*$P$5)+(Q255*100*$Q$5)+(R255*100*$R$5)+(S255*100*$S$5)+(T255*$T$5)+(U255*$U$5)+(V255*$V$5)+(W255*$W$5)+(X255*$X$5)+(Y255*$Y$5)+(Z255*$Z$5)+(AA255*$AA$5) -> 34.71 | C255: =(K255*$K$6)+(L255*$L$6)+(M255*$M$6)+(N255*$N$6)+(O255*$O$6)+(P255*100*$P$6)+(Q255*100*$Q$6)+(R255*100*$R$6)+(S255*100*$S$6)+(T255*$T$6)+(U255*$U$6)+(V255*$V$6)+(W255*$W$6)+(X255*$X$6)+(Y255*$Y$6)+(Z255*$Z$6)+(AB255*$AA$6) -> 23.721 | D255: Sil | E255: 4 | F255: Q | G255: Quest Reward | I255: 58 | J255: P | K255: 121 | L255: 19 | M255: 10 | N255: 9
A256: Marshal's Leather Footguards | B256: =(K256*$K$5)+(L256*$L$5)+(M256*$M$5)+(N256*$N$5)+(O256*$O$5)+(P256*100*$P$5)+(Q256*100*$Q$5)+(R256*100*$R$5)+(S256*100*$S$5)+(T256*$T$5)+(U256*$U$5)+(V256*$V$5)+(W256*$W$5)+(X256*$X$5)+(Y256*$Y$5)+(Z256*$Z$5)+(AA256*$AA$5) -> 51.86 | C256: =(K256*$K$6)+(L256*$L$6)+(M256*$M$6)+(N256*$N$6)+(O256*$O$6)+(P256*100*$P$6)+(Q256*100*$Q$6)+(R256*100*$R$6)+(S256*100*$S$6)+(T256*$T$6)+(U256*$U$6)+(V256*$V$6)+(W256*$W$6)+(X256*$X$6)+(Y256*$Y$6)+(Z256*$Z$6)+(AB256*$AA$6) -> 23.436 | D256: PVP | E256: 2 | F256: FM | G256: Alliance Rank 12 PVP | H256: FM | I256: 60 | J256: P | K256: 186 | L256: 22 | M256: 25 | AA256: 3 | AB256: 1 | AC256: Sprint +3 sec.
A257: General's Leather Treads | B257: =(K257*$K$5)+(L257*$L$5)+(M257*$M$5)+(N257*$N$5)+(O257*$O$5)+(P257*100*$P$5)+(Q257*100*$Q$5)+(R257*100*$R$5)+(S257*100*$S$5)+(T257*$T$5)+(U257*$U$5)+(V257*$V$5)+(W257*$W$5)+(X257*$X$5)+(Y257*$Y$5)+(Z257*$Z$5)+(AA257*$AA$5) -> 51.86 | C257: =(K257*$K$6)+(L257*$L$6)+(M257*$M$6)+(N257*$N$6)+(O257*$O$6)+(P257*100*$P$6)+(Q257*100*$Q$6)+(R257*100*$R$6)+(S257*100*$S$6)+(T257*$T$6)+(U257*$U$6)+(V257*$V$6)+(W257*$W$6)+(X257*$X$6)+(Y257*$Y$6)+(Z257*$Z$6)+(AB257*$AA$6) -> 23.436 | D257: PVP | E257: 2 | F257: WL | G257: Horde Rank 12 PVP | H257: WL | I257: 60 | J257: P | K257: 186 | L257: 22 | M257: 25 | AA257: 3 | AB257: 1 | AC257: Sprint +3 sec.
A258: Mongoose Boots | B258: =(K258*$K$5)+(L258*$L$5)+(M258*$M$5)+(N258*$N$5)+(O258*$O$5)+(P258*100*$P$5)+(Q258*100*$Q$5)+(R258*100*$R$5)+(S258*100*$S$5)+(T258*$T$5)+(U258*$U$5)+(V258*$V$5)+(W258*$W$5)+(X258*$X$5)+(Y258*$Y$5)+(Z258*$Z$5)+(AA258*$AA$5) -> 33.2 | C258: =(K258*$K$6)+(L258*$L$6)+(M258*$M$6)+(N258*$N$6)+(O258*$O$6)+(P258*100*$P$6)+(Q258*100*$Q$6)+(R258*100*$R$6)+(S258*100*$S$6)+(T258*$T$6)+(U258*$U$6)+(V258*$V$6)+(W258*$W$6)+(X258*$X$6)+(Y258*$Y$6)+(Z258*$Z$6)+(AB258*$AA$6) -> 23.21 | D258: LW | E258: 2 | F258: 300 | G258: Knot Thimble. Cache | I258: 57 | J258: E | K258: 120 | L258: 23 | M258: 9
A259: Swiftwalker Boots | B259: =(K259*$K$5)+(L259*$L$5)+(M259*$M$5)+(N259*$N$5)+(O259*$O$5)+(P259*100*$P$5)+(Q259*100*$Q$5)+(R259*100*$R$5)+(S259*100*$S$5)+(T259*$T$5)+(U259*$U$5)+(V259*$V$5)+(W259*$W$5)+(X259*$X$5)+(Y259*$Y$5)+(Z259*$Z$5)+(AA259*$AA$5) -> 31.15 | C259: =(K259*$K$6)+(L259*$L$6)+(M259*$M$6)+(N259*$N$6)+(O259*$O$6)+(P259*100*$P$6)+(Q259*100*$Q$6)+(R259*100*$R$6)+(S259*100*$S$6)+(T259*$T$6)+(U259*$U$6)+(V259*$V$6)+(W259*$W$6)+(X259*$X$6)+(Y259*$Y$6)+(Z259*$Z$6)+(AB259*$AA$6) -> 23.184999999999999 | D259: BRD | E259: 1 | F259: 00.14 | G259: Princess Moira | I259: 54 | J259: P | K259: 115 | L259: 21 | M259: 7 | N259: 4
A260: Hive Tunneler's Boots | B260: =(K260*$K$5)+(L260*$L$5)+(M260*$M$5)+(N260*$N$5)+(O260*$O$5)+(P260*100*$P$5)+(Q260*100*$Q$5)+(R260*100*$R$5)+(S260*100*$S$5)+(T260*$T$5)+(U260*$U$5)+(V260*$V$5)+(W260*$W$5)+(X260*$X$5)+(Y260*$Y$5)+(Z260*$Z$5)+(AA260*$AA$5) -> 54.16 | C260: =(K260*$K$6)+(L260*$L$6)+(M260*$M$6)+(N260*$N$6)+(O260*$O$6)+(P260*100*$P$6)+(Q260*100*$Q$6)+(R260*100*$R$6)+(S260*100*$S$6)+(T260*$T$6)+(U260*$U$6)+(V260*$V$6)+(W260*$W$6)+(X260*$X$6)+(Y260*$Y$6)+(Z260*$Z$6)+(AB260*$AA$6) -> 22.516000000000002 | D260: AQ40 | E260: 5 | F260: 00.15 | G260: Fankriss | I260: 60 | J260: P | K260: 216 | L260: 17 | M260: 30 | N260: 10
A261: Shadowcraft Boots | B261: =(K261*$K$5)+(L261*$L$5)+(M261*$M$5)+(N261*$N$5)+(O261*$O$5)+(P261*100*$P$5)+(Q261*100*$Q$5)+(R261*100*$R$5)+(S261*100*$S$5)+(T261*$T$5)+(U261*$U$5)+(V261*$V$5)+(W261*$W$5)+(X261*$X$5)+(Y261*$Y$5)+(Z261*$Z$5)+(AA261*$AA$5) -> 31.15 | C261: =(K261*$K$6)+(L261*$L$6)+(M261*$M$6)+(N261*$N$6)+(O261*$O$6)+(P261*100*$P$6)+(Q261*100*$Q$6)+(R261*100*$R$6)+(S261*100*$S$6)+(T261*$T$6)+(U261*$U$6)+(V261*$V$6)+(W261*$W$6)+(X261*$X$6)+(Y261*$Y$6)+(Z261*$Z$6)+(AB261*$AA$6) -> 21.204999999999998 | D261: Sch | E261: 1 | F261: 00.12 | G261: Rattlegore | H261: SC | I261: 54 | J261: P | K261: 115 | L261: 21 | M261: 9
A262: Supreme Shoes of the Tiger | B262: =(K262*$K$5)+(L262*$L$5)+(M262*$M$5)+(N262*$N$5)+(O262*$O$5)+(P262*100*$P$5)+(Q262*100*$Q$5)+(R262*100*$R$5)+(S262*100*$S$5)+(T262*$T$5)+(U262*$U$5)+(V262*$V$5)+(W262*$W$5)+(X262*$X$5)+(Y262*$Y$5)+(Z262*$Z$5)+(AA262*$AA$5) -> 22.1 | C262: =(K262*$K$6)+(L262*$L$6)+(M262*$M$6)+(N262*$N$6)+(O262*$O$6)+(P262*100*$P$6)+(Q262*100*$Q$6)+(R262*100*$R$6)+(S262*100*$S$6)+(T262*$T$6)+(U262*$U$6)+(V262*$V$6)+(W262*$W$6)+(X262*$X$6)+(Y262*$Y$6)+(Z262*$Z$6)+(AB262*$AA$6) -> 21.11 | D262: R | E262: 1 | F262: 54-61 | G262: Random World Drop | I262: 58 | J262: E | K262: 110 | L262: 14 | N262: 14
A263: Adventurer's Boots of the Tiger | B263: =(K263*$K$5)+(L263*$L$5)+(M263*$M$5)+(N263*$N$5)+(O263*$O$5)+(P263*100*$P$5)+(Q263*100*$Q$5)+(R263*100*$R$5)+(S263*100*$S$5)+(T263*$T$5)+(U263*$U$5)+(V263*$V$5)+(W263*$W$5)+(X263*$X$5)+(Y263*$Y$5)+(Z263*$Z$5)+(AA263*$AA$5) -> 22.09 | C263: =(K263*$K$6)+(L263*$L$6)+(M263*$M$6)+(N263*$N$6)+(O263*$O$6)+(P263*100*$P$6)+(Q263*100*$Q$6)+(R263*100*$R$6)+(S263*100*$S$6)+(T263*$T$6)+(U263*$U$6)+(V263*$V$6)+(W263*$W$6)+(X263*$X$6)+(Y263*$Y$6)+(Z263*$Z$6)+(AB263*$AA$6) -> 21.109000000000002 | D263: R | E263: 1 | F263: 59-62 | G263: Random World Drop | I263: 57 | J263: E | K263: 109 | L263: 14 | N263: 14
A264: Mighty Boots of the Tiger | B264: =(K264*$K$5)+(L264*$L$5)+(M264*$M$5)+(N264*$N$5)+(O264*$O$5)+(P264*100*$P$5)+(Q264*100*$Q$5)+(R264*100*$R$5)+(S264*100*$S$5)+(T264*$T$5)+(U264*$U$5)+(V264*$V$5)+(W264*$W$5)+(X264*$X$5)+(Y264*$Y$5)+(Z264*$Z$5)+(AA264*$AA$5) -> 22.07 | C264: =(K264*$K$6)+(L264*$L$6)+(M264*$M$6)+(N264*$N$6)+(O264*$O$6)+(P264*100*$P$6)+(Q264*100*$Q$6)+(R264*100*$R$6)+(S264*100*$S$6)+(T264*$T$6)+(U264*$U$6)+(V264*$V$6)+(W264*$W$6)+(X264*$X$6)+(Y264*$Y$6)+(Z264*$Z$6)+(AB264*$AA$6) -> 21.106999999999999 | D264: R | E264: 1 | F264: 59-62 | G264: Random World Drop | I264: 56 | J264: E | K264: 107 | L264: 14 | N264: 14
A265: Swiftfoot Treads | B265: =(K265*$K$5)+(L265*$L$5)+(M265*$M$5)+(N265*$N$5)+(O265*$O$5)+(P265*100*$P$5)+(Q265*100*$Q$5)+(R265*100*$R$5)+(S265*100*$S$5)+(T265*$T$5)+(U265*$U$5)+(V265*$V$5)+(W265*$W$5)+(X265*$X$5)+(Y265*$Y$5)+(Z265*$Z$5)+(AA265*$AA$5) -> 21.56 | C265: =(K265*$K$6)+(L265*$L$6)+(M265*$M$6)+(N265*$N$6)+(O265*$O$6)+(P265*100*$P$6)+(Q265*100*$Q$6)+(R265*100*$R$6)+(S265*100*$S$6)+(T265*$T$6)+(U265*$U$6)+(V265*$V$6)+(W265*$W$6)+(X265*$X$6)+(Y265*$Y$6)+(Z265*$Z$6)+(AB265*$AA$6) -> 20.606000000000002 | D265: UBRS | E265: 1 | F265: Q | G265: UBRS Q Reward | I265: 57 | J265: P | K265: 106 | L265: 18 | N265: 5
A266: Pads of the Dread Wolf | B266: =(K266*$K$5)+(L266*$L$5)+(M266*$M$5)+(N266*$N$5)+(O266*$O$5)+(P266*100*$P$5)+(Q266*100*$Q$5)+(R266*100*$R$5)+(S266*100*$S$5)+(T266*$T$5)+(U266*$U$5)+(V266*$V$5)+(W266*$W$5)+(X266*$X$5)+(Y266*$Y$5)+(Z266*$Z$5)+(AA266*$AA$5) -> 35.16 | C266: =(K266*$K$6)+(L266*$L$6)+(M266*$M$6)+(N266*$N$6)+(O266*$O$6)+(P266*100*$P$6)+(Q266*100*$Q$6)+(R266*100*$R$6)+(S266*100*$S$6)+(T266*$T$6)+(U266*$U$6)+(V266*$V$6)+(W266*$W$6)+(X266*$X$6)+(Y266*$Y$6)+(Z266*$Z$6)+(AB266*$AA$6) -> 20.256 | D266: LBRS | E266: 1 | F266: 00.14 | G266: Halycon | I266: 55 | J266: P | K266: 116 | M266: 14 | O266: 40
A267: Albino Crocscale Boots | B267: =(K267*$K$5)+(L267*$L$5)+(M267*$M$5)+(N267*$N$5)+(O267*$O$5)+(P267*100*$P$5)+(Q267*100*$Q$5)+(R267*100*$R$5)+(S267*100*$S$5)+(T267*$T$5)+(U267*$U$5)+(V267*$V$5)+(W267*$W$5)+(X267*$X$5)+(Y267*$Y$5)+(Z267*$Z$5)+(AA267*$AA$5) -> 26.55 | C267: =(K267*$K$6)+(L267*$L$6)+(M267*$M$6)+(N267*$N$6)+(O267*$O$6)+(P267*100*$P$6)+(Q267*100*$Q$6)+(R267*100*$R$6)+(S267*100*$S$6)+(T267*$T$6)+(U267*$U$6)+(V267*$V$6)+(W267*$W$6)+(X267*$X$6)+(Y267*$Y$6)+(Z267*$Z$6)+(AB267*$AA$6) -> 20.204999999999998 | D267: Mar | E267: 1 | F267: 00.3 | G267: Rotgrip | I267: 48 | J267: P | K267: 105 | L267: 20 | M267: 5 | X267: 5
A268: Boots of Ferocity | B268: =(K268*$K$5)+(L268*$L$5)+(M268*$M$5)+(N268*$N$5)+(O268*$O$5)+(P268*100*$P$5)+(Q268*100*$Q$5)+(R268*100*$R$5)+(S268*100*$S$5)+(T268*$T$5)+(U268*$U$5)+(V268*$V$5)+(W268*$W$5)+(X268*$X$5)+(Y268*$Y$5)+(Z268*$Z$5)+(AA268*$AA$5) -> 33.68 | C268: =(K268*$K$6)+(L268*$L$6)+(M268*$M$6)+(N268*$N$6)+(O268*$O$6)+(P268*100*$P$6)+(Q268*100*$Q$6)+(R268*100*$R$6)+(S268*100*$S$6)+(T268*$T$6)+(U268*$U$6)+(V268*$V$6)+(W268*$W$6)+(X268*$X$6)+(Y268*$Y$6)+(Z268*$Z$6)+(AB268*$AA$6) -> 19.748000000000001 | D268: DM-E | E268: 5 | F268: 00.18 | G268: Isalien | I268: 56 | J268: P | K268: 118 | L268: 13 | M268: 13 | N268: 13
A269: Whisperwalk Boots | B269: =(K269*$K$5)+(L269*$L$5)+(M269*$M$5)+(N269*$N$5)+(O269*$O$5)+(P269*100*$P$5)+(Q269*100*$Q$5)+(R269*100*$R$5)+(S269*100*$S$5)+(T269*$T$5)+(U269*$U$5)+(V269*$V$5)+(W269*$W$5)+(X269*$X$5)+(Y269*$Y$5)+(Z269*$Z$5)+(AA269*$AA$5) -> 26.04 | C269: =(K269*$K$6)+(L269*$L$6)+(M269*$M$6)+(N269*$N$6)+(O269*$O$6)+(P269*100*$P$6)+(Q269*100*$Q$6)+(R269*100*$R$6)+(S269*100*$S$6)+(T269*$T$6)+(U269*$U$6)+(V269*$V$6)+(W269*$W$6)+(X269*$X$6)+(Y269*$Y$6)+(Z269*$Z$6)+(AB269*$AA$6) -> 19.143999999999998 | D269: ToAH | E269: 4 | F269: Q | G269: Quest Series Reward | I269: 50 | J269: P | K269: 104 | L269: 18 | M269: 4 | AA269: 3 | AB269: 1 | AC269: Stealth +1
A270: Highlander's Leather Boots (38) | B270: =(K270*$K$5)+(L270*$L$5)+(M270*$M$5)+(N270*$N$5)+(O270*$O$5)+(P270*100*$P$5)+(Q270*100*$Q$5)+(R270*100*$R$5)+(S270*100*$S$5)+(T270*$T$5)+(U270*$U$5)+(V270*$V$5)+(W270*$W$5)+(X270*$X$5)+(Y270*$Y$5)+(Z270*$Z$5)+(AA270*$AA$5) -> 29.29 | C270: =(K270*$K$6)+(L270*$L$6)+(M270*$M$6)+(N270*$N$6)+(O270*$O$6)+(P270*100*$P$6)+(Q270*100*$Q$6)+(R270*100*$R$6)+(S270*100*$S$6)+(T270*$T$6)+(U270*$U$6)+(V270*$V$6)+(W270*$W$6)+(X270*$X$6)+(Y270*$Y$6)+(Z270*$Z$6)+(AB270*$AA$6) -> 18.228999999999999 | D270: AB | E270: 4 | F270: Rev | G270: Alliance AB Revered | I270: 38 | J270: P | K270: 129 | L270: 8 | M270: 10 | O270: 6 | AA270: 7 | AB270: 7 | AC270: Inc. Run Spd
A271: Defiler's Leather Boots (38) | B271: =(K271*$K$5)+(L271*$L$5)+(M271*$M$5)+(N271*$N$5)+(O271*$O$5)+(P271*100*$P$5)+(Q271*100*$Q$5)+(R271*100*$R$5)+(S271*100*$S$5)+(T271*$T$5)+(U271*$U$5)+(V271*$V$5)+(W271*$W$5)+(X271*$X$5)+(Y271*$Y$5)+(Z271*$Z$5)+(AA271*$AA$5) -> 29.29 | C271: =(K271*$K$6)+(L271*$L$6)+(M271*$M$6)+(N271*$N$6)+(O271*$O$6)+(P271*100*$P$6)+(Q271*100*$Q$6)+(R271*100*$R$6)+(S271*100*$S$6)+(T271*$T$6)+(U271*$U$6)+(V271*$V$6)+(W271*$W$6)+(X271*$X$6)+(Y271*$Y$6)+(Z271*$Z$6)+(AB271*$AA$6) -> 18.228999999999999 | D271: AB | E271: 4 | F271: Rev | G271: Horde AB Revered | I271: 38 | J271: P | K271: 129 | L271: 8 | M271: 10 | O271: 6 | AA271: 7 | AB271: 7 | AC271: Inc. Run Spd
A272: Shadefiend Boots | B272: =(K272*$K$5)+(L272*$L$5)+(M272*$M$5)+(N272*$N$5)+(O272*$O$5)+(P272*100*$P$5)+(Q272*100*$Q$5)+(R272*100*$R$5)+(S272*100*$S$5)+(T272*$T$5)+(U272*$U$5)+(V272*$V$5)+(W272*$W$5)+(X272*$X$5)+(Y272*$Y$5)+(Z272*$Z$5)+(AA272*$AA$5) -> 30.09 | C272: =(K272*$K$6)+(L272*$L$6)+(M272*$M$6)+(N272*$N$6)+(O272*$O$6)+(P272*100*$P$6)+(Q272*100*$Q$6)+(R272*100*$R$6)+(S272*100*$S$6)+(T272*$T$6)+(U272*$U$6)+(V272*$V$6)+(W272*$W$6)+(X272*$X$6)+(Y272*$Y$6)+(Z272*$Z$6)+(AB272*$AA$6) -> 16.239000000000001 | D272: BRD | E272: 1 | F272: 00.37 | G272: Anub'shiah | I272: 50 | J272: P | K272: 109 | L272: 11 | M272: 13 | N272: 10
A273: Abyssal Leather Boots of Striking | B273: =(K273*$K$5)+(L273*$L$5)+(M273*$M$5)+(N273*$N$5)+(O273*$O$5)+(P273*100*$P$5)+(Q273*100*$Q$5)+(R273*100*$R$5)+(S273*100*$S$5)+(T273*$T$5)+(U273*$U$5)+(V273*$V$5)+(W273*$W$5)+(X273*$X$5)+(Y273*$Y$5)+(Z273*$Z$5)+(AA273*$AA$5) -> 27.06 | C273: =(K273*$K$6)+(L273*$L$6)+(M273*$M$6)+(N273*$N$6)+(O273*$O$6)+(P273*100*$P$6)+(Q273*100*$Q$6)+(R273*100*$R$6)+(S273*100*$S$6)+(T273*$T$6)+(U273*$U$6)+(V273*$V$6)+(W273*$W$6)+(X273*$X$6)+(Y273*$Y$6)+(Z273*$Z$6)+(AB273*$AA$6) -> 16.206 | D273: Sil | E273: 4 | F273: 00.16 | G273: Hoary Templar | I273: 55 | J273: E | K273: 106 | L273: 11 | M273: 10 | N273: 10
A274: Knight-Lt.'s Leather Walkers | B274: =(K274*$K$5)+(L274*$L$5)+(M274*$M$5)+(N274*$N$5)+(O274*$O$5)+(P274*100*$P$5)+(Q274*100*$Q$5)+(R274*100*$R$5)+(S274*100*$S$5)+(T274*$T$5)+(U274*$U$5)+(V274*$V$5)+(W274*$W$5)+(X274*$X$5)+(Y274*$Y$5)+(Z274*$Z$5)+(AA274*$AA$5) -> 36.66 | C274: =(K274*$K$6)+(L274*$L$6)+(M274*$M$6)+(N274*$N$6)+(O274*$O$6)+(P274*100*$P$6)+(Q274*100*$Q$6)+(R274*100*$R$6)+(S274*100*$S$6)+(T274*$T$6)+(U274*$U$6)+(V274*$V$6)+(W274*$W$6)+(X274*$X$6)+(Y274*$Y$6)+(Z274*$Z$6)+(AB274*$AA$6) -> 15.346 | D274: PVP | E274: 2 | F274: K-L | G274: Alliance Rank 7 PVP | H274: LCG | I274: 60 | J274: P | K274: 166 | M274: 18 | O274: 28 | AA274: 3 | AB274: 1 | AC274: Sprint +3 sec.
A275: Blood Guard's Leather Walkers | B275: =(K275*$K$5)+(L275*$L$5)+(M275*$M$5)+(N275*$N$5)+(O275*$O$5)+(P275*100*$P$5)+(Q275*100*$Q$5)+(R275*100*$R$5)+(S275*100*$S$5)+(T275*$T$5)+(U275*$U$5)+(V275*$V$5)+(W275*$W$5)+(X275*$X$5)+(Y275*$Y$5)+(Z275*$Z$5)+(AA275*$AA$5) -> 36.66 | C275: =(K275*$K$6)+(L275*$L$6)+(M275*$M$6)+(N275*$N$6)+(O275*$O$6)+(P275*100*$P$6)+(Q275*100*$Q$6)+(R275*100*$R$6)+(S275*100*$S$6)+(T275*$T$6)+(U275*$U$6)+(V275*$V$6)+(W275*$W$6)+(X275*$X$6)+(Y275*$Y$6)+(Z275*$Z$6)+(AB275*$AA$6) -> 15.346 | D275: PVP | E275: 2 | F275: K-L | G275: Horde Rank 7 PVP | H275: CV | I275: 60 | J275: P | K275: 166 | M275: 18 | O275: 28 | AA275: 3 | AB275: 1 | AC275: Sprint +3 sec.
A276: Defiler's Leather Boots (28) | B276: =(K276*$K$5)+(L276*$L$5)+(M276*$M$5)+(N276*$N$5)+(O276*$O$5)+(P276*100*$P$5)+(Q276*100*$Q$5)+(R276*100*$R$5)+(S276*100*$S$5)+(T276*$T$5)+(U276*$U$5)+(V276*$V$5)+(W276*$W$5)+(X276*$X$5)+(Y276*$Y$5)+(Z276*$Z$5)+(AA276*$AA$5) -> 23.04 | C276: =(K276*$K$6)+(L276*$L$6)+(M276*$M$6)+(N276*$N$6)+(O276*$O$6)+(P276*100*$P$6)+(Q276*100*$Q$6)+(R276*100*$R$6)+(S276*100*$S$6)+(T276*$T$6)+(U276*$U$6)+(V276*$V$6)+(W276*$W$6)+(X276*$X$6)+(Y276*$Y$6)+(Z276*$Z$6)+(AB276*$AA$6) -> 14.184000000000001 | D276: AB | E276: 4 | F276: Rev | G276: Horde AB Revered | I276: 28 | J276: P | K276: 104 | L276: 7 | M276: 8 | AA276: 7 | AB276: 7 | AC276: Inc. Run Spd
A277: Highlander's Leather Boots (28) | B277: =(K277*$K$5)+(L277*$L$5)+(M277*$M$5)+(N277*$N$5)+(O277*$O$5)+(P277*100*$P$5)+(Q277*100*$Q$5)+(R277*100*$R$5)+(S277*100*$S$5)+(T277*$T$5)+(U277*$U$5)+(V277*$V$5)+(W277*$W$5)+(X277*$X$5)+(Y277*$Y$5)+(Z277*$Z$5)+(AA277*$AA$5) -> 23.04 | C277: =(K277*$K$6)+(L277*$L$6)+(M277*$M$6)+(N277*$N$6)+(O277*$O$6)+(P277*100*$P$6)+(Q277*100*$Q$6)+(R277*100*$R$6)+(S277*100*$S$6)+(T277*$T$6)+(U277*$U$6)+(V277*$V$6)+(W277*$W$6)+(X277*$X$6)+(Y277*$Y$6)+(Z277*$Z$6)+(AB277*$AA$6) -> 14.184000000000001 | D277: AB | E277: 4 | F277: Rev | G277: Alliance AB Revered | I277: 28 | J277: P | K277: 104 | L277: 7 | M277: 8 | AA277: 7 | AB277: 7 | AC277: Inc. Run Spd
A278: Corehound Boots | B278: =(K278*$K$5)+(L278*$L$5)+(M278*$M$5)+(N278*$N$5)+(O278*$O$5)+(P278*100*$P$5)+(Q278*100*$Q$5)+(R278*100*$R$5)+(S278*100*$S$5)+(T278*$T$5)+(U278*$U$5)+(V278*$V$5)+(W278*$W$5)+(X278*$X$5)+(Y278*$Y$5)+(Z278*$Z$5)+(AA278*$AA$5) -> 26.66 | C278: =(K278*$K$6)+(L278*$L$6)+(M278*$M$6)+(N278*$N$6)+(O278*$O$6)+(P278*100*$P$6)+(Q278*100*$Q$6)+(R278*100*$R$6)+(S278*100*$S$6)+(T278*$T$6)+(U278*$U$6)+(V278*$V$6)+(W278*$W$6)+(X278*$X$6)+(Y278*$Y$6)+(Z278*$Z$6)+(AB278*$AA$6) -> 13.465999999999999 | D278: LW | E278: 1 | F278: 295 | G278: Thorium Friendly | I278: 54 | J278: E | K278: 126 | L278: 13 | M278: 10 | V278: 24
A279: Ash Covered Boots | B279: =(K279*$K$5)+(L279*$L$5)+(M279*$M$5)+(N279*$N$5)+(O279*$O$5)+(P279*100*$P$5)+(Q279*100*$Q$5)+(R279*100*$R$5)+(S279*100*$S$5)+(T279*$T$5)+(U279*$U$5)+(V279*$V$5)+(W279*$W$5)+(X279*$X$5)+(Y279*$Y$5)+(Z279*$Z$5)+(AA279*$AA$5) -> 30.18 | C279: =(K279*$K$6)+(L279*$L$6)+(M279*$M$6)+(N279*$N$6)+(O279*$O$6)+(P279*100*$P$6)+(Q279*100*$Q$6)+(R279*100*$R$6)+(S279*100*$S$6)+(T279*$T$6)+(U279*$U$6)+(V279*$V$6)+(W279*$W$6)+(X279*$X$6)+(Y279*$Y$6)+(Z279*$Z$6)+(AB279*$AA$6) -> 13.258000000000001 | D279: Str | E279: 1 | F279: 00.09 | G279: Archivist Galford | I279: 56 | J279: P | K279: 118 | L279: 13 | M279: 13 | S279: 00.01
A280: Swampwalker Boots | B280: =(K280*$K$5)+(L280*$L$5)+(M280*$M$5)+(N280*$N$5)+(O280*$O$5)+(P280*100*$P$5)+(Q280*100*$Q$5)+(R280*100*$R$5)+(S280*100*$S$5)+(T280*$T$5)+(U280*$U$5)+(V280*$V$5)+(W280*$W$5)+(X280*$X$5)+(Y280*$Y$5)+(Z280*$Z$5)+(AA280*$AA$5) -> 19.79 | C280: =(K280*$K$6)+(L280*$L$6)+(M280*$M$6)+(N280*$N$6)+(O280*$O$6)+(P280*100*$P$6)+(Q280*100*$Q$6)+(R280*100*$R$6)+(S280*100*$S$6)+(T280*$T$6)+(U280*$U$6)+(V280*$V$6)+(W280*$W$6)+(X280*$X$6)+(Y280*$Y$6)+(Z280*$Z$6)+(AB280*$AA$6) -> 13.139000000000001 | D280: R | E280: 1 | F280: 34-39 | G280: Random World Drop | I280: 32 | J280: E | K280: 79 | L280: 13 | M280: 6
A281: Cadaverous Walkers | B281: =(K281*$K$5)+(L281*$L$5)+(M281*$M$5)+(N281*$N$5)+(O281*$O$5)+(P281*100*$P$5)+(Q281*100*$Q$5)+(R281*100*$R$5)+(S281*100*$S$5)+(T281*$T$5)+(U281*$U$5)+(V281*$V$5)+(W281*$W$5)+(X281*$X$5)+(Y281*$Y$5)+(Z281*$Z$5)+(AA281*$AA$5) -> 33.18 | C281: =(K281*$K$6)+(L281*$L$6)+(M281*$M$6)+(N281*$N$6)+(O281*$O$6)+(P281*100*$P$6)+(Q281*100*$Q$6)+(R281*100*$R$6)+(S281*100*$S$6)+(T281*$T$6)+(U281*$U$6)+(V281*$V$6)+(W281*$W$6)+(X281*$X$6)+(Y281*$Y$6)+(Z281*$Z$6)+(AB281*$AA$6) -> 12.318 | D281: Sch | E281: 1 | F281: 00.04 | G281: Scholo Boss Drop | H281: Cad | I281: 56 | J281: P | K281: 118 | M281: 20 | O281: 24
A282: Blood Guard's Leather Treads | B282: =(K282*$K$5)+(L282*$L$5)+(M282*$M$5)+(N282*$N$5)+(O282*$O$5)+(P282*100*$P$5)+(Q282*100*$Q$5)+(R282*100*$R$5)+(S282*100*$S$5)+(T282*$T$5)+(U282*$U$5)+(V282*$V$5)+(W282*$W$5)+(X282*$X$5)+(Y282*$Y$5)+(Z282*$Z$5)+(AA282*$AA$5) -> 33.21 | C282: =(K282*$K$6)+(L282*$L$6)+(M282*$M$6)+(N282*$N$6)+(O282*$O$6)+(P282*100*$P$6)+(Q282*100*$Q$6)+(R282*100*$R$6)+(S282*100*$S$6)+(T282*$T$6)+(U282*$U$6)+(V282*$V$6)+(W282*$W$6)+(X282*$X$6)+(Y282*$Y$6)+(Z282*$Z$6)+(AB282*$AA$6) -> 12.301 | D282: PVP | E282: 2 | F282: K-L | G282: Horde Rank 7 PVP | H282: CG | I282: 58 | J282: P | K282: 121 | L282: 11 | M282: 18 | AA282: 3 | AB282: 1 | AC282: Sprint +3 sec.
A283: Knight-Lt.'s Leather Boots | B283: =(K283*$K$5)+(L283*$L$5)+(M283*$M$5)+(N283*$N$5)+(O283*$O$5)+(P283*100*$P$5)+(Q283*100*$Q$5)+(R283*100*$R$5)+(S283*100*$S$5)+(T283*$T$5)+(U283*$U$5)+(V283*$V$5)+(W283*$W$5)+(X283*$X$5)+(Y283*$Y$5)+(Z283*$Z$5)+(AA283*$AA$5) -> 33.21 | C283: =(K283*$K$6)+(L283*$L$6)+(M283*$M$6)+(N283*$N$6)+(O283*$O$6)+(P283*100*$P$6)+(Q283*100*$Q$6)+(R283*100*$R$6)+(S283*100*$S$6)+(T283*$T$6)+(U283*$U$6)+(V283*$V$6)+(W283*$W$6)+(X283*$X$6)+(Y283*$Y$6)+(Z283*$Z$6)+(AB283*$AA$6) -> 12.301 | D283: PVP | E283: 2 | F283: K-L | G283: Alliance Rank 7 PVP | H283: LCV | I283: 58 | J283: P | K283: 121 | L283: 11 | M283: 18 | AA283: 3 | AB283: 1 | AC283: Sprint +3 sec.
A285: WRIST | B285: AEP | C285: MAEP | D285: Loc | E285: P | F285: Info | G285: Source | H285: Set | I285: Lvl | J285: B | K285: Arm | L285: Agi | M285: Sta | N285: Str | O285: AP | P285: Cri | Q285: Hit | R285: Par | S285: Dod | T285: Def | U285: Ar | V285: Fi | W285: Fr | X285: Na | Y285: Sh | Z285: H/5 | AA285: PVP | AB285: PVE | AC285: Special
A286: Bonescythe Bracers | B286: =(K286*$K$5)+(L286*$L$5)+(M286*$M$5)+(N286*$N$5)+(O286*$O$5)+(P286*100*$P$5)+(Q286*100*$Q$5)+(R286*100*$R$5)+(S286*100*$S$5)+(T286*$T$5)+(U286*$U$5)+(V286*$V$5)+(W286*$W$5)+(X286*$X$5)+(Y286*$Y$5)+(Z286*$Z$5)+(AA286*$AA$5) -> 51.11 | C286: =(K286*$K$6)+(L286*$L$6)+(M286*$M$6)+(N286*$N$6)+(O286*$O$6)+(P286*100*$P$6)+(Q286*100*$Q$6)+(R286*100*$R$6)+(S286*100*$S$6)+(T286*$T$6)+(U286*$U$6)+(V286*$V$6)+(W286*$W$6)+(X286*$X$6)+(Y286*$Y$6)+(Z286*$Z$6)+(AB286*$AA$6) -> 36.251000000000005 | D286: Naxx | E286: 6 | F286: Q | G286: Anub/Gr Wdw/Gluth | H286: BS | I286: 60 | J286: P | K286: 111 | L286: 26 | M286: 14 | P286: 00.01
A287: Qiraji Execution Bracers | B287: =(K287*$K$5)+(L287*$L$5)+(M287*$M$5)+(N287*$N$5)+(O287*$O$5)+(P287*100*$P$5)+(Q287*100*$Q$5)+(R287*100*$R$5)+(S287*100*$S$5)+(T287*$T$5)+(U287*$U$5)+(V287*$V$5)+(W287*$W$5)+(X287*$X$5)+(Y287*$Y$5)+(Z287*$Z$5)+(AA287*$AA$5) -> 46.03 | C287: =(K287*$K$6)+(L287*$L$6)+(M287*$M$6)+(N287*$N$6)+(O287*$O$6)+(P287*100*$P$6)+(Q287*100*$Q$6)+(R287*100*$R$6)+(S287*100*$S$6)+(T287*$T$6)+(U287*$U$6)+(V287*$V$6)+(W287*$W$6)+(X287*$X$6)+(Y287*$Y$6)+(Z287*$Z$6)+(AB287*$AA$6) -> 31.243000000000002 | D287: AQ40 | E287: 5 | F287: 00.17 | G287: Emperor Vek'lor | I287: 60 | J287: P | K287: 103 | L287: 16 | M287: 14 | N287: 15 | Q287: 00.01
A288: Bloodfang Bracers | B288: =(K288*$K$5)+(L288*$L$5)+(M288*$M$5)+(N288*$N$5)+(O288*$O$5)+(P288*100*$P$5)+(Q288*100*$Q$5)+(R288*100*$R$5)+(S288*100*$S$5)+(T288*$T$5)+(U288*$U$5)+(V288*$V$5)+(W288*$W$5)+(X288*$X$5)+(Y288*$Y$5)+(Z288*$Z$5)+(AA288*$AA$5) -> 44.48 | C288: =(K288*$K$6)+(L288*$L$6)+(M288*$M$6)+(N288*$N$6)+(O288*$O$6)+(P288*100*$P$6)+(Q288*100*$Q$6)+(R288*100*$R$6)+(S288*100*$S$6)+(T288*$T$6)+(U288*$U$6)+(V288*$V$6)+(W288*$W$6)+(X288*$X$6)+(Y288*$Y$6)+(Z288*$Z$6)+(AB288*$AA$6) -> 30.727999999999998 | D288: BWL | E288: 3 | F288: 00.21 | G288: Razorgore | H288: BF | I288: 60 | J288: P | K288: 98 | L288: 23 | M288: 13 | Q288: 00.01
A289: Forest Stalker's Bracers (60) | B289: =(K289*$K$5)+(L289*$L$5)+(M289*$M$5)+(N289*$N$5)+(O289*$O$5)+(P289*100*$P$5)+(Q289*100*$Q$5)+(R289*100*$R$5)+(S289*100*$S$5)+(T289*$T$5)+(U289*$U$5)+(V289*$V$5)+(W289*$W$5)+(X289*$X$5)+(Y289*$Y$5)+(Z289*$Z$5)+(AA289*$AA$5) -> 33.36 | C289: =(K289*$K$6)+(L289*$L$6)+(M289*$M$6)+(N289*$N$6)+(O289*$O$6)+(P289*100*$P$6)+(Q289*100*$Q$6)+(R289*100*$R$6)+(S289*100*$S$6)+(T289*$T$6)+(U289*$U$6)+(V289*$V$6)+(W289*$W$6)+(X289*$X$6)+(Y289*$Y$6)+(Z289*$Z$6)+(AB289*$AA$6) -> 24.665999999999997 | D289: WSG | E289: 3 | F289: Exa | G289: WSG Exalted Reward | I289: 60 | J289: P | K289: 86 | L289: 19 | M289: 8 | N289: 11
A290: Wristwraps of Undead Slaying | B290: =(K290*$K$5)+(L290*$L$5)+(M290*$M$5)+(N290*$N$5)+(O290*$O$5)+(P290*100*$P$5)+(Q290*100*$Q$5)+(R290*100*$R$5)+(S290*100*$S$5)+(T290*$T$5)+(U290*$U$5)+(V290*$V$5)+(W290*$W$5)+(X290*$X$5)+(Y290*$Y$5)+(Z290*$Z$5)+(AA290*$AA$5) -> 33.27 | C290: =(K290*$K$6)+(L290*$L$6)+(M290*$M$6)+(N290*$N$6)+(O290*$O$6)+(P290*100*$P$6)+(Q290*100*$Q$6)+(R290*100*$R$6)+(S290*100*$S$6)+(T290*$T$6)+(U290*$U$6)+(V290*$V$6)+(W290*$W$6)+(X290*$X$6)+(Y290*$Y$6)+(Z290*$Z$6)+(AB290*$AA$6) -> 22.677 | D290: R | E290: 6 | F290: 59-60 | G290: Scourge Invasion | H290: US | I290: 58 | J290: E | K290: 77 | M290: 10 | O290: 45 | AC290: +45AP vs Und
A291: Bracers of the Eclipse | B291: =(K291*$K$5)+(L291*$L$5)+(M291*$M$5)+(N291*$N$5)+(O291*$O$5)+(P291*100*$P$5)+(Q291*100*$Q$5)+(R291*100*$R$5)+(S291*100*$S$5)+(T291*$T$5)+(U291*$U$5)+(V291*$V$5)+(W291*$W$5)+(X291*$X$5)+(Y291*$Y$5)+(Z291*$Z$5)+(AA291*$AA$5) -> 31.76 | C291: =(K291*$K$6)+(L291*$L$6)+(M291*$M$6)+(N291*$N$6)+(O291*$O$6)+(P291*100*$P$6)+(Q291*100*$Q$6)+(R291*100*$R$6)+(S291*100*$S$6)+(T291*$T$6)+(U291*$U$6)+(V291*$V$6)+(W291*$W$6)+(X291*$X$6)+(Y291*$Y$6)+(Z291*$Z$6)+(AB291*$AA$6) -> 22.166 | D291: DM-W | E291: 2 | F291: 00.19 | G291: Prince Tortheldrin | I291: 57 | J291: P | K291: 76 | L291: 10 | M291: 9 | O291: 24
A292: Primal Batskin Bracers | B292: =(K292*$K$5)+(L292*$L$5)+(M292*$M$5)+(N292*$N$5)+(O292*$O$5)+(P292*100*$P$5)+(Q292*100*$Q$5)+(R292*100*$R$5)+(S292*100*$S$5)+(T292*$T$5)+(U292*$U$5)+(V292*$V$5)+(W292*$W$5)+(X292*$X$5)+(Y292*$Y$5)+(Z292*$Z$5)+(AA292*$AA$5) -> 29.29 | C292: =(K292*$K$6)+(L292*$L$6)+(M292*$M$6)+(N292*$N$6)+(O292*$O$6)+(P292*100*$P$6)+(Q292*100*$Q$6)+(R292*100*$R$6)+(S292*100*$S$6)+(T292*$T$6)+(U292*$U$6)+(V292*$V$6)+(W292*$W$6)+(X292*$X$6)+(Y292*$Y$6)+(Z292*$Z$6)+(AB292*$AA$6) -> 21.649000000000001 | D292: LW | E292: 4 | F292: 300 | G292: Zandalar Friendly | H292: PB | I292: 60 | J292: E | K292: 79 | L292: 14 | M292: 7 | Q292: 00.01
A293: Forest Stalker's Bracers (50) | B293: =(K293*$K$5)+(L293*$L$5)+(M293*$M$5)+(N293*$N$5)+(O293*$O$5)+(P293*100*$P$5)+(Q293*100*$Q$5)+(R293*100*$R$5)+(S293*100*$S$5)+(T293*$T$5)+(U293*$U$5)+(V293*$V$5)+(W293*$W$5)+(X293*$X$5)+(Y293*$Y$5)+(Z293*$Z$5)+(AA293*$AA$5) -> 29.25 | C293: =(K293*$K$6)+(L293*$L$6)+(M293*$M$6)+(N293*$N$6)+(O293*$O$6)+(P293*100*$P$6)+(Q293*100*$Q$6)+(R293*100*$R$6)+(S293*100*$S$6)+(T293*$T$6)+(U293*$U$6)+(V293*$V$6)+(W293*$W$6)+(X293*$X$6)+(Y293*$Y$6)+(Z293*$Z$6)+(AB293*$AA$6) -> 21.645 | D293: WSG | E293: 3 | F293: Exa | G293: WSG Exalted Reward | I293: 50 | J293: P | K293: 75 | L293: 17 | M293: 7 | N293: 9
A294: Nightslayer Bracelets | B294: =(K294*$K$5)+(L294*$L$5)+(M294*$M$5)+(N294*$N$5)+(O294*$O$5)+(P294*100*$P$5)+(Q294*100*$Q$5)+(R294*100*$R$5)+(S294*100*$S$5)+(T294*$T$5)+(U294*$U$5)+(V294*$V$5)+(W294*$W$5)+(X294*$X$5)+(Y294*$Y$5)+(Z294*$Z$5)+(AA294*$AA$5) -> 35.88 | C294: =(K294*$K$6)+(L294*$L$6)+(M294*$M$6)+(N294*$N$6)+(O294*$O$6)+(P294*100*$P$6)+(Q294*100*$Q$6)+(R294*100*$R$6)+(S294*100*$S$6)+(T294*$T$6)+(U294*$U$6)+(V294*$V$6)+(W294*$W$6)+(X294*$X$6)+(Y294*$Y$6)+(Z294*$Z$6)+(AB294*$AA$6) -> 20.238 | D294: MC | E294: 1 | F294: R | G294: Random MC Drop | H294: NS | I294: 60 | J294: E | K294: 88 | L294: 20 | M294: 15
A295: Bracers of Subterfuge | B295: =(K295*$K$5)+(L295*$L$5)+(M295*$M$5)+(N295*$N$5)+(O295*$O$5)+(P295*100*$P$5)+(Q295*100*$Q$5)+(R295*100*$R$5)+(S295*100*$S$5)+(T295*$T$5)+(U295*$U$5)+(V295*$V$5)+(W295*$W$5)+(X295*$X$5)+(Y295*$Y$5)+(Z295*$Z$5)+(AA295*$AA$5) -> 32.81 | C295: =(K295*$K$6)+(L295*$L$6)+(M295*$M$6)+(N295*$N$6)+(O295*$O$6)+(P295*100*$P$6)+(Q295*100*$Q$6)+(R295*100*$R$6)+(S295*100*$S$6)+(T295*$T$6)+(U295*$U$6)+(V295*$V$6)+(W295*$W$6)+(X295*$X$6)+(Y295*$Y$6)+(Z295*$Z$6)+(AB295*$AA$6) -> 20.201000000000001 | D295: EPL | E295: 6 | F295: AD | G295: AD Quest Reward | I295: 55 | J295: P | K295: 81 | L295: 15 | M295: 12 | N295: 10
A296: Scaled Bracers of the Gorger | B296: =(K296*$K$5)+(L296*$L$5)+(M296*$M$5)+(N296*$N$5)+(O296*$O$5)+(P296*100*$P$5)+(Q296*100*$Q$5)+(R296*100*$R$5)+(S296*100*$S$5)+(T296*$T$5)+(U296*$U$5)+(V296*$V$5)+(W296*$W$5)+(X296*$X$5)+(Y296*$Y$5)+(Z296*$Z$5)+(AA296*$AA$5) -> 28.87 | C296: =(K296*$K$6)+(L296*$L$6)+(M296*$M$6)+(N296*$N$6)+(O296*$O$6)+(P296*100*$P$6)+(Q296*100*$Q$6)+(R296*100*$R$6)+(S296*100*$S$6)+(T296*$T$6)+(U296*$U$6)+(V296*$V$6)+(W296*$W$6)+(X296*$X$6)+(Y296*$Y$6)+(Z296*$Z$6)+(AB296*$AA$6) -> 20.167000000000002 | D296: AQ20 | E296: 5 | F296: 00.24 | G296: Buru the Gorger | I296: 60 | J296: P | K296: 87 | L296: 15 | M296: 8 | N296: 10
A297: Zandalar Madcap's Bracers | B297: =(K297*$K$5)+(L297*$L$5)+(M297*$M$5)+(N297*$N$5)+(O297*$O$5)+(P297*100*$P$5)+(Q297*100*$Q$5)+(R297*100*$R$5)+(S297*100*$S$5)+(T297*$T$5)+(U297*$U$5)+(V297*$V$5)+(W297*$W$5)+(X297*$X$5)+(Y297*$Y$5)+(Z297*$Z$5)+(AA297*$AA$5) -> 33.32 | C297: =(K297*$K$6)+(L297*$L$6)+(M297*$M$6)+(N297*$N$6)+(O297*$O$6)+(P297*100*$P$6)+(Q297*100*$Q$6)+(R297*100*$R$6)+(S297*100*$S$6)+(T297*$T$6)+(U297*$U$6)+(V297*$V$6)+(W297*$W$6)+(X297*$X$6)+(Y297*$Y$6)+(Z297*$Z$6)+(AB297*$AA$6) -> 18.722000000000001 | D297: ZG | E297: 4 | F297: Q | G297: Zandalar - Friendly | H297: MO | I297: 58 | J297: P | K297: 82 | L297: 14 | M297: 14 | N297: 9
A298: Darkmantle Bracers | B298: =(K298*$K$5)+(L298*$L$5)+(M298*$M$5)+(N298*$N$5)+(O298*$O$5)+(P298*100*$P$5)+(Q298*100*$Q$5)+(R298*100*$R$5)+(S298*100*$S$5)+(T298*$T$5)+(U298*$U$5)+(V298*$V$5)+(W298*$W$5)+(X298*$X$5)+(Y298*$Y$5)+(Z298*$Z$5)+(AA298*$AA$5) -> 26.29 | C298: =(K298*$K$6)+(L298*$L$6)+(M298*$M$6)+(N298*$N$6)+(O298*$O$6)+(P298*100*$P$6)+(Q298*100*$Q$6)+(R298*100*$R$6)+(S298*100*$S$6)+(T298*$T$6)+(U298*$U$6)+(V298*$V$6)+(W298*$W$6)+(X298*$X$6)+(Y298*$Y$6)+(Z298*$Z$6)+(AB298*$AA$6) -> 18.649000000000001 | D298: Q | E298: 5 | F298: Q | G298: SC Upgrade Quest | H298: DM | I298: 58 | J298: P | K298: 79 | L298: 15 | M298: 7 | N298: 7
A299: Abyssal Leather Bracers of Stri. | B299: =(K299*$K$5)+(L299*$L$5)+(M299*$M$5)+(N299*$N$5)+(O299*$O$5)+(P299*100*$P$5)+(Q299*100*$Q$5)+(R299*100*$R$5)+(S299*100*$S$5)+(T299*$T$5)+(U299*$U$5)+(V299*$V$5)+(W299*$W$5)+(X299*$X$5)+(Y299*$Y$5)+(Z299*$Z$5)+(AA299*$AA$5) -> 30.82 | C299: =(K299*$K$6)+(L299*$L$6)+(M299*$M$6)+(N299*$N$6)+(O299*$O$6)+(P299*100*$P$6)+(Q299*100*$Q$6)+(R299*100*$R$6)+(S299*100*$S$6)+(T299*$T$6)+(U299*$U$6)+(V299*$V$6)+(W299*$W$6)+(X299*$X$6)+(Y299*$Y$6)+(Z299*$Z$6)+(AB299*$AA$6) -> 18.201999999999998 | D299: Sil | E299: 4 | F299: 00.3 | G299: Prince Skaldrenox | I299: 60 | J299: P | K299: 82 | L299: 12 | M299: 12 | N299: 12
A300: Forest Stalker's Bracers (40) | B300: =(K300*$K$5)+(L300*$L$5)+(M300*$M$5)+(N300*$N$5)+(O300*$O$5)+(P300*100*$P$5)+(Q300*100*$Q$5)+(R300*100*$R$5)+(S300*100*$S$5)+(T300*$T$5)+(U300*$U$5)+(V300*$V$5)+(W300*$W$5)+(X300*$X$5)+(Y300*$Y$5)+(Z300*$Z$5)+(AA300*$AA$5) -> 24.64 | C300: =(K300*$K$6)+(L300*$L$6)+(M300*$M$6)+(N300*$N$6)+(O300*$O$6)+(P300*100*$P$6)+(Q300*100*$Q$6)+(R300*100*$R$6)+(S300*100*$S$6)+(T300*$T$6)+(U300*$U$6)+(V300*$V$6)+(W300*$W$6)+(X300*$X$6)+(Y300*$Y$6)+(Z300*$Z$6)+(AB300*$AA$6) -> 18.124000000000002 | D300: WSG | E300: 3 | F300: Exa | G300: WSG Exalted Reward | I300: 40 | J300: P | K300: 64 | L300: 14 | M300: 6 | N300: 8
A301: Deepfury Bracers | B301: =(K301*$K$5)+(L301*$L$5)+(M301*$M$5)+(N301*$N$5)+(O301*$O$5)+(P301*100*$P$5)+(Q301*100*$Q$5)+(R301*100*$R$5)+(S301*100*$S$5)+(T301*$T$5)+(U301*$U$5)+(V301*$V$5)+(W301*$W$5)+(X301*$X$5)+(Y301*$Y$5)+(Z301*$Z$5)+(AA301*$AA$5) -> 21.69 | C301: =(K301*$K$6)+(L301*$L$6)+(M301*$M$6)+(N301*$N$6)+(O301*$O$6)+(P301*100*$P$6)+(Q301*100*$Q$6)+(R301*100*$R$6)+(S301*100*$S$6)+(T301*$T$6)+(U301*$U$6)+(V301*$V$6)+(W301*$W$6)+(X301*$X$6)+(Y301*$Y$6)+(Z301*$Z$6)+(AB301*$AA$6) -> 17.109000000000002 | D301: R | E301: 1 | F301: 52-62 | G301: Random World Drop | I301: 50 | J301: E | K301: 69 | L301: 15 | M301: 4 | N301: 4
A302: Dragonspur Wraps | B302: =(K302*$K$5)+(L302*$L$5)+(M302*$M$5)+(N302*$N$5)+(O302*$O$5)+(P302*100*$P$5)+(Q302*100*$Q$5)+(R302*100*$R$5)+(S302*100*$S$5)+(T302*$T$5)+(U302*$U$5)+(V302*$V$5)+(W302*$W$5)+(X302*$X$5)+(Y302*$Y$5)+(Z302*$Z$5)+(AA302*$AA$5) -> 35.93 | C302: =(K302*$K$6)+(L302*$L$6)+(M302*$M$6)+(N302*$N$6)+(O302*$O$6)+(P302*100*$P$6)+(Q302*100*$Q$6)+(R302*100*$R$6)+(S302*100*$S$6)+(T302*$T$6)+(U302*$U$6)+(V302*$V$6)+(W302*$W$6)+(X302*$X$6)+(Y302*$Y$6)+(Z302*$Z$6)+(AB302*$AA$6) -> 16.462999999999997 | D302: 4D | E302: 4 | F302: 00.13 | G302: 4 Dragons | I302: 60 | J302: P | K302: 93 | M302: 17 | O302: 32 | U302: 4 | V302: 4 | W302: 4 | X302: 4 | Y302: 4
A303: Cinderhide Armsplints of the Tiger | B303: =(K303*$K$5)+(L303*$L$5)+(M303*$M$5)+(N303*$N$5)+(O303*$O$5)+(P303*100*$P$5)+(Q303*100*$Q$5)+(R303*100*$R$5)+(S303*100*$S$5)+(T303*$T$5)+(U303*$U$5)+(V303*$V$5)+(W303*$W$5)+(X303*$X$5)+(Y303*$Y$5)+(Z303*$Z$5)+(AA303*$AA$5) -> 16.71 | C303: =(K303*$K$6)+(L303*$L$6)+(M303*$M$6)+(N303*$N$6)+(O303*$O$6)+(P303*100*$P$6)+(Q303*100*$Q$6)+(R303*100*$R$6)+(S303*100*$S$6)+(T303*$T$6)+(U303*$U$6)+(V303*$V$6)+(W303*$W$6)+(X303*$X$6)+(Y303*$Y$6)+(Z303*$Z$6)+(AB303*$AA$6) -> 15.170999999999999 | D303: BRD | E303: 1 | F303: 00.01 | G303: Lord Incendius | I303: 52 | J303: P | K303: 71 | L303: 10 | N303: 10 | V303: 10
A304: Shadowcraft Bracers | B304: =(K304*$K$5)+(L304*$L$5)+(M304*$M$5)+(N304*$N$5)+(O304*$O$5)+(P304*100*$P$5)+(Q304*100*$Q$5)+(R304*100*$R$5)+(S304*100*$S$5)+(T304*$T$5)+(U304*$U$5)+(V304*$V$5)+(W304*$W$5)+(X304*$X$5)+(Y304*$Y$5)+(Z304*$Z$5)+(AA304*$AA$5) -> 22.71 | C304: =(K304*$K$6)+(L304*$L$6)+(M304*$M$6)+(N304*$N$6)+(O304*$O$6)+(P304*100*$P$6)+(Q304*100*$Q$6)+(R304*100*$R$6)+(S304*100*$S$6)+(T304*$T$6)+(U304*$U$6)+(V304*$V$6)+(W304*$W$6)+(X304*$X$6)+(Y304*$Y$6)+(Z304*$Z$6)+(AB304*$AA$6) -> 15.141 | D304: Sch | E304: 1 | F304: 58-61 | G304: Scholo Mob Drop | H304: SC | I304: 52 | J304: E | K304: 71 | L304: 15 | M304: 7
A305: Darkwater Bracers of the Tiger | B305: =(K305*$K$5)+(L305*$L$5)+(M305*$M$5)+(N305*$N$5)+(O305*$O$5)+(P305*100*$P$5)+(Q305*100*$Q$5)+(R305*100*$R$5)+(S305*100*$S$5)+(T305*$T$5)+(U305*$U$5)+(V305*$V$5)+(W305*$W$5)+(X305*$X$5)+(Y305*$Y$5)+(Z305*$Z$5)+(AA305*$AA$5) -> 16.36 | C305: =(K305*$K$6)+(L305*$L$6)+(M305*$M$6)+(N305*$N$6)+(O305*$O$6)+(P305*100*$P$6)+(Q305*100*$Q$6)+(R305*100*$R$6)+(S305*100*$S$6)+(T305*$T$6)+(U305*$U$6)+(V305*$V$6)+(W305*$W$6)+(X305*$X$6)+(Y305*$Y$6)+(Z305*$Z$6)+(AB305*$AA$6) -> 15.136000000000001 | D305: ToAH | E305: 1 | F305: 00.09 | G305: Atal'alarion | I305: 47 | J305: P | K305: 66 | L305: 10 | N305: 10 | Y305: 7
A306: Adv. Bracers of the Tiger | B306: =(K306*$K$5)+(L306*$L$5)+(M306*$M$5)+(N306*$N$5)+(O306*$O$5)+(P306*100*$P$5)+(Q306*100*$Q$5)+(R306*100*$R$5)+(S306*100*$S$5)+(T306*$T$5)+(U306*$U$5)+(V306*$V$5)+(W306*$W$5)+(X306*$X$5)+(Y306*$Y$5)+(Z306*$Z$5)+(AA306*$AA$5) -> 15.68 | C306: =(K306*$K$6)+(L306*$L$6)+(M306*$M$6)+(N306*$N$6)+(O306*$O$6)+(P306*100*$P$6)+(Q306*100*$Q$6)+(R306*100*$R$6)+(S306*100*$S$6)+(T306*$T$6)+(U306*$U$6)+(V306*$V$6)+(W306*$W$6)+(X306*$X$6)+(Y306*$Y$6)+(Z306*$Z$6)+(AB306*$AA$6) -> 15.068 | D306: R | E306: 1 | F306: 59-61 | G306: Random World Drop | I306: 56 | J306: E | K306: 68 | L306: 10 | N306: 10
A307: Mighty Armsplints of the Tiger | B307: =(K307*$K$5)+(L307*$L$5)+(M307*$M$5)+(N307*$N$5)+(O307*$O$5)+(P307*100*$P$5)+(Q307*100*$Q$5)+(R307*100*$R$5)+(S307*100*$S$5)+(T307*$T$5)+(U307*$U$5)+(V307*$V$5)+(W307*$W$5)+(X307*$X$5)+(Y307*$Y$5)+(Z307*$Z$5)+(AA307*$AA$5) -> 15.67 | C307: =(K307*$K$6)+(L307*$L$6)+(M307*$M$6)+(N307*$N$6)+(O307*$O$6)+(P307*100*$P$6)+(Q307*100*$Q$6)+(R307*100*$R$6)+(S307*100*$S$6)+(T307*$T$6)+(U307*$U$6)+(V307*$V$6)+(W307*$W$6)+(X307*$X$6)+(Y307*$Y$6)+(Z307*$Z$6)+(AB307*$AA$6) -> 15.067 | D307: R | E307: 1 | F307: 57-61 | G307: Random World Drop | I307: 55 | J307: E | K307: 67 | L307: 10 | N307: 10
A308: Supreme Bracers of the Tiger | B308: =(K308*$K$5)+(L308*$L$5)+(M308*$M$5)+(N308*$N$5)+(O308*$O$5)+(P308*100*$P$5)+(Q308*100*$Q$5)+(R308*100*$R$5)+(S308*100*$S$5)+(T308*$T$5)+(U308*$U$5)+(V308*$V$5)+(W308*$W$5)+(X308*$X$5)+(Y308*$Y$5)+(Z308*$Z$5)+(AA308*$AA$5) -> 15.67 | C308: =(K308*$K$6)+(L308*$L$6)+(M308*$M$6)+(N308*$N$6)+(O308*$O$6)+(P308*100*$P$6)+(Q308*100*$Q$6)+(R308*100*$R$6)+(S308*100*$S$6)+(T308*$T$6)+(U308*$U$6)+(V308*$V$6)+(W308*$W$6)+(X308*$X$6)+(Y308*$Y$6)+(Z308*$Z$6)+(AB308*$AA$6) -> 15.067 | D308: R | E308: 1 | F308: 58-60 | G308: Random World Drop | I308: 55 | J308: E | K308: 67 | L308: 10 | N308: 10
A309: Nghtsh. Armguards of the Tiger | B309: =(K309*$K$5)+(L309*$L$5)+(M309*$M$5)+(N309*$N$5)+(O309*$O$5)+(P309*100*$P$5)+(Q309*100*$Q$5)+(R309*100*$R$5)+(S309*100*$S$5)+(T309*$T$5)+(U309*$U$5)+(V309*$V$5)+(W309*$W$5)+(X309*$X$5)+(Y309*$Y$5)+(Z309*$Z$5)+(AA309*$AA$5) -> 15.66 | C309: =(K309*$K$6)+(L309*$L$6)+(M309*$M$6)+(N309*$N$6)+(O309*$O$6)+(P309*100*$P$6)+(Q309*100*$Q$6)+(R309*100*$R$6)+(S309*100*$S$6)+(T309*$T$6)+(U309*$U$6)+(V309*$V$6)+(W309*$W$6)+(X309*$X$6)+(Y309*$Y$6)+(Z309*$Z$6)+(AB309*$AA$6) -> 15.066000000000001 | D309: R | E309: 1 | F309: 56-59 | G309: Random World Drop | I309: 53 | J309: E | K309: 66 | L309: 10 | N309: 10
A310: Wanderer's Bracers of the Tiger | B310: =(K310*$K$5)+(L310*$L$5)+(M310*$M$5)+(N310*$N$5)+(O310*$O$5)+(P310*100*$P$5)+(Q310*100*$Q$5)+(R310*100*$R$5)+(S310*100*$S$5)+(T310*$T$5)+(U310*$U$5)+(V310*$V$5)+(W310*$W$5)+(X310*$X$5)+(Y310*$Y$5)+(Z310*$Z$5)+(AA310*$AA$5) -> 14.12 | C310: =(K310*$K$6)+(L310*$L$6)+(M310*$M$6)+(N310*$N$6)+(O310*$O$6)+(P310*100*$P$6)+(Q310*100*$Q$6)+(R310*100*$R$6)+(S310*100*$S$6)+(T310*$T$6)+(U310*$U$6)+(V310*$V$6)+(W310*$W$6)+(X310*$X$6)+(Y310*$Y$6)+(Z310*$Z$6)+(AB310*$AA$6) -> 13.561999999999999 | D310: R | E310: 1 | F310: 51-55 | G310: Random World Drop | I310: 49 | J310: E | K310: 62 | L310: 9 | N310: 9
A311: Unearthed Bands of the Tiger | B311: =(K311*$K$5)+(L311*$L$5)+(M311*$M$5)+(N311*$N$5)+(O311*$O$5)+(P311*100*$P$5)+(Q311*100*$Q$5)+(R311*100*$R$5)+(S311*100*$S$5)+(T311*$T$5)+(U311*$U$5)+(V311*$V$5)+(W311*$W$5)+(X311*$X$5)+(Y311*$Y$5)+(Z311*$Z$5)+(AA311*$AA$5) -> 13.49 | C311: =(K311*$K$6)+(L311*$L$6)+(M311*$M$6)+(N311*$N$6)+(O311*$O$6)+(P311*100*$P$6)+(Q311*100*$Q$6)+(R311*100*$R$6)+(S311*100*$S$6)+(T311*$T$6)+(U311*$U$6)+(V311*$V$6)+(W311*$W$6)+(X311*$X$6)+(Y311*$Y$6)+(Z311*$Z$6)+(AB311*$AA$6) -> 13.048999999999999 | D311: Uld | E311: 1 | F311: 35-43 | G311: Random Uld Drop | I311: 30 | J311: E | K311: 49 | L311: 6 | N311: 6 | O311: 8
A312: Pridelord Bands | B312: =(K312*$K$5)+(L312*$L$5)+(M312*$M$5)+(N312*$N$5)+(O312*$O$5)+(P312*100*$P$5)+(Q312*100*$Q$5)+(R312*100*$R$5)+(S312*100*$S$5)+(T312*$T$5)+(U312*$U$5)+(V312*$V$5)+(W312*$W$5)+(X312*$X$5)+(Y312*$Y$5)+(Z312*$Z$5)+(AA312*$AA$5) -> 16.11 | C312: =(K312*$K$6)+(L312*$L$6)+(M312*$M$6)+(N312*$N$6)+(O312*$O$6)+(P312*100*$P$6)+(Q312*100*$Q$6)+(R312*100*$R$6)+(S312*100*$S$6)+(T312*$T$6)+(U312*$U$6)+(V312*$V$6)+(W312*$W$6)+(X312*$X$6)+(Y312*$Y$6)+(Z312*$Z$6)+(AB312*$AA$6) -> 12.590999999999999 | D312: R | E312: 1 | F312: 51-54 | G312: Random World Drop | I312: 48 | J312: E | K312: 61 | L312: 10 | M312: 3 | N312: 5
A313: Polar Bracers | B313: =(K313*$K$5)+(L313*$L$5)+(M313*$M$5)+(N313*$N$5)+(O313*$O$5)+(P313*100*$P$5)+(Q313*100*$Q$5)+(R313*100*$R$5)+(S313*100*$S$5)+(T313*$T$5)+(U313*$U$5)+(V313*$V$5)+(W313*$W$5)+(X313*$X$5)+(Y313*$Y$5)+(Z313*$Z$5)+(AA313*$AA$5) -> 35.02 | C313: =(K313*$K$6)+(L313*$L$6)+(M313*$M$6)+(N313*$N$6)+(O313*$O$6)+(P313*100*$P$6)+(Q313*100*$Q$6)+(R313*100*$R$6)+(S313*100*$S$6)+(T313*$T$6)+(U313*$U$6)+(V313*$V$6)+(W313*$W$6)+(X313*$X$6)+(Y313*$Y$6)+(Z313*$Z$6)+(AB313*$AA$6) -> 12.501999999999999 | D313: Naxx | E313: 6 | F313: Q | G313: Naxx Quest Reward | I313: 60 | J313: P | K313: 102 | L313: 12 | M313: 20 | W313: 20
A314: Wristguards of Stability | B314: =(K314*$K$5)+(L314*$L$5)+(M314*$M$5)+(N314*$N$5)+(O314*$O$5)+(P314*100*$P$5)+(Q314*100*$Q$5)+(R314*100*$R$5)+(S314*100*$S$5)+(T314*$T$5)+(U314*$U$5)+(V314*$V$5)+(W314*$W$5)+(X314*$X$5)+(Y314*$Y$5)+(Z314*$Z$5)+(AA314*$AA$5) -> 20.86 | C314: =(K314*$K$6)+(L314*$L$6)+(M314*$M$6)+(N314*$N$6)+(O314*$O$6)+(P314*100*$P$6)+(Q314*100*$Q$6)+(R314*100*$R$6)+(S314*100*$S$6)+(T314*$T$6)+(U314*$U$6)+(V314*$V$6)+(W314*$W$6)+(X314*$X$6)+(Y314*$Y$6)+(Z314*$Z$6)+(AB314*$AA$6) -> 12.166 | D314: MC | E314: 3 | F314: 00.06 | G314: MC Boss Drop | I314: 60 | J314: P | K314: 86 | M314: 8 | N314: 24
A315: Yeti Hide Bracers | B315: =(K315*$K$5)+(L315*$L$5)+(M315*$M$5)+(N315*$N$5)+(O315*$O$5)+(P315*100*$P$5)+(Q315*100*$Q$5)+(R315*100*$R$5)+(S315*100*$S$5)+(T315*$T$5)+(U315*$U$5)+(V315*$V$5)+(W315*$W$5)+(X315*$X$5)+(Y315*$Y$5)+(Z315*$Z$5)+(AA315*$AA$5) -> 26.27 | C315: =(K315*$K$6)+(L315*$L$6)+(M315*$M$6)+(N315*$N$6)+(O315*$O$6)+(P315*100*$P$6)+(Q315*100*$Q$6)+(R315*100*$R$6)+(S315*100*$S$6)+(T315*$T$6)+(U315*$U$6)+(V315*$V$6)+(W315*$W$6)+(X315*$X$6)+(Y315*$Y$6)+(Z315*$Z$6)+(AB315*$AA$6) -> 11.717000000000001 | D315: AV | E315: 3 | F315: 00.18 | G315: AV Boss Drop | I315: 58 | J315: P | K315: 77 | L315: 8 | M315: 14 | N315: 7
A316: Traveler's Bracers | B316: =(K316*$K$5)+(L316*$L$5)+(M316*$M$5)+(N316*$N$5)+(O316*$O$5)+(P316*100*$P$5)+(Q316*100*$Q$5)+(R316*100*$R$5)+(S316*100*$S$5)+(T316*$T$5)+(U316*$U$5)+(V316*$V$5)+(W316*$W$5)+(X316*$X$5)+(Y316*$Y$5)+(Z316*$Z$5)+(AA316*$AA$5) -> 17.64 | C316: =(K316*$K$6)+(L316*$L$6)+(M316*$M$6)+(N316*$N$6)+(O316*$O$6)+(P316*100*$P$6)+(Q316*100*$Q$6)+(R316*100*$R$6)+(S316*100*$S$6)+(T316*$T$6)+(U316*$U$6)+(V316*$V$6)+(W316*$W$6)+(X316*$X$6)+(Y316*$Y$6)+(Z316*$Z$6)+(AB316*$AA$6) -> 11.124000000000001 | D316: R | E316: 1 | F316: 53-57 | G316: Random World Drop | I316: 51 | J316: E | K316: 64 | L316: 11 | M316: 6
A317: Wicked Leather Bracers | B317: =(K317*$K$5)+(L317*$L$5)+(M317*$M$5)+(N317*$N$5)+(O317*$O$5)+(P317*100*$P$5)+(Q317*100*$Q$5)+(R317*100*$R$5)+(S317*100*$S$5)+(T317*$T$5)+(U317*$U$5)+(V317*$V$5)+(W317*$W$5)+(X317*$X$5)+(Y317*$Y$5)+(Z317*$Z$5)+(AA317*$AA$5) -> 16.61 | C317: =(K317*$K$6)+(L317*$L$6)+(M317*$M$6)+(N317*$N$6)+(O317*$O$6)+(P317*100*$P$6)+(Q317*100*$Q$6)+(R317*100*$R$6)+(S317*100*$S$6)+(T317*$T$6)+(U317*$U$6)+(V317*$V$6)+(W317*$W$6)+(X317*$X$6)+(Y317*$Y$6)+(Z317*$Z$6)+(AB317*$AA$6) -> 11.111000000000001 | D317: LW | E317: 1 | F317: 265 | G317: Azs Recipe Drop | I317: 48 | J317: E | K317: 61 | L317: 11 | M317: 5
A318: Blackmist Armguards | B318: =(K318*$K$5)+(L318*$L$5)+(M318*$M$5)+(N318*$N$5)+(O318*$O$5)+(P318*100*$P$5)+(Q318*100*$Q$5)+(R318*100*$R$5)+(S318*100*$S$5)+(T318*$T$5)+(U318*$U$5)+(V318*$V$5)+(W318*$W$5)+(X318*$X$5)+(Y318*$Y$5)+(Z318*$Z$5)+(AA318*$AA$5) -> 22.27 | C318: =(K318*$K$6)+(L318*$L$6)+(M318*$M$6)+(N318*$N$6)+(O318*$O$6)+(P318*100*$P$6)+(Q318*100*$Q$6)+(R318*100*$R$6)+(S318*100*$S$6)+(T318*$T$6)+(U318*$U$6)+(V318*$V$6)+(W318*$W$6)+(X318*$X$6)+(Y318*$Y$6)+(Z318*$Z$6)+(AB318*$AA$6) -> 7.8069999999999995 | D318: UBRS | E318: 1 | F318: 00.24 | G318: The Beast | I318: 58 | J318: P | K318: 77 | M318: 13 | Q318: 00.01 | Y318: 10
A319: First Sgt. Leather Armguards (58) | B319: =(K319*$K$5)+(L319*$L$5)+(M319*$M$5)+(N319*$N$5)+(O319*$O$5)+(P319*100*$P$5)+(Q319*100*$Q$5)+(R319*100*$R$5)+(S319*100*$S$5)+(T319*$T$5)+(U319*$U$5)+(V319*$V$5)+(W319*$W$5)+(X319*$X$5)+(Y319*$Y$5)+(Z319*$Z$5)+(AA319*$AA$5) -> 24.77 | C319: =(K319*$K$6)+(L319*$L$6)+(M319*$M$6)+(N319*$N$6)+(O319*$O$6)+(P319*100*$P$6)+(Q319*100*$Q$6)+(R319*100*$R$6)+(S319*100*$S$6)+(T319*$T$6)+(U319*$U$6)+(V319*$V$6)+(W319*$W$6)+(X319*$X$6)+(Y319*$Y$6)+(Z319*$Z$6)+(AB319*$AA$6) -> 7.2469999999999999 | D319: PVP | E319: 2 | F319: FS | G319: Horde Rank 5 PVP | I319: 58 | J319: P | K319: 77 | L319: 7 | M319: 17
A320: Sgt. Mjr Leather Armsplints (58) | B320: =(K320*$K$5)+(L320*$L$5)+(M320*$M$5)+(N320*$N$5)+(O320*$O$5)+(P320*100*$P$5)+(Q320*100*$Q$5)+(R320*100*$R$5)+(S320*100*$S$5)+(T320*$T$5)+(U320*$U$5)+(V320*$V$5)+(W320*$W$5)+(X320*$X$5)+(Y320*$Y$5)+(Z320*$Z$5)+(AA320*$AA$5) -> 24.77 | C320: =(K320*$K$6)+(L320*$L$6)+(M320*$M$6)+(N320*$N$6)+(O320*$O$6)+(P320*100*$P$6)+(Q320*100*$Q$6)+(R320*100*$R$6)+(S320*100*$S$6)+(T320*$T$6)+(U320*$U$6)+(V320*$V$6)+(W320*$W$6)+(X320*$X$6)+(Y320*$Y$6)+(Z320*$Z$6)+(AB320*$AA$6) -> 7.2469999999999999 | D320: PVP | E320: 2 | F320: SgM | G320: Alliance Rank 5 PVP | I320: 58 | J320: P | K320: 77 | L320: 7 | M320: 17
A321: Malefic Bracers | B321: =(K321*$K$5)+(L321*$L$5)+(M321*$M$5)+(N321*$N$5)+(O321*$O$5)+(P321*100*$P$5)+(Q321*100*$Q$5)+(R321*100*$R$5)+(S321*100*$S$5)+(T321*$T$5)+(U321*$U$5)+(V321*$V$5)+(W321*$W$5)+(X321*$X$5)+(Y321*$Y$5)+(Z321*$Z$5)+(AA321*$AA$5) -> 23.72 | C321: =(K321*$K$6)+(L321*$L$6)+(M321*$M$6)+(N321*$N$6)+(O321*$O$6)+(P321*100*$P$6)+(Q321*100*$Q$6)+(R321*100*$R$6)+(S321*100*$S$6)+(T321*$T$6)+(U321*$U$6)+(V321*$V$6)+(W321*$W$6)+(X321*$X$6)+(Y321*$Y$6)+(Z321*$Z$6)+(AB321*$AA$6) -> 7.2320000000000002 | D321: Sch | E321: 1 | F321: 58-60 | G321: Random Scholo Drop | I321: 53 | J321: P | K321: 72 | L321: 7 | M321: 16
A323: HANDS | B323: AEP | C323: MAEP | D323: Loc | E323: P | F323: Info | G323: Source | H323: Set | I323: Lvl | J323: B | K323: Arm | L323: Agi | M323: Sta | N323: Str | O323: AP | P323: Cri | Q323: Hit | R323: Par | S323: Dod | T323: Def | U323: Ar | V323: Fi | W323: Fr | X323: Na | Y323: Sh | Z323: H/5 | AA323: PVP | AB323: PVE | AC323: Special
A324: Bonescythe Guantlets | B324: =(K324*$K$5)+(L324*$L$5)+(M324*$M$5)+(N324*$N$5)+(O324*$O$5)+(P324*100*$P$5)+(Q324*100*$Q$5)+(R324*100*$R$5)+(S324*100*$S$5)+(T324*$T$5)+(U324*$U$5)+(V324*$V$5)+(W324*$W$5)+(X324*$X$5)+(Y324*$Y$5)+(Z324*$Z$5)+(AA324*$AA$5) -> 72.08 | C324: =(K324*$K$6)+(L324*$L$6)+(M324*$M$6)+(N324*$N$6)+(O324*$O$6)+(P324*100*$P$6)+(Q324*100*$Q$6)+(R324*100*$R$6)+(S324*100*$S$6)+(T324*$T$6)+(U324*$U$6)+(V324*$V$6)+(W324*$W$6)+(X324*$X$6)+(Y324*$Y$6)+(Z324*$Z$6)+(AB324*$AA$6) -> 50.857999999999997 | D324: Naxx | E324: 6 | F324: Q | G324: Maexxna | H324: BS | I324: 60 | J324: P | K324: 158 | M324: 20 | O324: 66 | P324: 00.01 | Q324: 00.01
A325: Gloves of Enforcement | B325: =(K325*$K$5)+(L325*$L$5)+(M325*$M$5)+(N325*$N$5)+(O325*$O$5)+(P325*100*$P$5)+(Q325*100*$Q$5)+(R325*100*$R$5)+(S325*100*$S$5)+(T325*$T$5)+(U325*$U$5)+(V325*$V$5)+(W325*$W$5)+(X325*$X$5)+(Y325*$Y$5)+(Z325*$Z$5)+(AA325*$AA$5) -> 48.9 | C325: =(K325*$K$6)+(L325*$L$6)+(M325*$M$6)+(N325*$N$6)+(O325*$O$6)+(P325*100*$P$6)+(Q325*100*$Q$6)+(R325*100*$R$6)+(S325*100*$S$6)+(T325*$T$6)+(U325*$U$6)+(V325*$V$6)+(W325*$W$6)+(X325*$X$6)+(Y325*$Y$6)+(Z325*$Z$6)+(AB325*$AA$6) -> 41.7 | D325: AQ40 | E325: 5 | F325: 00.15 | G325: Battleguard Sartura | I325: 60 | J325: P | K325: 140 | L325: 20 | M325: 6 | N325: 28 | Q325: 00.01
A326: Aged Core Leather Gloves | B326: =(K326*$K$5)+(L326*$L$5)+(M326*$M$5)+(N326*$N$5)+(O326*$O$5)+(P326*100*$P$5)+(Q326*100*$Q$5)+(R326*100*$R$5)+(S326*100*$S$5)+(T326*$T$5)+(U326*$U$5)+(V326*$V$5)+(W326*$W$5)+(X326*$X$5)+(Y326*$Y$5)+(Z326*$Z$5)+(AA326*$AA$5) -> 40.1 | C326: =(K326*$K$6)+(L326*$L$6)+(M326*$M$6)+(N326*$N$6)+(O326*$O$6)+(P326*100*$P$6)+(Q326*100*$Q$6)+(R326*100*$R$6)+(S326*100*$S$6)+(T326*$T$6)+(U326*$U$6)+(V326*$V$6)+(W326*$W$6)+(X326*$X$6)+(Y326*$Y$6)+(Z326*$Z$6)+(AB326*$AA$6) -> 37.91 | D326: MC | E326: 1 | F326: R | G326: MC Bosses | I326: 60 | J326: P | K326: 130 | M326: 15 | N326: 15 | P326: 00.01 | V326: 8 | Y326: 5 | AA326: 5 | AB326: 20 | AC326: Daggers +5
A327: Doomhide Gauntlets | B327: =(K327*$K$5)+(L327*$L$5)+(M327*$M$5)+(N327*$N$5)+(O327*$O$5)+(P327*100*$P$5)+(Q327*100*$Q$5)+(R327*100*$R$5)+(S327*100*$S$5)+(T327*$T$5)+(U327*$U$5)+(V327*$V$5)+(W327*$W$5)+(X327*$X$5)+(Y327*$Y$5)+(Z327*$Z$5)+(AA327*$AA$5) -> 51.93 | C327: =(K327*$K$6)+(L327*$L$6)+(M327*$M$6)+(N327*$N$6)+(O327*$O$6)+(P327*100*$P$6)+(Q327*100*$Q$6)+(R327*100*$R$6)+(S327*100*$S$6)+(T327*$T$6)+(U327*$U$6)+(V327*$V$6)+(W327*$W$6)+(X327*$X$6)+(Y327*$Y$6)+(Z327*$Z$6)+(AB327*$AA$6) -> 35.432999999999993 | D327: BL | E327: 2 | F327: 00.06 | G327: Lord Kazzak | I327: 60 | J327: P | K327: 133 | L327: 14 | M327: 14 | O327: 42 | V327: 8 | Y327: 8
A328: Gloves of Holy Might (vs Undead) | B328: =(K328*$K$5)+(L328*$L$5)+(M328*$M$5)+(N328*$N$5)+(O328*$O$5)+(P328*100*$P$5)+(Q328*100*$Q$5)+(R328*100*$R$5)+(S328*100*$S$5)+(T328*$T$5)+(U328*$U$5)+(V328*$V$5)+(W328*$W$5)+(X328*$X$5)+(Y328*$Y$5)+(Z328*$Z$5)+(AA328*$AA$5) -> 35.86 | C328: =(K328*$K$6)+(L328*$L$6)+(M328*$M$6)+(N328*$N$6)+(O328*$O$6)+(P328*100*$P$6)+(Q328*100*$Q$6)+(R328*100*$R$6)+(S328*100*$S$6)+(T328*$T$6)+(U328*$U$6)+(V328*$V$6)+(W328*$W$6)+(X328*$X$6)+(Y328*$Y$6)+(Z328*$Z$6)+(AB328*$AA$6) -> 35.085999999999999 | D328: R | E328: 1 | F328: 40-44 | G328: Random World Drop | I328: 37 | J328: E | K328: 86 | O328: 50 | P328: 00.01 | AC328: +30AP vs Und
A329: Nightslayer Gloves | B329: =(K329*$K$5)+(L329*$L$5)+(M329*$M$5)+(N329*$N$5)+(O329*$O$5)+(P329*100*$P$5)+(Q329*100*$Q$5)+(R329*100*$R$5)+(S329*100*$S$5)+(T329*$T$5)+(U329*$U$5)+(V329*$V$5)+(W329*$W$5)+(X329*$X$5)+(Y329*$Y$5)+(Z329*$Z$5)+(AA329*$AA$5) -> 50.45 | C329: =(K329*$K$6)+(L329*$L$6)+(M329*$M$6)+(N329*$N$6)+(O329*$O$6)+(P329*100*$P$6)+(Q329*100*$Q$6)+(R329*100*$R$6)+(S329*100*$S$6)+(T329*$T$6)+(U329*$U$6)+(V329*$V$6)+(W329*$W$6)+(X329*$X$6)+(Y329*$Y$6)+(Z329*$Z$6)+(AB329*$AA$6) -> 31.864999999999998 | D329: MC | E329: 1 | F329: 00.22 | G329: Gehennas | H329: NS | I329: 60 | J329: P | K329: 125 | L329: 18 | M329: 17 | N329: 12 | Q329: 00.01 | V329: 7
A330: Bloodfang Gloves | B330: =(K330*$K$5)+(L330*$L$5)+(M330*$M$5)+(N330*$N$5)+(O330*$O$5)+(P330*100*$P$5)+(Q330*100*$Q$5)+(R330*100*$R$5)+(S330*100*$S$5)+(T330*$T$5)+(U330*$U$5)+(V330*$V$5)+(W330*$W$5)+(X330*$X$5)+(Y330*$Y$5)+(Z330*$Z$5)+(AA330*$AA$5) -> 61.9 | C330: =(K330*$K$6)+(L330*$L$6)+(M330*$M$6)+(N330*$N$6)+(O330*$O$6)+(P330*100*$P$6)+(Q330*100*$Q$6)+(R330*100*$R$6)+(S330*100*$S$6)+(T330*$T$6)+(U330*$U$6)+(V330*$V$6)+(W330*$W$6)+(X330*$X$6)+(Y330*$Y$6)+(Z330*$Z$6)+(AB330*$AA$6) -> 30.94 | D330: BWL | E330: 3 | F330: 00.09 | G330: BWL Boss Drop | H330: BF | I330: 60 | J330: P | K330: 140 | L330: 20 | M330: 20 | N330: 19 | Y330: 10 | AA330: 10 | AB330: 1 | AC330: Imm. to disarm.
A331: Gloves of the Hidden Temple | B331: =(K331*$K$5)+(L331*$L$5)+(M331*$M$5)+(N331*$N$5)+(O331*$O$5)+(P331*100*$P$5)+(Q331*100*$Q$5)+(R331*100*$R$5)+(S331*100*$S$5)+(T331*$T$5)+(U331*$U$5)+(V331*$V$5)+(W331*$W$5)+(X331*$X$5)+(Y331*$Y$5)+(Z331*$Z$5)+(AA331*$AA$5) -> 55.08 | C331: =(K331*$K$6)+(L331*$L$6)+(M331*$M$6)+(N331*$N$6)+(O331*$O$6)+(P331*100*$P$6)+(Q331*100*$Q$6)+(R331*100*$R$6)+(S331*100*$S$6)+(T331*$T$6)+(U331*$U$6)+(V331*$V$6)+(W331*$W$6)+(X331*$X$6)+(Y331*$Y$6)+(Z331*$Z$6)+(AB331*$AA$6) -> 30.527999999999999 | D331: AQ40 | E331: 5 | F331: 00.14 | G331: Emperor Vek'nilash | I331: 60 | J331: P | K331: 248 | L331: 21 | M331: 22 | N331: 18 | Y331: 6
A332: Marshal's Leather Handgrips | B332: =(K332*$K$5)+(L332*$L$5)+(M332*$M$5)+(N332*$N$5)+(O332*$O$5)+(P332*100*$P$5)+(Q332*100*$Q$5)+(R332*100*$R$5)+(S332*100*$S$5)+(T332*$T$5)+(U332*$U$5)+(V332*$V$5)+(W332*$W$5)+(X332*$X$5)+(Y332*$Y$5)+(Z332*$Z$5)+(AA332*$AA$5) -> 54.93 | C332: =(K332*$K$6)+(L332*$L$6)+(M332*$M$6)+(N332*$N$6)+(O332*$O$6)+(P332*100*$P$6)+(Q332*100*$Q$6)+(R332*100*$R$6)+(S332*100*$S$6)+(T332*$T$6)+(U332*$U$6)+(V332*$V$6)+(W332*$W$6)+(X332*$X$6)+(Y332*$Y$6)+(Z332*$Z$6)+(AB332*$AA$6) -> 30.423000000000002 | D332: PVP | E332: 2 | F332: FM | G332: Alliance Rank 12 PVP | H332: FM | I332: 60 | J332: P | K332: 193 | L332: 20 | M332: 23 | P332: 00.01
A333: General's Leather Mitts | B333: =(K333*$K$5)+(L333*$L$5)+(M333*$M$5)+(N333*$N$5)+(O333*$O$5)+(P333*100*$P$5)+(Q333*100*$Q$5)+(R333*100*$R$5)+(S333*100*$S$5)+(T333*$T$5)+(U333*$U$5)+(V333*$V$5)+(W333*$W$5)+(X333*$X$5)+(Y333*$Y$5)+(Z333*$Z$5)+(AA333*$AA$5) -> 54.93 | C333: =(K333*$K$6)+(L333*$L$6)+(M333*$M$6)+(N333*$N$6)+(O333*$O$6)+(P333*100*$P$6)+(Q333*100*$Q$6)+(R333*100*$R$6)+(S333*100*$S$6)+(T333*$T$6)+(U333*$U$6)+(V333*$V$6)+(W333*$W$6)+(X333*$X$6)+(Y333*$Y$6)+(Z333*$Z$6)+(AB333*$AA$6) -> 30.423000000000002 | D333: PVP | E333: 2 | F333: WL | G333: Horde Rank 12 PVP | H333: WL | I333: 60 | J333: P | K333: 193 | L333: 20 | M333: 23 | P333: 00.01
A334: Handwraps of Undead Slaying | B334: =(K334*$K$5)+(L334*$L$5)+(M334*$M$5)+(N334*$N$5)+(O334*$O$5)+(P334*100*$P$5)+(Q334*100*$Q$5)+(R334*100*$R$5)+(S334*100*$S$5)+(T334*$T$5)+(U334*$U$5)+(V334*$V$5)+(W334*$W$5)+(X334*$X$5)+(Y334*$Y$5)+(Z334*$Z$5)+(AA334*$AA$5) -> 46.1 | C334: =(K334*$K$6)+(L334*$L$6)+(M334*$M$6)+(N334*$N$6)+(O334*$O$6)+(P334*100*$P$6)+(Q334*100*$Q$6)+(R334*100*$R$6)+(S334*100*$S$6)+(T334*$T$6)+(U334*$U$6)+(V334*$V$6)+(W334*$W$6)+(X334*$X$6)+(Y334*$Y$6)+(Z334*$Z$6)+(AB334*$AA$6) -> 30.26 | D334: R | E334: 6 | F334: 59-60 | G334: Scourge Invasion | H334: US | I334: 58 | J334: P | K334: 110 | M334: 15 | O334: 60 | AC334: +60AP vs Und
A335: Darkmantle Gloves | B335: =(K335*$K$5)+(L335*$L$5)+(M335*$M$5)+(N335*$N$5)+(O335*$O$5)+(P335*100*$P$5)+(Q335*100*$Q$5)+(R335*100*$R$5)+(S335*100*$S$5)+(T335*$T$5)+(U335*$U$5)+(V335*$V$5)+(W335*$W$5)+(X335*$X$5)+(Y335*$Y$5)+(Z335*$Z$5)+(AA335*$AA$5) -> 38.08 | C335: =(K335*$K$6)+(L335*$L$6)+(M335*$M$6)+(N335*$N$6)+(O335*$O$6)+(P335*100*$P$6)+(Q335*100*$Q$6)+(R335*100*$R$6)+(S335*100*$S$6)+(T335*$T$6)+(U335*$U$6)+(V335*$V$6)+(W335*$W$6)+(X335*$X$6)+(Y335*$Y$6)+(Z335*$Z$6)+(AB335*$AA$6) -> 28.198 | D335: Q | E335: 5 | F335: Q | G335: SC Upgrade Quest | H335: DM | I335: 58 | J335: P | K335: 108 | L335: 22 | M335: 9 | N335: 12
A336: Blooddrenched Grips | B336: =(K336*$K$5)+(L336*$L$5)+(M336*$M$5)+(N336*$N$5)+(O336*$O$5)+(P336*100*$P$5)+(Q336*100*$Q$5)+(R336*100*$R$5)+(S336*100*$S$5)+(T336*$T$5)+(U336*$U$5)+(V336*$V$5)+(W336*$W$5)+(X336*$X$5)+(Y336*$Y$5)+(Z336*$Z$5)+(AA336*$AA$5) -> 44.22 | C336: =(K336*$K$6)+(L336*$L$6)+(M336*$M$6)+(N336*$N$6)+(O336*$O$6)+(P336*100*$P$6)+(Q336*100*$Q$6)+(R336*100*$R$6)+(S336*100*$S$6)+(T336*$T$6)+(U336*$U$6)+(V336*$V$6)+(W336*$W$6)+(X336*$X$6)+(Y336*$Y$6)+(Z336*$Z$6)+(AB336*$AA$6) -> 27.282 | D336: ZG | E336: 4 | F336: 00.13 | G336: Bloodlord Mandokir | I336: 60 | J336: P | K336: 122 | M336: 16 | O336: 34 | P336: 00.01
A337: Blood Guard's Leather Vices | B337: =(K337*$K$5)+(L337*$L$5)+(M337*$M$5)+(N337*$N$5)+(O337*$O$5)+(P337*100*$P$5)+(Q337*100*$Q$5)+(R337*100*$R$5)+(S337*100*$S$5)+(T337*$T$5)+(U337*$U$5)+(V337*$V$5)+(W337*$W$5)+(X337*$X$5)+(Y337*$Y$5)+(Z337*$Z$5)+(AA337*$AA$5) -> 42.1 | C337: =(K337*$K$6)+(L337*$L$6)+(M337*$M$6)+(N337*$N$6)+(O337*$O$6)+(P337*100*$P$6)+(Q337*100*$Q$6)+(R337*100*$R$6)+(S337*100*$S$6)+(T337*$T$6)+(U337*$U$6)+(V337*$V$6)+(W337*$W$6)+(X337*$X$6)+(Y337*$Y$6)+(Z337*$Z$6)+(AB337*$AA$6) -> 26.26 | D337: PVP | E337: 2 | F337: K-L | G337: Horde Rank 7 PVP | H337: CG | I337: 58 | J337: P | K337: 110 | L337: 10 | M337: 15 | O337: 32
A338: Knight-Lt.'s Leather Guantlets | B338: =(K338*$K$5)+(L338*$L$5)+(M338*$M$5)+(N338*$N$5)+(O338*$O$5)+(P338*100*$P$5)+(Q338*100*$Q$5)+(R338*100*$R$5)+(S338*100*$S$5)+(T338*$T$5)+(U338*$U$5)+(V338*$V$5)+(W338*$W$5)+(X338*$X$5)+(Y338*$Y$5)+(Z338*$Z$5)+(AA338*$AA$5) -> 42.1 | C338: =(K338*$K$6)+(L338*$L$6)+(M338*$M$6)+(N338*$N$6)+(O338*$O$6)+(P338*100*$P$6)+(Q338*100*$Q$6)+(R338*100*$R$6)+(S338*100*$S$6)+(T338*$T$6)+(U338*$U$6)+(V338*$V$6)+(W338*$W$6)+(X338*$X$6)+(Y338*$Y$6)+(Z338*$Z$6)+(AB338*$AA$6) -> 26.26 | D338: PVP | E338: 2 | F338: K-L | G338: Alliance Rank 7 PVP | H338: LCV | I338: 58 | J338: P | K338: 110 | L338: 10 | M338: 15 | O338: 32
A339: Primal Batskin Gloves | B339: =(K339*$K$5)+(L339*$L$5)+(M339*$M$5)+(N339*$N$5)+(O339*$O$5)+(P339*100*$P$5)+(Q339*100*$Q$5)+(R339*100*$R$5)+(S339*100*$S$5)+(T339*$T$5)+(U339*$U$5)+(V339*$V$5)+(W339*$W$5)+(X339*$X$5)+(Y339*$Y$5)+(Z339*$Z$5)+(AA339*$AA$5) -> 35.13 | C339: =(K339*$K$6)+(L339*$L$6)+(M339*$M$6)+(N339*$N$6)+(O339*$O$6)+(P339*100*$P$6)+(Q339*100*$Q$6)+(R339*100*$R$6)+(S339*100*$S$6)+(T339*$T$6)+(U339*$U$6)+(V339*$V$6)+(W339*$W$6)+(X339*$X$6)+(Y339*$Y$6)+(Z339*$Z$6)+(AB339*$AA$6) -> 25.202999999999999 | D339: LW | E339: 4 | F339: 300 | G339: Zandalar Honored | H339: PB | I339: 60 | J339: E | K339: 113 | L339: 10 | M339: 9 | Q339: 00.02
A340: Devilsaur Gauntlets | B340: =(K340*$K$5)+(L340*$L$5)+(M340*$M$5)+(N340*$N$5)+(O340*$O$5)+(P340*100*$P$5)+(Q340*100*$Q$5)+(R340*100*$R$5)+(S340*100*$S$5)+(T340*$T$5)+(U340*$U$5)+(V340*$V$5)+(W340*$W$5)+(X340*$X$5)+(Y340*$Y$5)+(Z340*$Z$5)+(AA340*$AA$5) -> 34.03 | C340: =(K340*$K$6)+(L340*$L$6)+(M340*$M$6)+(N340*$N$6)+(O340*$O$6)+(P340*100*$P$6)+(Q340*100*$Q$6)+(R340*100*$R$6)+(S340*100*$S$6)+(T340*$T$6)+(U340*$U$6)+(V340*$V$6)+(W340*$W$6)+(X340*$X$6)+(Y340*$Y$6)+(Z340*$Z$6)+(AB340*$AA$6) -> 24.192999999999998 | D340: LW | E340: 1 | F340: 290 | G340: Un'Goro Vendor Rec. | H340: Dev | I340: 53 | J340: E | K340: 103 | M340: 9 | O340: 28 | P340: 00.01
A341: Slaghide Gauntlets of the Tiger | B341: =(K341*$K$5)+(L341*$L$5)+(M341*$M$5)+(N341*$N$5)+(O341*$O$5)+(P341*100*$P$5)+(Q341*100*$Q$5)+(R341*100*$R$5)+(S341*100*$S$5)+(T341*$T$5)+(U341*$U$5)+(V341*$V$5)+(W341*$W$5)+(X341*$X$5)+(Y341*$Y$5)+(Z341*$Z$5)+(AA341*$AA$5) -> 24.57 | C341: =(K341*$K$6)+(L341*$L$6)+(M341*$M$6)+(N341*$N$6)+(O341*$O$6)+(P341*100*$P$6)+(Q341*100*$Q$6)+(R341*100*$R$6)+(S341*100*$S$6)+(T341*$T$6)+(U341*$U$6)+(V341*$V$6)+(W341*$W$6)+(X341*$X$6)+(Y341*$Y$6)+(Z341*$Z$6)+(AB341*$AA$6) -> 22.707000000000001 | D341: LBRS | E341: 1 | F341: 00.01 | G341: Urok Doomhowl | I341: 56 | J341: P | K341: 207 | L341: 15 | N341: 15
A342: Bile-Covered Gauntlets | B342: =(K342*$K$5)+(L342*$L$5)+(M342*$M$5)+(N342*$N$5)+(O342*$O$5)+(P342*100*$P$5)+(Q342*100*$Q$5)+(R342*100*$R$5)+(S342*100*$S$5)+(T342*$T$5)+(U342*$U$5)+(V342*$V$5)+(W342*$W$5)+(X342*$X$5)+(Y342*$Y$5)+(Z342*$Z$5)+(AA342*$AA$5) -> 47.03 | C342: =(K342*$K$6)+(L342*$L$6)+(M342*$M$6)+(N342*$N$6)+(O342*$O$6)+(P342*100*$P$6)+(Q342*100*$Q$6)+(R342*100*$R$6)+(S342*100*$S$6)+(T342*$T$6)+(U342*$U$6)+(V342*$V$6)+(W342*$W$6)+(X342*$X$6)+(Y342*$Y$6)+(Z342*$Z$6)+(AB342*$AA$6) -> 22.613 | D342: AQ40 | E342: 5 | F342: 00.2 | G342: Princess Yauj | I342: 60 | J342: P | K342: 203 | L342: 17 | M342: 21 | N342: 10 | X342: 20
A343: Cadaverous Gloves | B343: =(K343*$K$5)+(L343*$L$5)+(M343*$M$5)+(N343*$N$5)+(O343*$O$5)+(P343*100*$P$5)+(Q343*100*$Q$5)+(R343*100*$R$5)+(S343*100*$S$5)+(T343*$T$5)+(U343*$U$5)+(V343*$V$5)+(W343*$W$5)+(X343*$X$5)+(Y343*$Y$5)+(Z343*$Z$5)+(AA343*$AA$5) -> 32.07 | C343: =(K343*$K$6)+(L343*$L$6)+(M343*$M$6)+(N343*$N$6)+(O343*$O$6)+(P343*100*$P$6)+(Q343*100*$Q$6)+(R343*100*$R$6)+(S343*100*$S$6)+(T343*$T$6)+(U343*$U$6)+(V343*$V$6)+(W343*$W$6)+(X343*$X$6)+(Y343*$Y$6)+(Z343*$Z$6)+(AB343*$AA$6) -> 22.196999999999999 | D343: Sch | E343: 1 | F343: 00.05 | G343: Scholo Boss Drop | H343: Cad | I343: 56 | J343: P | K343: 107 | M343: 9 | O343: 44
A344: Adv. Gloves of the Tiger | B344: =(K344*$K$5)+(L344*$L$5)+(M344*$M$5)+(N344*$N$5)+(O344*$O$5)+(P344*100*$P$5)+(Q344*100*$Q$5)+(R344*100*$R$5)+(S344*100*$S$5)+(T344*$T$5)+(U344*$U$5)+(V344*$V$5)+(W344*$W$5)+(X344*$X$5)+(Y344*$Y$5)+(Z344*$Z$5)+(AA344*$AA$5) -> 22 | C344: =(K344*$K$6)+(L344*$L$6)+(M344*$M$6)+(N344*$N$6)+(O344*$O$6)+(P344*100*$P$6)+(Q344*100*$Q$6)+(R344*100*$R$6)+(S344*100*$S$6)+(T344*$T$6)+(U344*$U$6)+(V344*$V$6)+(W344*$W$6)+(X344*$X$6)+(Y344*$Y$6)+(Z344*$Z$6)+(AB344*$AA$6) -> 21.1 | D344: R | E344: 1 | F344: 60-62 | G344: Random World Drop | I344: 58 | J344: E | K344: 100 | L344: 14 | N344: 14
A345: Supreme Gloves of the Tiger | B345: =(K345*$K$5)+(L345*$L$5)+(M345*$M$5)+(N345*$N$5)+(O345*$O$5)+(P345*100*$P$5)+(Q345*100*$Q$5)+(R345*100*$R$5)+(S345*100*$S$5)+(T345*$T$5)+(U345*$U$5)+(V345*$V$5)+(W345*$W$5)+(X345*$X$5)+(Y345*$Y$5)+(Z345*$Z$5)+(AA345*$AA$5) -> 22 | C345: =(K345*$K$6)+(L345*$L$6)+(M345*$M$6)+(N345*$N$6)+(O345*$O$6)+(P345*100*$P$6)+(Q345*100*$Q$6)+(R345*100*$R$6)+(S345*100*$S$6)+(T345*$T$6)+(U345*$U$6)+(V345*$V$6)+(W345*$W$6)+(X345*$X$6)+(Y345*$Y$6)+(Z345*$Z$6)+(AB345*$AA$6) -> 21.1 | D345: R | E345: 1 | F345: 55-63 | G345: Random World Drop | I345: 58 | J345: E | K345: 100 | L345: 14 | N345: 14
A346: Mighty Gauntlets of the Tiger | B346: =(K346*$K$5)+(L346*$L$5)+(M346*$M$5)+(N346*$N$5)+(O346*$O$5)+(P346*100*$P$5)+(Q346*100*$Q$5)+(R346*100*$R$5)+(S346*100*$S$5)+(T346*$T$5)+(U346*$U$5)+(V346*$V$5)+(W346*$W$5)+(X346*$X$5)+(Y346*$Y$5)+(Z346*$Z$5)+(AA346*$AA$5) -> 21.97 | C346: =(K346*$K$6)+(L346*$L$6)+(M346*$M$6)+(N346*$N$6)+(O346*$O$6)+(P346*100*$P$6)+(Q346*100*$Q$6)+(R346*100*$R$6)+(S346*100*$S$6)+(T346*$T$6)+(U346*$U$6)+(V346*$V$6)+(W346*$W$6)+(X346*$X$6)+(Y346*$Y$6)+(Z346*$Z$6)+(AB346*$AA$6) -> 21.097000000000001 | D346: R | E346: 1 | F346: 58-62 | G346: Random World Drop | I346: 56 | J346: E | K346: 97 | L346: 14 | N346: 14
A347: Toughened Silithid Hide Gloves | B347: =(K347*$K$5)+(L347*$L$5)+(M347*$M$5)+(N347*$N$5)+(O347*$O$5)+(P347*100*$P$5)+(Q347*100*$Q$5)+(R347*100*$R$5)+(S347*100*$S$5)+(T347*$T$5)+(U347*$U$5)+(V347*$V$5)+(W347*$W$5)+(X347*$X$5)+(Y347*$Y$5)+(Z347*$Z$5)+(AA347*$AA$5) -> 40.32 | C347: =(K347*$K$6)+(L347*$L$6)+(M347*$M$6)+(N347*$N$6)+(O347*$O$6)+(P347*100*$P$6)+(Q347*100*$Q$6)+(R347*100*$R$6)+(S347*100*$S$6)+(T347*$T$6)+(U347*$U$6)+(V347*$V$6)+(W347*$W$6)+(X347*$X$6)+(Y347*$Y$6)+(Z347*$Z$6)+(AB347*$AA$6) -> 20.862000000000002 | D347: AQ20 | E347: 5 | F347: 00.15 | G347: Kurinaxx | I347: 60 | J347: P | K347: 182 | L347: 15 | M347: 18 | N347: 11
A348: Knight-Lt.'s Leather Grips | B348: =(K348*$K$5)+(L348*$L$5)+(M348*$M$5)+(N348*$N$5)+(O348*$O$5)+(P348*100*$P$5)+(Q348*100*$Q$5)+(R348*100*$R$5)+(S348*100*$S$5)+(T348*$T$5)+(U348*$U$5)+(V348*$V$5)+(W348*$W$5)+(X348*$X$5)+(Y348*$Y$5)+(Z348*$Z$5)+(AA348*$AA$5) -> 39.55 | C348: =(K348*$K$6)+(L348*$L$6)+(M348*$M$6)+(N348*$N$6)+(O348*$O$6)+(P348*100*$P$6)+(Q348*100*$Q$6)+(R348*100*$R$6)+(S348*100*$S$6)+(T348*$T$6)+(U348*$U$6)+(V348*$V$6)+(W348*$W$6)+(X348*$X$6)+(Y348*$Y$6)+(Z348*$Z$6)+(AB348*$AA$6) -> 20.335000000000001 | D348: PVP | E348: 2 | F348: K-L | G348: Alliance Rank 7 PVP | H348: LCG | I348: 60 | J348: P | K348: 155 | M348: 18 | O348: 20 | P348: 00.01
A349: Blood Guard's Leather Grips | B349: =(K349*$K$5)+(L349*$L$5)+(M349*$M$5)+(N349*$N$5)+(O349*$O$5)+(P349*100*$P$5)+(Q349*100*$Q$5)+(R349*100*$R$5)+(S349*100*$S$5)+(T349*$T$5)+(U349*$U$5)+(V349*$V$5)+(W349*$W$5)+(X349*$X$5)+(Y349*$Y$5)+(Z349*$Z$5)+(AA349*$AA$5) -> 39.55 | C349: =(K349*$K$6)+(L349*$L$6)+(M349*$M$6)+(N349*$N$6)+(O349*$O$6)+(P349*100*$P$6)+(Q349*100*$Q$6)+(R349*100*$R$6)+(S349*100*$S$6)+(T349*$T$6)+(U349*$U$6)+(V349*$V$6)+(W349*$W$6)+(X349*$X$6)+(Y349*$Y$6)+(Z349*$Z$6)+(AB349*$AA$6) -> 20.335000000000001 | D349: PVP | E349: 2 | F349: K-L | G349: Horde Rank 7 PVP | H349: CV | I349: 60 | J349: P | K349: 155 | M349: 18 | O349: 20 | P349: 00.01
A350: Gargoyle Slashers | B350: =(K350*$K$5)+(L350*$L$5)+(M350*$M$5)+(N350*$N$5)+(O350*$O$5)+(P350*100*$P$5)+(Q350*100*$Q$5)+(R350*100*$R$5)+(S350*100*$S$5)+(T350*$T$5)+(U350*$U$5)+(V350*$V$5)+(W350*$W$5)+(X350*$X$5)+(Y350*$Y$5)+(Z350*$Z$5)+(AA350*$AA$5) -> 33.07 | C350: =(K350*$K$6)+(L350*$L$6)+(M350*$M$6)+(N350*$N$6)+(O350*$O$6)+(P350*100*$P$6)+(Q350*100*$Q$6)+(R350*100*$R$6)+(S350*100*$S$6)+(T350*$T$6)+(U350*$U$6)+(V350*$V$6)+(W350*$W$6)+(X350*$X$6)+(Y350*$Y$6)+(Z350*$Z$6)+(AB350*$AA$6) -> 20.227 | D350: Sch | E350: 1 | F350: 00.15 | G350: Kirtonos the Herald | I350: 56 | J350: P | K350: 107 | L350: 5 | M350: 12 | N350: 10 | P350: 00.01
A351: Skul's Fingerbone Claws | B351: =(K351*$K$5)+(L351*$L$5)+(M351*$M$5)+(N351*$N$5)+(O351*$O$5)+(P351*100*$P$5)+(Q351*100*$Q$5)+(R351*100*$R$5)+(S351*100*$S$5)+(T351*$T$5)+(U351*$U$5)+(V351*$V$5)+(W351*$W$5)+(X351*$X$5)+(Y351*$Y$5)+(Z351*$Z$5)+(AA351*$AA$5) -> 31.05 | C351: =(K351*$K$6)+(L351*$L$6)+(M351*$M$6)+(N351*$N$6)+(O351*$O$6)+(P351*100*$P$6)+(Q351*100*$Q$6)+(R351*100*$R$6)+(S351*100*$S$6)+(T351*$T$6)+(U351*$U$6)+(V351*$V$6)+(W351*$W$6)+(X351*$X$6)+(Y351*$Y$6)+(Z351*$Z$6)+(AB351*$AA$6) -> 20.204999999999998 | D351: Str | E351: 1 | F351: 00.26 | G351: Skul | I351: 54 | J351: P | K351: 105 | M351: 10 | O351: 40
A352: Gloves of Holy Might | B352: =(K352*$K$5)+(L352*$L$5)+(M352*$M$5)+(N352*$N$5)+(O352*$O$5)+(P352*100*$P$5)+(Q352*100*$Q$5)+(R352*100*$R$5)+(S352*100*$S$5)+(T352*$T$5)+(U352*$U$5)+(V352*$V$5)+(W352*$W$5)+(X352*$X$5)+(Y352*$Y$5)+(Z352*$Z$5)+(AA352*$AA$5) -> 20.86 | C352: =(K352*$K$6)+(L352*$L$6)+(M352*$M$6)+(N352*$N$6)+(O352*$O$6)+(P352*100*$P$6)+(Q352*100*$Q$6)+(R352*100*$R$6)+(S352*100*$S$6)+(T352*$T$6)+(U352*$U$6)+(V352*$V$6)+(W352*$W$6)+(X352*$X$6)+(Y352*$Y$6)+(Z352*$Z$6)+(AB352*$AA$6) -> 20.085999999999999 | D352: R | E352: 1 | F352: 40-44 | G352: Random World Drop | I352: 37 | J352: E | K352: 86 | O352: 20 | P352: 00.01 | AC352: +30AP vs Und
A353: Shadowcraft Gloves | B353: =(K353*$K$5)+(L353*$L$5)+(M353*$M$5)+(N353*$N$5)+(O353*$O$5)+(P353*100*$P$5)+(Q353*100*$Q$5)+(R353*100*$R$5)+(S353*100*$S$5)+(T353*$T$5)+(U353*$U$5)+(V353*$V$5)+(W353*$W$5)+(X353*$X$5)+(Y353*$Y$5)+(Z353*$Z$5)+(AA353*$AA$5) -> 28.55 | C353: =(K353*$K$6)+(L353*$L$6)+(M353*$M$6)+(N353*$N$6)+(O353*$O$6)+(P353*100*$P$6)+(Q353*100*$Q$6)+(R353*100*$R$6)+(S353*100*$S$6)+(T353*$T$6)+(U353*$U$6)+(V353*$V$6)+(W353*$W$6)+(X353*$X$6)+(Y353*$Y$6)+(Z353*$Z$6)+(AB353*$AA$6) -> 18.695 | D353: LBRS | E353: 1 | F353: 500 | G353: Shdw Hntr Vosh'gajin | H353: SC | I353: 54 | J353: E | K353: 105 | L353: 14 | M353: 9 | N353: 9
A354: Polar Gloves | B354: =(K354*$K$5)+(L354*$L$5)+(M354*$M$5)+(N354*$N$5)+(O354*$O$5)+(P354*100*$P$5)+(Q354*100*$Q$5)+(R354*100*$R$5)+(S354*100*$S$5)+(T354*$T$5)+(U354*$U$5)+(V354*$V$5)+(W354*$W$5)+(X354*$X$5)+(Y354*$Y$5)+(Z354*$Z$5)+(AA354*$AA$5) -> 40.46 | C354: =(K354*$K$6)+(L354*$L$6)+(M354*$M$6)+(N354*$N$6)+(O354*$O$6)+(P354*100*$P$6)+(Q354*100*$Q$6)+(R354*100*$R$6)+(S354*100*$S$6)+(T354*$T$6)+(U354*$U$6)+(V354*$V$6)+(W354*$W$6)+(X354*$X$6)+(Y354*$Y$6)+(Z354*$Z$6)+(AB354*$AA$6) -> 18.626000000000001 | D354: Naxx | E354: 6 | F354: Q | G354: Naxx Quest Reward | I354: 60 | J354: P | K354: 146 | L354: 18 | M354: 18 | W354: 30
A355: Nightfall Gloves | B355: =(K355*$K$5)+(L355*$L$5)+(M355*$M$5)+(N355*$N$5)+(O355*$O$5)+(P355*100*$P$5)+(Q355*100*$Q$5)+(R355*100*$R$5)+(S355*100*$S$5)+(T355*$T$5)+(U355*$U$5)+(V355*$V$5)+(W355*$W$5)+(X355*$X$5)+(Y355*$Y$5)+(Z355*$Z$5)+(AA355*$AA$5) -> 18.91 | C355: =(K355*$K$6)+(L355*$L$6)+(M355*$M$6)+(N355*$N$6)+(O355*$O$6)+(P355*100*$P$6)+(Q355*100*$Q$6)+(R355*100*$R$6)+(S355*100*$S$6)+(T355*$T$6)+(U355*$U$6)+(V355*$V$6)+(W355*$W$6)+(X355*$X$6)+(Y355*$Y$6)+(Z355*$Z$6)+(AB355*$AA$6) -> 18.091000000000001 | D355: BRD | E355: 1 | F355: Q | G355: BRD Quest Reward | I355: 48 | J355: P | K355: 91 | L355: 12 | N355: 12
A356: Praetorian Gloves of the Tiger | B356: =(K356*$K$5)+(L356*$L$5)+(M356*$M$5)+(N356*$N$5)+(O356*$O$5)+(P356*100*$P$5)+(Q356*100*$Q$5)+(R356*100*$R$5)+(S356*100*$S$5)+(T356*$T$5)+(U356*$U$5)+(V356*$V$5)+(W356*$W$5)+(X356*$X$5)+(Y356*$Y$5)+(Z356*$Z$5)+(AA356*$AA$5) -> 18.88 | C356: =(K356*$K$6)+(L356*$L$6)+(M356*$M$6)+(N356*$N$6)+(O356*$O$6)+(P356*100*$P$6)+(Q356*100*$Q$6)+(R356*100*$R$6)+(S356*100*$S$6)+(T356*$T$6)+(U356*$U$6)+(V356*$V$6)+(W356*$W$6)+(X356*$X$6)+(Y356*$Y$6)+(Z356*$Z$6)+(AB356*$AA$6) -> 18.088000000000001 | D356: R | E356: 1 | F356: 51-55 | G356: Random World Drop | I356: 49 | J356: E | K356: 88 | L356: 12 | N356: 12
A357: Shadow Panther Hide Gloves | B357: =(K357*$K$5)+(L357*$L$5)+(M357*$M$5)+(N357*$N$5)+(O357*$O$5)+(P357*100*$P$5)+(Q357*100*$Q$5)+(R357*100*$R$5)+(S357*100*$S$5)+(T357*$T$5)+(U357*$U$5)+(V357*$V$5)+(W357*$W$5)+(X357*$X$5)+(Y357*$Y$5)+(Z357*$Z$5)+(AA357*$AA$5) -> 29.23 | C357: =(K357*$K$6)+(L357*$L$6)+(M357*$M$6)+(N357*$N$6)+(O357*$O$6)+(P357*100*$P$6)+(Q357*100*$Q$6)+(R357*100*$R$6)+(S357*100*$S$6)+(T357*$T$6)+(U357*$U$6)+(V357*$V$6)+(W357*$W$6)+(X357*$X$6)+(Y357*$Y$6)+(Z357*$Z$6)+(AB357*$AA$6) -> 17.773 | D357: ZG | E357: 4 | F357: R | G357: Random ZG Drop | I357: 60 | J357: E | K357: 173 | M357: 10 | N357: 15 | P357: 00.01
A358: Stormshroud Gloves | B358: =(K358*$K$5)+(L358*$L$5)+(M358*$M$5)+(N358*$N$5)+(O358*$O$5)+(P358*100*$P$5)+(Q358*100*$Q$5)+(R358*100*$R$5)+(S358*100*$S$5)+(T358*$T$5)+(U358*$U$5)+(V358*$V$5)+(W358*$W$5)+(X358*$X$5)+(Y358*$Y$5)+(Z358*$Z$5)+(AA358*$AA$5) -> 18.59 | C358: =(K358*$K$6)+(L358*$L$6)+(M358*$M$6)+(N358*$N$6)+(O358*$O$6)+(P358*100*$P$6)+(Q358*100*$Q$6)+(R358*100*$R$6)+(S358*100*$S$6)+(T358*$T$6)+(U358*$U$6)+(V358*$V$6)+(W358*$W$6)+(X358*$X$6)+(Y358*$Y$6)+(Z358*$Z$6)+(AB358*$AA$6) -> 17.609000000000002 | D358: LW | E358: 5 | F358: 300 | G358: Silithus Recipe Drop | H358: SS | I358: 57 | J358: E | K358: 109 | P358: 00.01 | Q358: 00.01
A359: Blight Leather Gloves | B359: =(K359*$K$5)+(L359*$L$5)+(M359*$M$5)+(N359*$N$5)+(O359*$O$5)+(P359*100*$P$5)+(Q359*100*$Q$5)+(R359*100*$R$5)+(S359*100*$S$5)+(T359*$T$5)+(U359*$U$5)+(V359*$V$5)+(W359*$W$5)+(X359*$X$5)+(Y359*$Y$5)+(Z359*$Z$5)+(AA359*$AA$5) -> 25.94 | C359: =(K359*$K$6)+(L359*$L$6)+(M359*$M$6)+(N359*$N$6)+(O359*$O$6)+(P359*100*$P$6)+(Q359*100*$Q$6)+(R359*100*$R$6)+(S359*100*$S$6)+(T359*$T$6)+(U359*$U$6)+(V359*$V$6)+(W359*$W$6)+(X359*$X$6)+(Y359*$Y$6)+(Z359*$Z$6)+(AB359*$AA$6) -> 17.173999999999999 | D359: Fel | E359: 1 | F359: Q | G359: Fel. Quest Series | I359: 48 | J359: P | K359: 94 | L359: 13 | M359: 8 | N359: 8
A360: Abyssal Leather Gloves of Striking | B360: =(K360*$K$5)+(L360*$L$5)+(M360*$M$5)+(N360*$N$5)+(O360*$O$5)+(P360*100*$P$5)+(Q360*100*$Q$5)+(R360*100*$R$5)+(S360*100*$S$5)+(T360*$T$5)+(U360*$U$5)+(V360*$V$5)+(W360*$W$5)+(X360*$X$5)+(Y360*$Y$5)+(Z360*$Z$5)+(AA360*$AA$5) -> 26.96 | C360: =(K360*$K$6)+(L360*$L$6)+(M360*$M$6)+(N360*$N$6)+(O360*$O$6)+(P360*100*$P$6)+(Q360*100*$Q$6)+(R360*100*$R$6)+(S360*100*$S$6)+(T360*$T$6)+(U360*$U$6)+(V360*$V$6)+(W360*$W$6)+(X360*$X$6)+(Y360*$Y$6)+(Z360*$Z$6)+(AB360*$AA$6) -> 16.195999999999998 | D360: Sil | E360: 4 | F360: 00.06 | G360: Earthen Templar | I360: 55 | J360: E | K360: 96 | L360: 11 | M360: 10 | N360: 10
A361: Pridelord Gloves | B361: =(K361*$K$5)+(L361*$L$5)+(M361*$M$5)+(N361*$N$5)+(O361*$O$5)+(P361*100*$P$5)+(Q361*100*$Q$5)+(R361*100*$R$5)+(S361*100*$S$5)+(T361*$T$5)+(U361*$U$5)+(V361*$V$5)+(W361*$W$5)+(X361*$X$5)+(Y361*$Y$5)+(Z361*$Z$5)+(AA361*$AA$5) -> 24.41 | C361: =(K361*$K$6)+(L361*$L$6)+(M361*$M$6)+(N361*$N$6)+(O361*$O$6)+(P361*100*$P$6)+(Q361*100*$Q$6)+(R361*100*$R$6)+(S361*100*$S$6)+(T361*$T$6)+(U361*$U$6)+(V361*$V$6)+(W361*$W$6)+(X361*$X$6)+(Y361*$Y$6)+(Z361*$Z$6)+(AB361*$AA$6) -> 15.670999999999999 | D361: R | E361: 1 | F361: 53-57 | G361: Random World Drop | I361: 51 | J361: E | K361: 91 | L361: 12 | M361: 8 | N361: 7
A362: Arachnid Gloves of the Tiger | B362: =(K362*$K$5)+(L362*$L$5)+(M362*$M$5)+(N362*$N$5)+(O362*$O$5)+(P362*100*$P$5)+(Q362*100*$Q$5)+(R362*100*$R$5)+(S362*100*$S$5)+(T362*$T$5)+(U362*$U$5)+(V362*$V$5)+(W362*$W$5)+(X362*$X$5)+(Y362*$Y$5)+(Z362*$Z$5)+(AA362*$AA$5) -> 16.79 | C362: =(K362*$K$6)+(L362*$L$6)+(M362*$M$6)+(N362*$N$6)+(O362*$O$6)+(P362*100*$P$6)+(Q362*100*$Q$6)+(R362*100*$R$6)+(S362*100*$S$6)+(T362*$T$6)+(U362*$U$6)+(V362*$V$6)+(W362*$W$6)+(X362*$X$6)+(Y362*$Y$6)+(Z362*$Z$6)+(AB362*$AA$6) -> 15.179 | D362: RFD | E362: 1 | F362: 00.01 | G362: Tuten'kash | I362: 37 | J362: P | K362: 79 | L362: 10 | N362: 10 | X362: 10
A363: Plaguebat Fur Gloves | B363: =(K363*$K$5)+(L363*$L$5)+(M363*$M$5)+(N363*$N$5)+(O363*$O$5)+(P363*100*$P$5)+(Q363*100*$Q$5)+(R363*100*$R$5)+(S363*100*$S$5)+(T363*$T$5)+(U363*$U$5)+(V363*$V$5)+(W363*$W$5)+(X363*$X$5)+(Y363*$Y$5)+(Z363*$Z$5)+(AA363*$AA$5) -> 29.03 | C363: =(K363*$K$6)+(L363*$L$6)+(M363*$M$6)+(N363*$N$6)+(O363*$O$6)+(P363*100*$P$6)+(Q363*100*$Q$6)+(R363*100*$R$6)+(S363*100*$S$6)+(T363*$T$6)+(U363*$U$6)+(V363*$V$6)+(W363*$W$6)+(X363*$X$6)+(Y363*$Y$6)+(Z363*$Z$6)+(AB363*$AA$6) -> 13.343 | D363: Str | E363: 1 | F363: 55-61 | G363: Random Strath Drop | I363: 53 | J363: E | K363: 103 | L363: 13 | M363: 14 | Y363: 10
A364: Quickdraw Gloves | B364: =(K364*$K$5)+(L364*$L$5)+(M364*$M$5)+(N364*$N$5)+(O364*$O$5)+(P364*100*$P$5)+(Q364*100*$Q$5)+(R364*100*$R$5)+(S364*100*$S$5)+(T364*$T$5)+(U364*$U$5)+(V364*$V$5)+(W364*$W$5)+(X364*$X$5)+(Y364*$Y$5)+(Z364*$Z$5)+(AA364*$AA$5) -> 22.59 | C364: =(K364*$K$6)+(L364*$L$6)+(M364*$M$6)+(N364*$N$6)+(O364*$O$6)+(P364*100*$P$6)+(Q364*100*$Q$6)+(R364*100*$R$6)+(S364*100*$S$6)+(T364*$T$6)+(U364*$U$6)+(V364*$V$6)+(W364*$W$6)+(X364*$X$6)+(Y364*$Y$6)+(Z364*$Z$6)+(AB364*$AA$6) -> 11.689 | D364: DM-W | E364: 2 | F364: 00.22 | G364: Immol'thar | I364: 57 | J364: P | K364: 109 | L364: 8 | M364: 7 | N364: 7 | S364: 00.01
A365: Stonebark Gauntlets | B365: =(K365*$K$5)+(L365*$L$5)+(M365*$M$5)+(N365*$N$5)+(O365*$O$5)+(P365*100*$P$5)+(Q365*100*$Q$5)+(R365*100*$R$5)+(S365*100*$S$5)+(T365*$T$5)+(U365*$U$5)+(V365*$V$5)+(W365*$W$5)+(X365*$X$5)+(Y365*$Y$5)+(Z365*$Z$5)+(AA365*$AA$5) -> 22.65 | C365: =(K365*$K$6)+(L365*$L$6)+(M365*$M$6)+(N365*$N$6)+(O365*$O$6)+(P365*100*$P$6)+(Q365*100*$Q$6)+(R365*100*$R$6)+(S365*100*$S$6)+(T365*$T$6)+(U365*$U$6)+(V365*$V$6)+(W365*$W$6)+(X365*$X$6)+(Y365*$Y$6)+(Z365*$Z$6)+(AB365*$AA$6) -> 10.365 | D365: DM-R | E365: 2 | F365: 57-59 | G365: Random DM Drop | I365: 54 | J365: P | K365: 105 | L365: 10 | M365: 10 | X365: 16
A366: Shadowskin Gloves | B366: =(K366*$K$5)+(L366*$L$5)+(M366*$M$5)+(N366*$N$5)+(O366*$O$5)+(P366*100*$P$5)+(Q366*100*$Q$5)+(R366*100*$R$5)+(S366*100*$S$5)+(T366*$T$5)+(U366*$U$5)+(V366*$V$5)+(W366*$W$5)+(X366*$X$5)+(Y366*$Y$5)+(Z366*$Z$5)+(AA366*$AA$5) -> 16.76 | C366: =(K366*$K$6)+(L366*$L$6)+(M366*$M$6)+(N366*$N$6)+(O366*$O$6)+(P366*100*$P$6)+(Q366*100*$Q$6)+(R366*100*$R$6)+(S366*100*$S$6)+(T366*$T$6)+(U366*$U$6)+(V366*$V$6)+(W366*$W$6)+(X366*$X$6)+(Y366*$Y$6)+(Z366*$Z$6)+(AB366*$AA$6) -> 10.135999999999999 | D366: LW | E366: 1 | F366: 200 | G366: LW Trainer | I366: 35 | J366: E | K366: 76 | M366: 6 | P366: 00.01
A368: FINGER | B368: AEP | C368: MAEP | D368: Loc | E368: P | F368: Info | G368: Source | H368: Set | I368: Lvl | J368: B | K368: Arm | L368: Agi | M368: Sta | N368: Str | O368: AP | P368: Cri | Q368: Hit | R368: Par | S368: Dod | T368: Def | U368: Ar | V368: Fi | W368: Fr | X368: Na | Y368: Sh | Z368: H/5 | AA368: PVP | AB368: PVE | AC368: Special
A369: Band of Unnatural Forces | B369: =(K369*$K$5)+(L369*$L$5)+(M369*$M$5)+(N369*$N$5)+(O369*$O$5)+(P369*100*$P$5)+(Q369*100*$Q$5)+(R369*100*$R$5)+(S369*100*$S$5)+(T369*$T$5)+(U369*$U$5)+(V369*$V$5)+(W369*$W$5)+(X369*$X$5)+(Y369*$Y$5)+(Z369*$Z$5)+(AA369*$AA$5) -> 43.5 | C369: =(K369*$K$6)+(L369*$L$6)+(M369*$M$6)+(N369*$N$6)+(O369*$O$6)+(P369*100*$P$6)+(Q369*100*$Q$6)+(R369*100*$R$6)+(S369*100*$S$6)+(T369*$T$6)+(U369*$U$6)+(V369*$V$6)+(W369*$W$6)+(X369*$X$6)+(Y369*$Y$6)+(Z369*$Z$6)+(AB369*$AA$6) -> 43.5 | D369: Naxx | E369: 6 | F369: 00.2 | G369: Loatheb | I369: 60 | J369: P | O369: 52 | P369: 00.01 | Q369: 00.01
A370: Bonescythe Ring | B370: =(K370*$K$5)+(L370*$L$5)+(M370*$M$5)+(N370*$N$5)+(O370*$O$5)+(P370*100*$P$5)+(Q370*100*$Q$5)+(R370*100*$R$5)+(S370*100*$S$5)+(T370*$T$5)+(U370*$U$5)+(V370*$V$5)+(W370*$W$5)+(X370*$X$5)+(Y370*$Y$5)+(Z370*$Z$5)+(AA370*$AA$5) -> 47.5 | C370: =(K370*$K$6)+(L370*$L$6)+(M370*$M$6)+(N370*$N$6)+(O370*$O$6)+(P370*100*$P$6)+(Q370*100*$Q$6)+(R370*100*$R$6)+(S370*100*$S$6)+(T370*$T$6)+(U370*$U$6)+(V370*$V$6)+(W370*$W$6)+(X370*$X$6)+(Y370*$Y$6)+(Z370*$Z$6)+(AB370*$AA$6) -> 37.6 | D370: Naxx | E370: 6 | F370: 00.21 | G370: Kel'Thuzad | H370: BS | I370: 60 | J370: P | L370: 20 | M370: 10 | N370: 20 | Q370: 00.01
A371: Band of Reanimation | B371: =(K371*$K$5)+(L371*$L$5)+(M371*$M$5)+(N371*$N$5)+(O371*$O$5)+(P371*100*$P$5)+(Q371*100*$Q$5)+(R371*100*$R$5)+(S371*100*$S$5)+(T371*$T$5)+(U371*$U$5)+(V371*$V$5)+(W371*$W$5)+(X371*$X$5)+(Y371*$Y$5)+(Z371*$Z$5)+(AA371*$AA$5) -> 34 | C371: =(K371*$K$6)+(L371*$L$6)+(M371*$M$6)+(N371*$N$6)+(O371*$O$6)+(P371*100*$P$6)+(Q371*100*$Q$6)+(R371*100*$R$6)+(S371*100*$S$6)+(T371*$T$6)+(U371*$U$6)+(V371*$V$6)+(W371*$W$6)+(X371*$X$6)+(Y371*$Y$6)+(Z371*$Z$6)+(AB371*$AA$6) -> 34 | D371: Naxx | E371: 6 | F371: 00.2 | G371: Patchwerk | I371: 60 | J371: P | L371: 34
A372: Master Dragonslayer's Ring | B372: =(K372*$K$5)+(L372*$L$5)+(M372*$M$5)+(N372*$N$5)+(O372*$O$5)+(P372*100*$P$5)+(Q372*100*$Q$5)+(R372*100*$R$5)+(S372*100*$S$5)+(T372*$T$5)+(U372*$U$5)+(V372*$V$5)+(W372*$W$5)+(X372*$X$5)+(Y372*$Y$5)+(Z372*$Z$5)+(AA372*$AA$5) -> 45.5 | C372: =(K372*$K$6)+(L372*$L$6)+(M372*$M$6)+(N372*$N$6)+(O372*$O$6)+(P372*100*$P$6)+(Q372*100*$Q$6)+(R372*100*$R$6)+(S372*100*$S$6)+(T372*$T$6)+(U372*$U$6)+(V372*$V$6)+(W372*$W$6)+(X372*$X$6)+(Y372*$Y$6)+(Z372*$Z$6)+(AB372*$AA$6) -> 31.64 | D372: BWL | E372: 3 | F372: Q | G372: Head of Nefarian | I372: 60 | J372: P | M372: 14 | O372: 48 | Q372: 00.01
A373: Signet Ring of the Bronze (DPS5) | B373: =(K373*$K$5)+(L373*$L$5)+(M373*$M$5)+(N373*$N$5)+(O373*$O$5)+(P373*100*$P$5)+(Q373*100*$Q$5)+(R373*100*$R$5)+(S373*100*$S$5)+(T373*$T$5)+(U373*$U$5)+(V373*$V$5)+(W373*$W$5)+(X373*$X$5)+(Y373*$Y$5)+(Z373*$Z$5)+(AA373*$AA$5) -> 44.5 | C373: =(K373*$K$6)+(L373*$L$6)+(M373*$M$6)+(N373*$N$6)+(O373*$O$6)+(P373*100*$P$6)+(Q373*100*$Q$6)+(R373*100*$R$6)+(S373*100*$S$6)+(T373*$T$6)+(U373*$U$6)+(V373*$V$6)+(W373*$W$6)+(X373*$X$6)+(Y373*$Y$6)+(Z373*$Z$6)+(AB373*$AA$6) -> 31.63 | D373: Sil | E373: 5 | F373: Exalt | G373: Exalted w/ BD | I373: 60 | J373: P | L373: 24 | M373: 13 | Q373: 00.01
A374: Band of Accuria | B374: =(K374*$K$5)+(L374*$L$5)+(M374*$M$5)+(N374*$N$5)+(O374*$O$5)+(P374*100*$P$5)+(Q374*100*$Q$5)+(R374*100*$R$5)+(S374*100*$S$5)+(T374*$T$5)+(U374*$U$5)+(V374*$V$5)+(W374*$W$5)+(X374*$X$5)+(Y374*$Y$5)+(Z374*$Z$5)+(AA374*$AA$5) -> 41 | C374: =(K374*$K$6)+(L374*$L$6)+(M374*$M$6)+(N374*$N$6)+(O374*$O$6)+(P374*100*$P$6)+(Q374*100*$Q$6)+(R374*100*$R$6)+(S374*100*$S$6)+(T374*$T$6)+(U374*$U$6)+(V374*$V$6)+(W374*$W$6)+(X374*$X$6)+(Y374*$Y$6)+(Z374*$Z$6)+(AB374*$AA$6) -> 31.1 | D374: MC | E374: 1 | F374: 00.1 | G374: Ragnaros | I374: 60 | J374: P | L374: 16 | M374: 10 | Q374: 00.02
A375: Ring of the Qiraji Fury | B375: =(K375*$K$5)+(L375*$L$5)+(M375*$M$5)+(N375*$N$5)+(O375*$O$5)+(P375*100*$P$5)+(Q375*100*$Q$5)+(R375*100*$R$5)+(S375*100*$S$5)+(T375*$T$5)+(U375*$U$5)+(V375*$V$5)+(W375*$W$5)+(X375*$X$5)+(Y375*$Y$5)+(Z375*$Z$5)+(AA375*$AA$5) -> 42 | C375: =(K375*$K$6)+(L375*$L$6)+(M375*$M$6)+(N375*$N$6)+(O375*$O$6)+(P375*100*$P$6)+(Q375*100*$Q$6)+(R375*100*$R$6)+(S375*100*$S$6)+(T375*$T$6)+(U375*$U$6)+(V375*$V$6)+(W375*$W$6)+(X375*$X$6)+(Y375*$Y$6)+(Z375*$Z$6)+(AB375*$AA$6) -> 30.12 | D375: AQ40 | E375: 5 | F375: 00.14 | G375: Sartura/Viscidus | I375: 60 | J375: P | M375: 12 | O375: 40 | P375: 00.01
A376: Signet Ring of the Bronze (DPS4) | B376: =(K376*$K$5)+(L376*$L$5)+(M376*$M$5)+(N376*$N$5)+(O376*$O$5)+(P376*100*$P$5)+(Q376*100*$Q$5)+(R376*100*$R$5)+(S376*100*$S$5)+(T376*$T$5)+(U376*$U$5)+(V376*$V$5)+(W376*$W$5)+(X376*$X$5)+(Y376*$Y$5)+(Z376*$Z$5)+(AA376*$AA$5) -> 40.5 | C376: =(K376*$K$6)+(L376*$L$6)+(M376*$M$6)+(N376*$N$6)+(O376*$O$6)+(P376*100*$P$6)+(Q376*100*$Q$6)+(R376*100*$R$6)+(S376*100*$S$6)+(T376*$T$6)+(U376*$U$6)+(V376*$V$6)+(W376*$W$6)+(X376*$X$6)+(Y376*$Y$6)+(Z376*$Z$6)+(AB376*$AA$6) -> 29.61 | D376: Sil | E376: 5 | F376: Rev | G376: Revered w/ BD | I376: 60 | J376: P | L376: 22 | M376: 11 | Q376: 00.01
A377: Signet Ring of the Bronze (DPS3) | B377: =(K377*$K$5)+(L377*$L$5)+(M377*$M$5)+(N377*$N$5)+(O377*$O$5)+(P377*100*$P$5)+(Q377*100*$Q$5)+(R377*100*$R$5)+(S377*100*$S$5)+(T377*$T$5)+(U377*$U$5)+(V377*$V$5)+(W377*$W$5)+(X377*$X$5)+(Y377*$Y$5)+(Z377*$Z$5)+(AA377*$AA$5) -> 39.5 | C377: =(K377*$K$6)+(L377*$L$6)+(M377*$M$6)+(N377*$N$6)+(O377*$O$6)+(P377*100*$P$6)+(Q377*100*$Q$6)+(R377*100*$R$6)+(S377*100*$S$6)+(T377*$T$6)+(U377*$U$6)+(V377*$V$6)+(W377*$W$6)+(X377*$X$6)+(Y377*$Y$6)+(Z377*$Z$6)+(AB377*$AA$6) -> 28.61 | D377: Sil | E377: 5 | F377: Hon | G377: Honored w/ BD | I377: 60 | J377: P | L377: 21 | M377: 11 | Q377: 00.01
A378: Circle of Applied Force | B378: =(K378*$K$5)+(L378*$L$5)+(M378*$M$5)+(N378*$N$5)+(O378*$O$5)+(P378*100*$P$5)+(Q378*100*$Q$5)+(R378*100*$R$5)+(S378*100*$S$5)+(T378*$T$5)+(U378*$U$5)+(V378*$V$5)+(W378*$W$5)+(X378*$X$5)+(Y378*$Y$5)+(Z378*$Z$5)+(AA378*$AA$5) -> 37 | C378: =(K378*$K$6)+(L378*$L$6)+(M378*$M$6)+(N378*$N$6)+(O378*$O$6)+(P378*100*$P$6)+(Q378*100*$Q$6)+(R378*100*$R$6)+(S378*100*$S$6)+(T378*$T$6)+(U378*$U$6)+(V378*$V$6)+(W378*$W$6)+(X378*$X$6)+(Y378*$Y$6)+(Z378*$Z$6)+(AB378*$AA$6) -> 28.09 | D378: BWL | E378: 3 | F378: 00.09 | G378: Flamegor | I378: 60 | J378: P | L378: 22 | M378: 9 | N378: 12
A379: Quick Strike Ring | B379: =(K379*$K$5)+(L379*$L$5)+(M379*$M$5)+(N379*$N$5)+(O379*$O$5)+(P379*100*$P$5)+(Q379*100*$Q$5)+(R379*100*$R$5)+(S379*100*$S$5)+(T379*$T$5)+(U379*$U$5)+(V379*$V$5)+(W379*$W$5)+(X379*$X$5)+(Y379*$Y$5)+(Z379*$Z$5)+(AA379*$AA$5) -> 35.5 | C379: =(K379*$K$6)+(L379*$L$6)+(M379*$M$6)+(N379*$N$6)+(O379*$O$6)+(P379*100*$P$6)+(Q379*100*$Q$6)+(R379*100*$R$6)+(S379*100*$S$6)+(T379*$T$6)+(U379*$U$6)+(V379*$V$6)+(W379*$W$6)+(X379*$X$6)+(Y379*$Y$6)+(Z379*$Z$6)+(AB379*$AA$6) -> 27.58 | D379: MC | E379: 1 | F379: 00.07 | G379: MC Boss Drop | I379: 60 | J379: P | M379: 8 | N379: 5 | O379: 30 | P379: 00.01
A380: Ring of the Godslayer | B380: =(K380*$K$5)+(L380*$L$5)+(M380*$M$5)+(N380*$N$5)+(O380*$O$5)+(P380*100*$P$5)+(Q380*100*$Q$5)+(R380*100*$R$5)+(S380*100*$S$5)+(T380*$T$5)+(U380*$U$5)+(V380*$V$5)+(W380*$W$5)+(X380*$X$5)+(Y380*$Y$5)+(Z380*$Z$5)+(AA380*$AA$5) -> 44 | C380: =(K380*$K$6)+(L380*$L$6)+(M380*$M$6)+(N380*$N$6)+(O380*$O$6)+(P380*100*$P$6)+(Q380*100*$Q$6)+(R380*100*$R$6)+(S380*100*$S$6)+(T380*$T$6)+(U380*$U$6)+(V380*$V$6)+(W380*$W$6)+(X380*$X$6)+(Y380*$Y$6)+(Z380*$Z$6)+(AB380*$AA$6) -> 27.17 | D380: AQ40 | E380: 5 | F380: 00.15 | G380: C'Thun | I380: 60 | J380: P | L380: 27 | M380: 17
A381: Signet Ring of the Bronze (DPS2) | B381: =(K381*$K$5)+(L381*$L$5)+(M381*$M$5)+(N381*$N$5)+(O381*$O$5)+(P381*100*$P$5)+(Q381*100*$Q$5)+(R381*100*$R$5)+(S381*100*$S$5)+(T381*$T$5)+(U381*$U$5)+(V381*$V$5)+(W381*$W$5)+(X381*$X$5)+(Y381*$Y$5)+(Z381*$Z$5)+(AA381*$AA$5) -> 35.5 | C381: =(K381*$K$6)+(L381*$L$6)+(M381*$M$6)+(N381*$N$6)+(O381*$O$6)+(P381*100*$P$6)+(Q381*100*$Q$6)+(R381*100*$R$6)+(S381*100*$S$6)+(T381*$T$6)+(U381*$U$6)+(V381*$V$6)+(W381*$W$6)+(X381*$X$6)+(Y381*$Y$6)+(Z381*$Z$6)+(AB381*$AA$6) -> 26.59 | D381: Sil | E381: 5 | F381: Fri | G381: Friendly w/ BD | I381: 60 | J381: P | L381: 19 | M381: 9 | Q381: 00.01
A382: Don Julio's Band | B382: =(K382*$K$5)+(L382*$L$5)+(M382*$M$5)+(N382*$N$5)+(O382*$O$5)+(P382*100*$P$5)+(Q382*100*$Q$5)+(R382*100*$R$5)+(S382*100*$S$5)+(T382*$T$5)+(U382*$U$5)+(V382*$V$5)+(W382*$W$5)+(X382*$X$5)+(Y382*$Y$5)+(Z382*$Z$5)+(AA382*$AA$5) -> 36.5 | C382: =(K382*$K$6)+(L382*$L$6)+(M382*$M$6)+(N382*$N$6)+(O382*$O$6)+(P382*100*$P$6)+(Q382*100*$Q$6)+(R382*100*$R$6)+(S382*100*$S$6)+(T382*$T$6)+(U382*$U$6)+(V382*$V$6)+(W382*$W$6)+(X382*$X$6)+(Y382*$Y$6)+(Z382*$Z$6)+(AB382*$AA$6) -> 25.61 | D382: AV | E382: 3 | F382: Exalt | G382: AV Exalted Reward | I382: 60 | J382: P | M382: 11 | O382: 16 | P382: 00.01 | Q382: 00.01
A383: Signet Ring of the Bronze (DPS1) | B383: =(K383*$K$5)+(L383*$L$5)+(M383*$M$5)+(N383*$N$5)+(O383*$O$5)+(P383*100*$P$5)+(Q383*100*$Q$5)+(R383*100*$R$5)+(S383*100*$S$5)+(T383*$T$5)+(U383*$U$5)+(V383*$V$5)+(W383*$W$5)+(X383*$X$5)+(Y383*$Y$5)+(Z383*$Z$5)+(AA383*$AA$5) -> 33.5 | C383: =(K383*$K$6)+(L383*$L$6)+(M383*$M$6)+(N383*$N$6)+(O383*$O$6)+(P383*100*$P$6)+(Q383*100*$Q$6)+(R383*100*$R$6)+(S383*100*$S$6)+(T383*$T$6)+(U383*$U$6)+(V383*$V$6)+(W383*$W$6)+(X383*$X$6)+(Y383*$Y$6)+(Z383*$Z$6)+(AB383*$AA$6) -> 25.58 | D383: Sil | E383: 5 | F383: Neu | G383: Neutral w/ BD | I383: 60 | J383: P | L383: 18 | M383: 8 | Q383: 00.01
A384: Band of Veiled Shadows | B384: =(K384*$K$5)+(L384*$L$5)+(M384*$M$5)+(N384*$N$5)+(O384*$O$5)+(P384*100*$P$5)+(Q384*100*$Q$5)+(R384*100*$R$5)+(S384*100*$S$5)+(T384*$T$5)+(U384*$U$5)+(V384*$V$5)+(W384*$W$5)+(X384*$X$5)+(Y384*$Y$5)+(Z384*$Z$5)+(AA384*$AA$5) -> 31.5 | C384: =(K384*$K$6)+(L384*$L$6)+(M384*$M$6)+(N384*$N$6)+(O384*$O$6)+(P384*100*$P$6)+(Q384*100*$Q$6)+(R384*100*$R$6)+(S384*100*$S$6)+(T384*$T$6)+(U384*$U$6)+(V384*$V$6)+(W384*$W$6)+(X384*$X$6)+(Y384*$Y$6)+(Z384*$Z$6)+(AB384*$AA$6) -> 23.58 | D384: AQ40 | E384: 5 | F384: Q | G384: AQ40 Quest Reward | H384: VS | I384: 60 | J384: P | L384: 18 | M384: 8 | N384: 11
A385: Might of Cenarius | B385: =(K385*$K$5)+(L385*$L$5)+(M385*$M$5)+(N385*$N$5)+(O385*$O$5)+(P385*100*$P$5)+(Q385*100*$Q$5)+(R385*100*$R$5)+(S385*100*$S$5)+(T385*$T$5)+(U385*$U$5)+(V385*$V$5)+(W385*$W$5)+(X385*$X$5)+(Y385*$Y$5)+(Z385*$Z$5)+(AA385*$AA$5) -> 19.5 | C385: =(K385*$K$6)+(L385*$L$6)+(M385*$M$6)+(N385*$N$6)+(O385*$O$6)+(P385*100*$P$6)+(Q385*100*$Q$6)+(R385*100*$R$6)+(S385*100*$S$6)+(T385*$T$6)+(U385*$U$6)+(V385*$V$6)+(W385*$W$6)+(X385*$X$6)+(Y385*$Y$6)+(Z385*$Z$6)+(AB385*$AA$6) -> 23.58 | D385: Sil | E385: 5 | F385: Q | G385: Sil Quest Reward | I385: 60 | J385: P | M385: 8 | Q385: 00.01 | AA385: 4 | AB385: 16 | AC385: +4 Weap Dam
A386: Ring of Fury | B386: =(K386*$K$5)+(L386*$L$5)+(M386*$M$5)+(N386*$N$5)+(O386*$O$5)+(P386*100*$P$5)+(Q386*100*$Q$5)+(R386*100*$R$5)+(S386*100*$S$5)+(T386*$T$5)+(U386*$U$5)+(V386*$V$5)+(W386*$W$5)+(X386*$X$5)+(Y386*$Y$5)+(Z386*$Z$5)+(AA386*$AA$5) -> 31.5 | C386: =(K386*$K$6)+(L386*$L$6)+(M386*$M$6)+(N386*$N$6)+(O386*$O$6)+(P386*100*$P$6)+(Q386*100*$Q$6)+(R386*100*$R$6)+(S386*100*$S$6)+(T386*$T$6)+(U386*$U$6)+(V386*$V$6)+(W386*$W$6)+(X386*$X$6)+(Y386*$Y$6)+(Z386*$Z$6)+(AB386*$AA$6) -> 22.59 | D386: AQ20 | E386: 5 | F386: 00.11 | G386: Moam | I386: 60 | J386: P | M386: 9 | O386: 30 | Q386: 00.01
A387: Tarnished Elven Ring | B387: =(K387*$K$5)+(L387*$L$5)+(M387*$M$5)+(N387*$N$5)+(O387*$O$5)+(P387*100*$P$5)+(Q387*100*$Q$5)+(R387*100*$R$5)+(S387*100*$S$5)+(T387*$T$5)+(U387*$U$5)+(V387*$V$5)+(W387*$W$5)+(X387*$X$5)+(Y387*$Y$5)+(Z387*$Z$5)+(AA387*$AA$5) -> 22.5 | C387: =(K387*$K$6)+(L387*$L$6)+(M387*$M$6)+(N387*$N$6)+(O387*$O$6)+(P387*100*$P$6)+(Q387*100*$Q$6)+(R387*100*$R$6)+(S387*100*$S$6)+(T387*$T$6)+(U387*$U$6)+(V387*$V$6)+(W387*$W$6)+(X387*$X$6)+(Y387*$Y$6)+(Z387*$Z$6)+(AB387*$AA$6) -> 22.5 | D387: DM-N | E387: 2 | F387: 00.16 | G387: Gordok Tribute | I387: 56 | J387: P | L387: 15 | Q387: 00.01
A388: Band of Jin | B388: =(K388*$K$5)+(L388*$L$5)+(M388*$M$5)+(N388*$N$5)+(O388*$O$5)+(P388*100*$P$5)+(Q388*100*$Q$5)+(R388*100*$R$5)+(S388*100*$S$5)+(T388*$T$5)+(U388*$U$5)+(V388*$V$5)+(W388*$W$5)+(X388*$X$5)+(Y388*$Y$5)+(Z388*$Z$5)+(AA388*$AA$5) -> 29.5 | C388: =(K388*$K$6)+(L388*$L$6)+(M388*$M$6)+(N388*$N$6)+(O388*$O$6)+(P388*100*$P$6)+(Q388*100*$Q$6)+(R388*100*$R$6)+(S388*100*$S$6)+(T388*$T$6)+(U388*$U$6)+(V388*$V$6)+(W388*$W$6)+(X388*$X$6)+(Y388*$Y$6)+(Z388*$Z$6)+(AB388*$AA$6) -> 21.58 | D388: ZG | E388: 4 | F388: 00.13 | G388: High Priestess Mar'li | H388: MMI | I388: 60 | J388: P | L388: 14 | M388: 8 | Q388: 00.01
A389: Ring of the Unliving | B389: =(K389*$K$5)+(L389*$L$5)+(M389*$M$5)+(N389*$N$5)+(O389*$O$5)+(P389*100*$P$5)+(Q389*100*$Q$5)+(R389*100*$R$5)+(S389*100*$S$5)+(T389*$T$5)+(U389*$U$5)+(V389*$V$5)+(W389*$W$5)+(X389*$X$5)+(Y389*$Y$5)+(Z389*$Z$5)+(AA389*$AA$5) -> 37 | C389: =(K389*$K$6)+(L389*$L$6)+(M389*$M$6)+(N389*$N$6)+(O389*$O$6)+(P389*100*$P$6)+(Q389*100*$Q$6)+(R389*100*$R$6)+(S389*100*$S$6)+(T389*$T$6)+(U389*$U$6)+(V389*$V$6)+(W389*$W$6)+(X389*$X$6)+(Y389*$Y$6)+(Z389*$Z$6)+(AB389*$AA$6) -> 21.16 | D389: 4D | E389: 4 | F389: 00.14 | G389: Emeriss | I389: 60 | J389: P | L389: 21 | M389: 16
A390: Band of Earthen Might | B390: =(K390*$K$5)+(L390*$L$5)+(M390*$M$5)+(N390*$N$5)+(O390*$O$5)+(P390*100*$P$5)+(Q390*100*$Q$5)+(R390*100*$R$5)+(S390*100*$S$5)+(T390*$T$5)+(U390*$U$5)+(V390*$V$5)+(W390*$W$5)+(X390*$X$5)+(Y390*$Y$5)+(Z390*$Z$5)+(AA390*$AA$5) -> 20.5 | C390: =(K390*$K$6)+(L390*$L$6)+(M390*$M$6)+(N390*$N$6)+(O390*$O$6)+(P390*100*$P$6)+(Q390*100*$Q$6)+(R390*100*$R$6)+(S390*100*$S$6)+(T390*$T$6)+(U390*$U$6)+(V390*$V$6)+(W390*$W$6)+(X390*$X$6)+(Y390*$Y$6)+(Z390*$Z$6)+(AB390*$AA$6) -> 20.5 | D390: Sil | E390: 5 | F390: Q | G390: Silithus Quest | I390: 60 | J390: P | N390: 6 | P390: 00.01 | Q390: 00.01
A391: Seal of the Gurubashi Berserker | B391: =(K391*$K$5)+(L391*$L$5)+(M391*$M$5)+(N391*$N$5)+(O391*$O$5)+(P391*100*$P$5)+(Q391*100*$Q$5)+(R391*100*$R$5)+(S391*100*$S$5)+(T391*$T$5)+(U391*$U$5)+(V391*$V$5)+(W391*$W$5)+(X391*$X$5)+(Y391*$Y$5)+(Z391*$Z$5)+(AA391*$AA$5) -> 33 | C391: =(K391*$K$6)+(L391*$L$6)+(M391*$M$6)+(N391*$N$6)+(O391*$O$6)+(P391*100*$P$6)+(Q391*100*$Q$6)+(R391*100*$R$6)+(S391*100*$S$6)+(T391*$T$6)+(U391*$U$6)+(V391*$V$6)+(W391*$W$6)+(X391*$X$6)+(Y391*$Y$6)+(Z391*$Z$6)+(AB391*$AA$6) -> 20.13 | D391: ZG | E391: 4 | F391: 00.06 | G391: ZG Boss Drop | I391: 60 | J391: P | M391: 13 | O391: 40
A392: Seal of Jin | B392: =(K392*$K$5)+(L392*$L$5)+(M392*$M$5)+(N392*$N$5)+(O392*$O$5)+(P392*100*$P$5)+(Q392*100*$Q$5)+(R392*100*$R$5)+(S392*100*$S$5)+(T392*$T$5)+(U392*$U$5)+(V392*$V$5)+(W392*$W$5)+(X392*$X$5)+(Y392*$Y$5)+(Z392*$Z$5)+(AA392*$AA$5) -> 28 | C392: =(K392*$K$6)+(L392*$L$6)+(M392*$M$6)+(N392*$N$6)+(O392*$O$6)+(P392*100*$P$6)+(Q392*100*$Q$6)+(R392*100*$R$6)+(S392*100*$S$6)+(T392*$T$6)+(U392*$U$6)+(V392*$V$6)+(W392*$W$6)+(X392*$X$6)+(Y392*$Y$6)+(Z392*$Z$6)+(AB392*$AA$6) -> 20.08 | D392: ZG | E392: 4 | F392: 00.15 | G392: High Priest Thekal | H392: MMI | I392: 60 | J392: P | M392: 8 | O392: 20 | P392: 00.01
A393: Painweaver Band | B393: =(K393*$K$5)+(L393*$L$5)+(M393*$M$5)+(N393*$N$5)+(O393*$O$5)+(P393*100*$P$5)+(Q393*100*$Q$5)+(R393*100*$R$5)+(S393*100*$S$5)+(T393*$T$5)+(U393*$U$5)+(V393*$V$5)+(W393*$W$5)+(X393*$X$5)+(Y393*$Y$5)+(Z393*$Z$5)+(AA393*$AA$5) -> 25 | C393: =(K393*$K$6)+(L393*$L$6)+(M393*$M$6)+(N393*$N$6)+(O393*$O$6)+(P393*100*$P$6)+(Q393*100*$Q$6)+(R393*100*$R$6)+(S393*100*$S$6)+(T393*$T$6)+(U393*$U$6)+(V393*$V$6)+(W393*$W$6)+(X393*$X$6)+(Y393*$Y$6)+(Z393*$Z$6)+(AB393*$AA$6) -> 18.07 | D393: UBRS | E393: 1 | F393: 00.16 | G393: General Drakkisath | I393: 58 | J393: P | M393: 7 | O393: 16 | P393: 00.01
A394: Blackstone Ring | B394: =(K394*$K$5)+(L394*$L$5)+(M394*$M$5)+(N394*$N$5)+(O394*$O$5)+(P394*100*$P$5)+(Q394*100*$Q$5)+(R394*100*$R$5)+(S394*100*$S$5)+(T394*$T$5)+(U394*$U$5)+(V394*$V$5)+(W394*$W$5)+(X394*$X$5)+(Y394*$Y$5)+(Z394*$Z$5)+(AA394*$AA$5) -> 23.5 | C394: =(K394*$K$6)+(L394*$L$6)+(M394*$M$6)+(N394*$N$6)+(O394*$O$6)+(P394*100*$P$6)+(Q394*100*$Q$6)+(R394*100*$R$6)+(S394*100*$S$6)+(T394*$T$6)+(U394*$U$6)+(V394*$V$6)+(W394*$W$6)+(X394*$X$6)+(Y394*$Y$6)+(Z394*$Z$6)+(AB394*$AA$6) -> 17.56 | D394: Mar | E394: 1 | F394: 00.18 | G394: Princess Theradras | I394: 49 | J394: P | M394: 6 | O394: 20 | Q394: 00.01
A395: Legionnaire's Band (58) | B395: =(K395*$K$5)+(L395*$L$5)+(M395*$M$5)+(N395*$N$5)+(O395*$O$5)+(P395*100*$P$5)+(Q395*100*$Q$5)+(R395*100*$R$5)+(S395*100*$S$5)+(T395*$T$5)+(U395*$U$5)+(V395*$V$5)+(W395*$W$5)+(X395*$X$5)+(Y395*$Y$5)+(Z395*$Z$5)+(AA395*$AA$5) -> 25 | C395: =(K395*$K$6)+(L395*$L$6)+(M395*$M$6)+(N395*$N$6)+(O395*$O$6)+(P395*100*$P$6)+(Q395*100*$Q$6)+(R395*100*$R$6)+(S395*100*$S$6)+(T395*$T$6)+(U395*$U$6)+(V395*$V$6)+(W395*$W$6)+(X395*$X$6)+(Y395*$Y$6)+(Z395*$Z$6)+(AB395*$AA$6) -> 17.08 | D395: WSG | E395: 3 | F395: Hon | G395: Horde WSG Honored | I395: 58 | J395: P | L395: 11 | M395: 8 | N395: 12
A396: Protector's Band (58) | B396: =(K396*$K$5)+(L396*$L$5)+(M396*$M$5)+(N396*$N$5)+(O396*$O$5)+(P396*100*$P$5)+(Q396*100*$Q$5)+(R396*100*$R$5)+(S396*100*$S$5)+(T396*$T$5)+(U396*$U$5)+(V396*$V$5)+(W396*$W$5)+(X396*$X$5)+(Y396*$Y$5)+(Z396*$Z$5)+(AA396*$AA$5) -> 25 | C396: =(K396*$K$6)+(L396*$L$6)+(M396*$M$6)+(N396*$N$6)+(O396*$O$6)+(P396*100*$P$6)+(Q396*100*$Q$6)+(R396*100*$R$6)+(S396*100*$S$6)+(T396*$T$6)+(U396*$U$6)+(V396*$V$6)+(W396*$W$6)+(X396*$X$6)+(Y396*$Y$6)+(Z396*$Z$6)+(AB396*$AA$6) -> 17.08 | D396: WSG | E396: 3 | F396: Hon | G396: All. WSG Honored | I396: 58 | J396: P | L396: 11 | M396: 8 | N396: 12
A397: Prismatic Band of the Tiger | B397: =(K397*$K$5)+(L397*$L$5)+(M397*$M$5)+(N397*$N$5)+(O397*$O$5)+(P397*100*$P$5)+(Q397*100*$Q$5)+(R397*100*$R$5)+(S397*100*$S$5)+(T397*$T$5)+(U397*$U$5)+(V397*$V$5)+(W397*$W$5)+(X397*$X$5)+(Y397*$Y$5)+(Z397*$Z$5)+(AA397*$AA$5) -> 16.5 | C397: =(K397*$K$6)+(L397*$L$6)+(M397*$M$6)+(N397*$N$6)+(O397*$O$6)+(P397*100*$P$6)+(Q397*100*$Q$6)+(R397*100*$R$6)+(S397*100*$S$6)+(T397*$T$6)+(U397*$U$6)+(V397*$V$6)+(W397*$W$6)+(X397*$X$6)+(Y397*$Y$6)+(Z397*$Z$6)+(AB397*$AA$6) -> 16.5 | D397: R | E397: 1 | F397: 56-63 | G397: Random World Drop | I397: 60 | J397: E | L397: 11 | N397: 11
A398: Band of the Cultist | B398: =(K398*$K$5)+(L398*$L$5)+(M398*$M$5)+(N398*$N$5)+(O398*$O$5)+(P398*100*$P$5)+(Q398*100*$Q$5)+(R398*100*$R$5)+(S398*100*$S$5)+(T398*$T$5)+(U398*$U$5)+(V398*$V$5)+(W398*$W$5)+(X398*$X$5)+(Y398*$Y$5)+(Z398*$Z$5)+(AA398*$AA$5) -> 27.5 | C398: =(K398*$K$6)+(L398*$L$6)+(M398*$M$6)+(N398*$N$6)+(O398*$O$6)+(P398*100*$P$6)+(Q398*100*$Q$6)+(R398*100*$R$6)+(S398*100*$S$6)+(T398*$T$6)+(U398*$U$6)+(V398*$V$6)+(W398*$W$6)+(X398*$X$6)+(Y398*$Y$6)+(Z398*$Z$6)+(AB398*$AA$6) -> 15.62 | D398: Sil | E398: 4 | F398: Q | G398: Abyssal Q Reward | I398: 60 | J398: E | L398: 12 | M398: 12 | N398: 7
A399: Magma Forged Band | B399: =(K399*$K$5)+(L399*$L$5)+(M399*$M$5)+(N399*$N$5)+(O399*$O$5)+(P399*100*$P$5)+(Q399*100*$Q$5)+(R399*100*$R$5)+(S399*100*$S$5)+(T399*$T$5)+(U399*$U$5)+(V399*$V$5)+(W399*$W$5)+(X399*$X$5)+(Y399*$Y$5)+(Z399*$Z$5)+(AA399*$AA$5) -> 22.5 | C399: =(K399*$K$6)+(L399*$L$6)+(M399*$M$6)+(N399*$N$6)+(O399*$O$6)+(P399*100*$P$6)+(Q399*100*$Q$6)+(R399*100*$R$6)+(S399*100*$S$6)+(T399*$T$6)+(U399*$U$6)+(V399*$V$6)+(W399*$W$6)+(X399*$X$6)+(Y399*$Y$6)+(Z399*$Z$6)+(AB399*$AA$6) -> 15.57 | D399: BRD | E399: 5 | F399: R | G399: Random BRD Drop | I399: 52 | J399: P | L399: 12 | M399: 7 | N399: 7
A400: Innervating Band | B400: =(K400*$K$5)+(L400*$L$5)+(M400*$M$5)+(N400*$N$5)+(O400*$O$5)+(P400*100*$P$5)+(Q400*100*$Q$5)+(R400*100*$R$5)+(S400*100*$S$5)+(T400*$T$5)+(U400*$U$5)+(V400*$V$5)+(W400*$W$5)+(X400*$X$5)+(Y400*$Y$5)+(Z400*$Z$5)+(AA400*$AA$5) -> 24 | C400: =(K400*$K$6)+(L400*$L$6)+(M400*$M$6)+(N400*$N$6)+(O400*$O$6)+(P400*100*$P$6)+(Q400*100*$Q$6)+(R400*100*$R$6)+(S400*100*$S$6)+(T400*$T$6)+(U400*$U$6)+(V400*$V$6)+(W400*$W$6)+(X400*$X$6)+(Y400*$Y$6)+(Z400*$Z$6)+(AB400*$AA$6) -> 15.09 | D400: Sch | E400: 1 | F400: 57-61 | G400: Random Scholo Drop | I400: 54 | J400: P | L400: 15 | M400: 9
A401: Drakeclaw Band of the Tiger | B401: =(K401*$K$5)+(L401*$L$5)+(M401*$M$5)+(N401*$N$5)+(O401*$O$5)+(P401*100*$P$5)+(Q401*100*$Q$5)+(R401*100*$R$5)+(S401*100*$S$5)+(T401*$T$5)+(U401*$U$5)+(V401*$V$5)+(W401*$W$5)+(X401*$X$5)+(Y401*$Y$5)+(Z401*$Z$5)+(AA401*$AA$5) -> 16.2 | C401: =(K401*$K$6)+(L401*$L$6)+(M401*$M$6)+(N401*$N$6)+(O401*$O$6)+(P401*100*$P$6)+(Q401*100*$Q$6)+(R401*100*$R$6)+(S401*100*$S$6)+(T401*$T$6)+(U401*$U$6)+(V401*$V$6)+(W401*$W$6)+(X401*$X$6)+(Y401*$Y$6)+(Z401*$Z$6)+(AB401*$AA$6) -> 15.06 | D401: ToAH | E401: 1 | F401: 51-53 | G401: ToAH Boss Drop | I401: 49 | J401: P | L401: 10 | N401: 10 | T401: 6
A402: Jungle Ring of the Tiger | B402: =(K402*$K$5)+(L402*$L$5)+(M402*$M$5)+(N402*$N$5)+(O402*$O$5)+(P402*100*$P$5)+(Q402*100*$Q$5)+(R402*100*$R$5)+(S402*100*$S$5)+(T402*$T$5)+(U402*$U$5)+(V402*$V$5)+(W402*$W$5)+(X402*$X$5)+(Y402*$Y$5)+(Z402*$Z$5)+(AA402*$AA$5) -> 15 | C402: =(K402*$K$6)+(L402*$L$6)+(M402*$M$6)+(N402*$N$6)+(O402*$O$6)+(P402*100*$P$6)+(Q402*100*$Q$6)+(R402*100*$R$6)+(S402*100*$S$6)+(T402*$T$6)+(U402*$U$6)+(V402*$V$6)+(W402*$W$6)+(X402*$X$6)+(Y402*$Y$6)+(Z402*$Z$6)+(AB402*$AA$6) -> 15 | D402: R | E402: 1 | F402: 58-61 | G402: Random World Drop | I402: 56 | J402: E | L402: 10 | N402: 10
A403: Archimtiros' Ring of Reckoning | B403: =(K403*$K$5)+(L403*$L$5)+(M403*$M$5)+(N403*$N$5)+(O403*$O$5)+(P403*100*$P$5)+(Q403*100*$Q$5)+(R403*100*$R$5)+(S403*100*$S$5)+(T403*$T$5)+(U403*$U$5)+(V403*$V$5)+(W403*$W$5)+(X403*$X$5)+(Y403*$Y$5)+(Z403*$Z$5)+(AA403*$AA$5) -> 42 | C403: =(K403*$K$6)+(L403*$L$6)+(M403*$M$6)+(N403*$N$6)+(O403*$O$6)+(P403*100*$P$6)+(Q403*100*$Q$6)+(R403*100*$R$6)+(S403*100*$S$6)+(T403*$T$6)+(U403*$U$6)+(V403*$V$6)+(W403*$W$6)+(X403*$X$6)+(Y403*$Y$6)+(Z403*$Z$6)+(AB403*$AA$6) -> 14.28 | D403: BWL | E403: 3 | F403: 00.27 | G403: Nefarian | I403: 60 | J403: P | L403: 14 | M403: 28
A404: Legionnaire's Band (48) | B404: =(K404*$K$5)+(L404*$L$5)+(M404*$M$5)+(N404*$N$5)+(O404*$O$5)+(P404*100*$P$5)+(Q404*100*$Q$5)+(R404*100*$R$5)+(S404*100*$S$5)+(T404*$T$5)+(U404*$U$5)+(V404*$V$5)+(W404*$W$5)+(X404*$X$5)+(Y404*$Y$5)+(Z404*$Z$5)+(AA404*$AA$5) -> 20 | C404: =(K404*$K$6)+(L404*$L$6)+(M404*$M$6)+(N404*$N$6)+(O404*$O$6)+(P404*100*$P$6)+(Q404*100*$Q$6)+(R404*100*$R$6)+(S404*100*$S$6)+(T404*$T$6)+(U404*$U$6)+(V404*$V$6)+(W404*$W$6)+(X404*$X$6)+(Y404*$Y$6)+(Z404*$Z$6)+(AB404*$AA$6) -> 14.06 | D404: BG | E404: 3 | F404: Hon | G404: Horde WSG Honored | I404: 48 | J404: P | L404: 9 | M404: 6 | N404: 10
A405: Protector's Band (48) | B405: =(K405*$K$5)+(L405*$L$5)+(M405*$M$5)+(N405*$N$5)+(O405*$O$5)+(P405*100*$P$5)+(Q405*100*$Q$5)+(R405*100*$R$5)+(S405*100*$S$5)+(T405*$T$5)+(U405*$U$5)+(V405*$V$5)+(W405*$W$5)+(X405*$X$5)+(Y405*$Y$5)+(Z405*$Z$5)+(AA405*$AA$5) -> 20 | C405: =(K405*$K$6)+(L405*$L$6)+(M405*$M$6)+(N405*$N$6)+(O405*$O$6)+(P405*100*$P$6)+(Q405*100*$Q$6)+(R405*100*$R$6)+(S405*100*$S$6)+(T405*$T$6)+(U405*$U$6)+(V405*$V$6)+(W405*$W$6)+(X405*$X$6)+(Y405*$Y$6)+(Z405*$Z$6)+(AB405*$AA$6) -> 14.06 | D405: BG | E405: 3 | F405: Hon | G405: All. WSG Honored | I405: 48 | J405: P | L405: 9 | M405: 6 | N405: 10
A406: Magni's Will (Alliance) | B406: =(K406*$K$5)+(L406*$L$5)+(M406*$M$5)+(N406*$N$5)+(O406*$O$5)+(P406*100*$P$5)+(Q406*100*$Q$5)+(R406*100*$R$5)+(S406*100*$S$5)+(T406*$T$5)+(U406*$U$5)+(V406*$V$5)+(W406*$W$5)+(X406*$X$5)+(Y406*$Y$5)+(Z406*$Z$5)+(AA406*$AA$5) -> 20 | C406: =(K406*$K$6)+(L406*$L$6)+(M406*$M$6)+(N406*$N$6)+(O406*$O$6)+(P406*100*$P$6)+(Q406*100*$Q$6)+(R406*100*$R$6)+(S406*100*$S$6)+(T406*$T$6)+(U406*$U$6)+(V406*$V$6)+(W406*$W$6)+(X406*$X$6)+(Y406*$Y$6)+(Z406*$Z$6)+(AB406*$AA$6) -> 13.07 | D406: BRD | E406: 1 | F406: Q | G406: BRD Quest Series | I406: 50 | J406: P | M406: 7 | N406: 6 | P406: 00.01
A407: Masons Fraternity Ring | B407: =(K407*$K$5)+(L407*$L$5)+(M407*$M$5)+(N407*$N$5)+(O407*$O$5)+(P407*100*$P$5)+(Q407*100*$Q$5)+(R407*100*$R$5)+(S407*100*$S$5)+(T407*$T$5)+(U407*$U$5)+(V407*$V$5)+(W407*$W$5)+(X407*$X$5)+(Y407*$Y$5)+(Z407*$Z$5)+(AA407*$AA$5) -> 18 | C407: =(K407*$K$6)+(L407*$L$6)+(M407*$M$6)+(N407*$N$6)+(O407*$O$6)+(P407*100*$P$6)+(Q407*100*$Q$6)+(R407*100*$R$6)+(S407*100*$S$6)+(T407*$T$6)+(U407*$U$6)+(V407*$V$6)+(W407*$W$6)+(X407*$X$6)+(Y407*$Y$6)+(Z407*$Z$6)+(AB407*$AA$6) -> 13.05 | D407: ZF | E407: 1 | F407: Q | G407: ZF Quest Series | I407: 40 | J407: P | L407: 13 | M407: 5
A408: Overlord's Crimson Band | B408: =(K408*$K$5)+(L408*$L$5)+(M408*$M$5)+(N408*$N$5)+(O408*$O$5)+(P408*100*$P$5)+(Q408*100*$Q$5)+(R408*100*$R$5)+(S408*100*$S$5)+(T408*$T$5)+(U408*$U$5)+(V408*$V$5)+(W408*$W$5)+(X408*$X$5)+(Y408*$Y$5)+(Z408*$Z$5)+(AA408*$AA$5) -> 23.9 | C408: =(K408*$K$6)+(L408*$L$6)+(M408*$M$6)+(N408*$N$6)+(O408*$O$6)+(P408*100*$P$6)+(Q408*100*$Q$6)+(R408*100*$R$6)+(S408*100*$S$6)+(T408*$T$6)+(U408*$U$6)+(V408*$V$6)+(W408*$W$6)+(X408*$X$6)+(Y408*$Y$6)+(Z408*$Z$6)+(AB408*$AA$6) -> 12.67 | D408: ZG | E408: 4 | F408: 00.14 | G408: Bloodlord Mandokir | H408: OR | I408: 60 | J408: P | L408: 8 | M408: 10 | N408: 9 | T408: 7
A409: Myrmidon's Signet | B409: =(K409*$K$5)+(L409*$L$5)+(M409*$M$5)+(N409*$N$5)+(O409*$O$5)+(P409*100*$P$5)+(Q409*100*$Q$5)+(R409*100*$R$5)+(S409*100*$S$5)+(T409*$T$5)+(U409*$U$5)+(V409*$V$5)+(W409*$W$5)+(X409*$X$5)+(Y409*$Y$5)+(Z409*$Z$5)+(AA409*$AA$5) -> 29 | C409: =(K409*$K$6)+(L409*$L$6)+(M409*$M$6)+(N409*$N$6)+(O409*$O$6)+(P409*100*$P$6)+(Q409*100*$Q$6)+(R409*100*$R$6)+(S409*100*$S$6)+(T409*$T$6)+(U409*$U$6)+(V409*$V$6)+(W409*$W$6)+(X409*$X$6)+(Y409*$Y$6)+(Z409*$Z$6)+(AB409*$AA$6) -> 12.17 | D409: R | E409: 1 | F409: 56-60 | G409: Random World Drop | I409: 53 | J409: E | L409: 7 | M409: 17 | N409: 10
A410: Legionnaire's Band (38) | B410: =(K410*$K$5)+(L410*$L$5)+(M410*$M$5)+(N410*$N$5)+(O410*$O$5)+(P410*100*$P$5)+(Q410*100*$Q$5)+(R410*100*$R$5)+(S410*100*$S$5)+(T410*$T$5)+(U410*$U$5)+(V410*$V$5)+(W410*$W$5)+(X410*$X$5)+(Y410*$Y$5)+(Z410*$Z$5)+(AA410*$AA$5) -> 17 | C410: =(K410*$K$6)+(L410*$L$6)+(M410*$M$6)+(N410*$N$6)+(O410*$O$6)+(P410*100*$P$6)+(Q410*100*$Q$6)+(R410*100*$R$6)+(S410*100*$S$6)+(T410*$T$6)+(U410*$U$6)+(V410*$V$6)+(W410*$W$6)+(X410*$X$6)+(Y410*$Y$6)+(Z410*$Z$6)+(AB410*$AA$6) -> 12.05 | D410: BG | E410: 3 | F410: Hon | G410: Horde WSG Honored | I410: 38 | J410: P | L410: 8 | M410: 5 | N410: 8
A411: Protector's Band (38) | B411: =(K411*$K$5)+(L411*$L$5)+(M411*$M$5)+(N411*$N$5)+(O411*$O$5)+(P411*100*$P$5)+(Q411*100*$Q$5)+(R411*100*$R$5)+(S411*100*$S$5)+(T411*$T$5)+(U411*$U$5)+(V411*$V$5)+(W411*$W$5)+(X411*$X$5)+(Y411*$Y$5)+(Z411*$Z$5)+(AA411*$AA$5) -> 17 | C411: =(K411*$K$6)+(L411*$L$6)+(M411*$M$6)+(N411*$N$6)+(O411*$O$6)+(P411*100*$P$6)+(Q411*100*$Q$6)+(R411*100*$R$6)+(S411*100*$S$6)+(T411*$T$6)+(U411*$U$6)+(V411*$V$6)+(W411*$W$6)+(X411*$X$6)+(Y411*$Y$6)+(Z411*$Z$6)+(AB411*$AA$6) -> 12.05 | D411: BG | E411: 3 | F411: Hon | G411: All. WSG Honored | I411: 38 | J411: P | L411: 8 | M411: 5 | N411: 8
A412: Band of Vigor | B412: =(K412*$K$5)+(L412*$L$5)+(M412*$M$5)+(N412*$N$5)+(O412*$O$5)+(P412*100*$P$5)+(Q412*100*$Q$5)+(R412*100*$R$5)+(S412*100*$S$5)+(T412*$T$5)+(U412*$U$5)+(V412*$V$5)+(W412*$W$5)+(X412*$X$5)+(Y412*$Y$5)+(Z412*$Z$5)+(AA412*$AA$5) -> 18 | C412: =(K412*$K$6)+(L412*$L$6)+(M412*$M$6)+(N412*$N$6)+(O412*$O$6)+(P412*100*$P$6)+(Q412*100*$Q$6)+(R412*100*$R$6)+(S412*100*$S$6)+(T412*$T$6)+(U412*$U$6)+(V412*$V$6)+(W412*$W$6)+(X412*$X$6)+(Y412*$Y$6)+(Z412*$Z$6)+(AB412*$AA$6) -> 11.07 | D412: DM-E | E412: 2 | F412: 00.33 | G412: Lethtendris | I412: 53 | J412: P | L412: 7 | M412: 7 | N412: 8
A413: Ring of the Underwood | B413: =(K413*$K$5)+(L413*$L$5)+(M413*$M$5)+(N413*$N$5)+(O413*$O$5)+(P413*100*$P$5)+(Q413*100*$Q$5)+(R413*100*$R$5)+(S413*100*$S$5)+(T413*$T$5)+(U413*$U$5)+(V413*$V$5)+(W413*$W$5)+(X413*$X$5)+(Y413*$Y$5)+(Z413*$Z$5)+(AA413*$AA$5) -> 14 | C413: =(K413*$K$6)+(L413*$L$6)+(M413*$M$6)+(N413*$N$6)+(O413*$O$6)+(P413*100*$P$6)+(Q413*100*$Q$6)+(R413*100*$R$6)+(S413*100*$S$6)+(T413*$T$6)+(U413*$U$6)+(V413*$V$6)+(W413*$W$6)+(X413*$X$6)+(Y413*$Y$6)+(Z413*$Z$6)+(AB413*$AA$6) -> 11.03 | D413: R | E413: 1 | F413: 33-37 | G413: Random World Drop | I413: 31 | J413: E | L413: 10 | M413: 3 | N413: 2
A414: Ironspine's Eye | B414: =(K414*$K$5)+(L414*$L$5)+(M414*$M$5)+(N414*$N$5)+(O414*$O$5)+(P414*100*$P$5)+(Q414*100*$Q$5)+(R414*100*$R$5)+(S414*100*$S$5)+(T414*$T$5)+(U414*$U$5)+(V414*$V$5)+(W414*$W$5)+(X414*$X$5)+(Y414*$Y$5)+(Z414*$Z$5)+(AA414*$AA$5) -> 11 | C414: =(K414*$K$6)+(L414*$L$6)+(M414*$M$6)+(N414*$N$6)+(O414*$O$6)+(P414*100*$P$6)+(Q414*100*$Q$6)+(R414*100*$R$6)+(S414*100*$S$6)+(T414*$T$6)+(U414*$U$6)+(V414*$V$6)+(W414*$W$6)+(X414*$X$6)+(Y414*$Y$6)+(Z414*$Z$6)+(AB414*$AA$6) -> 11 | D414: SM | E414: 1 | F414: 00.35 | G414: Ironspine | I414: 30 | J414: P | L414: 9 | N414: 4
A415: Charged Gear of the Tiger | B415: =(K415*$K$5)+(L415*$L$5)+(M415*$M$5)+(N415*$N$5)+(O415*$O$5)+(P415*100*$P$5)+(Q415*100*$Q$5)+(R415*100*$R$5)+(S415*100*$S$5)+(T415*$T$5)+(U415*$U$5)+(V415*$V$5)+(W415*$W$5)+(X415*$X$5)+(Y415*$Y$5)+(Z415*$Z$5)+(AA415*$AA$5) -> 11.5 | C415: =(K415*$K$6)+(L415*$L$6)+(M415*$M$6)+(N415*$N$6)+(O415*$O$6)+(P415*100*$P$6)+(Q415*100*$Q$6)+(R415*100*$R$6)+(S415*100*$S$6)+(T415*$T$6)+(U415*$U$6)+(V415*$V$6)+(W415*$W$6)+(X415*$X$6)+(Y415*$Y$6)+(Z415*$Z$6)+(AB415*$AA$6) -> 10.6 | D415: Gno | E415: 1 | F415: 00.01 | G415: Mekgineer | I415: 32 | J415: P | L415: 7 | N415: 7 | U415: 5 | X415: 5
A416: Falcon's Hook | B416: =(K416*$K$5)+(L416*$L$5)+(M416*$M$5)+(N416*$N$5)+(O416*$O$5)+(P416*100*$P$5)+(Q416*100*$Q$5)+(R416*100*$R$5)+(S416*100*$S$5)+(T416*$T$5)+(U416*$U$5)+(V416*$V$5)+(W416*$W$5)+(X416*$X$5)+(Y416*$Y$5)+(Z416*$Z$5)+(AA416*$AA$5) -> 10.5 | C416: =(K416*$K$6)+(L416*$L$6)+(M416*$M$6)+(N416*$N$6)+(O416*$O$6)+(P416*100*$P$6)+(Q416*100*$Q$6)+(R416*100*$R$6)+(S416*100*$S$6)+(T416*$T$6)+(U416*$U$6)+(V416*$V$6)+(W416*$W$6)+(X416*$X$6)+(Y416*$Y$6)+(Z416*$Z$6)+(AB416*$AA$6) -> 10.5 | D416: R | E416: 1 | F416: 42-45 | G416: Random World Drop | I416: 39 | J416: E | L416: 9 | N416: 3
A417: Band of the Penitent | B417: =(K417*$K$5)+(L417*$L$5)+(M417*$M$5)+(N417*$N$5)+(O417*$O$5)+(P417*100*$P$5)+(Q417*100*$Q$5)+(R417*100*$R$5)+(S417*100*$S$5)+(T417*$T$5)+(U417*$U$5)+(V417*$V$5)+(W417*$W$5)+(X417*$X$5)+(Y417*$Y$5)+(Z417*$Z$5)+(AA417*$AA$5) -> 10 | C417: =(K417*$K$6)+(L417*$L$6)+(M417*$M$6)+(N417*$N$6)+(O417*$O$6)+(P417*100*$P$6)+(Q417*100*$Q$6)+(R417*100*$R$6)+(S417*100*$S$6)+(T417*$T$6)+(U417*$U$6)+(V417*$V$6)+(W417*$W$6)+(X417*$X$6)+(Y417*$Y$6)+(Z417*$Z$6)+(AB417*$AA$6) -> 10 | D417: Str | E417: 1 | F417: Q | G417: Str Quest Reward | I417: 55 | J417: P | P417: 00.01
A419: TRINKET | B419: AEP | C419: MAEP | D419: Loc | E419: P | F419: Info | G419: Source | H419: Set | I419: Lvl | J419: B | K419: Arm | L419: Agi | M419: Sta | N419: Str | O419: AP | P419: Cri | Q419: Hit | R419: Par | S419: Dod | T419: Def | U419: Ar | V419: Fi | W419: Fr | X419: Na | Y419: Sh | Z419: H/5 | AA419: PVP | AB419: PVE | AC419: Special
A420: Mark of the Champion (vs Un/De) | B420: =(K420*$K$5)+(L420*$L$5)+(M420*$M$5)+(N420*$N$5)+(O420*$O$5)+(P420*100*$P$5)+(Q420*100*$Q$5)+(R420*100*$R$5)+(S420*100*$S$5)+(T420*$T$5)+(U420*$U$5)+(V420*$V$5)+(W420*$W$5)+(X420*$X$5)+(Y420*$Y$5)+(Z420*$Z$5)+(AA420*$AA$5) -> 75 | C420: =(K420*$K$6)+(L420*$L$6)+(M420*$M$6)+(N420*$N$6)+(O420*$O$6)+(P420*100*$P$6)+(Q420*100*$Q$6)+(R420*100*$R$6)+(S420*100*$S$6)+(T420*$T$6)+(U420*$U$6)+(V420*$V$6)+(W420*$W$6)+(X420*$X$6)+(Y420*$Y$6)+(Z420*$Z$6)+(AB420*$AA$6) -> 75 | D420: Naxx | E420: 6 | F420: Q | G420: Naxx Q Reward | I420: 60 | J420: P | O420: 150 | AC420: 150AP-Un/De
A421: Slayer's Crest | B421: =(K421*$K$5)+(L421*$L$5)+(M421*$M$5)+(N421*$N$5)+(O421*$O$5)+(P421*100*$P$5)+(Q421*100*$Q$5)+(R421*100*$R$5)+(S421*100*$S$5)+(T421*$T$5)+(U421*$U$5)+(V421*$V$5)+(W421*$W$5)+(X421*$X$5)+(Y421*$Y$5)+(Z421*$Z$5)+(AA421*$AA$5) -> 53.666666666666671 | C421: =(K421*$K$6)+(L421*$L$6)+(M421*$M$6)+(N421*$N$6)+(O421*$O$6)+(P421*100*$P$6)+(Q421*100*$Q$6)+(R421*100*$R$6)+(S421*100*$S$6)+(T421*$T$6)+(U421*$U$6)+(V421*$V$6)+(W421*$W$6)+(X421*$X$6)+(Y421*$Y$6)+(Z421*$Z$6)+(AB421*$AA$6) -> 53.666666666666671 | D421: Naxx | E421: 6 | F421: 00.19 | G421: Sapphiron | I421: 60 | J421: P | O421: 64 | AA421: =(260)/6*0.5 -> 21.666666666666668 | AB421: =(260)/6*0.5 -> 21.666666666666668 | AC421: 280 AP 20 sec
A422: Kiss of the Spider | B422: =(K422*$K$5)+(L422*$L$5)+(M422*$M$5)+(N422*$N$5)+(O422*$O$5)+(P422*100*$P$5)+(Q422*100*$Q$5)+(R422*100*$R$5)+(S422*100*$S$5)+(T422*$T$5)+(U422*$U$5)+(V422*$V$5)+(W422*$W$5)+(X422*$X$5)+(Y422*$Y$5)+(Z422*$Z$5)+(AA422*$AA$5) -> 47.5 | C422: =(K422*$K$6)+(L422*$L$6)+(M422*$M$6)+(N422*$N$6)+(O422*$O$6)+(P422*100*$P$6)+(Q422*100*$Q$6)+(R422*100*$R$6)+(S422*100*$S$6)+(T422*$T$6)+(U422*$U$6)+(V422*$V$6)+(W422*$W$6)+(X422*$X$6)+(Y422*$Y$6)+(Z422*$Z$6)+(AB422*$AA$6) -> 47.5 | D422: Naxx | E422: 6 | F422: 00.2 | G422: Maexxna | I422: 60 | J422: P | P422: 00.01 | Q422: 00.01 | AA422: 30 | AB422: 30 | AC422: Inc At Sp 15s
A423: Drake Fang Talisman | B423: =(K423*$K$5)+(L423*$L$5)+(M423*$M$5)+(N423*$N$5)+(O423*$O$5)+(P423*100*$P$5)+(Q423*100*$Q$5)+(R423*100*$R$5)+(S423*100*$S$5)+(T423*$T$5)+(U423*$U$5)+(V423*$V$5)+(W423*$W$5)+(X423*$X$5)+(Y423*$Y$5)+(Z423*$Z$5)+(AA423*$AA$5) -> 46 | C423: =(K423*$K$6)+(L423*$L$6)+(M423*$M$6)+(N423*$N$6)+(O423*$O$6)+(P423*100*$P$6)+(Q423*100*$Q$6)+(R423*100*$R$6)+(S423*100*$S$6)+(T423*$T$6)+(U423*$U$6)+(V423*$V$6)+(W423*$W$6)+(X423*$X$6)+(Y423*$Y$6)+(Z423*$Z$6)+(AB423*$AA$6) -> 43.01 | D423: BWL | E423: 3 | F423: 00.09 | G423: Ebonroc | I423: 60 | J423: P | O423: 56 | Q423: 00.02 | S423: 00.01
A424: Seal of the Dawn (vs Undead) | B424: =(K424*$K$5)+(L424*$L$5)+(M424*$M$5)+(N424*$N$5)+(O424*$O$5)+(P424*100*$P$5)+(Q424*100*$Q$5)+(R424*100*$R$5)+(S424*100*$S$5)+(T424*$T$5)+(U424*$U$5)+(V424*$V$5)+(W424*$W$5)+(X424*$X$5)+(Y424*$Y$5)+(Z424*$Z$5)+(AA424*$AA$5) -> 40.5 | C424: =(K424*$K$6)+(L424*$L$6)+(M424*$M$6)+(N424*$N$6)+(O424*$O$6)+(P424*100*$P$6)+(Q424*100*$Q$6)+(R424*100*$R$6)+(S424*100*$S$6)+(T424*$T$6)+(U424*$U$6)+(V424*$V$6)+(W424*$W$6)+(X424*$X$6)+(Y424*$Y$6)+(Z424*$Z$6)+(AB424*$AA$6) -> 40.5 | D424: Str | E424: 1 | F424: Q | G424: Strath Quest Series | I424: 58 | J424: P | O424: 81 | AC424: +81AP vs Und
A425: Hand of Justice | B425: =(K425*$K$5)+(L425*$L$5)+(M425*$M$5)+(N425*$N$5)+(O425*$O$5)+(P425*100*$P$5)+(Q425*100*$Q$5)+(R425*100*$R$5)+(S425*100*$S$5)+(T425*$T$5)+(U425*$U$5)+(V425*$V$5)+(W425*$W$5)+(X425*$X$5)+(Y425*$Y$5)+(Z425*$Z$5)+(AA425*$AA$5) -> 30 | C425: =(K425*$K$6)+(L425*$L$6)+(M425*$M$6)+(N425*$N$6)+(O425*$O$6)+(P425*100*$P$6)+(Q425*100*$Q$6)+(R425*100*$R$6)+(S425*100*$S$6)+(T425*$T$6)+(U425*$U$6)+(V425*$V$6)+(W425*$W$6)+(X425*$X$6)+(Y425*$Y$6)+(Z425*$Z$6)+(AB425*$AA$6) -> 30 | D425: BRD | E425: 1 | F425: 00.1 | G425: Emperor Dagran | I425: 53 | J425: P | O425: 20 | AA425: 20 | AB425: 20 | AC425: Extra att. proc
A426: Jom Gabbar | B426: =(K426*$K$5)+(L426*$L$5)+(M426*$M$5)+(N426*$N$5)+(O426*$O$5)+(P426*100*$P$5)+(Q426*100*$Q$5)+(R426*100*$R$5)+(S426*100*$S$5)+(T426*$T$5)+(U426*$U$5)+(V426*$V$5)+(W426*$W$5)+(X426*$X$5)+(Y426*$Y$5)+(Z426*$Z$5)+(AA426*$AA$5) -> 29.791664999999998 | C426: =(K426*$K$6)+(L426*$L$6)+(M426*$M$6)+(N426*$N$6)+(O426*$O$6)+(P426*100*$P$6)+(Q426*100*$Q$6)+(R426*100*$R$6)+(S426*100*$S$6)+(T426*$T$6)+(U426*$U$6)+(V426*$V$6)+(W426*$W$6)+(X426*$X$6)+(Y426*$Y$6)+(Z426*$Z$6)+(AB426*$AA$6) -> 29.791664999999998 | D426: AQ40 | E426: 5 | F426: 00.17 | G426: Ouro | I426: 60 | J426: P | AA426: =59.58333*0.5 -> 29.791664999999998 | AB426: =59.58333*0.5 -> 29.791664999999998 | AC426: Incr AP 20s
A427: Darkmoon Card: Maelstrom | B427: =(K427*$K$5)+(L427*$L$5)+(M427*$M$5)+(N427*$N$5)+(O427*$O$5)+(P427*100*$P$5)+(Q427*100*$Q$5)+(R427*100*$R$5)+(S427*100*$S$5)+(T427*$T$5)+(U427*$U$5)+(V427*$V$5)+(W427*$W$5)+(X427*$X$5)+(Y427*$Y$5)+(Z427*$Z$5)+(AA427*$AA$5) -> 25 | C427: =(K427*$K$6)+(L427*$L$6)+(M427*$M$6)+(N427*$N$6)+(O427*$O$6)+(P427*100*$P$6)+(Q427*100*$Q$6)+(R427*100*$R$6)+(S427*100*$S$6)+(T427*$T$6)+(U427*$U$6)+(V427*$V$6)+(W427*$W$6)+(X427*$X$6)+(Y427*$Y$6)+(Z427*$Z$6)+(AB427*$AA$6) -> 25 | D427: DMF | E427: 3 | F427: Q | G427: Elementals Deck | I427: 60 | J427: P | AA427: 25 | AB427: 25 | AC427: Lightning Proc
A428: Earthstrike | B428: =(K428*$K$5)+(L428*$L$5)+(M428*$M$5)+(N428*$N$5)+(O428*$O$5)+(P428*100*$P$5)+(Q428*100*$Q$5)+(R428*100*$R$5)+(S428*100*$S$5)+(T428*$T$5)+(U428*$U$5)+(V428*$V$5)+(W428*$W$5)+(X428*$X$5)+(Y428*$Y$5)+(Z428*$Z$5)+(AA428*$AA$5) -> 23.333333333333332 | C428: =(K428*$K$6)+(L428*$L$6)+(M428*$M$6)+(N428*$N$6)+(O428*$O$6)+(P428*100*$P$6)+(Q428*100*$Q$6)+(R428*100*$R$6)+(S428*100*$S$6)+(T428*$T$6)+(U428*$U$6)+(V428*$V$6)+(W428*$W$6)+(X428*$X$6)+(Y428*$Y$6)+(Z428*$Z$6)+(AB428*$AA$6) -> 23.333333333333332 | D428: Sil | E428: 5 | F428: Q | G428: Exalted CC Quest | I428: 60 | J428: P | AA428: =(280)/6*0.5 -> 23.333333333333332 | AB428: =(280)/6*0.5 -> 23.333333333333332 | AC428: 280 AP 20 sec
A429: Blackhand's Breadth | B429: =(K429*$K$5)+(L429*$L$5)+(M429*$M$5)+(N429*$N$5)+(O429*$O$5)+(P429*100*$P$5)+(Q429*100*$Q$5)+(R429*100*$R$5)+(S429*100*$S$5)+(T429*$T$5)+(U429*$U$5)+(V429*$V$5)+(W429*$W$5)+(X429*$X$5)+(Y429*$Y$5)+(Z429*$Z$5)+(AA429*$AA$5) -> 20 | C429: =(K429*$K$6)+(L429*$L$6)+(M429*$M$6)+(N429*$N$6)+(O429*$O$6)+(P429*100*$P$6)+(Q429*100*$Q$6)+(R429*100*$R$6)+(S429*100*$S$6)+(T429*$T$6)+(U429*$U$6)+(V429*$V$6)+(W429*$W$6)+(X429*$X$6)+(Y429*$Y$6)+(Z429*$Z$6)+(AB429*$AA$6) -> 20 | D429: UBRS | E429: 1 | F429: Q | G429: UBRS Quest Series | I429: 55 | J429: P | P429: 00.02
A430: Rune of the Guard Captain (Horde) | B430: =(K430*$K$5)+(L430*$L$5)+(M430*$M$5)+(N430*$N$5)+(O430*$O$5)+(P430*100*$P$5)+(Q430*100*$Q$5)+(R430*100*$R$5)+(S430*100*$S$5)+(T430*$T$5)+(U430*$U$5)+(V430*$V$5)+(W430*$W$5)+(X430*$X$5)+(Y430*$Y$5)+(Z430*$Z$5)+(AA430*$AA$5) -> 17.5 | C430: =(K430*$K$6)+(L430*$L$6)+(M430*$M$6)+(N430*$N$6)+(O430*$O$6)+(P430*100*$P$6)+(Q430*100*$Q$6)+(R430*100*$R$6)+(S430*100*$S$6)+(T430*$T$6)+(U430*$U$6)+(V430*$V$6)+(W430*$W$6)+(X430*$X$6)+(Y430*$Y$6)+(Z430*$Z$6)+(AB430*$AA$6) -> 17.5 | D430: Hin | E430: 1 | F430: Q | G430: Horde Quest Reward | I430: 46 | J430: P | O430: 20 | Q430: 00.01
A431: Royal Seal of Eldre'Thalas (Rogue) | B431: =(K431*$K$5)+(L431*$L$5)+(M431*$M$5)+(N431*$N$5)+(O431*$O$5)+(P431*100*$P$5)+(Q431*100*$Q$5)+(R431*100*$R$5)+(S431*100*$S$5)+(T431*$T$5)+(U431*$U$5)+(V431*$V$5)+(W431*$W$5)+(X431*$X$5)+(Y431*$Y$5)+(Z431*$Z$5)+(AA431*$AA$5) -> 16 | C431: =(K431*$K$6)+(L431*$L$6)+(M431*$M$6)+(N431*$N$6)+(O431*$O$6)+(P431*100*$P$6)+(Q431*100*$Q$6)+(R431*100*$R$6)+(S431*100*$S$6)+(T431*$T$6)+(U431*$U$6)+(V431*$V$6)+(W431*$W$6)+(X431*$X$6)+(Y431*$Y$6)+(Z431*$Z$6)+(AB431*$AA$6) -> 15.1 | D431: DM-B | E431: 2 | F431: Q | G431: DM Book: Garona | I431: 54 | J431: P | Q431: 00.02 | V431: 10
A432: Gnomish Death Ray (5m CD) | B432: =(K432*$K$5)+(L432*$L$5)+(M432*$M$5)+(N432*$N$5)+(O432*$O$5)+(P432*100*$P$5)+(Q432*100*$Q$5)+(R432*100*$R$5)+(S432*100*$S$5)+(T432*$T$5)+(U432*$U$5)+(V432*$V$5)+(W432*$W$5)+(X432*$X$5)+(Y432*$Y$5)+(Z432*$Z$5)+(AA432*$AA$5) -> 15 | C432: =(K432*$K$6)+(L432*$L$6)+(M432*$M$6)+(N432*$N$6)+(O432*$O$6)+(P432*100*$P$6)+(Q432*100*$Q$6)+(R432*100*$R$6)+(S432*100*$S$6)+(T432*$T$6)+(U432*$U$6)+(V432*$V$6)+(W432*$W$6)+(X432*$X$6)+(Y432*$Y$6)+(Z432*$Z$6)+(AB432*$AA$6) -> 15 | D432: Eng | E432: 1 | F432: 240 | G432: Engineering Trainer | I432: 20 | J432: P | AA432: 15 | AB432: 15 | AC432: Death Ray
A433: Heart of Wyrmthalak | B433: =(K433*$K$5)+(L433*$L$5)+(M433*$M$5)+(N433*$N$5)+(O433*$O$5)+(P433*100*$P$5)+(Q433*100*$Q$5)+(R433*100*$R$5)+(S433*100*$S$5)+(T433*$T$5)+(U433*$U$5)+(V433*$V$5)+(W433*$W$5)+(X433*$X$5)+(Y433*$Y$5)+(Z433*$Z$5)+(AA433*$AA$5) -> 15 | C433: =(K433*$K$6)+(L433*$L$6)+(M433*$M$6)+(N433*$N$6)+(O433*$O$6)+(P433*100*$P$6)+(Q433*100*$Q$6)+(R433*100*$R$6)+(S433*100*$S$6)+(T433*$T$6)+(U433*$U$6)+(V433*$V$6)+(W433*$W$6)+(X433*$X$6)+(Y433*$Y$6)+(Z433*$Z$6)+(AB433*$AA$6) -> 15 | D433: LBRS | E433: 5 | F433: 00.13 | G433: Overlord Wyrmthalak | I433: 56 | J433: P | AA433: 15 | AB433: 15 | AC433: 120-180 Fire
A434: Mark of the Chosen | B434: =(K434*$K$5)+(L434*$L$5)+(M434*$M$5)+(N434*$N$5)+(O434*$O$5)+(P434*100*$P$5)+(Q434*100*$Q$5)+(R434*100*$R$5)+(S434*100*$S$5)+(T434*$T$5)+(U434*$U$5)+(V434*$V$5)+(W434*$W$5)+(X434*$X$5)+(Y434*$Y$5)+(Z434*$Z$5)+(AA434*$AA$5) -> 12 | C434: =(K434*$K$6)+(L434*$L$6)+(M434*$M$6)+(N434*$N$6)+(O434*$O$6)+(P434*100*$P$6)+(Q434*100*$Q$6)+(R434*100*$R$6)+(S434*100*$S$6)+(T434*$T$6)+(U434*$U$6)+(V434*$V$6)+(W434*$W$6)+(X434*$X$6)+(Y434*$Y$6)+(Z434*$Z$6)+(AB434*$AA$6) -> 12 | D434: Mar | E434: 1 | F434: Q | G434: Mar. Quest Reward | I434: 39 | J434: P | AA434: 12 | AB434: 12 | AC434: +25 stats proc
A435: Counterattack Lodestone | B435: =(K435*$K$5)+(L435*$L$5)+(M435*$M$5)+(N435*$N$5)+(O435*$O$5)+(P435*100*$P$5)+(Q435*100*$Q$5)+(R435*100*$R$5)+(S435*100*$S$5)+(T435*$T$5)+(U435*$U$5)+(V435*$V$5)+(W435*$W$5)+(X435*$X$5)+(Y435*$Y$5)+(Z435*$Z$5)+(AA435*$AA$5) -> 16 | C435: =(K435*$K$6)+(L435*$L$6)+(M435*$M$6)+(N435*$N$6)+(O435*$O$6)+(P435*100*$P$6)+(Q435*100*$Q$6)+(R435*100*$R$6)+(S435*100*$S$6)+(T435*$T$6)+(U435*$U$6)+(V435*$V$6)+(W435*$W$6)+(X435*$X$6)+(Y435*$Y$6)+(Z435*$Z$6)+(AB435*$AA$6) -> 11.01 | D435: DM-N | E435: 2 | F435: 00.1 | G435: Gordok Tribute | I435: 58 | J435: P | O435: 22 | R435: 00.01
A436: Arcanite Dragonling (1h CD) | B436: =(K436*$K$5)+(L436*$L$5)+(M436*$M$5)+(N436*$N$5)+(O436*$O$5)+(P436*100*$P$5)+(Q436*100*$Q$5)+(R436*100*$R$5)+(S436*100*$S$5)+(T436*$T$5)+(U436*$U$5)+(V436*$V$5)+(W436*$W$5)+(X436*$X$5)+(Y436*$Y$5)+(Z436*$Z$5)+(AA436*$AA$5) -> 10 | C436: =(K436*$K$6)+(L436*$L$6)+(M436*$M$6)+(N436*$N$6)+(O436*$O$6)+(P436*100*$P$6)+(Q436*100*$Q$6)+(R436*100*$R$6)+(S436*100*$S$6)+(T436*$T$6)+(U436*$U$6)+(V436*$V$6)+(W436*$W$6)+(X436*$X$6)+(Y436*$Y$6)+(Z436*$Z$6)+(AB436*$AA$6) -> 10 | D436: Eng | E436: 1 | F436: 300 | G436: Engineering Trainer | I436: 50 | J436: E | AA436: 10 | AB436: 10 | AC436: Dragonling
A437: Def. of the Timbermaw (10m CD) | B437: =(K437*$K$5)+(L437*$L$5)+(M437*$M$5)+(N437*$N$5)+(O437*$O$5)+(P437*100*$P$5)+(Q437*100*$Q$5)+(R437*100*$R$5)+(S437*100*$S$5)+(T437*$T$5)+(U437*$U$5)+(V437*$V$5)+(W437*$W$5)+(X437*$X$5)+(Y437*$Y$5)+(Z437*$Z$5)+(AA437*$AA$5) -> 10 | C437: =(K437*$K$6)+(L437*$L$6)+(M437*$M$6)+(N437*$N$6)+(O437*$O$6)+(P437*100*$P$6)+(Q437*100*$Q$6)+(R437*100*$R$6)+(S437*100*$S$6)+(T437*$T$6)+(U437*$U$6)+(V437*$V$6)+(W437*$W$6)+(X437*$X$6)+(Y437*$Y$6)+(Z437*$Z$6)+(AB437*$AA$6) -> 10 | D437: Fel | E437: 5 | F437: Q | G437: Exa Timbwemaw Q | I437: 49 | J437: P | AA437: 10 | AB437: 10 | AC437: Summ Furbolg
A438: Badge of the Swarmguard | B438: =(K438*$K$5)+(L438*$L$5)+(M438*$M$5)+(N438*$N$5)+(O438*$O$5)+(P438*100*$P$5)+(Q438*100*$Q$5)+(R438*100*$R$5)+(S438*100*$S$5)+(T438*$T$5)+(U438*$U$5)+(V438*$V$5)+(W438*$W$5)+(X438*$X$5)+(Y438*$Y$5)+(Z438*$Z$5)+(AA438*$AA$5) -> 10 | C438: =(K438*$K$6)+(L438*$L$6)+(M438*$M$6)+(N438*$N$6)+(O438*$O$6)+(P438*100*$P$6)+(Q438*100*$Q$6)+(R438*100*$R$6)+(S438*100*$S$6)+(T438*$T$6)+(U438*$U$6)+(V438*$V$6)+(W438*$W$6)+(X438*$X$6)+(Y438*$Y$6)+(Z438*$Z$6)+(AB438*$AA$6) -> 10 | D438: AQ40 | E438: 5 | F438: 00.15 | G438: Battleguard Sartura | I438: 60 | J438: P | AA438: 10 | AB438: 10 | AC438: Up to 6x sund
A439: Zandalarian Hero Medallion | B439: =(K439*$K$5)+(L439*$L$5)+(M439*$M$5)+(N439*$N$5)+(O439*$O$5)+(P439*100*$P$5)+(Q439*100*$Q$5)+(R439*100*$R$5)+(S439*100*$S$5)+(T439*$T$5)+(U439*$U$5)+(V439*$V$5)+(W439*$W$5)+(X439*$X$5)+(Y439*$Y$5)+(Z439*$Z$5)+(AA439*$AA$5) -> 10 | C439: =(K439*$K$6)+(L439*$L$6)+(M439*$M$6)+(N439*$N$6)+(O439*$O$6)+(P439*100*$P$6)+(Q439*100*$Q$6)+(R439*100*$R$6)+(S439*100*$S$6)+(T439*$T$6)+(U439*$U$6)+(V439*$V$6)+(W439*$W$6)+(X439*$X$6)+(Y439*$Y$6)+(Z439*$Z$6)+(AB439*$AA$6) -> 10 | D439: ZG | E439: 4 | F439: Q | G439: Hakkar Heart Q | I439: 58 | J439: P | AA439: =(120)/2/6 -> 10 | AB439: =(120)/2/6 -> 10 | AC439: Incr. Mel. Dam.
A440: Renataki's Charm of Trickery | B440: =(K440*$K$5)+(L440*$L$5)+(M440*$M$5)+(N440*$N$5)+(O440*$O$5)+(P440*100*$P$5)+(Q440*100*$Q$5)+(R440*100*$R$5)+(S440*100*$S$5)+(T440*$T$5)+(U440*$U$5)+(V440*$V$5)+(W440*$W$5)+(X440*$X$5)+(Y440*$Y$5)+(Z440*$Z$5)+(AA440*$AA$5) -> 8.3333333333333339 | C440: =(K440*$K$6)+(L440*$L$6)+(M440*$M$6)+(N440*$N$6)+(O440*$O$6)+(P440*100*$P$6)+(Q440*100*$Q$6)+(R440*100*$R$6)+(S440*100*$S$6)+(T440*$T$6)+(U440*$U$6)+(V440*$V$6)+(W440*$W$6)+(X440*$X$6)+(Y440*$Y$6)+(Z440*$Z$6)+(AB440*$AA$6) -> 8.3333333333333339 | D440: ZG | E440: 4 | F440: Q | G440: Zandalar Quest | H440: MO | I440: 60 | J440: P | AA440: =500*3/180 -> 8.3333333333333339 | AB440: =500*3/180 -> 8.3333333333333339 | AC440: Use: +60 ener.
A441: Venomous Totem | B441: =(K441*$K$5)+(L441*$L$5)+(M441*$M$5)+(N441*$N$5)+(O441*$O$5)+(P441*100*$P$5)+(Q441*100*$Q$5)+(R441*100*$R$5)+(S441*100*$S$5)+(T441*$T$5)+(U441*$U$5)+(V441*$V$5)+(W441*$W$5)+(X441*$X$5)+(Y441*$Y$5)+(Z441*$Z$5)+(AA441*$AA$5) -> 6 | C441: =(K441*$K$6)+(L441*$L$6)+(M441*$M$6)+(N441*$N$6)+(O441*$O$6)+(P441*100*$P$6)+(Q441*100*$Q$6)+(R441*100*$R$6)+(S441*100*$S$6)+(T441*$T$6)+(U441*$U$6)+(V441*$V$6)+(W441*$W$6)+(X441*$X$6)+(Y441*$Y$6)+(Z441*$Z$6)+(AB441*$AA$6) -> 6 | D441: BWL | E441: 3 | F441: 00.17 | G441: Broodlord Lashlayer | I441: 60 | J441: P | AA441: 6 | AB441: 6 | AC441: Incr. Pois App
A442: Lifestone | B442: =(K442*$K$5)+(L442*$L$5)+(M442*$M$5)+(N442*$N$5)+(O442*$O$5)+(P442*100*$P$5)+(Q442*100*$Q$5)+(R442*100*$R$5)+(S442*100*$S$5)+(T442*$T$5)+(U442*$U$5)+(V442*$V$5)+(W442*$W$5)+(X442*$X$5)+(Y442*$Y$5)+(Z442*$Z$5)+(AA442*$AA$5) -> 6 | C442: =(K442*$K$6)+(L442*$L$6)+(M442*$M$6)+(N442*$N$6)+(O442*$O$6)+(P442*100*$P$6)+(Q442*100*$Q$6)+(R442*100*$R$6)+(S442*100*$S$6)+(T442*$T$6)+(U442*$U$6)+(V442*$V$6)+(W442*$W$6)+(X442*$X$6)+(Y442*$Y$6)+(Z442*$Z$6)+(AB442*$AA$6) -> 5.1 | D442: R | E442: 1 | F442: 53-58 | G442: Random World Drop | I442: 51 | J442: E | Z442: 10 | AA442: 5 | AB442: 5 | AC442: Use:3-700hp
A443: Linken's Boomerang (3m CD) | B443: =(K443*$K$5)+(L443*$L$5)+(M443*$M$5)+(N443*$N$5)+(O443*$O$5)+(P443*100*$P$5)+(Q443*100*$Q$5)+(R443*100*$R$5)+(S443*100*$S$5)+(T443*$T$5)+(U443*$U$5)+(V443*$V$5)+(W443*$W$5)+(X443*$X$5)+(Y443*$Y$5)+(Z443*$Z$5)+(AA443*$AA$5) -> 5 | C443: =(K443*$K$6)+(L443*$L$6)+(M443*$M$6)+(N443*$N$6)+(O443*$O$6)+(P443*100*$P$6)+(Q443*100*$Q$6)+(R443*100*$R$6)+(S443*100*$S$6)+(T443*$T$6)+(U443*$U$6)+(V443*$V$6)+(W443*$W$6)+(X443*$X$6)+(Y443*$Y$6)+(Z443*$Z$6)+(AB443*$AA$6) -> 5 | D443: UGC | E443: 1 | F443: Q | G443: UGC Quest | I443: 47 | J443: P | AA443: 5 | AB443: 5 | AC443: 113-188 dam
A444: Essence of the Pure Flame | B444: =(K444*$K$5)+(L444*$L$5)+(M444*$M$5)+(N444*$N$5)+(O444*$O$5)+(P444*100*$P$5)+(Q444*100*$Q$5)+(R444*100*$R$5)+(S444*100*$S$5)+(T444*$T$5)+(U444*$U$5)+(V444*$V$5)+(W444*$W$5)+(X444*$X$5)+(Y444*$Y$5)+(Z444*$Z$5)+(AA444*$AA$5) -> 5 | C444: =(K444*$K$6)+(L444*$L$6)+(M444*$M$6)+(N444*$N$6)+(O444*$O$6)+(P444*100*$P$6)+(Q444*100*$Q$6)+(R444*100*$R$6)+(S444*100*$S$6)+(T444*$T$6)+(U444*$U$6)+(V444*$V$6)+(W444*$W$6)+(X444*$X$6)+(Y444*$Y$6)+(Z444*$Z$6)+(AB444*$AA$6) -> 5 | D444: MC | E444: 2 | F444: 00.11 | G444: Ragnaros | I444: 60 | J444: P | AA444: 5 | AB444: 5 | AC444: +13 Fire proc
A445: Gnomish Battle Chicken (30m CD) | B445: =(K445*$K$5)+(L445*$L$5)+(M445*$M$5)+(N445*$N$5)+(O445*$O$5)+(P445*100*$P$5)+(Q445*100*$Q$5)+(R445*100*$R$5)+(S445*100*$S$5)+(T445*$T$5)+(U445*$U$5)+(V445*$V$5)+(W445*$W$5)+(X445*$X$5)+(Y445*$Y$5)+(Z445*$Z$5)+(AA445*$AA$5) -> 3 | C445: =(K445*$K$6)+(L445*$L$6)+(M445*$M$6)+(N445*$N$6)+(O445*$O$6)+(P445*100*$P$6)+(Q445*100*$Q$6)+(R445*100*$R$6)+(S445*100*$S$6)+(T445*$T$6)+(U445*$U$6)+(V445*$V$6)+(W445*$W$6)+(X445*$X$6)+(Y445*$Y$6)+(Z445*$Z$6)+(AB445*$AA$6) -> 3 | D445: Eng | E445: 1 | F445: 230 | G445: Engineering Trainer | I445: 20 | J445: P | AA445: 3 | AB445: 3 | AC445: Battle Chicken
A446: Blazing Emblem | B446: =(K446*$K$5)+(L446*$L$5)+(M446*$M$5)+(N446*$N$5)+(O446*$O$5)+(P446*100*$P$5)+(Q446*100*$Q$5)+(R446*100*$R$5)+(S446*100*$S$5)+(T446*$T$5)+(U446*$U$5)+(V446*$V$5)+(W446*$W$5)+(X446*$X$5)+(Y446*$Y$5)+(Z446*$Z$5)+(AA446*$AA$5) -> 6.5 | C446: =(K446*$K$6)+(L446*$L$6)+(M446*$M$6)+(N446*$N$6)+(O446*$O$6)+(P446*100*$P$6)+(Q446*100*$Q$6)+(R446*100*$R$6)+(S446*100*$S$6)+(T446*$T$6)+(U446*$U$6)+(V446*$V$6)+(W446*$W$6)+(X446*$X$6)+(Y446*$Y$6)+(Z446*$Z$6)+(AB446*$AA$6) -> 1.15 | D446: R | E446: 1 | F446: 40-45 | G446: Random World Drop | I446: 38 | J446: E | V446: 15 | AA446: 5 | AB446: 1 | AC446: Inc. Fire Prot.
A447: Heart of Noxxion | B447: =(K447*$K$5)+(L447*$L$5)+(M447*$M$5)+(N447*$N$5)+(O447*$O$5)+(P447*100*$P$5)+(Q447*100*$Q$5)+(R447*100*$R$5)+(S447*100*$S$5)+(T447*$T$5)+(U447*$U$5)+(V447*$V$5)+(W447*$W$5)+(X447*$X$5)+(Y447*$Y$5)+(Z447*$Z$5)+(AA447*$AA$5) -> 6 | C447: =(K447*$K$6)+(L447*$L$6)+(M447*$M$6)+(N447*$N$6)+(O447*$O$6)+(P447*100*$P$6)+(Q447*100*$Q$6)+(R447*100*$R$6)+(S447*100*$S$6)+(T447*$T$6)+(U447*$U$6)+(V447*$V$6)+(W447*$W$6)+(X447*$X$6)+(Y447*$Y$6)+(Z447*$Z$6)+(AB447*$AA$6) -> 1.1 | D447: Mar | E447: 1 | F447: 00.29 | G447: Noxxion | I447: 46 | J447: P | X447: 10 | AA447: 5 | AB447: 1 | AC447: Rem. poison.
A448: Glimmering Mithril Insignia (10m CD) | B448: =(K448*$K$5)+(L448*$L$5)+(M448*$M$5)+(N448*$N$5)+(O448*$O$5)+(P448*100*$P$5)+(Q448*100*$Q$5)+(R448*100*$R$5)+(S448*100*$S$5)+(T448*$T$5)+(U448*$U$5)+(V448*$V$5)+(W448*$W$5)+(X448*$X$5)+(Y448*$Y$5)+(Z448*$Z$5)+(AA448*$AA$5) -> 15 | C448: =(K448*$K$6)+(L448*$L$6)+(M448*$M$6)+(N448*$N$6)+(O448*$O$6)+(P448*100*$P$6)+(Q448*100*$Q$6)+(R448*100*$R$6)+(S448*100*$S$6)+(T448*$T$6)+(U448*$U$6)+(V448*$V$6)+(W448*$W$6)+(X448*$X$6)+(Y448*$Y$6)+(Z448*$Z$6)+(AB448*$AA$6) -> 1 | D448: BS | E448: 1 | F448: Q | G448: BS Quest Reward | I448: 40 | J448: P | AA448: 15 | AB448: 1 | AC448: Stats/No Fear
A449: Uther's Strength | B449: =(K449*$K$5)+(L449*$L$5)+(M449*$M$5)+(N449*$N$5)+(O449*$O$5)+(P449*100*$P$5)+(Q449*100*$Q$5)+(R449*100*$R$5)+(S449*100*$S$5)+(T449*$T$5)+(U449*$U$5)+(V449*$V$5)+(W449*$W$5)+(X449*$X$5)+(Y449*$Y$5)+(Z449*$Z$5)+(AA449*$AA$5) -> 5 | C449: =(K449*$K$6)+(L449*$L$6)+(M449*$M$6)+(N449*$N$6)+(O449*$O$6)+(P449*100*$P$6)+(Q449*100*$Q$6)+(R449*100*$R$6)+(S449*100*$S$6)+(T449*$T$6)+(U449*$U$6)+(V449*$V$6)+(W449*$W$6)+(X449*$X$6)+(Y449*$Y$6)+(Z449*$Z$6)+(AB449*$AA$6) -> 1 | D449: R | E449: 1 | F449: 49-60 | G449: Random World Drop | I449: 47 | J449: P | AA449: 5 | AB449: 1 | AC449: Holy Shld proc
A450: Nifty Stopwatch (30m CD) | B450: =(K450*$K$5)+(L450*$L$5)+(M450*$M$5)+(N450*$N$5)+(O450*$O$5)+(P450*100*$P$5)+(Q450*100*$Q$5)+(R450*100*$R$5)+(S450*100*$S$5)+(T450*$T$5)+(U450*$U$5)+(V450*$V$5)+(W450*$W$5)+(X450*$X$5)+(Y450*$Y$5)+(Z450*$Z$5)+(AA450*$AA$5) -> 5 | C450: =(K450*$K$6)+(L450*$L$6)+(M450*$M$6)+(N450*$N$6)+(O450*$O$6)+(P450*100*$P$6)+(Q450*100*$Q$6)+(R450*100*$R$6)+(S450*100*$S$6)+(T450*$T$6)+(U450*$U$6)+(V450*$V$6)+(W450*$W$6)+(X450*$X$6)+(Y450*$Y$6)+(Z450*$Z$6)+(AB450*$AA$6) -> 1 | D450: BL | E450: 1 | F450: Q | G450: BL Quest Reward | I450: 35 | J450: P | AA450: 5 | AB450: 1 | AC450: Sprint 10 sec.
A451: Onyxia Blood Talisman | B451: =(K451*$K$5)+(L451*$L$5)+(M451*$M$5)+(N451*$N$5)+(O451*$O$5)+(P451*100*$P$5)+(Q451*100*$Q$5)+(R451*100*$R$5)+(S451*100*$S$5)+(T451*$T$5)+(U451*$U$5)+(V451*$V$5)+(W451*$W$5)+(X451*$X$5)+(Y451*$Y$5)+(Z451*$Z$5)+(AA451*$AA$5) -> 9.4 | C451: =(K451*$K$6)+(L451*$L$6)+(M451*$M$6)+(N451*$N$6)+(O451*$O$6)+(P451*100*$P$6)+(Q451*100*$Q$6)+(R451*100*$R$6)+(S451*100*$S$6)+(T451*$T$6)+(U451*$U$6)+(V451*$V$6)+(W451*$W$6)+(X451*$X$6)+(Y451*$Y$6)+(Z451*$Z$6)+(AB451*$AA$6) -> 00.33 | D451: OL | E451: 2 | F451: Q | G451: Onyxia Head Reward | I451: 60 | J451: P | R451: 00.01 | T451: 12 | V451: 15 | Z451: 5
A452: Demon's Blood | B452: =(K452*$K$5)+(L452*$L$5)+(M452*$M$5)+(N452*$N$5)+(O452*$O$5)+(P452*100*$P$5)+(Q452*100*$Q$5)+(R452*100*$R$5)+(S452*100*$S$5)+(T452*$T$5)+(U452*$U$5)+(V452*$V$5)+(W452*$W$5)+(X452*$X$5)+(Y452*$Y$5)+(Z452*$Z$5)+(AA452*$AA$5) -> 2.3 | C452: =(K452*$K$6)+(L452*$L$6)+(M452*$M$6)+(N452*$N$6)+(O452*$O$6)+(P452*100*$P$6)+(Q452*100*$Q$6)+(R452*100*$R$6)+(S452*100*$S$6)+(T452*$T$6)+(U452*$U$6)+(V452*$V$6)+(W452*$W$6)+(X452*$X$6)+(Y452*$Y$6)+(Z452*$Z$6)+(AB452*$AA$6) -> 00.18 | D452: BL | E452: 1 | F452: Q | G452: BL Quest Series | I452: 50 | J452: P | T452: 5 | Y452: 10 | Z452: 3
A453: Stormpike Insignia Rank 6 | B453: =(K453*$K$5)+(L453*$L$5)+(M453*$M$5)+(N453*$N$5)+(O453*$O$5)+(P453*100*$P$5)+(Q453*100*$Q$5)+(R453*100*$R$5)+(S453*100*$S$5)+(T453*$T$5)+(U453*$U$5)+(V453*$V$5)+(W453*$W$5)+(X453*$X$5)+(Y453*$Y$5)+(Z453*$Z$5)+(AA453*$AA$5) -> 7.5 | C453: =(K453*$K$6)+(L453*$L$6)+(M453*$M$6)+(N453*$N$6)+(O453*$O$6)+(P453*100*$P$6)+(Q453*100*$Q$6)+(R453*100*$R$6)+(S453*100*$S$6)+(T453*$T$6)+(U453*$U$6)+(V453*$V$6)+(W453*$W$6)+(X453*$X$6)+(Y453*$Y$6)+(Z453*$Z$6)+(AB453*$AA$6) -> 00.17 | D453: BG | E453: 3 | F453: Exa | G453: Alliance AV Exalted | I453: 51 | J453: P | S453: 00.02 | W453: 10 | Z453: 5 | AC453: Port to AV
A454: Frostwolf Insignia Rank 6 | B454: =(K454*$K$5)+(L454*$L$5)+(M454*$M$5)+(N454*$N$5)+(O454*$O$5)+(P454*100*$P$5)+(Q454*100*$Q$5)+(R454*100*$R$5)+(S454*100*$S$5)+(T454*$T$5)+(U454*$U$5)+(V454*$V$5)+(W454*$W$5)+(X454*$X$5)+(Y454*$Y$5)+(Z454*$Z$5)+(AA454*$AA$5) -> 7.5 | C454: =(K454*$K$6)+(L454*$L$6)+(M454*$M$6)+(N454*$N$6)+(O454*$O$6)+(P454*100*$P$6)+(Q454*100*$Q$6)+(R454*100*$R$6)+(S454*100*$S$6)+(T454*$T$6)+(U454*$U$6)+(V454*$V$6)+(W454*$W$6)+(X454*$X$6)+(Y454*$Y$6)+(Z454*$Z$6)+(AB454*$AA$6) -> 00.17 | D454: BG | E454: 3 | F454: Exa | G454: Horde AV Exalted | I454: 51 | J454: P | S454: 00.02 | W454: 10 | Z454: 5 | AC454: Port to AV
A455: Stormpike Insignia Rank 5 | B455: =(K455*$K$5)+(L455*$L$5)+(M455*$M$5)+(N455*$N$5)+(O455*$O$5)+(P455*100*$P$5)+(Q455*100*$Q$5)+(R455*100*$R$5)+(S455*100*$S$5)+(T455*$T$5)+(U455*$U$5)+(V455*$V$5)+(W455*$W$5)+(X455*$X$5)+(Y455*$Y$5)+(Z455*$Z$5)+(AA455*$AA$5) -> 4.4 | C455: =(K455*$K$6)+(L455*$L$6)+(M455*$M$6)+(N455*$N$6)+(O455*$O$6)+(P455*100*$P$6)+(Q455*100*$Q$6)+(R455*100*$R$6)+(S455*100*$S$6)+(T455*$T$6)+(U455*$U$6)+(V455*$V$6)+(W455*$W$6)+(X455*$X$6)+(Y455*$Y$6)+(Z455*$Z$6)+(AB455*$AA$6) -> 00.15 | D455: BG | E455: 3 | F455: Exa | G455: Alliance AV Exalted | I455: 51 | J455: P | S455: 00.01 | W455: 10 | Z455: 4 | AC455: Port to AV
A456: Frostwolf Insignia Rank 5 | B456: =(K456*$K$5)+(L456*$L$5)+(M456*$M$5)+(N456*$N$5)+(O456*$O$5)+(P456*100*$P$5)+(Q456*100*$Q$5)+(R456*100*$R$5)+(S456*100*$S$5)+(T456*$T$5)+(U456*$U$5)+(V456*$V$5)+(W456*$W$5)+(X456*$X$5)+(Y456*$Y$5)+(Z456*$Z$5)+(AA456*$AA$5) -> 4.4 | C456: =(K456*$K$6)+(L456*$L$6)+(M456*$M$6)+(N456*$N$6)+(O456*$O$6)+(P456*100*$P$6)+(Q456*100*$Q$6)+(R456*100*$R$6)+(S456*100*$S$6)+(T456*$T$6)+(U456*$U$6)+(V456*$V$6)+(W456*$W$6)+(X456*$X$6)+(Y456*$Y$6)+(Z456*$Z$6)+(AB456*$AA$6) -> 00.15 | D456: BG | E456: 3 | F456: Exa | G456: Horde AV Exalted | I456: 51 | J456: P | S456: 00.01 | W456: 10 | Z456: 4 | AC456: Port to AV
A457: Stormpike Insignia Rank 4 | B457: =(K457*$K$5)+(L457*$L$5)+(M457*$M$5)+(N457*$N$5)+(O457*$O$5)+(P457*100*$P$5)+(Q457*100*$Q$5)+(R457*100*$R$5)+(S457*100*$S$5)+(T457*$T$5)+(U457*$U$5)+(V457*$V$5)+(W457*$W$5)+(X457*$X$5)+(Y457*$Y$5)+(Z457*$Z$5)+(AA457*$AA$5) -> 4.1 | C457: =(K457*$K$6)+(L457*$L$6)+(M457*$M$6)+(N457*$N$6)+(O457*$O$6)+(P457*100*$P$6)+(Q457*100*$Q$6)+(R457*100*$R$6)+(S457*100*$S$6)+(T457*$T$6)+(U457*$U$6)+(V457*$V$6)+(W457*$W$6)+(X457*$X$6)+(Y457*$Y$6)+(Z457*$Z$6)+(AB457*$AA$6) -> 00.12 | D457: BG | E457: 3 | F457: Rev | G457: Alliance AV Revered | I457: 51 | J457: P | S457: 00.01 | W457: 8 | Z457: 3 | AC457: Port to AV
A458: Frostwolf Insignia Rank 4 | B458: =(K458*$K$5)+(L458*$L$5)+(M458*$M$5)+(N458*$N$5)+(O458*$O$5)+(P458*100*$P$5)+(Q458*100*$Q$5)+(R458*100*$R$5)+(S458*100*$S$5)+(T458*$T$5)+(U458*$U$5)+(V458*$V$5)+(W458*$W$5)+(X458*$X$5)+(Y458*$Y$5)+(Z458*$Z$5)+(AA458*$AA$5) -> 4.1 | C458: =(K458*$K$6)+(L458*$L$6)+(M458*$M$6)+(N458*$N$6)+(O458*$O$6)+(P458*100*$P$6)+(Q458*100*$Q$6)+(R458*100*$R$6)+(S458*100*$S$6)+(T458*$T$6)+(U458*$U$6)+(V458*$V$6)+(W458*$W$6)+(X458*$X$6)+(Y458*$Y$6)+(Z458*$Z$6)+(AB458*$AA$6) -> 00.12 | D458: BG | E458: 3 | F458: Rev | G458: Horde AV Revered | I458: 51 | J458: P | S458: 00.01 | W458: 8 | Z458: 3 | AC458: Port to AV
A459: Rune of Duty (40) | B459: =(K459*$K$5)+(L459*$L$5)+(M459*$M$5)+(N459*$N$5)+(O459*$O$5)+(P459*100*$P$5)+(Q459*100*$Q$5)+(R459*100*$R$5)+(S459*100*$S$5)+(T459*$T$5)+(U459*$U$5)+(V459*$V$5)+(W459*$W$5)+(X459*$X$5)+(Y459*$Y$5)+(Z459*$Z$5)+(AA459*$AA$5) -> 7.4 | C459: =(K459*$K$6)+(L459*$L$6)+(M459*$M$6)+(N459*$N$6)+(O459*$O$6)+(P459*100*$P$6)+(Q459*100*$Q$6)+(R459*100*$R$6)+(S459*100*$S$6)+(T459*$T$6)+(U459*$U$6)+(V459*$V$6)+(W459*$W$6)+(X459*$X$6)+(Y459*$Y$6)+(Z459*$Z$6)+(AB459*$AA$6) -> 00.11 | D459: WSG | E459: 3 | F459: Frien | G459: WSG Friendly | I459: 40 | J459: P | M459: 7 | Z459: 4
A460: Shard of the Flame | B460: =(K460*$K$5)+(L460*$L$5)+(M460*$M$5)+(N460*$N$5)+(O460*$O$5)+(P460*100*$P$5)+(Q460*100*$Q$5)+(R460*100*$R$5)+(S460*100*$S$5)+(T460*$T$5)+(U460*$U$5)+(V460*$V$5)+(W460*$W$5)+(X460*$X$5)+(Y460*$Y$5)+(Z460*$Z$5)+(AA460*$AA$5) -> 00.9 | C460: =(K460*$K$6)+(L460*$L$6)+(M460*$M$6)+(N460*$N$6)+(O460*$O$6)+(P460*100*$P$6)+(Q460*100*$Q$6)+(R460*100*$R$6)+(S460*100*$S$6)+(T460*$T$6)+(U460*$U$6)+(V460*$V$6)+(W460*$W$6)+(X460*$X$6)+(Y460*$Y$6)+(Z460*$Z$6)+(AB460*$AA$6) -> 00.09 | D460: MC | E460: 1 | F460: 00.1 | G460: Ragnaros | H460: SG | I460: 57 | J460: P | Z460: 9
A461: Stormpike Insignia Rank 3 | B461: =(K461*$K$5)+(L461*$L$5)+(M461*$M$5)+(N461*$N$5)+(O461*$O$5)+(P461*100*$P$5)+(Q461*100*$Q$5)+(R461*100*$R$5)+(S461*100*$S$5)+(T461*$T$5)+(U461*$U$5)+(V461*$V$5)+(W461*$W$5)+(X461*$X$5)+(Y461*$Y$5)+(Z461*$Z$5)+(AA461*$AA$5) -> 3.7 | C461: =(K461*$K$6)+(L461*$L$6)+(M461*$M$6)+(N461*$N$6)+(O461*$O$6)+(P461*100*$P$6)+(Q461*100*$Q$6)+(R461*100*$R$6)+(S461*100*$S$6)+(T461*$T$6)+(U461*$U$6)+(V461*$V$6)+(W461*$W$6)+(X461*$X$6)+(Y461*$Y$6)+(Z461*$Z$6)+(AB461*$AA$6) -> 00.08 | D461: BG | E461: 3 | F461: Hon | G461: Alliance AV Honored | I461: 51 | J461: P | S461: 00.01 | W461: 5 | Z461: 2 | AC461: Port to AV
A462: Frostwolf Insignia Rank 3 | B462: =(K462*$K$5)+(L462*$L$5)+(M462*$M$5)+(N462*$N$5)+(O462*$O$5)+(P462*100*$P$5)+(Q462*100*$Q$5)+(R462*100*$R$5)+(S462*100*$S$5)+(T462*$T$5)+(U462*$U$5)+(V462*$V$5)+(W462*$W$5)+(X462*$X$5)+(Y462*$Y$5)+(Z462*$Z$5)+(AA462*$AA$5) -> 3.7 | C462: =(K462*$K$6)+(L462*$L$6)+(M462*$M$6)+(N462*$N$6)+(O462*$O$6)+(P462*100*$P$6)+(Q462*100*$Q$6)+(R462*100*$R$6)+(S462*100*$S$6)+(T462*$T$6)+(U462*$U$6)+(V462*$V$6)+(W462*$W$6)+(X462*$X$6)+(Y462*$Y$6)+(Z462*$Z$6)+(AB462*$AA$6) -> 00.08 | D462: BG | E462: 3 | F462: Hon | G462: Horde AV Honored | I462: 51 | J462: P | S462: 00.01 | W462: 5 | Z462: 2 | AC462: Port to AV
A463: Rune of Duty (20) | B463: =(K463*$K$5)+(L463*$L$5)+(M463*$M$5)+(N463*$N$5)+(O463*$O$5)+(P463*100*$P$5)+(Q463*100*$Q$5)+(R463*100*$R$5)+(S463*100*$S$5)+(T463*$T$5)+(U463*$U$5)+(V463*$V$5)+(W463*$W$5)+(X463*$X$5)+(Y463*$Y$5)+(Z463*$Z$5)+(AA463*$AA$5) -> 4.3 | C463: =(K463*$K$6)+(L463*$L$6)+(M463*$M$6)+(N463*$N$6)+(O463*$O$6)+(P463*100*$P$6)+(Q463*100*$Q$6)+(R463*100*$R$6)+(S463*100*$S$6)+(T463*$T$6)+(U463*$U$6)+(V463*$V$6)+(W463*$W$6)+(X463*$X$6)+(Y463*$Y$6)+(Z463*$Z$6)+(AB463*$AA$6) -> 00.07 | D463: WSG | E463: 3 | F463: Frien | G463: WSG Friendly | I463: 20 | J463: P | M463: 4 | Z463: 3
A464: Stormpike Insignia Rank 2 | B464: =(K464*$K$5)+(L464*$L$5)+(M464*$M$5)+(N464*$N$5)+(O464*$O$5)+(P464*100*$P$5)+(Q464*100*$Q$5)+(R464*100*$R$5)+(S464*100*$S$5)+(T464*$T$5)+(U464*$U$5)+(V464*$V$5)+(W464*$W$5)+(X464*$X$5)+(Y464*$Y$5)+(Z464*$Z$5)+(AA464*$AA$5) -> 00.7 | C464: =(K464*$K$6)+(L464*$L$6)+(M464*$M$6)+(N464*$N$6)+(O464*$O$6)+(P464*100*$P$6)+(Q464*100*$Q$6)+(R464*100*$R$6)+(S464*100*$S$6)+(T464*$T$6)+(U464*$U$6)+(V464*$V$6)+(W464*$W$6)+(X464*$X$6)+(Y464*$Y$6)+(Z464*$Z$6)+(AB464*$AA$6) -> 00.07 | D464: BG | E464: 3 | F464: Frien | G464: Alliance AV Friendly | I464: 51 | J464: P | W464: 5 | Z464: 2 | AC464: Port to AV
A465: Frostwolf Insignia Rank 2 | B465: =(K465*$K$5)+(L465*$L$5)+(M465*$M$5)+(N465*$N$5)+(O465*$O$5)+(P465*100*$P$5)+(Q465*100*$Q$5)+(R465*100*$R$5)+(S465*100*$S$5)+(T465*$T$5)+(U465*$U$5)+(V465*$V$5)+(W465*$W$5)+(X465*$X$5)+(Y465*$Y$5)+(Z465*$Z$5)+(AA465*$AA$5) -> 00.7 | C465: =(K465*$K$6)+(L465*$L$6)+(M465*$M$6)+(N465*$N$6)+(O465*$O$6)+(P465*100*$P$6)+(Q465*100*$Q$6)+(R465*100*$R$6)+(S465*100*$S$6)+(T465*$T$6)+(U465*$U$6)+(V465*$V$6)+(W465*$W$6)+(X465*$X$6)+(Y465*$Y$6)+(Z465*$Z$6)+(AB465*$AA$6) -> 00.07 | D465: BG | E465: 3 | F465: Frien | G465: Horde AV Friendly | I465: 51 | J465: P | W465: 5 | Z465: 2 | AC465: Port to AV
A466: Shard of Afrasa | B466: =(K466*$K$5)+(L466*$L$5)+(M466*$M$5)+(N466*$N$5)+(O466*$O$5)+(P466*100*$P$5)+(Q466*100*$Q$5)+(R466*100*$R$5)+(S466*100*$S$5)+(T466*$T$5)+(U466*$U$5)+(V466*$V$5)+(W466*$W$5)+(X466*$X$5)+(Y466*$Y$5)+(Z466*$Z$5)+(AA466*$AA$5) -> 0.5 | C466: =(K466*$K$6)+(L466*$L$6)+(M466*$M$6)+(N466*$N$6)+(O466*$O$6)+(P466*100*$P$6)+(Q466*100*$Q$6)+(R466*100*$R$6)+(S466*100*$S$6)+(T466*$T$6)+(U466*$U$6)+(V466*$V$6)+(W466*$W$6)+(X466*$X$6)+(Y466*$Y$6)+(Z466*$Z$6)+(AB466*$AA$6) -> 00.05 | D466: BL | E466: 1 | F466: Q | G466: BL Quest Reward | I466: 45 | J466: P | Z466: 5
A468: BACK | B468: AEP | C468: MAEP | D468: Loc | E468: P | F468: Info | G468: Source | H468: Set | I468: Lvl | J468: B | K468: Arm | L468: Agi | M468: Sta | N468: Str | O468: AP | P468: Cri | Q468: Hit | R468: Par | S468: Dod | T468: Def | U468: Ar | V468: Fi | W468: Fr | X468: Na | Y468: Sh | Z468: H/5 | AA468: PVP | AB468: PVE | AC468: Special
A469: Shroud of Dominion | B469: =(K469*$K$5)+(L469*$L$5)+(M469*$M$5)+(N469*$N$5)+(O469*$O$5)+(P469*100*$P$5)+(Q469*100*$Q$5)+(R469*100*$R$5)+(S469*100*$S$5)+(T469*$T$5)+(U469*$U$5)+(V469*$V$5)+(W469*$W$5)+(X469*$X$5)+(Y469*$Y$5)+(Z469*$Z$5)+(AA469*$AA$5) -> 46.68 | C469: =(K469*$K$6)+(L469*$L$6)+(M469*$M$6)+(N469*$N$6)+(O469*$O$6)+(P469*100*$P$6)+(Q469*100*$Q$6)+(R469*100*$R$6)+(S469*100*$S$6)+(T469*$T$6)+(U469*$U$6)+(V469*$V$6)+(W469*$W$6)+(X469*$X$6)+(Y469*$Y$6)+(Z469*$Z$6)+(AB469*$AA$6) -> 35.177999999999997 | D469: Naxx | E469: 6 | F469: 00.19 | G469: Sapphiron | I469: 60 | J469: P | K469: 68 | M469: 11 | O469: 50 | P469: 00.01
A470: Cloak of the Fallen God | B470: =(K470*$K$5)+(L470*$L$5)+(M470*$M$5)+(N470*$N$5)+(O470*$O$5)+(P470*100*$P$5)+(Q470*100*$Q$5)+(R470*100*$R$5)+(S470*100*$S$5)+(T470*$T$5)+(U470*$U$5)+(V470*$V$5)+(W470*$W$5)+(X470*$X$5)+(Y470*$Y$5)+(Z470*$Z$5)+(AA470*$AA$5) -> 47.16 | C470: =(K470*$K$6)+(L470*$L$6)+(M470*$M$6)+(N470*$N$6)+(O470*$O$6)+(P470*100*$P$6)+(Q470*100*$Q$6)+(R470*100*$R$6)+(S470*100*$S$6)+(T470*$T$6)+(U470*$U$6)+(V470*$V$6)+(W470*$W$6)+(X470*$X$6)+(Y470*$Y$6)+(Z470*$Z$6)+(AB470*$AA$6) -> 31.715999999999998 | D470: AQ40 | E470: 5 | F470: Q | G470: C'Thun Eye Reward | I470: 60 | J470: P | K470: 66 | L470: 26 | M470: 15 | N470: 11
A471: Cloak of Concentrated Hatred | B471: =(K471*$K$5)+(L471*$L$5)+(M471*$M$5)+(N471*$N$5)+(O471*$O$5)+(P471*100*$P$5)+(Q471*100*$Q$5)+(R471*100*$R$5)+(S471*100*$S$5)+(T471*$T$5)+(U471*$U$5)+(V471*$V$5)+(W471*$W$5)+(X471*$X$5)+(Y471*$Y$5)+(Z471*$Z$5)+(AA471*$AA$5) -> 44.56 | C471: =(K471*$K$6)+(L471*$L$6)+(M471*$M$6)+(N471*$N$6)+(O471*$O$6)+(P471*100*$P$6)+(Q471*100*$Q$6)+(R471*100*$R$6)+(S471*100*$S$6)+(T471*$T$6)+(U471*$U$6)+(V471*$V$6)+(W471*$W$6)+(X471*$X$6)+(Y471*$Y$6)+(Z471*$Z$6)+(AB471*$AA$6) -> 29.206 | D471: AQ40 | E471: 5 | F471: 00.15 | G471: Prophet Skeram | I471: 60 | J471: P | K471: 56 | L471: 16 | M471: 15 | N471: 11 | Q471: 00.01
A472: Puissant Cape | B472: =(K472*$K$5)+(L472*$L$5)+(M472*$M$5)+(N472*$N$5)+(O472*$O$5)+(P472*100*$P$5)+(Q472*100*$Q$5)+(R472*100*$R$5)+(S472*100*$S$5)+(T472*$T$5)+(U472*$U$5)+(V472*$V$5)+(W472*$W$5)+(X472*$X$5)+(Y472*$Y$5)+(Z472*$Z$5)+(AA472*$AA$5) -> 40.04 | C472: =(K472*$K$6)+(L472*$L$6)+(M472*$M$6)+(N472*$N$6)+(O472*$O$6)+(P472*100*$P$6)+(Q472*100*$Q$6)+(R472*100*$R$6)+(S472*100*$S$6)+(T472*$T$6)+(U472*$U$6)+(V472*$V$6)+(W472*$W$6)+(X472*$X$6)+(Y472*$Y$6)+(Z472*$Z$6)+(AB472*$AA$6) -> 27.673999999999999 | D472: Azs | E472: 2 | F472: 00.19 | G472: Azuregos | I472: 60 | J472: P | K472: 54 | M472: 12 | O472: 40 | Q472: 00.01
A473: Cloak of Veiled Shadows | B473: =(K473*$K$5)+(L473*$L$5)+(M473*$M$5)+(N473*$N$5)+(O473*$O$5)+(P473*100*$P$5)+(Q473*100*$Q$5)+(R473*100*$R$5)+(S473*100*$S$5)+(T473*$T$5)+(U473*$U$5)+(V473*$V$5)+(W473*$W$5)+(X473*$X$5)+(Y473*$Y$5)+(Z473*$Z$5)+(AA473*$AA$5) -> 37.02 | C473: =(K473*$K$6)+(L473*$L$6)+(M473*$M$6)+(N473*$N$6)+(O473*$O$6)+(P473*100*$P$6)+(Q473*100*$Q$6)+(R473*100*$R$6)+(S473*100*$S$6)+(T473*$T$6)+(U473*$U$6)+(V473*$V$6)+(W473*$W$6)+(X473*$X$6)+(Y473*$Y$6)+(Z473*$Z$6)+(AB473*$AA$6) -> 25.661999999999999 | D473: AQ40 | E473: 5 | F473: Q | G473: AQ40 Quest Reward | H473: VS | I473: 60 | J473: P | K473: 52 | L473: 18 | M473: 11 | Q473: 00.01
A474: Cloak of Firemaw | B474: =(K474*$K$5)+(L474*$L$5)+(M474*$M$5)+(N474*$N$5)+(O474*$O$5)+(P474*100*$P$5)+(Q474*100*$Q$5)+(R474*100*$R$5)+(S474*100*$S$5)+(T474*$T$5)+(U474*$U$5)+(V474*$V$5)+(W474*$W$5)+(X474*$X$5)+(Y474*$Y$5)+(Z474*$Z$5)+(AA474*$AA$5) -> 37.57 | C474: =(K474*$K$6)+(L474*$L$6)+(M474*$M$6)+(N474*$N$6)+(O474*$O$6)+(P474*100*$P$6)+(Q474*100*$Q$6)+(R474*100*$R$6)+(S474*100*$S$6)+(T474*$T$6)+(U474*$U$6)+(V474*$V$6)+(W474*$W$6)+(X474*$X$6)+(Y474*$Y$6)+(Z474*$Z$6)+(AB474*$AA$6) -> 25.177 | D474: BWL | E474: 3 | F474: 00.09 | G474: Firemaw | I474: 60 | J474: P | K474: 57 | M474: 12 | O474: 50
A475: Cape of the Black Baron | B475: =(K475*$K$5)+(L475*$L$5)+(M475*$M$5)+(N475*$N$5)+(O475*$O$5)+(P475*100*$P$5)+(Q475*100*$Q$5)+(R475*100*$R$5)+(S475*100*$S$5)+(T475*$T$5)+(U475*$U$5)+(V475*$V$5)+(W475*$W$5)+(X475*$X$5)+(Y475*$Y$5)+(Z475*$Z$5)+(AA475*$AA$5) -> 25.45 | C475: =(K475*$K$6)+(L475*$L$6)+(M475*$M$6)+(N475*$N$6)+(O475*$O$6)+(P475*100*$P$6)+(Q475*100*$Q$6)+(R475*100*$R$6)+(S475*100*$S$6)+(T475*$T$6)+(U475*$U$6)+(V475*$V$6)+(W475*$W$6)+(X475*$X$6)+(Y475*$Y$6)+(Z475*$Z$6)+(AB475*$AA$6) -> 25.045000000000002 | D475: Str | E475: 1 | F475: 00.09 | G475: Baron Rivendare | I475: 58 | J475: P | K475: 45 | L475: 15 | O475: 20
A476: Cloak of Draconic Might | B476: =(K476*$K$5)+(L476*$L$5)+(M476*$M$5)+(N476*$N$5)+(O476*$O$5)+(P476*100*$P$5)+(Q476*100*$Q$5)+(R476*100*$R$5)+(S476*100*$S$5)+(T476*$T$5)+(U476*$U$5)+(V476*$V$5)+(W476*$W$5)+(X476*$X$5)+(Y476*$Y$5)+(Z476*$Z$5)+(AA476*$AA$5) -> 28.54 | C476: =(K476*$K$6)+(L476*$L$6)+(M476*$M$6)+(N476*$N$6)+(O476*$O$6)+(P476*100*$P$6)+(Q476*100*$Q$6)+(R476*100*$R$6)+(S476*100*$S$6)+(T476*$T$6)+(U476*$U$6)+(V476*$V$6)+(W476*$W$6)+(X476*$X$6)+(Y476*$Y$6)+(Z476*$Z$6)+(AB476*$AA$6) -> 24.093999999999998 | D476: BWL | E476: 3 | F476: 00.03 | G476: Death Talon Mobs | I476: 60 | J476: P | K476: 54 | L476: 16 | M476: 4 | N476: 16
A477: Cloak of the Scourge | B477: =(K477*$K$5)+(L477*$L$5)+(M477*$M$5)+(N477*$N$5)+(O477*$O$5)+(P477*100*$P$5)+(Q477*100*$Q$5)+(R477*100*$R$5)+(S477*100*$S$5)+(T477*$T$5)+(U477*$U$5)+(V477*$V$5)+(W477*$W$5)+(X477*$X$5)+(Y477*$Y$5)+(Z477*$Z$5)+(AA477*$AA$5) -> 46.13 | C477: =(K477*$K$6)+(L477*$L$6)+(M477*$M$6)+(N477*$N$6)+(O477*$O$6)+(P477*100*$P$6)+(Q477*100*$Q$6)+(R477*100*$R$6)+(S477*100*$S$6)+(T477*$T$6)+(U477*$U$6)+(V477*$V$6)+(W477*$W$6)+(X477*$X$6)+(Y477*$Y$6)+(Z477*$Z$6)+(AB477*$AA$6) -> 22.792999999999999 | D477: Naxx | E477: 6 | F477: 00.14 | G477: Noth | I477: 60 | J477: P | K477: 63 | M477: 23 | O477: 30 | Q477: 00.01
A478: Earthweave Cloak | B478: =(K478*$K$5)+(L478*$L$5)+(M478*$M$5)+(N478*$N$5)+(O478*$O$5)+(P478*100*$P$5)+(Q478*100*$Q$5)+(R478*100*$R$5)+(S478*100*$S$5)+(T478*$T$5)+(U478*$U$5)+(V478*$V$5)+(W478*$W$5)+(X478*$X$5)+(Y478*$Y$5)+(Z478*$Z$5)+(AA478*$AA$5) -> 22.94 | C478: =(K478*$K$6)+(L478*$L$6)+(M478*$M$6)+(N478*$N$6)+(O478*$O$6)+(P478*100*$P$6)+(Q478*100*$Q$6)+(R478*100*$R$6)+(S478*100*$S$6)+(T478*$T$6)+(U478*$U$6)+(V478*$V$6)+(W478*$W$6)+(X478*$X$6)+(Y478*$Y$6)+(Z478*$Z$6)+(AB478*$AA$6) -> 22.544 | D478: Sil | E478: 5 | F478: Q | G478: Silithus Quest | I478: 60 | J478: P | K478: 44 | L478: 15 | Q478: 00.01
A479: Cloak of the Shrouded Mists | B479: =(K479*$K$5)+(L479*$L$5)+(M479*$M$5)+(N479*$N$5)+(O479*$O$5)+(P479*100*$P$5)+(Q479*100*$Q$5)+(R479*100*$R$5)+(S479*100*$S$5)+(T479*$T$5)+(U479*$U$5)+(V479*$V$5)+(W479*$W$5)+(X479*$X$5)+(Y479*$Y$5)+(Z479*$Z$5)+(AA479*$AA$5) -> 35.77 | C479: =(K479*$K$6)+(L479*$L$6)+(M479*$M$6)+(N479*$N$6)+(O479*$O$6)+(P479*100*$P$6)+(Q479*100*$Q$6)+(R479*100*$R$6)+(S479*100*$S$6)+(T479*$T$6)+(U479*$U$6)+(V479*$V$6)+(W479*$W$6)+(X479*$X$6)+(Y479*$Y$6)+(Z479*$Z$6)+(AB479*$AA$6) -> 22.296999999999997 | D479: MC | E479: 1 | F479: 00.17 | G479: Ragnaros | I479: 60 | J479: P | K479: 57 | L479: 22 | M479: 12 | V479: 6 | X479: 6
A480: Cloak of the Honor Guard | B480: =(K480*$K$5)+(L480*$L$5)+(M480*$M$5)+(N480*$N$5)+(O480*$O$5)+(P480*100*$P$5)+(Q480*100*$Q$5)+(R480*100*$R$5)+(S480*100*$S$5)+(T480*$T$5)+(U480*$U$5)+(V480*$V$5)+(W480*$W$5)+(X480*$X$5)+(Y480*$Y$5)+(Z480*$Z$5)+(AA480*$AA$5) -> 33.5 | C480: =(K480*$K$6)+(L480*$L$6)+(M480*$M$6)+(N480*$N$6)+(O480*$O$6)+(P480*100*$P$6)+(Q480*100*$Q$6)+(R480*100*$R$6)+(S480*100*$S$6)+(T480*$T$6)+(U480*$U$6)+(V480*$V$6)+(W480*$W$6)+(X480*$X$6)+(Y480*$Y$6)+(Z480*$Z$6)+(AB480*$AA$6) -> 22.16 | D480: AB | E480: 4 | F480: Exa | G480: Alliance AB Exalted | I480: 60 | J480: P | K480: 50 | L480: 5 | M480: 11 | O480: 34
A481: Deathguard's Cloak | B481: =(K481*$K$5)+(L481*$L$5)+(M481*$M$5)+(N481*$N$5)+(O481*$O$5)+(P481*100*$P$5)+(Q481*100*$Q$5)+(R481*100*$R$5)+(S481*100*$S$5)+(T481*$T$5)+(U481*$U$5)+(V481*$V$5)+(W481*$W$5)+(X481*$X$5)+(Y481*$Y$5)+(Z481*$Z$5)+(AA481*$AA$5) -> 33.5 | C481: =(K481*$K$6)+(L481*$L$6)+(M481*$M$6)+(N481*$N$6)+(O481*$O$6)+(P481*100*$P$6)+(Q481*100*$Q$6)+(R481*100*$R$6)+(S481*100*$S$6)+(T481*$T$6)+(U481*$U$6)+(V481*$V$6)+(W481*$W$6)+(X481*$X$6)+(Y481*$Y$6)+(Z481*$Z$6)+(AB481*$AA$6) -> 22.16 | D481: AB | E481: 4 | F481: Exa | G481: Horde AB Exalted | I481: 60 | J481: P | K481: 50 | L481: 5 | M481: 11 | O481: 34
A482: Zulian Tigerhide Cloak | B482: =(K482*$K$5)+(L482*$L$5)+(M482*$M$5)+(N482*$N$5)+(O482*$O$5)+(P482*100*$P$5)+(Q482*100*$Q$5)+(R482*100*$R$5)+(S482*100*$S$5)+(T482*$T$5)+(U482*$U$5)+(V482*$V$5)+(W482*$W$5)+(X482*$X$5)+(Y482*$Y$5)+(Z482*$Z$5)+(AA482*$AA$5) -> 30.98 | C482: =(K482*$K$6)+(L482*$L$6)+(M482*$M$6)+(N482*$N$6)+(O482*$O$6)+(P482*100*$P$6)+(Q482*100*$Q$6)+(R482*100*$R$6)+(S482*100*$S$6)+(T482*$T$6)+(U482*$U$6)+(V482*$V$6)+(W482*$W$6)+(X482*$X$6)+(Y482*$Y$6)+(Z482*$Z$6)+(AB482*$AA$6) -> 20.648 | D482: ZG | E482: 4 | F482: 00.07 | G482: High Priest Venoxis | I482: 60 | J482: P | K482: 48 | L482: 13 | M482: 10 | Q482: 00.01
A483: Windshear Cape | B483: =(K483*$K$5)+(L483*$L$5)+(M483*$M$5)+(N483*$N$5)+(O483*$O$5)+(P483*100*$P$5)+(Q483*100*$Q$5)+(R483*100*$R$5)+(S483*100*$S$5)+(T483*$T$5)+(U483*$U$5)+(V483*$V$5)+(W483*$W$5)+(X483*$X$5)+(Y483*$Y$5)+(Z483*$Z$5)+(AA483*$AA$5) -> 33.5 | C483: =(K483*$K$6)+(L483*$L$6)+(M483*$M$6)+(N483*$N$6)+(O483*$O$6)+(P483*100*$P$6)+(Q483*100*$Q$6)+(R483*100*$R$6)+(S483*100*$S$6)+(T483*$T$6)+(U483*$U$6)+(V483*$V$6)+(W483*$W$6)+(X483*$X$6)+(Y483*$Y$6)+(Z483*$Z$6)+(AB483*$AA$6) -> 19.19 | D483: Sil | E483: 4 | F483: 00.27 | G483: High Mar. Whirlaxis | I483: 60 | J483: P | K483: 50 | L483: 15 | M483: 14 | N483: 8
A484: Shifting Cloak | B484: =(K484*$K$5)+(L484*$L$5)+(M484*$M$5)+(N484*$N$5)+(O484*$O$5)+(P484*100*$P$5)+(Q484*100*$Q$5)+(R484*100*$R$5)+(S484*100*$S$5)+(T484*$T$5)+(U484*$U$5)+(V484*$V$5)+(W484*$W$5)+(X484*$X$5)+(Y484*$Y$5)+(Z484*$Z$5)+(AA484*$AA$5) -> 28.48 | C484: =(K484*$K$6)+(L484*$L$6)+(M484*$M$6)+(N484*$N$6)+(O484*$O$6)+(P484*100*$P$6)+(Q484*100*$Q$6)+(R484*100*$R$6)+(S484*100*$S$6)+(T484*$T$6)+(U484*$U$6)+(V484*$V$6)+(W484*$W$6)+(X484*$X$6)+(Y484*$Y$6)+(Z484*$Z$6)+(AB484*$AA$6) -> 17.137999999999998 | D484: LW | E484: 2 | F484: 300 | G484: Knot Thimble. Cache | I484: 57 | J484: E | K484: 48 | L484: 17 | M484: 8 | S484: 00.01
A485: Shadow Prowler's Cloak | B485: =(K485*$K$5)+(L485*$L$5)+(M485*$M$5)+(N485*$N$5)+(O485*$O$5)+(P485*100*$P$5)+(Q485*100*$Q$5)+(R485*100*$R$5)+(S485*100*$S$5)+(T485*$T$5)+(U485*$U$5)+(V485*$V$5)+(W485*$W$5)+(X485*$X$5)+(Y485*$Y$5)+(Z485*$Z$5)+(AA485*$AA$5) -> 24.45 | C485: =(K485*$K$6)+(L485*$L$6)+(M485*$M$6)+(N485*$N$6)+(O485*$O$6)+(P485*100*$P$6)+(Q485*100*$Q$6)+(R485*100*$R$6)+(S485*100*$S$6)+(T485*$T$6)+(U485*$U$6)+(V485*$V$6)+(W485*$W$6)+(X485*$X$6)+(Y485*$Y$6)+(Z485*$Z$6)+(AB485*$AA$6) -> 17.114999999999998 | D485: UBRS | E485: 5 | F485: 00.38 | G485: Drakkisath | I485: 58 | J485: P | K485: 45 | L485: 17 | M485: 7
A486: Blackveil Cape | B486: =(K486*$K$5)+(L486*$L$5)+(M486*$M$5)+(N486*$N$5)+(O486*$O$5)+(P486*100*$P$5)+(Q486*100*$Q$5)+(R486*100*$R$5)+(S486*100*$S$5)+(T486*$T$5)+(U486*$U$5)+(V486*$V$5)+(W486*$W$5)+(X486*$X$5)+(Y486*$Y$5)+(Z486*$Z$5)+(AA486*$AA$5) -> 17.38 | C486: =(K486*$K$6)+(L486*$L$6)+(M486*$M$6)+(N486*$N$6)+(O486*$O$6)+(P486*100*$P$6)+(Q486*100*$Q$6)+(R486*100*$R$6)+(S486*100*$S$6)+(T486*$T$6)+(U486*$U$6)+(V486*$V$6)+(W486*$W$6)+(X486*$X$6)+(Y486*$Y$6)+(Z486*$Z$6)+(AB486*$AA$6) -> 17.038 | D486: BRD | E486: 1 | F486: 00.31 | G486: Houndmaster | I486: 48 | J486: P | K486: 38 | L486: 14 | N486: 6
A487: Cloak of the Golden Hive | B487: =(K487*$K$5)+(L487*$L$5)+(M487*$M$5)+(N487*$N$5)+(O487*$O$5)+(P487*100*$P$5)+(Q487*100*$Q$5)+(R487*100*$R$5)+(S487*100*$S$5)+(T487*$T$5)+(U487*$U$5)+(V487*$V$5)+(W487*$W$5)+(X487*$X$5)+(Y487*$Y$5)+(Z487*$Z$5)+(AA487*$AA$5) -> 37.29 | C487: =(K487*$K$6)+(L487*$L$6)+(M487*$M$6)+(N487*$N$6)+(O487*$O$6)+(P487*100*$P$6)+(Q487*100*$Q$6)+(R487*100*$R$6)+(S487*100*$S$6)+(T487*$T$6)+(U487*$U$6)+(V487*$V$6)+(W487*$W$6)+(X487*$X$6)+(Y487*$Y$6)+(Z487*$Z$6)+(AB487*$AA$6) -> 16.808999999999997 | D487: AQ40 | E487: 5 | F487: 00.17 | G487: Princess Huhuran | I487: 60 | J487: P | K487: 59 | L487: 10 | M487: 19 | N487: 13 | T487: 6
A488: Cloak of Revanchion | B488: =(K488*$K$5)+(L488*$L$5)+(M488*$M$5)+(N488*$N$5)+(O488*$O$5)+(P488*100*$P$5)+(Q488*100*$Q$5)+(R488*100*$R$5)+(S488*100*$S$5)+(T488*$T$5)+(U488*$U$5)+(V488*$V$5)+(W488*$W$5)+(X488*$X$5)+(Y488*$Y$5)+(Z488*$Z$5)+(AA488*$AA$5) -> 26.45 | C488: =(K488*$K$6)+(L488*$L$6)+(M488*$M$6)+(N488*$N$6)+(O488*$O$6)+(P488*100*$P$6)+(Q488*100*$Q$6)+(R488*100*$R$6)+(S488*100*$S$6)+(T488*$T$6)+(U488*$U$6)+(V488*$V$6)+(W488*$W$6)+(X488*$X$6)+(Y488*$Y$6)+(Z488*$Z$6)+(AB488*$AA$6) -> 15.154999999999999 | D488: DM-W | E488: 6 | F488: ? | G488: Revanchion | I488: 58 | J488: P | K488: 45 | L488: 10 | M488: 11 | N488: 10
A489: Blisterbane Wrap | B489: =(K489*$K$5)+(L489*$L$5)+(M489*$M$5)+(N489*$N$5)+(O489*$O$5)+(P489*100*$P$5)+(Q489*100*$Q$5)+(R489*100*$R$5)+(S489*100*$S$5)+(T489*$T$5)+(U489*$U$5)+(V489*$V$5)+(W489*$W$5)+(X489*$X$5)+(Y489*$Y$5)+(Z489*$Z$5)+(AA489*$AA$5) -> 18.99 | C489: =(K489*$K$6)+(L489*$L$6)+(M489*$M$6)+(N489*$N$6)+(O489*$O$6)+(P489*100*$P$6)+(Q489*100*$Q$6)+(R489*100*$R$6)+(S489*100*$S$6)+(T489*$T$6)+(U489*$U$6)+(V489*$V$6)+(W489*$W$6)+(X489*$X$6)+(Y489*$Y$6)+(Z489*$Z$6)+(AB489*$AA$6) -> 15.129 | D489: BRD | E489: 1 | F489: 52-57 | G489: Random BRD Drop | I489: 50 | J489: E | K489: 39 | L489: 15 | M489: 3 | Y489: 6
A490: Masterwork Cape of the Tiger | B490: =(K490*$K$5)+(L490*$L$5)+(M490*$M$5)+(N490*$N$5)+(O490*$O$5)+(P490*100*$P$5)+(Q490*100*$Q$5)+(R490*100*$R$5)+(S490*100*$S$5)+(T490*$T$5)+(U490*$U$5)+(V490*$V$5)+(W490*$W$5)+(X490*$X$5)+(Y490*$Y$5)+(Z490*$Z$5)+(AA490*$AA$5) -> 15.39 | C490: =(K490*$K$6)+(L490*$L$6)+(M490*$M$6)+(N490*$N$6)+(O490*$O$6)+(P490*100*$P$6)+(Q490*100*$Q$6)+(R490*100*$R$6)+(S490*100*$S$6)+(T490*$T$6)+(U490*$U$6)+(V490*$V$6)+(W490*$W$6)+(X490*$X$6)+(Y490*$Y$6)+(Z490*$Z$6)+(AB490*$AA$6) -> 15.039 | D490: R | E490: 1 | F490: 59-61 | G490: Random World Drop | I490: 56 | J490: E | K490: 39 | L490: 10 | N490: 10
A491: Supreme Cape of the Tiger | B491: =(K491*$K$5)+(L491*$L$5)+(M491*$M$5)+(N491*$N$5)+(O491*$O$5)+(P491*100*$P$5)+(Q491*100*$Q$5)+(R491*100*$R$5)+(S491*100*$S$5)+(T491*$T$5)+(U491*$U$5)+(V491*$V$5)+(W491*$W$5)+(X491*$X$5)+(Y491*$Y$5)+(Z491*$Z$5)+(AA491*$AA$5) -> 15.39 | C491: =(K491*$K$6)+(L491*$L$6)+(M491*$M$6)+(N491*$N$6)+(O491*$O$6)+(P491*100*$P$6)+(Q491*100*$Q$6)+(R491*100*$R$6)+(S491*100*$S$6)+(T491*$T$6)+(U491*$U$6)+(V491*$V$6)+(W491*$W$6)+(X491*$X$6)+(Y491*$Y$6)+(Z491*$Z$6)+(AB491*$AA$6) -> 15.039 | D491: R | E491: 1 | F491: 59-62 | G491: Random World Drop | I491: 56 | J491: E | K491: 39 | L491: 10 | N491: 10
A492: Adventurer's Cape of the Tiger | B492: =(K492*$K$5)+(L492*$L$5)+(M492*$M$5)+(N492*$N$5)+(O492*$O$5)+(P492*100*$P$5)+(Q492*100*$Q$5)+(R492*100*$R$5)+(S492*100*$S$5)+(T492*$T$5)+(U492*$U$5)+(V492*$V$5)+(W492*$W$5)+(X492*$X$5)+(Y492*$Y$5)+(Z492*$Z$5)+(AA492*$AA$5) -> 15.39 | C492: =(K492*$K$6)+(L492*$L$6)+(M492*$M$6)+(N492*$N$6)+(O492*$O$6)+(P492*100*$P$6)+(Q492*100*$Q$6)+(R492*100*$R$6)+(S492*100*$S$6)+(T492*$T$6)+(U492*$U$6)+(V492*$V$6)+(W492*$W$6)+(X492*$X$6)+(Y492*$Y$6)+(Z492*$Z$6)+(AB492*$AA$6) -> 15.039 | D492: R | E492: 1 | F492: 57-61 | G492: Random World Drop | I492: 55 | J492: E | K492: 39 | L492: 10 | N492: 10
A493: Mercurial Cloak of the Tiger | B493: =(K493*$K$5)+(L493*$L$5)+(M493*$M$5)+(N493*$N$5)+(O493*$O$5)+(P493*100*$P$5)+(Q493*100*$Q$5)+(R493*100*$R$5)+(S493*100*$S$5)+(T493*$T$5)+(U493*$U$5)+(V493*$V$5)+(W493*$W$5)+(X493*$X$5)+(Y493*$Y$5)+(Z493*$Z$5)+(AA493*$AA$5) -> 15.38 | C493: =(K493*$K$6)+(L493*$L$6)+(M493*$M$6)+(N493*$N$6)+(O493*$O$6)+(P493*100*$P$6)+(Q493*100*$Q$6)+(R493*100*$R$6)+(S493*100*$S$6)+(T493*$T$6)+(U493*$U$6)+(V493*$V$6)+(W493*$W$6)+(X493*$X$6)+(Y493*$Y$6)+(Z493*$Z$6)+(AB493*$AA$6) -> 15.038 | D493: R | E493: 1 | F493: 57-60 | G493: Random World Drop | I493: 54 | J493: E | K493: 38 | L493: 10 | N493: 10
A494: Triumphant Cloak of the Tiger | B494: =(K494*$K$5)+(L494*$L$5)+(M494*$M$5)+(N494*$N$5)+(O494*$O$5)+(P494*100*$P$5)+(Q494*100*$Q$5)+(R494*100*$R$5)+(S494*100*$S$5)+(T494*$T$5)+(U494*$U$5)+(V494*$V$5)+(W494*$W$5)+(X494*$X$5)+(Y494*$Y$5)+(Z494*$Z$5)+(AA494*$AA$5) -> 15.38 | C494: =(K494*$K$6)+(L494*$L$6)+(M494*$M$6)+(N494*$N$6)+(O494*$O$6)+(P494*100*$P$6)+(Q494*100*$Q$6)+(R494*100*$R$6)+(S494*100*$S$6)+(T494*$T$6)+(U494*$U$6)+(V494*$V$6)+(W494*$W$6)+(X494*$X$6)+(Y494*$Y$6)+(Z494*$Z$6)+(AB494*$AA$6) -> 15.038 | D494: R | E494: 1 | F494: 55-58 | G494: Random World Drop | I494: 53 | J494: E | K494: 38 | L494: 10 | N494: 10
A495: Duskbat Drape | B495: =(K495*$K$5)+(L495*$L$5)+(M495*$M$5)+(N495*$N$5)+(O495*$O$5)+(P495*100*$P$5)+(Q495*100*$Q$5)+(R495*100*$R$5)+(S495*100*$S$5)+(T495*$T$5)+(U495*$U$5)+(V495*$V$5)+(W495*$W$5)+(X495*$X$5)+(Y495*$Y$5)+(Z495*$Z$5)+(AA495*$AA$5) -> 15.37 | C495: =(K495*$K$6)+(L495*$L$6)+(M495*$M$6)+(N495*$N$6)+(O495*$O$6)+(P495*100*$P$6)+(Q495*100*$Q$6)+(R495*100*$R$6)+(S495*100*$S$6)+(T495*$T$6)+(U495*$U$6)+(V495*$V$6)+(W495*$W$6)+(X495*$X$6)+(Y495*$Y$6)+(Z495*$Z$6)+(AB495*$AA$6) -> 15.037000000000001 | D495: ToAH | E495: 4 | F495: Q | G495: Azs. Quest Series | I495: 50 | J495: P | K495: 37 | L495: 14 | AA495: 1 | AB495: 1 | AC495: Red. Fall Dam.
A496: Might of the Tribe | B496: =(K496*$K$5)+(L496*$L$5)+(M496*$M$5)+(N496*$N$5)+(O496*$O$5)+(P496*100*$P$5)+(Q496*100*$Q$5)+(R496*100*$R$5)+(S496*100*$S$5)+(T496*$T$5)+(U496*$U$5)+(V496*$V$5)+(W496*$W$5)+(X496*$X$5)+(Y496*$Y$5)+(Z496*$Z$5)+(AA496*$AA$5) -> 32.48 | C496: =(K496*$K$6)+(L496*$L$6)+(M496*$M$6)+(N496*$N$6)+(O496*$O$6)+(P496*100*$P$6)+(Q496*100*$Q$6)+(R496*100*$R$6)+(S496*100*$S$6)+(T496*$T$6)+(U496*$U$6)+(V496*$V$6)+(W496*$W$6)+(X496*$X$6)+(Y496*$Y$6)+(Z496*$Z$6)+(AB496*$AA$6) -> 14.228 | D496: ZG | E496: 4 | F496: 00.03 | G496: Priestesses | I496: 60 | J496: P | K496: 48 | M496: 18 | O496: 28
A497: Impenetrable Cloak of the Tiger | B497: =(K497*$K$5)+(L497*$L$5)+(M497*$M$5)+(N497*$N$5)+(O497*$O$5)+(P497*100*$P$5)+(Q497*100*$Q$5)+(R497*100*$R$5)+(S497*100*$S$5)+(T497*$T$5)+(U497*$U$5)+(V497*$V$5)+(W497*$W$5)+(X497*$X$5)+(Y497*$Y$5)+(Z497*$Z$5)+(AA497*$AA$5) -> 13.85 | C497: =(K497*$K$6)+(L497*$L$6)+(M497*$M$6)+(N497*$N$6)+(O497*$O$6)+(P497*100*$P$6)+(Q497*100*$Q$6)+(R497*100*$R$6)+(S497*100*$S$6)+(T497*$T$6)+(U497*$U$6)+(V497*$V$6)+(W497*$W$6)+(X497*$X$6)+(Y497*$Y$6)+(Z497*$Z$6)+(AB497*$AA$6) -> 13.535 | D497: R | E497: 1 | F497: 51-54 | G497: Random World Drop | I497: 49 | J497: E | K497: 35 | L497: 9 | N497: 9
A498: Peerless Cloak of the Tiger | B498: =(K498*$K$5)+(L498*$L$5)+(M498*$M$5)+(N498*$N$5)+(O498*$O$5)+(P498*100*$P$5)+(Q498*100*$Q$5)+(R498*100*$R$5)+(S498*100*$S$5)+(T498*$T$5)+(U498*$U$5)+(V498*$V$5)+(W498*$W$5)+(X498*$X$5)+(Y498*$Y$5)+(Z498*$Z$5)+(AA498*$AA$5) -> 13.85 | C498: =(K498*$K$6)+(L498*$L$6)+(M498*$M$6)+(N498*$N$6)+(O498*$O$6)+(P498*100*$P$6)+(Q498*100*$Q$6)+(R498*100*$R$6)+(S498*100*$S$6)+(T498*$T$6)+(U498*$U$6)+(V498*$V$6)+(W498*$W$6)+(X498*$X$6)+(Y498*$Y$6)+(Z498*$Z$6)+(AB498*$AA$6) -> 13.535 | D498: R | E498: 1 | F498: 51-55 | G498: Random World Drop | I498: 49 | J498: E | K498: 35 | L498: 9 | N498: 9
A499: Stormpike Soldier's Cloak | B499: =(K499*$K$5)+(L499*$L$5)+(M499*$M$5)+(N499*$N$5)+(O499*$O$5)+(P499*100*$P$5)+(Q499*100*$Q$5)+(R499*100*$R$5)+(S499*100*$S$5)+(T499*$T$5)+(U499*$U$5)+(V499*$V$5)+(W499*$W$5)+(X499*$X$5)+(Y499*$Y$5)+(Z499*$Z$5)+(AA499*$AA$5) -> 23.93 | C499: =(K499*$K$6)+(L499*$L$6)+(M499*$M$6)+(N499*$N$6)+(O499*$O$6)+(P499*100*$P$6)+(Q499*100*$Q$6)+(R499*100*$R$6)+(S499*100*$S$6)+(T499*$T$6)+(U499*$U$6)+(V499*$V$6)+(W499*$W$6)+(X499*$X$6)+(Y499*$Y$6)+(Z499*$Z$6)+(AB499*$AA$6) -> 12.203000000000001 | D499: AV | E499: 3 | F499: Hon | G499: Alliance AV Honored | I499: 55 | J499: P | K499: 43 | M499: 11 | O499: 24 | W499: 5
A500: Frostwolf Legionnaire's Cloak | B500: =(K500*$K$5)+(L500*$L$5)+(M500*$M$5)+(N500*$N$5)+(O500*$O$5)+(P500*100*$P$5)+(Q500*100*$Q$5)+(R500*100*$R$5)+(S500*100*$S$5)+(T500*$T$5)+(U500*$U$5)+(V500*$V$5)+(W500*$W$5)+(X500*$X$5)+(Y500*$Y$5)+(Z500*$Z$5)+(AA500*$AA$5) -> 23.93 | C500: =(K500*$K$6)+(L500*$L$6)+(M500*$M$6)+(N500*$N$6)+(O500*$O$6)+(P500*100*$P$6)+(Q500*100*$Q$6)+(R500*100*$R$6)+(S500*100*$S$6)+(T500*$T$6)+(U500*$U$6)+(V500*$V$6)+(W500*$W$6)+(X500*$X$6)+(Y500*$Y$6)+(Z500*$Z$6)+(AB500*$AA$6) -> 12.203000000000001 | D500: AV | E500: 3 | F500: Hon | G500: Horde AV Honored | I500: 55 | J500: P | K500: 43 | M500: 11 | O500: 24 | W500: 5
A501: Dark Hooded Cape | B501: =(K501*$K$5)+(L501*$L$5)+(M501*$M$5)+(N501*$N$5)+(O501*$O$5)+(P501*100*$P$5)+(Q501*100*$Q$5)+(R501*100*$R$5)+(S501*100*$S$5)+(T501*$T$5)+(U501*$U$5)+(V501*$V$5)+(W501*$W$5)+(X501*$X$5)+(Y501*$Y$5)+(Z501*$Z$5)+(AA501*$AA$5) -> 12.27 | C501: =(K501*$K$6)+(L501*$L$6)+(M501*$M$6)+(N501*$N$6)+(O501*$O$6)+(P501*100*$P$6)+(Q501*100*$Q$6)+(R501*100*$R$6)+(S501*100*$S$6)+(T501*$T$6)+(U501*$U$6)+(V501*$V$6)+(W501*$W$6)+(X501*$X$6)+(Y501*$Y$6)+(Z501*$Z$6)+(AB501*$AA$6) -> 12.026999999999999 | D501: ArHi | E501: 1 | F501: 00.11 | G501: Nimar the Slayer | I501: 32 | J501: E | K501: 27 | L501: 10 | N501: 4
A502: Stoneskin Gargoyle Cape | B502: =(K502*$K$5)+(L502*$L$5)+(M502*$M$5)+(N502*$N$5)+(O502*$O$5)+(P502*100*$P$5)+(Q502*100*$Q$5)+(R502*100*$R$5)+(S502*100*$S$5)+(T502*$T$5)+(U502*$U$5)+(V502*$V$5)+(W502*$W$5)+(X502*$X$5)+(Y502*$Y$5)+(Z502*$Z$5)+(AA502*$AA$5) -> 25.93 | C502: =(K502*$K$6)+(L502*$L$6)+(M502*$M$6)+(N502*$N$6)+(O502*$O$6)+(P502*100*$P$6)+(Q502*100*$Q$6)+(R502*100*$R$6)+(S502*100*$S$6)+(T502*$T$6)+(U502*$U$6)+(V502*$V$6)+(W502*$W$6)+(X502*$X$6)+(Y502*$Y$6)+(Z502*$Z$6)+(AB502*$AA$6) -> 11.683 | D502: Str | E502: 1 | F502: 00.19 | G502: Stonespine | I502: 56 | J502: P | K502: 43 | L502: 8 | M502: 14 | N502: 7
A503: Deep River Cloak | B503: =(K503*$K$5)+(L503*$L$5)+(M503*$M$5)+(N503*$N$5)+(O503*$O$5)+(P503*100*$P$5)+(Q503*100*$Q$5)+(R503*100*$R$5)+(S503*100*$S$5)+(T503*$T$5)+(U503*$U$5)+(V503*$V$5)+(W503*$W$5)+(X503*$X$5)+(Y503*$Y$5)+(Z503*$Z$5)+(AA503*$AA$5) -> 18.36 | C503: =(K503*$K$6)+(L503*$L$6)+(M503*$M$6)+(N503*$N$6)+(O503*$O$6)+(P503*100*$P$6)+(Q503*100*$Q$6)+(R503*100*$R$6)+(S503*100*$S$6)+(T503*$T$6)+(U503*$U$6)+(V503*$V$6)+(W503*$W$6)+(X503*$X$6)+(Y503*$Y$6)+(Z503*$Z$6)+(AB503*$AA$6) -> 11.106 | D503: WS | E503: 1 | F503: Q | G503: Quest Reward | I503: 51 | J503: P | K503: 36 | L503: 11 | M503: 7
A504: Eskhandar's Pelt | B504: =(K504*$K$5)+(L504*$L$5)+(M504*$M$5)+(N504*$N$5)+(O504*$O$5)+(P504*100*$P$5)+(Q504*100*$Q$5)+(R504*100*$R$5)+(S504*100*$S$5)+(T504*$T$5)+(U504*$U$5)+(V504*$V$5)+(W504*$W$5)+(X504*$X$5)+(Y504*$Y$5)+(Z504*$Z$5)+(AA504*$AA$5) -> 30.51 | C504: =(K504*$K$6)+(L504*$L$6)+(M504*$M$6)+(N504*$N$6)+(O504*$O$6)+(P504*100*$P$6)+(Q504*100*$Q$6)+(R504*100*$R$6)+(S504*100*$S$6)+(T504*$T$6)+(U504*$U$6)+(V504*$V$6)+(W504*$W$6)+(X504*$X$6)+(Y504*$Y$6)+(Z504*$Z$6)+(AB504*$AA$6) -> 10.250999999999999 | D504: BL | E504: 2 | F504: 00.18 | G504: Lord Kazzak | H504: SoE | I504: 60 | J504: P | K504: 51 | M504: 20 | P504: 00.01
A505: Shroud of Domination | B505: =(K505*$K$5)+(L505*$L$5)+(M505*$M$5)+(N505*$N$5)+(O505*$O$5)+(P505*100*$P$5)+(Q505*100*$Q$5)+(R505*100*$R$5)+(S505*100*$S$5)+(T505*$T$5)+(U505*$U$5)+(V505*$V$5)+(W505*$W$5)+(X505*$X$5)+(Y505*$Y$5)+(Z505*$Z$5)+(AA505*$AA$5) -> 15.95 | C505: =(K505*$K$6)+(L505*$L$6)+(M505*$M$6)+(N505*$N$6)+(O505*$O$6)+(P505*100*$P$6)+(Q505*100*$Q$6)+(R505*100*$R$6)+(S505*100*$S$6)+(T505*$T$6)+(U505*$U$6)+(V505*$V$6)+(W505*$W$6)+(X505*$X$6)+(Y505*$Y$6)+(Z505*$Z$6)+(AB505*$AA$6) -> 8.6150000000000002 | D505: LBRS | E505: 1 | F505: 00.26 | G505: Lord Valthalak | I505: 58 | J505: P | K505: 45 | M505: 7 | N505: 17
A506: Armswake Cloak | B506: =(K506*$K$5)+(L506*$L$5)+(M506*$M$5)+(N506*$N$5)+(O506*$O$5)+(P506*100*$P$5)+(Q506*100*$Q$5)+(R506*100*$R$5)+(S506*100*$S$5)+(T506*$T$5)+(U506*$U$5)+(V506*$V$5)+(W506*$W$5)+(X506*$X$5)+(Y506*$Y$5)+(Z506*$Z$5)+(AA506*$AA$5) -> 23.43 | C506: =(K506*$K$6)+(L506*$L$6)+(M506*$M$6)+(N506*$N$6)+(O506*$O$6)+(P506*100*$P$6)+(Q506*100*$Q$6)+(R506*100*$R$6)+(S506*100*$S$6)+(T506*$T$6)+(U506*$U$6)+(V506*$V$6)+(W506*$W$6)+(X506*$X$6)+(Y506*$Y$6)+(Z506*$Z$6)+(AB506*$AA$6) -> 8.1929999999999996 | D506: LBRS | E506: 1 | F506: 00.38 | G506: Ghok Bashguud | I506: 55 | J506: P | K506: 43 | M506: 15 | O506: 16
A507: Tigerstrike Mantle | B507: =(K507*$K$5)+(L507*$L$5)+(M507*$M$5)+(N507*$N$5)+(O507*$O$5)+(P507*100*$P$5)+(Q507*100*$Q$5)+(R507*100*$R$5)+(S507*100*$S$5)+(T507*$T$5)+(U507*$U$5)+(V507*$V$5)+(W507*$W$5)+(X507*$X$5)+(Y507*$Y$5)+(Z507*$Z$5)+(AA507*$AA$5) -> 15.25 | C507: =(K507*$K$6)+(L507*$L$6)+(M507*$M$6)+(N507*$N$6)+(O507*$O$6)+(P507*100*$P$6)+(Q507*100*$Q$6)+(R507*100*$R$6)+(S507*100*$S$6)+(T507*$T$6)+(U507*$U$6)+(V507*$V$6)+(W507*$W$6)+(X507*$X$6)+(Y507*$Y$6)+(Z507*$Z$6)+(AB507*$AA$6) -> 8.0950000000000006 | D507: R | E507: 1 | F507: 31-36 | G507: Random World Drop | I507: 29 | J507: E | K507: 25 | L507: 8 | M507: 7
A508: Cryptfiend Silk Cloak | B508: =(K508*$K$5)+(L508*$L$5)+(M508*$M$5)+(N508*$N$5)+(O508*$O$5)+(P508*100*$P$5)+(Q508*100*$Q$5)+(R508*100*$R$5)+(S508*100*$S$5)+(T508*$T$5)+(U508*$U$5)+(V508*$V$5)+(W508*$W$5)+(X508*$X$5)+(Y508*$Y$5)+(Z508*$Z$5)+(AA508*$AA$5) -> 27.93 | C508: =(K508*$K$6)+(L508*$L$6)+(M508*$M$6)+(N508*$N$6)+(O508*$O$6)+(P508*100*$P$6)+(Q508*100*$Q$6)+(R508*100*$R$6)+(S508*100*$S$6)+(T508*$T$6)+(U508*$U$6)+(V508*$V$6)+(W508*$W$6)+(X508*$X$6)+(Y508*$Y$6)+(Z508*$Z$6)+(AB508*$AA$6) -> 7.923 | D508: Naxx | E508: 6 | F508: 00.2 | G508: Anub'Rhekan | I508: 60 | J508: P | K508: 203 | M508: 14 | Q508: 00.01 | S508: 00.01 | T508: 7
A509: The Emperor's New Cape | B509: =(K509*$K$5)+(L509*$L$5)+(M509*$M$5)+(N509*$N$5)+(O509*$O$5)+(P509*100*$P$5)+(Q509*100*$Q$5)+(R509*100*$R$5)+(S509*100*$S$5)+(T509*$T$5)+(U509*$U$5)+(V509*$V$5)+(W509*$W$5)+(X509*$X$5)+(Y509*$Y$5)+(Z509*$Z$5)+(AA509*$AA$5) -> 23.43 | C509: =(K509*$K$6)+(L509*$L$6)+(M509*$M$6)+(N509*$N$6)+(O509*$O$6)+(P509*100*$P$6)+(Q509*100*$Q$6)+(R509*100*$R$6)+(S509*100*$S$6)+(T509*$T$6)+(U509*$U$6)+(V509*$V$6)+(W509*$W$6)+(X509*$X$6)+(Y509*$Y$6)+(Z509*$Z$6)+(AB509*$AA$6) -> 7.2030000000000003 | D509: BRD | E509: 1 | F509: 00.13 | G509: Emperor Dagran | I509: 55 | J509: P | K509: 43 | L509: 7 | M509: 16
A511: RANGED WEAPON | B511: AEP | C511: MAEP | D511: Loc | E511: P | F511: Info | G511: Source | H511: Set | I511: Lvl | J511: B | K511: Arm | L511: Agi | M511: Sta | N511: Str | O511: AP | P511: Cri | Q511: Hit | R511: Par | S511: Dod | T511: Def | U511: Ar | V511: Fi | W511: Fr | X511: Na | Y511: Sh | Z511: H/5 | AA511: PVP | AB511: PVE | AC511: Special
A512: Nerubian Slavemaker | B512: =(K512*$K$5)+(L512*$L$5)+(M512*$M$5)+(N512*$N$5)+(O512*$O$5)+(P512*100*$P$5)+(Q512*100*$Q$5)+(R512*100*$R$5)+(S512*100*$S$5)+(T512*$T$5)+(U512*$U$5)+(V512*$V$5)+(W512*$W$5)+(X512*$X$5)+(Y512*$Y$5)+(Z512*$Z$5)+(AA512*$AA$5) -> 22 | C512: =(K512*$K$6)+(L512*$L$6)+(M512*$M$6)+(N512*$N$6)+(O512*$O$6)+(P512*100*$P$6)+(Q512*100*$Q$6)+(R512*100*$R$6)+(S512*100*$S$6)+(T512*$T$6)+(U512*$U$6)+(V512*$V$6)+(W512*$W$6)+(X512*$X$6)+(Y512*$Y$6)+(Z512*$Z$6)+(AB512*$AA$6) -> 22 | D512: Naxx | E512: 6 | F512: 00.17 | G512: Kel'Thuzad | I512: 60 | J512: P | O512: 24 | P512: 00.01 | AC512: 128-238, 57.2
A513: Larvae of the Great Worm | B513: =(K513*$K$5)+(L513*$L$5)+(M513*$M$5)+(N513*$N$5)+(O513*$O$5)+(P513*100*$P$5)+(Q513*100*$Q$5)+(R513*100*$R$5)+(S513*100*$S$5)+(T513*$T$5)+(U513*$U$5)+(V513*$V$5)+(W513*$W$5)+(X513*$X$5)+(Y513*$Y$5)+(Z513*$Z$5)+(AA513*$AA$5) -> 19 | C513: =(K513*$K$6)+(L513*$L$6)+(M513*$M$6)+(N513*$N$6)+(O513*$O$6)+(P513*100*$P$6)+(Q513*100*$Q$6)+(R513*100*$R$6)+(S513*100*$S$6)+(T513*$T$6)+(U513*$U$6)+(V513*$V$6)+(W513*$W$6)+(X513*$X$6)+(Y513*$Y$6)+(Z513*$Z$6)+(AB513*$AA$6) -> 19 | D513: AQ40 | E513: 5 | F513: 00.17 | G513: Ouro | I513: 60 | J513: P | O513: 18 | P513: 00.01 | AC513: 103-192, 49.2
A514: Striker's Mark | B514: =(K514*$K$5)+(L514*$L$5)+(M514*$M$5)+(N514*$N$5)+(O514*$O$5)+(P514*100*$P$5)+(Q514*100*$Q$5)+(R514*100*$R$5)+(S514*100*$S$5)+(T514*$T$5)+(U514*$U$5)+(V514*$V$5)+(W514*$W$5)+(X514*$X$5)+(Y514*$Y$5)+(Z514*$Z$5)+(AA514*$AA$5) -> 18.5 | C514: =(K514*$K$6)+(L514*$L$6)+(M514*$M$6)+(N514*$N$6)+(O514*$O$6)+(P514*100*$P$6)+(Q514*100*$Q$6)+(R514*100*$R$6)+(S514*100*$S$6)+(T514*$T$6)+(U514*$U$6)+(V514*$V$6)+(W514*$W$6)+(X514*$X$6)+(Y514*$Y$6)+(Z514*$Z$6)+(AB514*$AA$6) -> 18.5 | D514: MC | E514: 1 | F514: 00.07 | G514: Magmadar | I514: 60 | J514: P | O514: 22 | Q514: 00.01 | AC514: 69-129, 39.6
A515: Soulstring | B515: =(K515*$K$5)+(L515*$L$5)+(M515*$M$5)+(N515*$N$5)+(O515*$O$5)+(P515*100*$P$5)+(Q515*100*$Q$5)+(R515*100*$R$5)+(S515*100*$S$5)+(T515*$T$5)+(U515*$U$5)+(V515*$V$5)+(W515*$W$5)+(X515*$X$5)+(Y515*$Y$5)+(Z515*$Z$5)+(AA515*$AA$5) -> 24 | C515: =(K515*$K$6)+(L515*$L$6)+(M515*$M$6)+(N515*$N$6)+(O515*$O$6)+(P515*100*$P$6)+(Q515*100*$Q$6)+(R515*100*$R$6)+(S515*100*$S$6)+(T515*$T$6)+(U515*$U$6)+(V515*$V$6)+(W515*$W$6)+(X515*$X$6)+(Y515*$Y$6)+(Z515*$Z$6)+(AB515*$AA$6) -> 18.06 | D515: Naxx | E515: 6 | F515: 00.17 | G515: The Four Horsemen | I515: 60 | J515: P | M515: 6 | O515: 16 | P515: 00.01 | AC515: 103-192, 50.9
A516: Huhuran's Stinger | B516: =(K516*$K$5)+(L516*$L$5)+(M516*$M$5)+(N516*$N$5)+(O516*$O$5)+(P516*100*$P$5)+(Q516*100*$Q$5)+(R516*100*$R$5)+(S516*100*$S$5)+(T516*$T$5)+(U516*$U$5)+(V516*$V$5)+(W516*$W$5)+(X516*$X$5)+(Y516*$Y$5)+(Z516*$Z$5)+(AA516*$AA$5) -> 18 | C516: =(K516*$K$6)+(L516*$L$6)+(M516*$M$6)+(N516*$N$6)+(O516*$O$6)+(P516*100*$P$6)+(Q516*100*$Q$6)+(R516*100*$R$6)+(S516*100*$S$6)+(T516*$T$6)+(U516*$U$6)+(V516*$V$6)+(W516*$W$6)+(X516*$X$6)+(Y516*$Y$6)+(Z516*$Z$6)+(AB516*$AA$6) -> 18 | D516: AQ40 | E516: 5 | F516: 00.17 | G516: Princess Huhuran | I516: 60 | J516: P | L516: 18 | AC516: 87-163, 46.3
A517: Crossbow of Imminent Doom | B517: =(K517*$K$5)+(L517*$L$5)+(M517*$M$5)+(N517*$N$5)+(O517*$O$5)+(P517*100*$P$5)+(Q517*100*$Q$5)+(R517*100*$R$5)+(S517*100*$S$5)+(T517*$T$5)+(U517*$U$5)+(V517*$V$5)+(W517*$W$5)+(X517*$X$5)+(Y517*$Y$5)+(Z517*$Z$5)+(AA517*$AA$5) -> 22 | C517: =(K517*$K$6)+(L517*$L$6)+(M517*$M$6)+(N517*$N$6)+(O517*$O$6)+(P517*100*$P$6)+(Q517*100*$Q$6)+(R517*100*$R$6)+(S517*100*$S$6)+(T517*$T$6)+(U517*$U$6)+(V517*$V$6)+(W517*$W$6)+(X517*$X$6)+(Y517*$Y$6)+(Z517*$Z$6)+(AB517*$AA$6) -> 17.05 | D517: AQ20 | E517: 5 | F517: 00.15 | G517: Ossirian | I517: 60 | J517: P | L517: 7 | M517: 5 | N517: 5 | Q517: 00.01 | AC517: 103-155, 41.6
A518: Gurubashi Dwarf Destroyer | B518: =(K518*$K$5)+(L518*$L$5)+(M518*$M$5)+(N518*$N$5)+(O518*$O$5)+(P518*100*$P$5)+(Q518*100*$Q$5)+(R518*100*$R$5)+(S518*100*$S$5)+(T518*$T$5)+(U518*$U$5)+(V518*$V$5)+(W518*$W$5)+(X518*$X$5)+(Y518*$Y$5)+(Z518*$Z$5)+(AA518*$AA$5) -> 15 | C518: =(K518*$K$6)+(L518*$L$6)+(M518*$M$6)+(N518*$N$6)+(O518*$O$6)+(P518*100*$P$6)+(Q518*100*$Q$6)+(R518*100*$R$6)+(S518*100*$S$6)+(T518*$T$6)+(U518*$U$6)+(V518*$V$6)+(W518*$W$6)+(X518*$X$6)+(Y518*$Y$6)+(Z518*$Z$6)+(AB518*$AA$6) -> 15 | D518: ZG | E518: 4 | F518: 00.14 | G518: Hakkar | I518: 60 | J518: P | O518: 30 | AC518: 76-142, 38.9
A519: Toxin Injector | B519: =(K519*$K$5)+(L519*$L$5)+(M519*$M$5)+(N519*$N$5)+(O519*$O$5)+(P519*100*$P$5)+(Q519*100*$Q$5)+(R519*100*$R$5)+(S519*100*$S$5)+(T519*$T$5)+(U519*$U$5)+(V519*$V$5)+(W519*$W$5)+(X519*$X$5)+(Y519*$Y$5)+(Z519*$Z$5)+(AA519*$AA$5) -> 24 | C519: =(K519*$K$6)+(L519*$L$6)+(M519*$M$6)+(N519*$N$6)+(O519*$O$6)+(P519*100*$P$6)+(Q519*100*$Q$6)+(R519*100*$R$6)+(S519*100*$S$6)+(T519*$T$6)+(U519*$U$6)+(V519*$V$6)+(W519*$W$6)+(X519*$X$6)+(Y519*$Y$6)+(Z519*$Z$6)+(AB519*$AA$6) -> 14.1 | D519: Naxx | E519: 6 | F519: 00.2 | G519: Grobbulus | I519: 60 | J519: P | M519: 10 | O519: 28 | AC519: 68-128, 49.0
A520: Dragonbreath Hand Cannon | B520: =(K520*$K$5)+(L520*$L$5)+(M520*$M$5)+(N520*$N$5)+(O520*$O$5)+(P520*100*$P$5)+(Q520*100*$Q$5)+(R520*100*$R$5)+(S520*100*$S$5)+(T520*$T$5)+(U520*$U$5)+(V520*$V$5)+(W520*$W$5)+(X520*$X$5)+(Y520*$Y$5)+(Z520*$Z$5)+(AA520*$AA$5) -> 21 | C520: =(K520*$K$6)+(L520*$L$6)+(M520*$M$6)+(N520*$N$6)+(O520*$O$6)+(P520*100*$P$6)+(Q520*100*$Q$6)+(R520*100*$R$6)+(S520*100*$S$6)+(T520*$T$6)+(U520*$U$6)+(V520*$V$6)+(W520*$W$6)+(X520*$X$6)+(Y520*$Y$6)+(Z520*$Z$6)+(AB520*$AA$6) -> 14.07 | D520: BWL | E520: 3 | F520: 00.07 | G520: Ebonroc | I520: 60 | J520: P | L520: 14 | M520: 7 | AC520: 86-160, 43.9
A521: Precisely Calibrated Boomstick | B521: =(K521*$K$5)+(L521*$L$5)+(M521*$M$5)+(N521*$N$5)+(O521*$O$5)+(P521*100*$P$5)+(Q521*100*$Q$5)+(R521*100*$R$5)+(S521*100*$S$5)+(T521*$T$5)+(U521*$U$5)+(V521*$V$5)+(W521*$W$5)+(X521*$X$5)+(Y521*$Y$5)+(Z521*$Z$5)+(AA521*$AA$5) -> 14 | C521: =(K521*$K$6)+(L521*$L$6)+(M521*$M$6)+(N521*$N$6)+(O521*$O$6)+(P521*100*$P$6)+(Q521*100*$Q$6)+(R521*100*$R$6)+(S521*100*$S$6)+(T521*$T$6)+(U521*$U$6)+(V521*$V$6)+(W521*$W$6)+(X521*$X$6)+(Y521*$Y$6)+(Z521*$Z$6)+(AB521*$AA$6) -> 14 | D521: R | E521: 1 | F521: 45-50 | G521: Random World Drop | I521: 43 | J521: E | L521: 14 | AC521: 38-45, 27.7
A522: Polished Ironwood Crossbow | B522: =(K522*$K$5)+(L522*$L$5)+(M522*$M$5)+(N522*$N$5)+(O522*$O$5)+(P522*100*$P$5)+(Q522*100*$Q$5)+(R522*100*$R$5)+(S522*100*$S$5)+(T522*$T$5)+(U522*$U$5)+(V522*$V$5)+(W522*$W$5)+(X522*$X$5)+(Y522*$Y$5)+(Z522*$Z$5)+(AA522*$AA$5) -> 17.7 | C522: =(K522*$K$6)+(L522*$L$6)+(M522*$M$6)+(N522*$N$6)+(O522*$O$6)+(P522*100*$P$6)+(Q522*100*$Q$6)+(R522*100*$R$6)+(S522*100*$S$6)+(T522*$T$6)+(U522*$U$6)+(V522*$V$6)+(W522*$W$6)+(X522*$X$6)+(Y522*$Y$6)+(Z522*$Z$6)+(AB522*$AA$6) -> 12.12 | D522: 4D | E522: 4 | F522: 00.14 | G522: Emeriss | I522: 60 | J522: P | M522: 5 | O522: 24 | X522: 7 | AC522: 101-153, 41.0
A523: Heartstriker | B523: =(K523*$K$5)+(L523*$L$5)+(M523*$M$5)+(N523*$N$5)+(O523*$O$5)+(P523*100*$P$5)+(Q523*100*$Q$5)+(R523*100*$R$5)+(S523*100*$S$5)+(T523*$T$5)+(U523*$U$5)+(V523*$V$5)+(W523*$W$5)+(X523*$X$5)+(Y523*$Y$5)+(Z523*$Z$5)+(AA523*$AA$5) -> 21 | C523: =(K523*$K$6)+(L523*$L$6)+(M523*$M$6)+(N523*$N$6)+(O523*$O$6)+(P523*100*$P$6)+(Q523*100*$Q$6)+(R523*100*$R$6)+(S523*100*$S$6)+(T523*$T$6)+(U523*$U$6)+(V523*$V$6)+(W523*$W$6)+(X523*$X$6)+(Y523*$Y$6)+(Z523*$Z$6)+(AB523*$AA$6) -> 12.09 | D523: BWL | E523: 3 | F523: 00.17 | G523: Broodlord Lashlayer | I523: 60 | J523: P | M523: 9 | O523: 24 | AC523: 80-149, 44.0
A524: Fahrad's Reloading Repeater | B524: =(K524*$K$5)+(L524*$L$5)+(M524*$M$5)+(N524*$N$5)+(O524*$O$5)+(P524*100*$P$5)+(Q524*100*$Q$5)+(R524*100*$R$5)+(S524*100*$S$5)+(T524*$T$5)+(U524*$U$5)+(V524*$V$5)+(W524*$W$5)+(X524*$X$5)+(Y524*$Y$5)+(Z524*$Z$5)+(AA524*$AA$5) -> 11.5 | C524: =(K524*$K$6)+(L524*$L$6)+(M524*$M$6)+(N524*$N$6)+(O524*$O$6)+(P524*100*$P$6)+(Q524*100*$Q$6)+(R524*100*$R$6)+(S524*100*$S$6)+(T524*$T$6)+(U524*$U$6)+(V524*$V$6)+(W524*$W$6)+(X524*$X$6)+(Y524*$Y$6)+(Z524*$Z$6)+(AB524*$AA$6) -> 11.5 | D524: Sil | E524: 5 | F524: Q | G524: Quest Reward | I524: 60 | J524: P | L524: 4 | Q524: 00.01 | AC524: 85-128, 33.3
A525: Mandokir's Sting | B525: =(K525*$K$5)+(L525*$L$5)+(M525*$M$5)+(N525*$N$5)+(O525*$O$5)+(P525*100*$P$5)+(Q525*100*$Q$5)+(R525*100*$R$5)+(S525*100*$S$5)+(T525*$T$5)+(U525*$U$5)+(V525*$V$5)+(W525*$W$5)+(X525*$X$5)+(Y525*$Y$5)+(Z525*$Z$5)+(AA525*$AA$5) -> 19 | C525: =(K525*$K$6)+(L525*$L$6)+(M525*$M$6)+(N525*$N$6)+(O525*$O$6)+(P525*100*$P$6)+(Q525*100*$Q$6)+(R525*100*$R$6)+(S525*100*$S$6)+(T525*$T$6)+(U525*$U$6)+(V525*$V$6)+(W525*$W$6)+(X525*$X$6)+(Y525*$Y$6)+(Z525*$Z$6)+(AB525*$AA$6) -> 11.08 | D525: ZG | E525: 4 | F525: 00.06 | G525: Bloodlord Mandokir | I525: 60 | J525: P | L525: 11 | M525: 8 | AC525: 68-127, 38.5
A526: Bow of Taut Sinew | B526: =(K526*$K$5)+(L526*$L$5)+(M526*$M$5)+(N526*$N$5)+(O526*$O$5)+(P526*100*$P$5)+(Q526*100*$Q$5)+(R526*100*$R$5)+(S526*100*$S$5)+(T526*$T$5)+(U526*$U$5)+(V526*$V$5)+(W526*$W$5)+(X526*$X$5)+(Y526*$Y$5)+(Z526*$Z$5)+(AA526*$AA$5) -> 11.8 | C526: =(K526*$K$6)+(L526*$L$6)+(M526*$M$6)+(N526*$N$6)+(O526*$O$6)+(P526*100*$P$6)+(Q526*100*$Q$6)+(R526*100*$R$6)+(S526*100*$S$6)+(T526*$T$6)+(U526*$U$6)+(V526*$V$6)+(W526*$W$6)+(X526*$X$6)+(Y526*$Y$6)+(Z526*$Z$6)+(AB526*$AA$6) -> 11.08 | D526: AQ20 | E526: 5 | F526: 00.13 | G526: Ayamiss the Hunter | I526: 60 | J526: P | O526: 22 | X526: 8 | AC526: 59-111, 38.6
A527: Bloodseeker | B527: =(K527*$K$5)+(L527*$L$5)+(M527*$M$5)+(N527*$N$5)+(O527*$O$5)+(P527*100*$P$5)+(Q527*100*$Q$5)+(R527*100*$R$5)+(S527*100*$S$5)+(T527*$T$5)+(U527*$U$5)+(V527*$V$5)+(W527*$W$5)+(X527*$X$5)+(Y527*$Y$5)+(Z527*$Z$5)+(AA527*$AA$5) -> 11 | C527: =(K527*$K$6)+(L527*$L$6)+(M527*$M$6)+(N527*$N$6)+(O527*$O$6)+(P527*100*$P$6)+(Q527*100*$Q$6)+(R527*100*$R$6)+(S527*100*$S$6)+(T527*$T$6)+(U527*$U$6)+(V527*$V$6)+(W527*$W$6)+(X527*$X$6)+(Y527*$Y$6)+(Z527*$Z$6)+(AB527*$AA$6) -> 11 | D527: AV | E527: 3 | F527: Q | G527: AV Quest Reward | I527: 51 | J527: P | L527: 7 | N527: 8 | AC527: 85-128, 32.3
A528: Ancient Bone Bow | B528: =(K528*$K$5)+(L528*$L$5)+(M528*$M$5)+(N528*$N$5)+(O528*$O$5)+(P528*100*$P$5)+(Q528*100*$Q$5)+(R528*100*$R$5)+(S528*100*$S$5)+(T528*$T$5)+(U528*$U$5)+(V528*$V$5)+(W528*$W$5)+(X528*$X$5)+(Y528*$Y$5)+(Z528*$Z$5)+(AA528*$AA$5) -> 11 | C528: =(K528*$K$6)+(L528*$L$6)+(M528*$M$6)+(N528*$N$6)+(O528*$O$6)+(P528*100*$P$6)+(Q528*100*$Q$6)+(R528*100*$R$6)+(S528*100*$S$6)+(T528*$T$6)+(U528*$U$6)+(V528*$V$6)+(W528*$W$6)+(X528*$X$6)+(Y528*$Y$6)+(Z528*$Z$6)+(AB528*$AA$6) -> 11 | D528: Sch | E528: 1 | F528: 60 | G528: Scholo Boss Drop | I528: 56 | J528: P | L528: 11 | AC528: 61-114, 31.2
A529: Riphook | B529: =(K529*$K$5)+(L529*$L$5)+(M529*$M$5)+(N529*$N$5)+(O529*$O$5)+(P529*100*$P$5)+(Q529*100*$Q$5)+(R529*100*$R$5)+(S529*100*$S$5)+(T529*$T$5)+(U529*$U$5)+(V529*$V$5)+(W529*$W$5)+(X529*$X$5)+(Y529*$Y$5)+(Z529*$Z$5)+(AA529*$AA$5) -> 11 | C529: =(K529*$K$6)+(L529*$L$6)+(M529*$M$6)+(N529*$N$6)+(O529*$O$6)+(P529*100*$P$6)+(Q529*100*$Q$6)+(R529*100*$R$6)+(S529*100*$S$6)+(T529*$T$6)+(U529*$U$6)+(V529*$V$6)+(W529*$W$6)+(X529*$X$6)+(Y529*$Y$6)+(Z529*$Z$6)+(AB529*$AA$6) -> 11 | D529: LBRS | E529: 1 | F529: 00.06 | G529: Shdw Hntr Vosh'gajin | I529: 54 | J529: P | O529: 22 | AC529: 46-87, 30.2
A530: Blackcrow | B530: =(K530*$K$5)+(L530*$L$5)+(M530*$M$5)+(N530*$N$5)+(O530*$O$5)+(P530*100*$P$5)+(Q530*100*$Q$5)+(R530*100*$R$5)+(S530*100*$S$5)+(T530*$T$5)+(U530*$U$5)+(V530*$V$5)+(W530*$W$5)+(X530*$X$5)+(Y530*$Y$5)+(Z530*$Z$5)+(AA530*$AA$5) -> 10.5 | C530: =(K530*$K$6)+(L530*$L$6)+(M530*$M$6)+(N530*$N$6)+(O530*$O$6)+(P530*100*$P$6)+(Q530*100*$Q$6)+(R530*100*$R$6)+(S530*100*$S$6)+(T530*$T$6)+(U530*$U$6)+(V530*$V$6)+(W530*$W$6)+(X530*$X$6)+(Y530*$Y$6)+(Z530*$Z$6)+(AB530*$AA$6) -> 10.5 | D530: LBRS | E530: 1 | F530: 00.08 | G530: Shdw Hntr Vosh'gajin | I530: 54 | J530: P | L530: 3 | Q530: 00.01 | AC530: 77-117, 30.3
A531: Satyr's Bow | B531: =(K531*$K$5)+(L531*$L$5)+(M531*$M$5)+(N531*$N$5)+(O531*$O$5)+(P531*100*$P$5)+(Q531*100*$Q$5)+(R531*100*$R$5)+(S531*100*$S$5)+(T531*$T$5)+(U531*$U$5)+(V531*$V$5)+(W531*$W$5)+(X531*$X$5)+(Y531*$Y$5)+(Z531*$Z$5)+(AA531*$AA$5) -> 10.5 | C531: =(K531*$K$6)+(L531*$L$6)+(M531*$M$6)+(N531*$N$6)+(O531*$O$6)+(P531*100*$P$6)+(Q531*100*$Q$6)+(R531*100*$R$6)+(S531*100*$S$6)+(T531*$T$6)+(U531*$U$6)+(V531*$V$6)+(W531*$W$6)+(X531*$X$6)+(Y531*$Y$6)+(Z531*$Z$6)+(AB531*$AA$6) -> 10.5 | D531: DM-E | E531: 2 | F531: 00.2 | G531: Zevrim Thornhoof | I531: 53 | J531: P | L531: 3 | Q531: 00.01 | AC531: 50-93, 29.8
A532: Blastershot Launcher | B532: =(K532*$K$5)+(L532*$L$5)+(M532*$M$5)+(N532*$N$5)+(O532*$O$5)+(P532*100*$P$5)+(Q532*100*$Q$5)+(R532*100*$R$5)+(S532*100*$S$5)+(T532*$T$5)+(U532*$U$5)+(V532*$V$5)+(W532*$W$5)+(X532*$X$5)+(Y532*$Y$5)+(Z532*$Z$5)+(AA532*$AA$5) -> 16 | C532: =(K532*$K$6)+(L532*$L$6)+(M532*$M$6)+(N532*$N$6)+(O532*$O$6)+(P532*100*$P$6)+(Q532*100*$Q$6)+(R532*100*$R$6)+(S532*100*$S$6)+(T532*$T$6)+(U532*$U$6)+(V532*$V$6)+(W532*$W$6)+(X532*$X$6)+(Y532*$Y$6)+(Z532*$Z$6)+(AB532*$AA$6) -> 10.06 | D532: MC | E532: 1 | F532: 00.07 | G532: Golemagg | I532: 60 | J532: P | M532: 6 | P532: 00.01 | AC532: 73-136, 40.2
A533: Hoodoo Hunting Bow | B533: =(K533*$K$5)+(L533*$L$5)+(M533*$M$5)+(N533*$N$5)+(O533*$O$5)+(P533*100*$P$5)+(Q533*100*$Q$5)+(R533*100*$R$5)+(S533*100*$S$5)+(T533*$T$5)+(U533*$U$5)+(V533*$V$5)+(W533*$W$5)+(X533*$X$5)+(Y533*$Y$5)+(Z533*$Z$5)+(AA533*$AA$5) -> 14 | C533: =(K533*$K$6)+(L533*$L$6)+(M533*$M$6)+(N533*$N$6)+(O533*$O$6)+(P533*100*$P$6)+(Q533*100*$Q$6)+(R533*100*$R$6)+(S533*100*$S$6)+(T533*$T$6)+(U533*$U$6)+(V533*$V$6)+(W533*$W$6)+(X533*$X$6)+(Y533*$Y$6)+(Z533*$Z$6)+(AB533*$AA$6) -> 10.04 | D533: ZG | E533: 4 | F533: 00.54 | G533: Wushoolay | I533: 60 | J533: P | L533: 10 | M533: 4 | AC533: 68-128, 35.0
A534: Crystal Slugthrower | B534: =(K534*$K$5)+(L534*$L$5)+(M534*$M$5)+(N534*$N$5)+(O534*$O$5)+(P534*100*$P$5)+(Q534*100*$Q$5)+(R534*100*$R$5)+(S534*100*$S$5)+(T534*$T$5)+(U534*$U$5)+(V534*$V$5)+(W534*$W$5)+(X534*$X$5)+(Y534*$Y$5)+(Z534*$Z$5)+(AA534*$AA$5) -> 14 | C534: =(K534*$K$6)+(L534*$L$6)+(M534*$M$6)+(N534*$N$6)+(O534*$O$6)+(P534*100*$P$6)+(Q534*100*$Q$6)+(R534*100*$R$6)+(S534*100*$S$6)+(T534*$T$6)+(U534*$U$6)+(V534*$V$6)+(W534*$W$6)+(X534*$X$6)+(Y534*$Y$6)+(Z534*$Z$6)+(AB534*$AA$6) -> 10.04 | D534: Sil | E534: 4 | F534: Q | G534: Abyssal Q Reward | I534: 60 | J534: E | M534: 4 | O534: 20 | AC534: 65-122, 33.4
A535: Malgen's Long Bow | B535: =(K535*$K$5)+(L535*$L$5)+(M535*$M$5)+(N535*$N$5)+(O535*$O$5)+(P535*100*$P$5)+(Q535*100*$Q$5)+(R535*100*$R$5)+(S535*100*$S$5)+(T535*$T$5)+(U535*$U$5)+(V535*$V$5)+(W535*$W$5)+(X535*$X$5)+(Y535*$Y$5)+(Z535*$Z$5)+(AA535*$AA$5) -> 14 | C535: =(K535*$K$6)+(L535*$L$6)+(M535*$M$6)+(N535*$N$6)+(O535*$O$6)+(P535*100*$P$6)+(Q535*100*$Q$6)+(R535*100*$R$6)+(S535*100*$S$6)+(T535*$T$6)+(U535*$U$6)+(V535*$V$6)+(W535*$W$6)+(X535*$X$6)+(Y535*$Y$6)+(Z535*$Z$6)+(AB535*$AA$6) -> 10.04 | D535: BRD | E535: 5 | F535: R | G535: Random BRD Drop | I535: 56 | J535: P | M535: 4 | O535: 20 | AC535: 63-118, 31.2
A536: Eaglehorn Long Bow | B536: =(K536*$K$5)+(L536*$L$5)+(M536*$M$5)+(N536*$N$5)+(O536*$O$5)+(P536*100*$P$5)+(Q536*100*$Q$5)+(R536*100*$R$5)+(S536*100*$S$5)+(T536*$T$5)+(U536*$U$5)+(V536*$V$5)+(W536*$W$5)+(X536*$X$5)+(Y536*$Y$5)+(Z536*$Z$5)+(AA536*$AA$5) -> 14 | C536: =(K536*$K$6)+(L536*$L$6)+(M536*$M$6)+(N536*$N$6)+(O536*$O$6)+(P536*100*$P$6)+(Q536*100*$Q$6)+(R536*100*$R$6)+(S536*100*$S$6)+(T536*$T$6)+(U536*$U$6)+(V536*$V$6)+(W536*$W$6)+(X536*$X$6)+(Y536*$Y$6)+(Z536*$Z$6)+(AB536*$AA$6) -> 10.04 | D536: R | E536: 1 | F536: 58-60 | G536: Random World Drop | I536: 58 | J536: E | L536: 10 | M536: 4 | AC536: 40-76, 32.2
A537: The Purifier | B537: =(K537*$K$5)+(L537*$L$5)+(M537*$M$5)+(N537*$N$5)+(O537*$O$5)+(P537*100*$P$5)+(Q537*100*$Q$5)+(R537*100*$R$5)+(S537*100*$S$5)+(T537*$T$5)+(U537*$U$5)+(V537*$V$5)+(W537*$W$5)+(X537*$X$5)+(Y537*$Y$5)+(Z537*$Z$5)+(AA537*$AA$5) -> 10 | C537: =(K537*$K$6)+(L537*$L$6)+(M537*$M$6)+(N537*$N$6)+(O537*$O$6)+(P537*100*$P$6)+(Q537*100*$Q$6)+(R537*100*$R$6)+(S537*100*$S$6)+(T537*$T$6)+(U537*$U$6)+(V537*$V$6)+(W537*$W$6)+(X537*$X$6)+(Y537*$Y$6)+(Z537*$Z$6)+(AB537*$AA$6) -> 10 | D537: EPL | E537: 6 | F537: Exa | G537: Quest Reward | I537: 55 | J537: P | P537: 00.01 | AC537: 71-132, 33.8
A538: Guttbuster | B538: =(K538*$K$5)+(L538*$L$5)+(M538*$M$5)+(N538*$N$5)+(O538*$O$5)+(P538*100*$P$5)+(Q538*100*$Q$5)+(R538*100*$R$5)+(S538*100*$S$5)+(T538*$T$5)+(U538*$U$5)+(V538*$V$5)+(W538*$W$5)+(X538*$X$5)+(Y538*$Y$5)+(Z538*$Z$5)+(AA538*$AA$5) -> 9.5 | C538: =(K538*$K$6)+(L538*$L$6)+(M538*$M$6)+(N538*$N$6)+(O538*$O$6)+(P538*100*$P$6)+(Q538*100*$Q$6)+(R538*100*$R$6)+(S538*100*$S$6)+(T538*$T$6)+(U538*$U$6)+(V538*$V$6)+(W538*$W$6)+(X538*$X$6)+(Y538*$Y$6)+(Z538*$Z$6)+(AB538*$AA$6) -> 9.5 | D538: R | E538: 1 | F538: 47-60 | G538: Random World Drop | I538: 45 | J538: E | L538: 8 | N538: 3 | AC538: 49-92, 26.1
A539: Heartseeking Crossbow | B539: =(K539*$K$5)+(L539*$L$5)+(M539*$M$5)+(N539*$N$5)+(O539*$O$5)+(P539*100*$P$5)+(Q539*100*$Q$5)+(R539*100*$R$5)+(S539*100*$S$5)+(T539*$T$5)+(U539*$U$5)+(V539*$V$5)+(W539*$W$5)+(X539*$X$5)+(Y539*$Y$5)+(Z539*$Z$5)+(AA539*$AA$5) -> 13 | C539: =(K539*$K$6)+(L539*$L$6)+(M539*$M$6)+(N539*$N$6)+(O539*$O$6)+(P539*100*$P$6)+(Q539*100*$Q$6)+(R539*100*$R$6)+(S539*100*$S$6)+(T539*$T$6)+(U539*$U$6)+(V539*$V$6)+(W539*$W$6)+(X539*$X$6)+(Y539*$Y$6)+(Z539*$Z$6)+(AB539*$AA$6) -> 9.04 | D539: R | E539: 1 | F539: 53-58 | G539: Random World Drop | I539: 51 | J539: E | L539: 9 | M539: 4 | AC539: 71-108, 29.7
A540: Archstrike Bow of the Tiger | B540: =(K540*$K$5)+(L540*$L$5)+(M540*$M$5)+(N540*$N$5)+(O540*$O$5)+(P540*100*$P$5)+(Q540*100*$Q$5)+(R540*100*$R$5)+(S540*100*$S$5)+(T540*$T$5)+(U540*$U$5)+(V540*$V$5)+(W540*$W$5)+(X540*$X$5)+(Y540*$Y$5)+(Z540*$Z$5)+(AA540*$AA$5) -> 9 | C540: =(K540*$K$6)+(L540*$L$6)+(M540*$M$6)+(N540*$N$6)+(O540*$O$6)+(P540*100*$P$6)+(Q540*100*$Q$6)+(R540*100*$R$6)+(S540*100*$S$6)+(T540*$T$6)+(U540*$U$6)+(V540*$V$6)+(W540*$W$6)+(X540*$X$6)+(Y540*$Y$6)+(Z540*$Z$6)+(AB540*$AA$6) -> 9 | D540: R | E540: 1 | F540: 55-63 | G540: Random World Drop | I540: 60 | J540: E | L540: 6 | N540: 6 | AC540: 48-91, 30.2
A541: Gryphonwing Long Bow | B541: =(K541*$K$5)+(L541*$L$5)+(M541*$M$5)+(N541*$N$5)+(O541*$O$5)+(P541*100*$P$5)+(Q541*100*$Q$5)+(R541*100*$R$5)+(S541*100*$S$5)+(T541*$T$5)+(U541*$U$5)+(V541*$V$5)+(W541*$W$5)+(X541*$X$5)+(Y541*$Y$5)+(Z541*$Z$5)+(AA541*$AA$5) -> 12 | C541: =(K541*$K$6)+(L541*$L$6)+(M541*$M$6)+(N541*$N$6)+(O541*$O$6)+(P541*100*$P$6)+(Q541*100*$Q$6)+(R541*100*$R$6)+(S541*100*$S$6)+(T541*$T$6)+(U541*$U$6)+(V541*$V$6)+(W541*$W$6)+(X541*$X$6)+(Y541*$Y$6)+(Z541*$Z$6)+(AB541*$AA$6) -> 8.04 | D541: R | E541: 1 | F541: 52-60 | G541: Random World Drop | I541: 50 | J541: E | L541: 8 | M541: 4 | AC541: 53-100, 28.3
A542: Siege Bow of the Tiger | B542: =(K542*$K$5)+(L542*$L$5)+(M542*$M$5)+(N542*$N$5)+(O542*$O$5)+(P542*100*$P$5)+(Q542*100*$Q$5)+(R542*100*$R$5)+(S542*100*$S$5)+(T542*$T$5)+(U542*$U$5)+(V542*$V$5)+(W542*$W$5)+(X542*$X$5)+(Y542*$Y$5)+(Z542*$Z$5)+(AA542*$AA$5) -> 7.5 | C542: =(K542*$K$6)+(L542*$L$6)+(M542*$M$6)+(N542*$N$6)+(O542*$O$6)+(P542*100*$P$6)+(Q542*100*$Q$6)+(R542*100*$R$6)+(S542*100*$S$6)+(T542*$T$6)+(U542*$U$6)+(V542*$V$6)+(W542*$W$6)+(X542*$X$6)+(Y542*$Y$6)+(Z542*$Z$6)+(AB542*$AA$6) -> 7.5 | D542: R | E542: 1 | F542: 50-54 | G542: Random World Drop | I542: 48 | J542: E | L542: 5 | N542: 5 | AC542: 48-90, 24.6
A543: Burnside Rifle of the Tiger | B543: =(K543*$K$5)+(L543*$L$5)+(M543*$M$5)+(N543*$N$5)+(O543*$O$5)+(P543*100*$P$5)+(Q543*100*$Q$5)+(R543*100*$R$5)+(S543*100*$S$5)+(T543*$T$5)+(U543*$U$5)+(V543*$V$5)+(W543*$W$5)+(X543*$X$5)+(Y543*$Y$5)+(Z543*$Z$5)+(AA543*$AA$5) -> 7.5 | C543: =(K543*$K$6)+(L543*$L$6)+(M543*$M$6)+(N543*$N$6)+(O543*$O$6)+(P543*100*$P$6)+(Q543*100*$Q$6)+(R543*100*$R$6)+(S543*100*$S$6)+(T543*$T$6)+(U543*$U$6)+(V543*$V$6)+(W543*$W$6)+(X543*$X$6)+(Y543*$Y$6)+(Z543*$Z$6)+(AB543*$AA$6) -> 7.5 | D543: R | E543: 1 | F543: 53-57 | G543: Random World Drop | I543: 51 | J543: E | L543: 5 | N543: 5 | AC543: 45-85, 26.0
A544: Harpy Needler of the Tiger | B544: =(K544*$K$5)+(L544*$L$5)+(M544*$M$5)+(N544*$N$5)+(O544*$O$5)+(P544*100*$P$5)+(Q544*100*$Q$5)+(R544*100*$R$5)+(S544*100*$S$5)+(T544*$T$5)+(U544*$U$5)+(V544*$V$5)+(W544*$W$5)+(X544*$X$5)+(Y544*$Y$5)+(Z544*$Z$5)+(AA544*$AA$5) -> 7.5 | C544: =(K544*$K$6)+(L544*$L$6)+(M544*$M$6)+(N544*$N$6)+(O544*$O$6)+(P544*100*$P$6)+(Q544*100*$Q$6)+(R544*100*$R$6)+(S544*100*$S$6)+(T544*$T$6)+(U544*$U$6)+(V544*$V$6)+(W544*$W$6)+(X544*$X$6)+(Y544*$Y$6)+(Z544*$Z$6)+(AB544*$AA$6) -> 7.5 | D544: R | E544: 1 | F544: 48-52 | G544: Random World Drop | I544: 46 | J544: E | L544: 5 | N544: 5 | AC544: 44-84, 23.7
A545: Sharpshooter Harq. of the Tiger | B545: =(K545*$K$5)+(L545*$L$5)+(M545*$M$5)+(N545*$N$5)+(O545*$O$5)+(P545*100*$P$5)+(Q545*100*$Q$5)+(R545*100*$R$5)+(S545*100*$S$5)+(T545*$T$5)+(U545*$U$5)+(V545*$V$5)+(W545*$W$5)+(X545*$X$5)+(Y545*$Y$5)+(Z545*$Z$5)+(AA545*$AA$5) -> 7.5 | C545: =(K545*$K$6)+(L545*$L$6)+(M545*$M$6)+(N545*$N$6)+(O545*$O$6)+(P545*100*$P$6)+(Q545*100*$Q$6)+(R545*100*$R$6)+(S545*100*$S$6)+(T545*$T$6)+(U545*$U$6)+(V545*$V$6)+(W545*$W$6)+(X545*$X$6)+(Y545*$Y$6)+(Z545*$Z$6)+(AB545*$AA$6) -> 7.5 | D545: R | E545: 1 | F545: 57-61 | G545: Random World Drop | I545: 55 | J545: E | L545: 5 | N545: 5 | AC545: 43-80, 28.0
A546: Quillfire Bow of the Tiger | B546: =(K546*$K$5)+(L546*$L$5)+(M546*$M$5)+(N546*$N$5)+(O546*$O$5)+(P546*100*$P$5)+(Q546*100*$Q$5)+(R546*100*$R$5)+(S546*100*$S$5)+(T546*$T$5)+(U546*$U$5)+(V546*$V$5)+(W546*$W$5)+(X546*$X$5)+(Y546*$Y$5)+(Z546*$Z$5)+(AA546*$AA$5) -> 7.5 | C546: =(K546*$K$6)+(L546*$L$6)+(M546*$M$6)+(N546*$N$6)+(O546*$O$6)+(P546*100*$P$6)+(Q546*100*$Q$6)+(R546*100*$R$6)+(S546*100*$S$6)+(T546*$T$6)+(U546*$U$6)+(V546*$V$6)+(W546*$W$6)+(X546*$X$6)+(Y546*$Y$6)+(Z546*$Z$6)+(AB546*$AA$6) -> 7.5 | D546: R | E546: 1 | F546: 52-56 | G546: Random World Drop | I546: 50 | J546: E | L546: 5 | N546: 5 | AC546: 41-77, 25.7
A547: Percussion Shotgun of the Tiger | B547: =(K547*$K$5)+(L547*$L$5)+(M547*$M$5)+(N547*$N$5)+(O547*$O$5)+(P547*100*$P$5)+(Q547*100*$Q$5)+(R547*100*$R$5)+(S547*100*$S$5)+(T547*$T$5)+(U547*$U$5)+(V547*$V$5)+(W547*$W$5)+(X547*$X$5)+(Y547*$Y$5)+(Z547*$Z$5)+(AA547*$AA$5) -> 7.5 | C547: =(K547*$K$6)+(L547*$L$6)+(M547*$M$6)+(N547*$N$6)+(O547*$O$6)+(P547*100*$P$6)+(Q547*100*$Q$6)+(R547*100*$R$6)+(S547*100*$S$6)+(T547*$T$6)+(U547*$U$6)+(V547*$V$6)+(W547*$W$6)+(X547*$X$6)+(Y547*$Y$6)+(Z547*$Z$6)+(AB547*$AA$6) -> 7.5 | D547: R | E547: 1 | F547: 47-51 | G547: Random World Drop | I547: 45 | J547: E | L547: 5 | N547: 5 | AC547: 37-70, 23.3
A548: The Silencer | B548: =(K548*$K$5)+(L548*$L$5)+(M548*$M$5)+(N548*$N$5)+(O548*$O$5)+(P548*100*$P$5)+(Q548*100*$Q$5)+(R548*100*$R$5)+(S548*100*$S$5)+(T548*$T$5)+(U548*$U$5)+(V548*$V$5)+(W548*$W$5)+(X548*$X$5)+(Y548*$Y$5)+(Z548*$Z$5)+(AA548*$AA$5) -> 7 | C548: =(K548*$K$6)+(L548*$L$6)+(M548*$M$6)+(N548*$N$6)+(O548*$O$6)+(P548*100*$P$6)+(Q548*100*$Q$6)+(R548*100*$R$6)+(S548*100*$S$6)+(T548*$T$6)+(U548*$U$6)+(V548*$V$6)+(W548*$W$6)+(X548*$X$6)+(Y548*$Y$6)+(Z548*$Z$6)+(AB548*$AA$6) -> 7 | D548: R | E548: 1 | F548: 40-44 | G548: Random World Drop | I548: 37 | J548: E | O548: 14 | AC548: 43-82, 22.3
A549: Swiftwind | B549: =(K549*$K$5)+(L549*$L$5)+(M549*$M$5)+(N549*$N$5)+(O549*$O$5)+(P549*100*$P$5)+(Q549*100*$Q$5)+(R549*100*$R$5)+(S549*100*$S$5)+(T549*$T$5)+(U549*$U$5)+(V549*$V$5)+(W549*$W$5)+(X549*$X$5)+(Y549*$Y$5)+(Z549*$Z$5)+(AA549*$AA$5) -> 7 | C549: =(K549*$K$6)+(L549*$L$6)+(M549*$M$6)+(N549*$N$6)+(O549*$O$6)+(P549*100*$P$6)+(Q549*100*$Q$6)+(R549*100*$R$6)+(S549*100*$S$6)+(T549*$T$6)+(U549*$U$6)+(V549*$V$6)+(W549*$W$6)+(X549*$X$6)+(Y549*$Y$6)+(Z549*$Z$6)+(AB549*$AA$6) -> 7 | D549: R | E549: 1 | F549: 37-42 | G549: Random World Drop | I549: 35 | J549: E | L549: 7 | AC549: 34-51, 21.2
A550: Ogre Toothpick Shooter | B550: =(K550*$K$5)+(L550*$L$5)+(M550*$M$5)+(N550*$N$5)+(O550*$O$5)+(P550*100*$P$5)+(Q550*100*$Q$5)+(R550*100*$R$5)+(S550*100*$S$5)+(T550*$T$5)+(U550*$U$5)+(V550*$V$5)+(W550*$W$5)+(X550*$X$5)+(Y550*$Y$5)+(Z550*$Z$5)+(AA550*$AA$5) -> 11 | C550: =(K550*$K$6)+(L550*$L$6)+(M550*$M$6)+(N550*$N$6)+(O550*$O$6)+(P550*100*$P$6)+(Q550*100*$Q$6)+(R550*100*$R$6)+(S550*100*$S$6)+(T550*$T$6)+(U550*$U$6)+(V550*$V$6)+(W550*$W$6)+(X550*$X$6)+(Y550*$Y$6)+(Z550*$Z$6)+(AB550*$AA$6) -> 6.05 | D550: DM-N | E550: 2 | F550: 00.18 | G550: Gordok Tribute | I550: 55 | J550: P | L550: 6 | M550: 5 | AC550: 61-62, 28.0
A551: Deep Strike Bow | B551: =(K551*$K$5)+(L551*$L$5)+(M551*$M$5)+(N551*$N$5)+(O551*$O$5)+(P551*100*$P$5)+(Q551*100*$Q$5)+(R551*100*$R$5)+(S551*100*$S$5)+(T551*$T$5)+(U551*$U$5)+(V551*$V$5)+(W551*$W$5)+(X551*$X$5)+(Y551*$Y$5)+(Z551*$Z$5)+(AA551*$AA$5) -> 10 | C551: =(K551*$K$6)+(L551*$L$6)+(M551*$M$6)+(N551*$N$6)+(O551*$O$6)+(P551*100*$P$6)+(Q551*100*$Q$6)+(R551*100*$R$6)+(S551*100*$S$6)+(T551*$T$6)+(U551*$U$6)+(V551*$V$6)+(W551*$W$6)+(X551*$X$6)+(Y551*$Y$6)+(Z551*$Z$6)+(AB551*$AA$6) -> 6.04 | D551: Sil | E551: 4 | F551: 00.02 | G551: Earthen Templar | I551: 55 | J551: P | L551: 6 | M551: 4 | AC551: 58-108, 30.7
A552: Monolithic Bow | B552: =(K552*$K$5)+(L552*$L$5)+(M552*$M$5)+(N552*$N$5)+(O552*$O$5)+(P552*100*$P$5)+(Q552*100*$Q$5)+(R552*100*$R$5)+(S552*100*$S$5)+(T552*$T$5)+(U552*$U$5)+(V552*$V$5)+(W552*$W$5)+(X552*$X$5)+(Y552*$Y$5)+(Z552*$Z$5)+(AA552*$AA$5) -> 6 | C552: =(K552*$K$6)+(L552*$L$6)+(M552*$M$6)+(N552*$N$6)+(O552*$O$6)+(P552*100*$P$6)+(Q552*100*$Q$6)+(R552*100*$R$6)+(S552*100*$S$6)+(T552*$T$6)+(U552*$U$6)+(V552*$V$6)+(W552*$W$6)+(X552*$X$6)+(Y552*$Y$6)+(Z552*$Z$6)+(AB552*$AA$6) -> 6 | D552: Uld | E552: 1 | F552: R | G552: Random Uld Drop | I552: 36 | J552: E | L552: 3 | N552: 6 | AC552: 41-77, 21.9
A553: Gorewood Bow | B553: =(K553*$K$5)+(L553*$L$5)+(M553*$M$5)+(N553*$N$5)+(O553*$O$5)+(P553*100*$P$5)+(Q553*100*$Q$5)+(R553*100*$R$5)+(S553*100*$S$5)+(T553*$T$5)+(U553*$U$5)+(V553*$V$5)+(W553*$W$5)+(X553*$X$5)+(Y553*$Y$5)+(Z553*$Z$5)+(AA553*$AA$5) -> 13 | C553: =(K553*$K$6)+(L553*$L$6)+(M553*$M$6)+(N553*$N$6)+(O553*$O$6)+(P553*100*$P$6)+(Q553*100*$Q$6)+(R553*100*$R$6)+(S553*100*$S$6)+(T553*$T$6)+(U553*$U$6)+(V553*$V$6)+(W553*$W$6)+(X553*$X$6)+(Y553*$Y$6)+(Z553*$Z$6)+(AB553*$AA$6) -> 4.09 | D553: EPL | E553: 1 | F553: Q | G553: Blightcaller Quest | I553: 56 | J553: P | L553: 3 | M553: 9 | N553: 2 | AC553: 55-104, 31.8
A555: Legend
A556: AEP: Agility Equivalence Points. A method to convert the value of item attributes to compare them in terms of Agility points. Based on the forum discussion by Ming from Lightning's Blade.
A557: AEP: PVP-Oriented formula which gives more weight to Stamina and defensive stats. MAEP: Maximum DPS AEP for use in maximizing PVE raid DPS.
A558: Loc: The location where the item can be found, usually the initials for a zone. BS = Blacksmithing, Enc = Enchanting, Eng = Engineering, R = Random World Drop, LW = Leatherworking. P = Phase.
A559: Info: Additional information about the item, such as drop percentage, random mob levels, the skill level required to create it, reputation, honor ranking or (Q)uest item.
A560: Source: The source of the item. Either the boss who drops it, the location of the recipe or the type of faction or quest required.
A561: Set: The initials for the set to which the armor belongs. Lvl: The level required to wear the armor. B: Bind on (P)ickup or (E)quip. Arm: Armor.
A562: Agi: Agility, Sta: Stamina, Str: Strength, AP: Attack Power, Cri: Critical Strike %, Hit: To Hit %, Par: Parry %, Dod: Dodge %, Def: Defense.
A563: Resistances: Ar: Arcane, Fi: Fire, Fr: Frost, Na: Nature, Sh: Shadow, H/5: Health Regeneration, PVP: PVP Special Value, PVE: PVE Special Value, Special:Special Abilities.
A564: World of Warcraft Classic Rogue PVE Armor Chart ï¿½ 2019 ShadowPanther.net - Data courtesy of classicdb.ch - World of Warcraft ï¿½ 2019 Blizzard Entertainment